,title,Volume,Issue,Pages,whole__author_name,simply_author_name,reprint author,DOI,reprint address,Abstract,Keywords,Document Type,Publisher,Research Domain,Published Date,impact_factor,Keywords_plus,joural,pdf_link,Download_SuccessOrDefeat
24,Physical model of scour at the toe of rock armoured structures,154,,,"den Bieman Joost P.,van Gent Marcel R. A.,Hoonhout Bas M.","den Bieman JP,van Gent MRA,Hoonhout BM",den Bieman JP,10.1016/j.coastaleng.2019.103572,Deltares,"Toe structures are a common feature in coastal rock armoured structures, both safeguarding the structure against scour at the toe and providing support to the armour layer. The toe structure itself is often comprised of rocks as well. Hence, generally some form of scour protection, such as a filter layer or a geotextile, is applied underneath the toe structure. Currently, there is a lack of available methods to judge the necessity of these kinds of costly scour protection measures underneath the toe structure. In this paper, a unique data set from physical model tests of scour at the toe of rock armoured structures is presented. The bed level change is measured by a laser scanner across the entirety of the sand bed, including underneath the structure. Additionally, the temporal development of the scour at the glass wall of the flume is measured using an innovative combination of video imagery and a deep learning algorithm. The sand diameter is not varied in the physical model tests. In all tests, scour was observed both in front of the structure and underneath the structure. Two expressions have been derived that give estimates for both kinds of scour, and thus can give insight into the necessity of scour protection underneath the toe structure.","Toe structures,Scour,Physical modelling,Breakwaters,Deep learning,Automated video analysis,Rubble mound,Open filters",Article,"ELSEVIER, RADARWEG 29, 1043 NX AMSTERDAM, NETHERLANDS",Engineering,,,"SUCTION,REMOVAL,OPEN,FILTERS,SEDIMENT,PROTECTION,DESIGN",COASTAL ENGINEERING,,
25,EMG-based online classification of gestures with recurrent neural networks,128,,45-51,"Simao Miguel,Neto Pedro,Gibaru Olivier","Simao M,Neto P,Gibaru O",Neto P,10.1016/j.patrec.2019.07.021,Universidade de Coimbra,"Online gesture classification can rely on unsupervised segmentation in order to divide the data stream into static and dynamic segments for individual classification. However, this process requires motion detection calibration and adds complexity to the classification, thus becoming an additional failure point. An alternative is the sequential (dynamic) classification of the data stream. In this study we propose the use of recurrent neural networks (RNNs) to improve the online classification of hand gestures with Electromyography (EMG) signals acquired from the forearm muscles. The proposed methodology was evaluated on the UC2018 DualMyo and the NinaPro DB5 data set. The performance of a Feed-Forward Neural Network (FFNN), a Recurrent Neural Network (RNN), a Long Short-Term Memory network (LSTM) and a Gated Recurrent Unit (GRU) are compared and discussed. Additionally, an alternative performance index, the gesture detection accuracy, is proposed to evaluate the performance of the model during online classification. It is demonstrated that the static model (FFNN) and the dynamic models (LSTM, RNN and GRU) achieve similar accuracy for both data sets, i.e., about 95% for the DualMyo and about 91% for the NinaPro DB5. Although both models had similar accuracies, the dynamic models (LSTM and GRU) have a third of the parameters, presenting smaller training and inference times. + + Long Short-Term Memory (LSTM). (C) 2019 Elsevier B.V. All rights reserved.","Online gesture recognition,long short-term memory networks,Recurrent neural networks,Time series classification,LSTM,EMG",Article,"ELSEVIER, RADARWEG 29, 1043 NX AMSTERDAM, NETHERLANDS",Computer Science,,3.615,,PATTERN RECOGNITION LETTERS,,
26,Dynamically enhanced static handwriting representation for Parkinson's disease detection,128,,204-210,"Diaz Moises,Angel Ferrer Miguel,Impedovo Donato,Pirlo Giuseppe,Vessio Gennaro","Diaz M,Ferrer MA,Impedovo D,Pirlo G,Vessio G",Vessio G,10.1016/j.patrec.2019.08.018,Universita degli Studi di Bari Aldo Moro,"Computer aided diagnosis systems can provide non-invasive, low-cost tools to support clinicians. These systems have the potential to assist the diagnosis and monitoring of neurodegenerative disorders, in particular Parkinson's disease (PD). Handwriting plays a special role in the context of PD assessment. In this paper, the discriminating power of ""dynamically enhanced"" static images of handwriting is investigated. The enhanced images are synthetically generated by exploiting simultaneously the static and dynamic properties of handwriting. Specifically, we propose a static representation that embeds dynamic information based on: (i) drawing the points of the samples, instead of linking them, so as to retain temporal/velocity information; and (ii) adding pen-ups for the same purpose. To evaluate the effectiveness of the new handwriting representation, a fair comparison between this approach and state-of-the-art methods based on static and dynamic handwriting is conducted on the same dataset, i.e. PaHaW. The classification workflow employs transfer learning to extract meaningful features from multiple representations of the input data. An ensemble of different classifiers is used to achieve the final predictions. Dynamically enhanced static handwriting is able to outperform the results obtained by using static and dynamic handwriting separately. (C) 2019 Elsevier B.V. All rights reserved.","Parkinson's disease,e-Health,Computer aided diagnosis,Dynamically enhanced static handwriting,Convolutional neural networks",Article,"ELSEVIER, RADARWEG 29, 1043 NX AMSTERDAM, NETHERLANDS",Computer Science,,3.615,,PATTERN RECOGNITION LETTERS,,
27,Mesoscale characterization of continuous fiber reinforced composites through machine learning: Fiber chirality,181,,447-459,"Sherman Samuel,Simmons Jeff,Przybyla Craig","Sherman S,Simmons J,Przybyla C",Simmons J,10.1016/j.actamat.2019.10.001,United States Department of Defense,"A method of quantifying fiber chirality, the twist of continuous fibers through a volume, is defined and applied to both phantom data and real data. Specifically, a field quantity termed the fiber chirality based on the anti-symmetric part of the gradient of the fiber orientation is introduced. For this method of estimation, the input is the set of fiber positions gathered from the stack of images which represent the sample volumes. The phantom sample is generated and several different real continuous fiber reinforced matrix composites are experimentally characterized. Each phantom dataset contains a bundle of fibers that rotate about a center axis with a user-defined angle at each step in the z-direction. The chirality of the fibers is calculated based on the pre-characterized positions using a machine learning algorithm. To validate the method of quantification, our chirality estimation method results in a colormap with an angle of rotation that becomes increasingly more similar to the user-defined angle with decreasing interstice distance. Fiber positions from real data are then input into the estimation method and the results are compared. Published by Elsevier Ltd on behalf of Acta Materialia Inc.","3D characterization,Microstructure,Ceramic matrix composites,Fibers",Article,"PERGAMON-ELSEVIER SCIENCE LTD, THE BOULEVARD, LANGFORD LANE, KIDLINGTON, OXFORD OX5 1GB, ENGLAND","Materials Science,Metallurgy & Metallurgical Engineering",,9.277,"TEXTILE,COMPOSITES",ACTA MATERIALIA,,
28,Deep Learning for EEG motor imagery classification based on multi-layer CNNs feature fusion,101,,542-554,"Amin Syed Umar,Alsulaiman Mansour,Muhammad Ghulam,Mekhtiche Mohamed Amine,Hossain M. Shamim","Amin SU,Alsulaiman M,Muhammad G,Mekhtiche MA,Hossain MS",Muhammad G,10.1016/j.future.2019.06.027,King Saud University,"Electroencephalography (EEG) motor imagery (MI) signals have recently gained a lot of attention as these signals encode a person's intent of performing an action. Researchers have used MI signals to help disabled persons, control devices such as wheelchairs and even for autonomous driving. Hence decoding these signals accurately is important for a Brain-Computer interface (BCI) system. But EEG decoding is a challenging task because of its complexity, dynamic nature and low signal to noise ratio. Convolution neural network (CNN) has shown that it can extract spatial and temporal features from EEG, but in order to learn the dynamic correlations present in MI signals, we need improved CNN models. CNN can extract good features with both shallow and deep models pointing to the fact that, at different levels relevant features can be extracted. Fusion of multiple CNN models has not been experimented for EEG data. In this work, we propose a multi-layer CNNs method for fusing CNNs with different characteristics and architectures to improve EEG MI classification accuracy. Our method utilizes different convolutional features to capture spatial and temporal features from raw EEG data. We demonstrate that our novel MCNN and CCNN fusion methods outperforms all the state-of-the-art machine learning and deep learning techniques for EEG classification. We have performed various experiments to evaluate the performance of the proposed CNN fusion method on public datasets. The proposed MCNN method achieves 75.7% and 95.4% on the BO Competition IV-2a dataset and the High Gamma Dataset respectively. The proposed CCNN method based on autoencoder cross-encoding achieves more than 10% improvement for cross-subject EEG classification. (C) 2019 Elsevier B.V. All rights reserved.","EEG motor imagery classification,Deep learning,Convolution neural network,Multi-layer CNNs feature fusion",Article,"ELSEVIER, RADARWEG 29, 1043 NX AMSTERDAM, NETHERLANDS",Computer Science,,6.644,"CONVOLUTIONAL,NEURAL-NETWORKS",FUTURE GENERATION COMPUTER SYSTEMS-THE INTERNATIONAL JOURNAL OF ESCIENCE,,
29,Corneal thickness measurement by secondary speckle tracking and image processing using machine-learning algorithms,24,12,,"Bennett Aviya,Davidovitch Elnatan,Beiderman Yafim,Agadarov Sergey,Beiderman Yevgeny,Moshkovitz Avital,Polat Uri,Zalevsky Zeev","Bennett A,Davidovitch E,Beiderman Y,Agadarov S,Beiderman Y,Moshkovitz A,Polat U,Zalevsky Z",Zalevsky Z,10.1117/1.JBO.24.12.126001,Bar Ilan University,"Corneal thickness (CoT) is an important tool in the evaluation process for several disorders and in the assessment of intraocular pressure. We present a method enabling high-precision measurement of CoT based on secondary speckle tracking and processing of the information by machine-learning (ML) algorithms. The proposed configuration includes capturing by fast camera the laser beam speckle patterns backscattered from the corneal-scleral border, followed by ML processing of the image. The technique was tested on a series of phantoms having different thicknesses as well as in clinical trials on human eyes. The results show high accuracy in determination of eye CoT, and implementation is speedy in comparison with other known measurement methods. (C) The Authors. Published by SPIE under a Creative Commons Attribution 4.0 Unported License.","secondary speckle patterns,machine learning,lasers,optics,imaging,corneal thickness",Article,"SPIE-SOC PHOTO-OPTICAL INSTRUMENTATION ENGINEERS, 1000 20TH ST, PO BOX 10, BELLINGHAM, WA 98225 USA","Biochemistry & Molecular Biology,Optics,Radiology, Nuclear Medicine & Medical Imaging",,2.993,"ULTRASOUND,PACHYMETRY,APPLANATION,TONOMETRY,SPECULAR,MICROSCOPY,ANTERIOR-CHAMBER,PENTACAM,REFLECTOMETRY,TOMOGRAPHY",JOURNAL OF BIOMEDICAL OPTICS,https://www.ncbi.nlm.nih.gov/pmc/articles/PMC7005539,
30,Modeling oil-brine interfacial tension at high pressure and high salinity conditions,183,,,"Amar Menad Nait,Shateri Mohammadhadi,Hemmati-Sarapardeh Abdolhossein,Alamatsaz Alireza","Amar MN,Shateri M,Hemmati-Sarapardeh A,Alamatsaz A",Hemmati-Sarapardeh A,10.1016/j.petrol.2019.106413,Shahid Bahonar University of Kerman (SBUK),"Accurate estimation of interfacial tension (IFT) in crude oil/brine system is of great importance for many processes in petroleum and chemical engineering. The current study plays emphasis on introducing the ""Gradient Boosting Decision Tree (GBDT)"" and ""Adaptive Boosting Support Vector Regression (AdaBoost SVR)"" as novel powerful machine learning tools to determine the IFT of crude oil/brine system. Two sorts of models have been developed using each of these two data-driven methods. The first kind includes six inputs, namely pressure (P), temperature (T) and four parameters describing the proprieties of crude oil (total acid number (TAN) and specific gravity (SG) and brine (NaCl equivalent salinity (S-eq) and pH), while the second kind deals with four inputs (without including pH and TAN). To this end, an extensive databank including 560 experimental points was considered, in which 80% of the points were employed for the training phase and the remaining part was utilized as blind test data. Results revealed that the proposed approaches provide very satisfactory predictions, and the implemented GBDT model with six inputs is the most accurate model of all with an average absolute relative error of 1.01%. Moreover, the outcomes of the GBDT model are better than literature models. Finally, outlier diagnostic using Leverage approach was performed to investigate the applicability domain of the GBDT model and to evaluate the quality of employed data.","Interfacial tension (IFT),Crude oil,Brine,Gradient boosting trees,AdaBoost SVR",Article,"ELSEVIER, RADARWEG 29, 1043 NX AMSTERDAM, NETHERLANDS","Energy & Fuels,Engineering",,,"COMPUTATIONAL,INTELLIGENCE,SCHEME,SPONTANEOUS,IMBIBITION,TEMPERATURE,WATER,SURFACTANT,PREDICTION,BEHAVIOR,SYSTEMS,RECOVERY",JOURNAL OF PETROLEUM SCIENCE AND ENGINEERING,,
31,Machine learning methods applied to drilling rate of penetration prediction and optimization - A review,183,,,"Barbosa Luis Felipe F. M.,Nascimento Andreas,Mathias Mauro Hugo,de Carvalho Joao Andrade Jr.","Barbosa LFFM,Nascimento A,Mathias MH,de Carvalho JA",Barbosa LFFM,10.1016/j.petrol.2019.106332,Universidade Estadual Paulista,"Drilling wells in challenging oil/gas environments implies in large capital expenditure on wellbore's construction. In order to optimize the drilling related operation, real-time decisions making have been put in place, so that prediction of rate of penetration (ROP) with accuracy is essential. Despite many efforts (theoretical and experimental) throughout the years, modeling the ROP as a mathematical function of some key variables is not so trivial, due to the highly non-linearity behavior experienced. Therefore, several researches in the recent years have been proposing to use data-driven models from artificial intelligence field for ROP prediction and optimization.
This paper presents an extensive review of the literature on ROP prediction, especially, with machine learning techniques, as well as how these models can be used to optimize the drilling activities. The ROP models are classified as traditional models (based on physics-models), statistical models (e.g. multiple regression), or machine learning methods. This review enables to see that machine learning techniques can potentially outperform in terms of ROP-prediction accuracy on top of traditional or statistical models. Throughout this work, an extensive analysis of different ways of obtaining ROP models is carried out, concluding with different strategies adopted in literature to perform data-driven model optimization.
Despite the saving potential which can be achieved with real-time optimization based on data-driven ROP models, it is noticeable that there is a lack of implementation of those techniques in the industry, as per literature review. To take a step forward in real implementations, the petroleum industry must be aware that yet no rule of thumb already exists on this specific area, but still, good and very reasonable results can be achieved by following the best practices identified in this review. In addition, the modern practices of machine learning provide promising guidelines for implementing projects in oil and gas industry.","Data-driven model,Artificial intelligence,Multi-objective optimization,ROP,Drilling optimization",Review,"ELSEVIER, RADARWEG 29, 1043 NX AMSTERDAM, NETHERLANDS","Energy & Fuels,Engineering",,4.376,"SUPPORT,VECTOR,REGRESSION,ARTIFICIAL,NEURAL-NETWORKS,FUZZY,INFERENCE,SYSTEM,MULTIOBJECTIVE,OPTIMIZATION,FEEDFORWARD,NETWORKS,INTELLIGENCE,TECHNIQUES,ROP,PREDICTION,RATE,MODEL,ALGORITHMS,OIL",JOURNAL OF PETROLEUM SCIENCE AND ENGINEERING,,
32,A spectroscopic method based on support vector machine and artificial neural network for fiber laser welding defects detection and classification,108,,,"Chen Yuanhang,Chen Bo,Yao Yongzhen,Tan Caiwang,Feng Jicai","Chen YH,Chen B,Yao YZ,Tan CW,Feng JC",Chen B,10.1016/j.ndteint.2019.102176,Harbin Institute of Technology,"Diverse welding processes have been utilized in manufacturing industry for years. But up to date, welding quality still cannot be guaranteed, due to the lack of an efficient and on-line welding defects monitoring method, and this leads to increased manufacturing costs. In this paper, a method based on feature extraction and machine learning algorithm for on-line quality monitoring and defects classification was presented. Plasma radiation was captured by an optical fiber probe, and delivered by an optical fiber to the spectrometer. The captured spectral signal was processed by selecting sensitive emission lines and extracting features of spectral data's evolution, which realized spectral data compression with low computational cost. After selecting the proper training data set, the designed ANN and SVM allows automatic detection and classification of welding defects. The validity of proposed method was successfully approved by test data set in welding experiments. Welding experiments on galvanized steel sheets showed the corresponding relationship between the output of classifiers and welding defects. Finally, the two classifiers were compared. Experiments indicated the performance of ANN is slightly better than that of SVM, while both of them have its own advantages.","Laser welding,Plasma spectral analysis,Support vector machine,Artificial neural network",Article,"ELSEVIER SCI LTD, THE BOULEVARD, LANGFORD LANE, KIDLINGTON, OXFORD OX5 1GB, OXON, ENGLAND",Materials Science,,3.719,"OPTICAL,SENSOR,PENETRATION,DEPTH,WIDTH",NDT & E INTERNATIONAL,,
33,Observation of Electron Shakeup in CdSe/CdS Core/Shell Nanoplatelets,19,12,8495-8502,"Antolinez Felipe V.,Rabouw Freddy T.,Rossinelli Aurelio A.,Cui Jian,Norris David J.","Antolinez FV,Rabouw FT,Rossinelli AA,Cui J,Norris DJ",Norris DJ,10.1021/acs.nanolett.9b02856,ETH Zurich,"While ensembles of CdSe nanoplatelets (NPLs) show remarkably narrow photoluminescence line widths at room temperature, adding a CdS shell to increase their fluorescence efficiency and photostability causes line width broadening. Moreover, ensemble emission spectra of CdSe/CdS core/shell NPLs become strongly asymmetric at cryogenic temperatures. If the origin of these effects were understood, this could potentially lead to stable core/shell NPLs with narrower emission, which would be advantageous for applications. To move in this direction, we report time-resolved emission spectra of individual CdSe/CdS core/shell NPLs at 4 K. We observe surprisingly complex emission spectra that contain multiple spectrally narrow emission features that change during the experiment. With machine-learning algorithms, we can extract characteristic peak energy differences in these spectra. We show that they are consistent with electron ""shakeup lines"" from negatively charged trions. In this process, an electron-hole pair recombines radiatively but gives part of its energy to the remaining electron by exciting it into a higher single-electron level. This ""shakeup"" mechanism is enabled in our NPLs due to strong exciton binding and weak lateral confinement of the charge carriers. Time-resolved single-photon-counting measurements and numerical calculations suggest that spectral jumps in the emission features originate from fluctuations in the confinement potential caused by microscopic structural changes on the NPL surface (e.g., due to mobile surface charges). Our results provide valuable insights into line width broadening mechanisms in colloidal NPLs.","CdSe/CdS nanoplatelets,core/shell nanoplatelets,shakeup line,trion emission,weak confinement,machine learning",Article,"AMER CHEMICAL SOC, 1155 16TH ST, NW, WASHINGTON, DC 20036 USA","Chemistry,Science & Technology - Other Topics,Materials Science,Physics",,12.777,"AUGER,RECOMBINATION,QUANTUM,SPECTROSCOPY,EXCITON,DECAY,BLINKING,NANOCRYSTALS,SUPPRESSION,DIFFUSION,DYNAMICS",NANO LETTERS,https://www.research-collection.ethz.ch/bitstream/20.500.11850/386327/1/Antolinez_etal_NanoLetters_Shakeup.pdf,
34,,,,,,,,,,,,,,,,,,,,
35,Dual-domain convolutional neural networks for improving structural information in 3 T MRI,64,,90-100,"Zhang Yongqin,Yap Pew-Thian,Qu Liangqiong,Cheng Jie-Zhi,Shen Dinggang","Zhang YQ,Yap PT,Qu LQ,Cheng JZ,Shen DG",Shen DG,10.1016/j.mri.2019.05.023,University of North Carolina,We propose a novel dual-domain convolutional neural network framework to improve structural information of routine 3 T images. We introduce a parameter-efficient butterfly network that involves two complementary domains: a spatial domain and a frequency domain. The butterfly network allows the interaction of these two domains in learning the complex mapping from 3 T to 7 T images. We verified the efficacy of the dual-domain strategy and butterfly network using 3 T and 7 T image pairs. Experimental results demonstrate that the proposed framework generates synthetic 7 T-like images and achieves performance superior to state-of-the-art methods.,"Image synthesis,Image super-resolution,Magnetic resonance imaging,Deep learning,Convolutional neural network",Article,"ELSEVIER SCIENCE INC, STE 800, 230 PARK AVE, NEW YORK, NY 10169 USA","Radiology, Nuclear Medicine & Medical Imaging",,2.608,"IMAGE,SUPERRESOLUTION,7T-LIKE,IMAGES,RECONSTRUCTION,REGISTRATION,ENHANCEMENT",MAGNETIC RESONANCE IMAGING,https://www.ncbi.nlm.nih.gov/pmc/articles/PMC6874896,
36,Temporal and spatial deep learning network for infrared thermal defect detection,108,,,"Luo Qin,Gao Bin,Woo W. L.,Yang Yang","Luo Q,Gao B,Woo WL,Yang Y",Gao B,10.1016/j.ndteint.2019.102164,University of Electronic Science & Technology of China,"Most common types of defects for composite are debond and delamination. It is difficult to detect the inner defects on a complex shaped specimen by using conventional optical thermography nondestructive testing (NDT) methods. In this paper, a hybrid of spatial and temporal deep learning architecture for automatic thermography defects detection is proposed. The integration of cross network learning strategy has the capability to significantly minimize the uneven illumination and enhance the detection rate. The probability of detection (POD) has been derived to measure the detection results and this is coupled with comparison studies to verify the efficacy of the proposed method. The results show that visual geometry group-Unet (VGG-Unet) cross learning structure can significantly improve the contrast between the defective and non-defective regions. In addition, investigation of different feature extraction methods in which embedded in deep learning is conducted to optimize the learning structure. To investigate the efficacy and robustness of the proposed method, experimental studies have been carried out for inner debond defects on both regular and irregular shaped carbon fiber reinforced polymer (CFRP) specimens.","Deep learning,Segmentation,Thermography defect detection,Nondestructive testing",Article,"ELSEVIER SCI LTD, THE BOULEVARD, LANGFORD LANE, KIDLINGTON, OXFORD OX5 1GB, OXON, ENGLAND",Materials Science,,3.719,"IMAGE,SEGMENTATION,DAMAGE,DETECTION,THERMOGRAPHY,COMPOSITES",NDT & E INTERNATIONAL,http://nrl.northumbria.ac.uk/id/eprint/41092/1/Temporal%20Spatial%20Deep%20Learning%20Infrared%20Thermal%20Detection_author%20version.pdf,
