,title,Volume,Issue,Pages,whole__author_name,simply_author_name,reprint author,DOI,reprint address,Abstract,Keywords,Document Type,Publisher,Research Domain,Published Date,impact_factor,Keywords_plus,joural,pdf_link,Download_SuccessOrDefeat
74,Breast mass detection from the digitized X-ray mammograms based on the combination of deep active learning and self-paced learning,101,,668-679,"Shen Rongbo,Yan Kezhou,Tian Kuan,Jiang Cheng,Zhou Ke","Shen RB,Yan KZ,Tian K,Jiang C,Zhou K",Zhou K,10.1016/j.future.2019.07.013,Huazhong University of Science & Technology,"Breast mass detection is a challenging task in mammogram, since mass is usually embedded and surrounded by various normal tissues with similar density. Recently, deep learning has achieved impressive performance on this task. However, most deep learning methods require large amounts of well-annotated datasets. Generally, the training datasets is generated through manual annotation by experienced radiologists. However, manual annotation is very time-consuming, tedious and subjective. In this paper, for the purpose of minimizing the annotation efforts, we propose a novel learning framework for mass detection that incorporates deep active learning (DAL) and self-paced learning (SPL) paradigm. The DAL can significantly reduce the annotation efforts by radiologists, while improves the efficiency of model training by obtaining better performance with fewer overall annotated samples. The SPL is able to alleviate the data ambiguity and yield a robust model with generalization capability in various scenarios. In detail, we first employ a few of annotated easy samples to initialize the deep learning model using Focal Loss. In order to find out the most informative samples, we propose an informativeness query algorithm to rank the large amounts of unannotated samples. Next, we propose a self-paced sampling algorithm to select a number of the most informative samples. Finally, the selected most informative samples are manually annotated by experienced radiologists, which are added into the annotated samples for the model updating. This process is looped until there are not enough most informative samples in the unannotated samples. We evaluate the proposed learning framework on 2223 digitized mammograms, which are accompanied with diagnostic reports containing weakly supervised information. The experimental results suggest that our proposed learning framework achieves superior performance over the counterparts. Moreover, our proposed learning framework dramatically reduces the requirement of the annotated samples, i.e., about 20% of all training data. (C) 2019 Published by Elsevier B.V.","Breast cancer,Mammography,Mass detection,Deep active learning,Self-paced learning",Article,"ELSEVIER, RADARWEG 29, 1043 NX AMSTERDAM, NETHERLANDS",Computer Science,,6.644,"COMPUTER-AIDED,DETECTION,SEGMENTATION,CLASSIFICATION",FUTURE GENERATION COMPUTER SYSTEMS-THE INTERNATIONAL JOURNAL OF ESCIENCE,,
75,Auto-detection of epileptic seizure events using deep neural network with different feature scaling techniques,128,,544-550,"Thara D. K.,PremaSudha B. G.,Xiong Fan","Thara DK,PremaSudha BG,Xiong F",Thara DK,10.1016/j.patrec.2019.10.029,"CIT, Dept ISE, Tumakuru, Karnataka, India.","Misdiagnosis of epilepsy is more seen in manual analysis of electroencephalogram (EEG) signals for epileptic seizure event detection. Therefore, automated systems for epilepsy detection are required to help neurologists in diagnosing epilepsy. These automated systems act as supporting systems for the neurologists to diagnose epilepsy with good accuracy in less time. In this paper an attempt is made to develop an automated seizure detection method using deep neural network using the dataset collected from Bonn University, Germany. The results of the experiment are compared with the existing machine learning method. Our model gives better results compared to ML methods without the need of feature extraction. It is important to perform normalization of the dataset using feature scaling techniques to obtain good accuracy in the results. In this experiment we also worked on feature scaling of the dataset. At first we tried using StandardScaler and calculated loss using mean squared error. For this we achieved an accuracy of 97.21%, Sensitivity 98.17%, Specificity 94.93%, F1_score 98.48%, MCC 91.96% and ROC 97.55%. Experiment was continued to compare the performance of four different feature scaling techniques and four different loss functions. From the experimental results it was observed that StandardScaler and RobustScaler are equally good and are the best feature scaling techniques. Loss computed using Mean squared error works better in combination with all feature scaling techniques. (C) 2019 Elsevier B.V. All rights reserved.","Deep neural network,Epilepsy,Seizure,Feature scaling,Loss",Article,"ELSEVIER, RADARWEG 29, 1043 NX AMSTERDAM, NETHERLANDS",Computer Science,,3.615,,PATTERN RECOGNITION LETTERS,,
76,Machine learning algorithms for structural performance classifications and predictions: Application to reinforced masonry shear walls,22,,252-265,"Siam Ahmad,Ezzeldin Mohamed,El-Dakhakhni Wael","Siam A,Ezzeldin M,El-Dakhakhni W",Ezzeldin M,10.1016/j.istruc.2019.06.017,McMaster University,"Current building codes and design standards classify different structural components according to their expected structural performance. Such classification is usually based on datasets of experimental results typically supplemented by analytical and/or numerical simulations. However, it is usually prohibitive to experimentally evaluate the influence of the typically large number of (and the wide numerical range of each of the) interacting design parameters, on the response of any one class of structural components. Subsequently, the current study builds on the recent advances in the area of machine learning (ML)-a class of artificial intelligence, to introduce a robust ML-based framework for performance prediction and classification of structural components. In order to demonstrate the use of the developed framework, a dataset of 97 reinforced masonry shear walls (RMSWs) is utilized. In this respect, the current study first conducts an exploratory data analysis to recognize the influence of the walls' geometrical and mechanical characteristics on the wall responses. Subsequently, an unsupervised learning algorithm is developed to cluster the walls based on their features. Finally, the training and validation datasets are used to further develop and validate a supervised learning algorithm to classify the walls and predict their lateral drifts according to their failure modes. The study is expected to introduce and demonstrate the capability of ML-based frameworks for future relevant studies within other structural engineering applications.","Classification,Clustering,Exploratory data analysis,Machine learning,Structural performance,Supervised learning,Unsupervised learning,Predictions",Article,"ELSEVIER SCIENCE INC, STE 800, 230 PARK AVE, NEW YORK, NY 10169 USA",Engineering,,3.12,"ARTIFICIAL,NEURAL-NETWORK,STRENGTH,MODEL,DESIGN",STRUCTURES,,
77,A novel Cerenkov luminescence tomography approach using multilayer fully connected neural network,64,24,,"Zhang Zeyu,Cai Meishan,Gao Yuan,Shi Xiaojing,Zhang Xiaojun,Hu Zhenhua,Tian Jie","Zhang ZY,Cai MS,Gao Y,Shi XJ,Zhang XJ,Hu ZH,Tian J",Tian J,10.1088/1361-6560/ab5bb4,Xidian University,"Cerenkov luminescence tomography (CLT) has been proved as an effective tool for various biomedical applications. Because of the severe scattering of Cerenkov luminescence, the performance of CLT remains unsatisfied. This paper proposed a novel CLT reconstruction approach based on a multilayer fully connected neural network (MFCNN). Monte Carlo simulation data was employed to train the MFCNN, and the complex relationship between the surface signals and the true sources was effectively learned by the network. Both simulation and in vivo experiments were performed to validate the performance of MFCNN CLT, and it was further compared with the typical radiative transfer equation (RTE) based method. The experimental data showed the superiority of MFCNN CLT in terms of accuracy and stability. This promising approach for CLT is expected to improve the performance of optical tomography, and to promote the exploration of machine learning in biomedical applications.","Cerenkov luminescence tomography (CLT),optical reconstruction,photon propagation,neural network,inverse problem",Article,"IOP PUBLISHING LTD, TEMPLE CIRCUS, TEMPLE WAY, BRISTOL BS1 6BE, ENGLAND","Engineering,Radiology, Nuclear Medicine & Medical Imaging",,3.554,"RECONSTRUCTION,MOUSE,MODEL",PHYSICS IN MEDICINE AND BIOLOGY,https://doi.org/10.1088/1361-6560/ab5bb4,
78,THE PROJECT OF ANOTHER LOW-COST METAPHASE FINDER (SECOND REPORT-APPLICATION OF ARTIFICIAL INTELLIGENCE),186,1,37-41,Furukawa Akira,Furukawa A,Furukawa A,10.1093/rpd/ncz012,National Institutes for Quantum & Radiological Science & Technology (QST)-Japan,"Biological dosimetry is used to estimate individual absorbed radiation dose by quantifying an appropriate biological marker. The most popular gold-standard marker is the appearance of dicentric chromosomes in metaphase. The metaphase finder is a tool for biological dosimetry that finds metaphase cells on glass slides. The author and a software company have designed a new system and are now preparing to produce the system commercially. The metaphase finder consists of an automated microscope, a camera, and a computer. To enhance the accuracy of the system, an artificial intelligence (AI) with deep learning was tested. A total of 1709 images of the metaphase finder detected as 'metaphases' were read into a nine-layer artificial neural network to detect true metaphases. A total of 456 images were used for training, and the rest of the images were used for validation. The accuracy of AI was 0.89 for metaphases and 0.90 for non-metaphases.",,Article; Proceedings Paper,"OXFORD UNIV PRESS, GREAT CLARENDON ST, OXFORD OX2 6DP, ENGLAND","Environmental Sciences & Ecology,Public, Environmental & Occupational Health,Nuclear Science & Technology,Radiology, Nuclear Medicine & Medical Imaging",,,,RADIATION PROTECTION DOSIMETRY,,
79,Production Forecast of Fractured Coalbed Methane Wells Based on PCA-NB Method,26,6,108-112,",,,,","Kong Peng,Li Zhongcheng,Yang Chenxi,Zhang Yunpeng,Wang Ruoxuan",,,Kong Peng,"In order to improve the forecast of fractured coalbed methane wellproduction,thePCA (principal component analysis)was used to determine the principal parameters influencing the coalbed methane production. On this basis, the NB (Naive Bayes)method was applied to train the principal components and production in the target block. In addition, it also presents a PCA-NB production forecast model. Research indicates that The production forecast accuracy of this PCA-NB method reaches 84.1%, which is significant higher than that of PCA method (forecast accuracy is 64.8%), NB method (forecast accuracy is 76.4%)and neural network method (forecast accuracy is 73.5%). This research is of certain significance for the well-interval optimization and fracturing optimization of coalbed methane wells.",coalbed methane; production forecast; Naive Bayes; principal component analysis; fracture,Article,,,,,,,,
80,Using EEG for Mental Fatigue Assessment: A Comprehensive Look Into the Current State of the Art,49,6,599-610,"Monteiro Thiago Gabriel,Skourup Charlotte,Zhang Houxiang","Monteiro TG,Skourup C,Zhang HX",Monteiro TG,10.1109/THMS.2019.2938156,Norwegian University of Science & Technology (NTNU),"This paper provides a brief survey of recent developments on the use of electroencephalogram (EEG) sensors for detecting mental fatigue (MF) in human operators during tasks involving human-machine interaction. This research topic has received much attention since there is a consensus among experts on the increasing relation between human failure and accidents in safety-critical tasks. MF is one of the most influential aspects leading to human failure and the most reliable way to assess it is using operators physiological data, especially EEG. In the past few decades, hundreds of publications have explored the use of EEG alone or together with other objective and subjective measures for assessing MF, drowsiness, and tiredness in human operators. With recent improvements in data preprocessing, feature extraction, and classification algorithms, the monitoring and mitigation of MF in real time has become a reality. This trend is mainly due to the increasing use of machine learning techniques. This paper provides a comprehensive look at the current state of the art in the field of MF detection using EEG, identifying the currently used technique, algorithms, and methods and possible trends and promising areas for further research. The paper is concluded by suggesting a kernel partial least squares discrete-output linear regression based model as an all-around good option for an MF assessment system.","Electroencephalography,Feature extraction,Human factors,Sensor fusion,Fatigue,Risk management,Electroencephalogram (EEG),human factors,human-machine systems,mental fatigue (MF) assessment,risk assessment,sensor fusion",Article,"IEEE-INST ELECTRICAL ELECTRONICS ENGINEERS INC, 445 HOES LANE, PISCATAWAY, NJ 08855-4141 USA",Computer Science,,,"EPILEPTIC,SEIZURE,DETECTION,DROWSINESS,DETECTION,AUTOMATIC,DETECTION,DRIVER,DROWSINESS,DETECTION,SYSTEM,WEARABLE,EEG,SIGNALS,ENTROPY,MODEL,SLEEPINESS",IEEE TRANSACTIONS ON HUMAN-MACHINE SYSTEMS,https://ntnuopen.ntnu.no/ntnu-xmlui/bitstream/11250/2618442/1/Using_EEG_for_Mental_Fatigue_Assessment__A_Comprehensive_Look_Into_the_Current__State_of_the_Art.pdf,
81,A Context-Supported Deep Learning Framework for Multimodal Brain Imaging Classification,49,6,611-622,"Jiang Jianmin,Fares Ahmed,Zhong Sheng-Hua","Jiang JM,Fares A,Zhong SH",Zhong SH,10.1109/THMS.2019.2904615,Shenzhen University,"Over the past decade, ""content-based"" multimedia systems have realized success. By comparison, brain imaging and classification systems demand more efforts for improvement with respect to accuracy, generalization, and interpretation. The relationship between electroencephalogram (EEG) signals and corresponding multimedia content needs to be further explored. In this paper, we integrate implicit and explicit learning modalities into a context-supported deep learning framework. We propose an improved solution for the task of brain imaging classification via EEG signals. In our proposed framework, we introduce a consistency test by exploiting the context of brain images and establishing a mapping between visual-level features and cognitive-level features inferred based on EEG signals. In this way, a multimodal approach can be developed to deliver an improved solution for brain imaging and its classification based on explicit learning modalities and research from the image processing community. In addition, a number of fusion techniques are investigated in this work to optimize individual classification results. Extensive experiments have been carried out, and their results demonstrate the effectiveness of our proposed framework. In comparison with the existing state-of-the-art approaches, our proposed framework achieves superior performance in terms of not only the standard visual object classification criteria, but also the exploitation of transfer learning. For the convenience of research dissemination, we make the source code publicly available for downloading at GitHub (https://github.com/aneeg/dual-modal-learning).","Electroencephalography,Brain,Deep learning,Feature extraction,Functional magnetic resonance imaging,Image classification,Deep learning,electroencephalogram (EEG),explicit learning modality,implicit learning modality,object classification",Article,"IEEE-INST ELECTRICAL ELECTRONICS ENGINEERS INC, 445 HOES LANE, PISCATAWAY, NJ 08855-4141 USA",Computer Science,,3.771,"CONVOLUTIONAL,NEURAL-NETWORKS,EMOTION,RECOGNITION,EEG,MUSIC",IEEE TRANSACTIONS ON HUMAN-MACHINE SYSTEMS,,
82,Tangent Space Features-Based Transfer Learning Classification Model for Two-Class Motor Imagery Brain-Computer Interface,29,10,,"Gaur Pramod,McCreadie Karl,Pachori Ram Bilas,Wang Hui,Prasad Girijesh","Gaur P,McCreadie K,Pachori RB,Wang H,Prasad G",Gaur P,10.1142/S0129065719500254,LNM Institute of Information Technology,"The performance of a brain-computer interface (BCI) will generally improve by increasing the volume of training data on which it is trained. However, a classifier's generalization ability is often negatively affected when highly non-stationary data are collected across both sessions and subjects. The aim of this work is to reduce the long calibration time in Bel systems by proposing a transfer learning model which can be used for evaluating unseen single trials for a subject without the need for training session data. A method is proposed which combines a generalization of the previously proposed subject-specific ""multivariate empirical-mode decomposition"" preprocessing technique by taking a fixed band of 8-30 Hz for all four motor imagery tasks and a novel classification model which exploits the structure of tangent space features drawn from the Riemannian geometry framework, that is shared among the training data of multiple sessions and subjects. Results demonstrate comparable performance improvement across multiple subjects without subject-specific calibration, when compared with other state-of-the-art techniques.","Motor imagery,brain-computer interface (BCI),tangent space,covariance matrix,multivariate empirical-mode decomposition (MEMD),subject-specific multivariate empirical-mode decomposition-based filtering (SS-MEMDBF)",Article,"WORLD SCIENTIFIC PUBL CO PTE LTD, 5 TOH TUCK LINK, SINGAPORE 596224, SINGAPORE",Computer Science,,5.439,"COVARIATE,SHIFT,DECOMPOSITION,NOISE",INTERNATIONAL JOURNAL OF NEURAL SYSTEMS,https://pure.ulster.ac.uk/ws/files/77556642/ws_ijns_revision7.pdf,
83,Epileptic Seizure Detection with EEG Textural Features and Imbalanced Classification Based on EasyEnsemble Learning,29,10,,"Sun Chengfa,Cui Hui,Zhou Weidong,Nie Weiwei,Wang Xiuying,Yuan Qi","Sun CF,Cui H,Zhou WD,Nie WW,Wang XY,Yuan Q",Yuan Q,10.1142/S0129065719500217,Shandong Normal University,"Imbalance data classification is a challenging task in automatic seizure detection from electroencephalogram (EEG) recordings when the durations of non-seizure periods are much longer than those of seizure activities. An imbalanced learning model is proposed in this paper to improve the identification of seizure events in long-term EEG signals. To better represent the underlying microstructure distributions of EEG signals while preserving the non-stationary nature, discrete wavelet transform (DWI') and uniform 1D-LBP feature extraction procedure are introduced. A learning framework is then designed by the ensemble of weakly trained support vector machines (SVMs). Under-sampling is employed to split the imbalanced seizure and non-seizure samples into multiple balanced subsets where each of them is utilized to train an individual SVM classifier. The weak SVMs are incorporated to build a strong classifier which emphasizes seizure samples and in the meantime analyzing the unbalanced class distribution of EEG data. Final seizure detection results are obtained in a multi-level decision fusion process by considering temporal and frequency factors. The model was validated over two long-term and one short-term public EEG databases. The model achieved a G-mean of 97.14% with respect to epoch-level assessment, an event-level sensitivity of 96.67%, and a false detection rate of 0.86/h on the long-term intracranial database. An epoch-level G-mean of 95.28% and event-level false detection rate of 0.81/h were yielded over the long-term scalp database. The comparisons with 14 published methods demonstrated the improved detection performance for imbalanced EEG signals and the generalizability of the proposed model.","Seizure detection,imbalanced classification,EasyEnsemble learning,textural feature,local binary pattern",Article,"WORLD SCIENTIFIC PUBL CO PTE LTD, 5 TOH TUCK LINK, SINGAPORE 596224, SINGAPORE",Computer Science,,5.439,"NEURAL-NETWORKS,BINARY,PATTERNS,RECOGNITION,TRANSFORM,ALGORITHM,DISTANCE,MACHINE,ENTROPY,RECORDS,SYSTEM",INTERNATIONAL JOURNAL OF NEURAL SYSTEMS,,
84,Moving in time: Simulating how neural circuits enable rhythmic enactment of planned sequences,120,,86-107,"Zeid Omar,Bullock Daniel","Zeid O,Bullock D",Zeid O,10.1016/j.neunet.2019.08.006,Vanderbilt University,"Many complex actions are mentally pre-composed as plans that specify orderings of simpler actions. To be executed accurately, planned orderings must become active in working memory, and then enacted one-by-one until the sequence is complete. Examples include writing, typing, and speaking. In cases where the planned complex action is musical in nature (e.g. a choreographed dance or a piano melody), it appears to be possible to deploy two learned sequences at the same time, one composed from actions and a second composed from the time intervals between actions. Despite this added complexity, humans readily learn and perform rhythm-based action sequences. Notably, people can learn action sequences and rhythmic sequences separately, and then combine them with little trouble (Ullen & Bengtsson 2003). Related functional MRI data suggest that there are distinct neural regions responsible for the two different sequence types (Bengtsson et al. 2004). Although research on musical rhythm is extensive, few computational models exist to extend and inform our understanding of its neural bases. To that end, this article introduces the TAMSIN (Timing And Motor System Integration Network) model, a systems-level neural network model capable of performing arbitrary item sequences in accord with any rhythmic pattern that can be represented as a sequence of integer multiples of a base interval. In TAMSIN, two Competitive Queuing (CQ) modules operate in parallel. One represents and controls item order (the ORD module) and the second represents and controls the sequence of inter-onset-intervals (IOIs) that define a rhythmic pattern (RHY module). Further circuitry helps these modules coordinate their signal processing to enable performative output consistent with a desired beat and tempo. (C) 2019 Elsevier Ltd. All rights reserved.","Competitive queuing,Computational neuroscience,Music performance,Rhythm,Systems neuroscience",Article,"PERGAMON-ELSEVIER SCIENCE LTD, THE BOULEVARD, LANGFORD LANE, KIDLINGTON, OXFORD OX5 1GB, ENGLAND","Computer Science,Neurosciences & Neurology",,,"ORDINAL,STRUCTURE,WORKING-MEMORY,PREFRONTAL,CORTEX,ARM,MOVEMENTS,SERIAL,ORDER,MODEL,MOTOR,PERCEPTION,SELECTION,SPEECH",NEURAL NETWORKS,,
85,The quantization error in a Self-Organizing Map as a contrast and colour specific indicator of single-pixel change in large random patterns,120,,116-128,"Wandeto John M.,Dresp-Langley Birgitta","Wandeto JM,Dresp-Langley B",Dresp-Langley B,10.1016/j.neunet.2019.09.017,Centre National de la Recherche Scientifique (CNRS),"The quantization error in a fixed-size Self-Organizing Map (SOM) with unsupervised winner-take-all learning has previously been used successfully to detect, in minimal computation time, highly meaningful changes across images in medical time series and in time series of satellite images. Here, the functional properties of the quantization error in SOM are explored further to show that the metric is capable of reliably discriminating between the finest differences in local contrast intensities and contrast signs. While this capability of the QE is akin to functional characteristics of a specific class of retinal ganglion cells (the so-called Y-cells) in the visual systems of the primate and the cat, the sensitivity of the QE surpasses the capacity limits of human visual detection. Here, the quantization error in the SOM is found to reliably signal changes in contrast or colour when contrast information is removed from or added to the image, but not when the amount and relative weight of contrast information is constant and only the local spatial position of contrast elements in the pattern changes. While the RGB Mean reflects coarser changes in colour or contrast well enough, the SOM-QE is shown to outperform the RGB Mean in the detection of single-pixel changes in images with up to five million pixels. This could have important implications in the context of unsupervised image learning and computational building block approaches to large sets of image data (big data), including deep learning blocks, and automatic detection of contrast change at the nanoscale in Transmission or Scanning Electron Micrographs (TEM, SEM), or at the subpixel level in multispectral and hyper-spectral imaging data. (C) 2019 Elsevier Ltd. All rights reserved.","Self-Organizing Maps,Quantization error,Image time series,Medical images,Random-dot images,Change detection",Article,"PERGAMON-ELSEVIER SCIENCE LTD, THE BOULEVARD, LANGFORD LANE, KIDLINGTON, OXFORD OX5 1GB, ENGLAND","Computer Science,Neurosciences & Neurology",,9.171,RECEPTIVE-FIELDS,NEURAL NETWORKS,http://arxiv.org/pdf/2011.03970,
