,title,Volume,Issue,Pages,whole__author_name,simply_author_name,reprint author,DOI,reprint address,Abstract,Keywords,Document Type,Publisher,Research Domain,Published Date,impact_factor,Keywords_plus,joural,pdf_link,Download_SuccessOrDefeat
50,A comparative data mining approach for the prediction of energy recovery potential from various municipal solid waste,116,,,"Bagheri Mehdi,Esfilar Reza,Golchi Mohammad Sina,Kennedy Christopher A.","Bagheri M,Esfilar R,Golchi MS,Kennedy CA",Bagheri M,10.1016/j.rser.2019.109423,University of Victoria,"Knowledge of higher heating value (HHV) is critically important in the techno-economic analysis and optimal performance of thermal waste-to-energy (WTE) systems. In this work, we proposed a rapid and cost-effective method to accurately estimate the high heating value for various municipal solid wastes using a novel machine learning technique and the ultimate analysis. To this end, we relied on a comprehensive experimental HHV dataset from a diverse range of geographical origins and eight various waste classifications (i.e., 30 paper, 12 textile, 12 rubber and leather, 29 MSW mixture, 34 plastic, 61 wood, 20 sewage sludge, and 53 other wastes). In particular, we developed nonlinear HHV equations for fast, accurate, straightforward applications (e.g., especially when limited elemental information is available) using robust gene expression programming (GEP) algorithm. Meanwhile, we analyzed the accuracy gains from the application of more complex and nonlinear models such as a novel support vector machine (RBAS-SVM) and a feed-forward neural network (FFNN). While coefficient of determination (R-2) of the time-saving and straightforward GEP equations is 0.966, the SVM and FFNN models have 0.973 and 0.978 R-2. Besides, root mean square error (RMSE) of GEP, SVM, and FFNN models are 1.57, 1.44, and 1.25, respectively. The results of statistical performances for the entire dataset showed that average absolute error (AAE) of the proposed models in a range of 0.87-1.12%. Finally, the presented models were compared to those developed by other authors regarding the comprehensiveness (dataset size and diversity), accuracy, and validity (statistical performances) for the entire dataset.","Machine learning,higher heating value,Municipal solid wastes,Biomass wastes,Nonlinear modeling",Article,"PERGAMON-ELSEVIER SCIENCE LTD, THE BOULEVARD, LANGFORD LANE, KIDLINGTON, OXFORD OX5 1GB, ENGLAND","Science & Technology - Other Topics,Energy & Fuels",,14.916,"HIGHER,HEATING,VALUE,ARTIFICIAL,NEURAL-NETWORK,TO-ENERGY,FORMATION,ENTHALPIES,ACCURATE,PREDICTION,PROXIMATE,ANALYSIS,REGRESSION-MODELS,FLASH-POINT,BIOMASS,MANAGEMENT",RENEWABLE & SUSTAINABLE ENERGY REVIEWS,,
51,Deep learning network with Euclidean similarity factor for Brain MR Tumor segmentation and volume estimation,10,6,,"Kumar G. Anand,Sridevi P. V","Kumar GA,Sridevi PV",Kumar GA,10.1142/S1793962319500399,Gayatri Vidya Parishad College of Engineering,"The major goal of this paper is to isolate tumor region from nontumor regions and the estimation of tumor volume. Accurate segmentation is not an easy task due to the varying size, shape and location of the tumor. After segmentation, volume estimation is necessary in order to accurately estimate the tumor volume. By exactly estimating the volume of abnormal tissue, physicians can do excellent prognosis, clinical planning and dosage estimation. This paper describes a new Euclidean Similarity factor (ESF) based active contour model with deep learning for segmenting the tumor region into complete, core and enhanced tumor portions. Initially, the ESF considers the spatial distances and intensity differences of the region automatically to detect the tumor region. It preserves the image details but removes the noisy details. Then, the 3D Convolutional Neural Network (3D CNN) segments the tumor by automatically extracting spatiotem-poral features. Finally, the extended shoelace method estimates the volume of the tumor accurately for n-sided polygons. The simulation result achieves a high accuracy of 92% and Jaccard index of 0.912 and computes the tumor volume with effective performance than existing approaches.","Active contour,brain tumor segmentation,convolutional neural network,Euclidean similarity factor,magnetic resonance imaging",Article,"WORLD SCIENTIFIC PUBL CO PTE LTD, 5 TOH TUCK LINK, SINGAPORE 596224, SINGAPORE",Computer Science,,,"IMAGE,SEGMENTATION,LOCALIZATION,MODEL",INTERNATIONAL JOURNAL OF MODELING SIMULATION AND SCIENTIFIC COMPUTING,,
52,Obstructive sleep apnea screening by heart rate variability-based apnea/normal respiration discriminant model,40,12,,"Nakayama Chikao,Fujiwara Koichi,Sumi Yukiyoshi,Matsuo Masahiro,Kano Manabu,Kadotani Hiroshi","Nakayama C,Fujiwara K,Sumi Y,Matsuo M,Kano M,Kadotani H",Fujiwara K,10.1088/1361-6579/ab57be,Nagoya University,"Objective: Obstructive sleep apnea (OSA) is a common sleep disorder; however, most patients are undiagnosed and untreated because it is difficult for patients themselves to notice OSA in daily living. Polysomnography (PSG), which is the gold standard test for sleep disorder diagnosis, cannot be performed in many hospitals. This fact motivates us to develop a simple system for screening OSA at home. Approach: The autonomic nervous system changes during apnea, and such changes affect heart rate variability (HRV). This work develops a new apnea screening method based on HRV analysis and machine learning technologies. An apnea/normal respiration (A/N) discriminant model is built for respiration condition estimation for every heart rate measurement, and an apnea/sleep ratio is introduced for final diagnosis. A random forest is adopted for the A/N discriminant model construction, which is trained with the PhysioNet apnea-ECG database. Main results: The screening performance of the proposed method was evaluated by applying it to clinical PSG data. Sensitivity and specificity achieved 76% and 92%, respectively, which are comparable to existing portable sleep monitoring devices used in sleep laboratories. Significance: Since the proposed OSA screening method can be used more easily than existing devices, it will contribute to OSA treatment.","obstructive sleep apnea,heart rate variability analysis,machine learning,home-use screening",Article,"IOP PUBLISHING LTD, TEMPLE CIRCUS, TEMPLE WAY, BRISTOL BS1 6BE, ENGLAND","Biophysics,Engineering,Physiology",,2.866,"CLINICAL-PRACTICE,GUIDELINE,AMERICAN-COLLEGE,POINCARE,PLOT,ASSOCIATION,POPULATION,ALGORITHM,DIAGNOSIS,HYPOPNEA,PRESSURE,MEDICINE",PHYSIOLOGICAL MEASUREMENT,https://doi.org/10.1088/1361-6579/ab57be,
53,Study on the effect of different electrode channel combinations of motor imagery EEG signals on classification accuracy,2019,23,8641-8645,"Zhu Kai,Wang Shuai,Zheng Dezhi,Dai Mengxi","Zhu K,Wang S,Zheng DZ,Dai MX",Wang S,10.1049/joe.2018.9073,Beihang University,"In order to improve the performance of motor imagery brain-computer interface (BCI) based on deep learning algorithm, here, the authors propose an electrode channel combination method. Although motor imagery electro-encephalography (EEG) signals which contain different electrode channels on the scalp surface have an effect on the classification performance, the effect of different electrode channel combinations has not been systematically explored. With the two deep learning models the authors constructed, the authors list some different electrode channel combinations to classify the left fist and right fist motor imagery EEG signals. The results show that the more the number of channels in these combinations, the higher the classification accuracy. However, when the number of channels exceeds 11, the classification accuracy increases slowly, and the classification effect is rarely improved. Therefore, the authors obtain an optimal electrode channel combination to use the electrode channels efficiently and to improve the performance of motor imagery BCI based on deep learning algorithms.","brain-computer interfaces,signal classification,electroencephalography,learning (artificial intelligence),medical signal processing,different electrode channel combinations,motor imagery EEG,classification accuracy,motor imagery brain-computer interface,deep learning algorithm,electrode channel combination method,motor imagery electro-encephalography signals,different electrode channels,fist motor imagery,classification effect,optimal electrode channel combination,motor imagery BCI",Article,"INST ENGINEERING TECHNOLOGY-IET, MICHAEL FARADAY HOUSE SIX HILLS WAY STEVENAGE, HERTFORD SG1 2AY, ENGLAND",Engineering,,,"EVENT-RELATED,SYNCHRONIZATION,DESYNCHRONIZATION",JOURNAL OF ENGINEERING-JOE,https://ietresearch.onlinelibrary.wiley.com/doi/pdfdirect/10.1049/joe.2018.9073,
54,Comparative study of motor imagery classification based on BP-NN and SVM,2019,23,8646-8649,"Jia Hongru,Wang Shuai,Zheng Dezhi,Qu Xiaolei,Fan Shangchun","Jia HR,Wang S,Zheng DZ,Qu XL,Fan SC",Wang S,10.1049/joe.2018.9075,Beihang University,"Motor imagery (MI) classification based on electroencephalogram (EEG) with high speed and accuracy is a key issue in brain-computer-interface (BCI) technology. This study compared the support vector machine (SVM) and back-propagation neural network (BP-NN) for MI classification. In this study, EEG data of four subjects provided by BCI competition 2008 was employed. For the comparison of classification accuracy (CA), there were three steps. First, EEG feature extraction for MI was implemented by using a common spatial pattern. Second, SVM and BP-NN were used to classify MI by cross-validation. Finally, the CA rate, receiver operating characteristic curve and area under the curve (AUC) were given to evaluate two classifiers. The average CA rates obtained on the four subjects using SVM and BP-NN were 75.20 and 80.73%, respectively. Furthermore, the mean AUCs of SVM and BP-NN were 0.7860 and 0.9462, respectively. Both average CA rate and AUC indicate that BP-NN has better accuracy of classification than SVM.","signal classification,neural nets,electroencephalography,medical signal processing,brain-computer interfaces,backpropagation,support vector machines,feature extraction,SVM,BP-NN,motor imagery classification,brain-computer-interface technology,MI classification,classification accuracy,EEG feature extraction,support vector machine,backpropagation neural network,electroencephalogram,BCI technology",Article,"INST ENGINEERING TECHNOLOGY-IET, MICHAEL FARADAY HOUSE SIX HILLS WAY STEVENAGE, HERTFORD SG1 2AY, ENGLAND",Engineering,,,,JOURNAL OF ENGINEERING-JOE,https://doi.org/10.1049/joe.2018.9075,
55,Deep learning-based research on the influence of training data size for breast cancer pathology detection,2019,23,8729-8732,"Cui Chongyang,Fan Shangchun,Lei Han,Qu Xiaolei,Zheng Dezhi","Cui CY,Fan SC,Lei H,Qu XL,Zheng DZ",Zheng DZ,10.1049/joe.2018.9093,Beihang University,"In pathological diagnosis of breast cancer, there are problems such as shortage of pathologists, difficulties in sample labeling, and huge workload of manual diagnosis. Therefore, deep learning-based computer-assisted pathology analysis systems have been developed to diagnose breast cancer and have achieved impressive results. However, it is difficult to obtain a large number of training sets due to the scarcity of pathological images and the huge labeling costs. Therefore, the size of the training set should be planned before building the pathology computer-assisted breast cancer analysis system. Here, the authors present a study to determine the optimal size of the training data set needed to achieve high classification accuracy when developing a pathology computer-assisted breast cancer analysis system. The authors trained two kind of CNNs using six different sizes of training data set and then tested the resulting system with a total of 10,000 images. All images were acquired from the Camelyon17 challenge. Here, the authors propose a scheme for determining the size of the training set and the size of the model in developing the pathology computer-assisted breast cancer analysis systems, which can be easily applied to develop systems for other different pathological images.","feature extraction,learning (artificial intelligence),medical image processing,patient diagnosis,cancer,neural nets,image classification,training data set,training set,pathology computer-assisted breast cancer analysis system,different pathological images,training data size,breast cancer pathology detection,pathological diagnosis,deep learning-based computer-assisted pathology analysis systems",Article,"INST ENGINEERING TECHNOLOGY-IET, MICHAEL FARADAY HOUSE SIX HILLS WAY STEVENAGE, HERTFORD SG1 2AY, ENGLAND",Engineering,,,,JOURNAL OF ENGINEERING-JOE,https://doi.org/10.1049/joe.2018.9093,
56,Pattern Discovery in White Etching Crack Experimental Data Using Machine Learning Techniques,9,24,,"Azzam Baher,Harzendorf Freia,Schelenz Ralf,Holweger Walter,Jacobs Georg","Azzam B,Harzendorf F,Schelenz R,Holweger W,Jacobs G",Azzam B,10.3390/app9245502,RWTH Aachen University,"White etching crack (WEC) failure is a failure mode that affects bearings in many applications, including wind turbine gearboxes, where it results in high, unplanned maintenance costs. WEC failure is unpredictable as of now, and its root causes are not yet fully understood. While WECs were produced under controlled conditions in several investigations in the past, converging the findings from the different combinations of factors that led to WECs in different experiments remains a challenge. This challenge is tackled in this paper using machine learning (ML) models that are capable of capturing patterns in high-dimensional data belonging to several experiments in order to identify influential variables to the risk of WECs. Three different ML models were designed and applied to a dataset containing roughly 700 high- and low-risk oil compositions to identify the constituting chemical compounds that make a given oil composition high-risk with respect to WECs. This includes the first application of a purpose-built neural network-based feature selection method. Out of 21 compounds, eight were identified as influential by models based on random forest and artificial neural networks. Association rules were also mined from the data to investigate the relationship between compound combinations and WEC risk, leading to results supporting those of previous analyses. In addition, the identified compound with the highest influence was proved in a separate investigation involving physical tests to be of high WEC risk. The presented methods can be applied to other experimental data where a high number of measured variables potentially influence a certain outcome and where there is a need to identify variables with the highest influence.","feature selection,premature bearing failure,wind turbine gearbox failure,random forests,artificial neural networks,association rules",Article,"MDPI, ST ALBAN-ANLAGE 66, CH-4052 BASEL, SWITZERLAND","Chemistry,Engineering,Materials Science,Physics",,2.736,"ROLLING-CONTACT,FATIGUE,MICROSTRUCTURAL,CHANGES,WEC,FORMATION,BEARINGS,AREA,FLAKING",APPLIED SCIENCES-BASEL,https://www.mdpi.com/2076-3417/9/24/5502/pdf,
57,"Identification of Toxic Herbs Using Deep Learning with Focus on the Sinomenium Acutum, Aristolochiae Manshuriensis Caulis, Akebiae Caulis",9,24,,"Cho Jaeseong,Jeon Suyeon,Song Siyoung,Kim Seokyeong,Kim Dohyun,Jeong Jongkil,Choi Goya,Lee Soongin","Cho J,Jeon S,Song S,Kim S,Kim D,Jeong J,Choi G,Lee S",Lee S,10.3390/app9245456,Dongshin University,"Toxic herbs are similar in appearance to those known to be safe, which can lead to medical accidents caused by identification errors. We aimed to study the deep learning models that can be used to distinguish the herb Aristolochiae Manshuriensis Caulis (AMC), which contains carcinogenic and nephrotoxic ingredients from Akebiae Caulis (AC) and Sinomenium acutum (SA). Five hundred images of each herb without backgrounds, captured with smartphones, and 100 images from the Internet were used as learning materials. The study employed the deep-learning models VGGNet16, ResNet50, and MobileNet for the identification. Two additional techniques were tried to enhance the accuracy of the models. One was extracting the edges from the images of the herbs using canny edge detection (CED) and the other was applying transfer learning (TL) to each model. In addition, the sensitivity and specificity of AMC, AC, and SA identification were assessed by experts with a Ph.D. degree in herbology, undergraduates and clinicians of oriental medicine, and the ability was compared with those of MobileNet-TL ' s. The identification accuracies of VGGNet16, ResNet50, and MobileNet were 93.9%, 92.2%, and 95.6%, respectively. After adopting the CED technique, the accuracy was 95.0% for VGGNet16, 63.9% for ResNet50, and 80.0% for MobileNet. After using TL without the CED technique, the accuracy was 97.8% for VGGNet16-TL, 98.9% for ResNet50-TL, and 99.4% for MobileNet-TL. Finally, MobileNet-TL showed the highest accuracy among three models. MobileNet-TL had higher identification accuracy than experts with a Ph.D. degree in herbology in Korea. The result identifying AMC, AC, and SA in MobileNet-TL has demonstrated a great capability to distinguish those three herbs beyond human identification accuracy. This study indicates that the deep-learning model can be used for herb identification.","Herbology,herb identification,deep learning,Aristolochiae Manshuriensis Caulis,MobileNet,transfer learning",Article,"MDPI, ST ALBAN-ANLAGE 66, CH-4052 BASEL, SWITZERLAND","Chemistry,Engineering,Materials Science,Physics",,2.736,,APPLIED SCIENCES-BASEL,https://www.mdpi.com/2076-3417/9/24/5456/pdf,
58,Optimized Resolution-Oriented Many-to-One Intensity Standardization Method for Magnetic Resonance Images,9,24,,"Gao Yuan,Wang Yuanyuan,Yu Jinhua","Gao Y,Wang YY,Yu JH",Wang YY,10.3390/app9245531,Fudan University,"With the development of big data, Radiomics and deep-learning methods based on magnetic resonance (MR) images, it is necessary to conduct large databases containing MR images from multiple centers. Having huge intensity distribution differences among images reduced or even eliminated, robust computer-aided diagnosis models could be established. Therefore, an optimized intensity standardization model is proposed. The network structure, loss function, and data input strategy were optimized to better avoid the image resolution loss during transformation. The experimental dataset was obtained from five MR scanners located in four hospitals and was divided into nine groups based on the imaging parameters, during which 9152 MR images from 499 participants were collected. Experiments show the superiority of the proposed method to the previously proposed unified model in resolution metrics including the peak signal-to-noise ratio, structural similarity, visual information fidelity, universal quality index, and image fidelity criterion. Another experiment further shows the advantage of the proposed method in increasing the effectiveness of following computer-aided diagnosis models by better preservation of MR image details. Moreover, the advantage over conventional standardization methods are also shown. Thus, MR images from different centers can be standardized using the proposed method, which will facilitate numerous data-driven medical imaging studies.","cycle generative adversarial network,intensity standardization,magnetic resonance imaging,resolution oriented,advanced weak-pair strategy",Article,"MDPI, ST ALBAN-ANLAGE 66, CH-4052 BASEL, SWITZERLAND","Chemistry,Engineering,Materials Science,Physics",,,,APPLIED SCIENCES-BASEL,https://www.mdpi.com/2076-3417/9/24/5531/pdf,
59,Detection and Imaging of Underground Objects for Distinguishing Explosives by Using a Fluxgate Sensor Array,9,24,,"Guerkan Serkan,Karapinar Mustafa,Dogan Seydi","Gurkan S,Karapinar M,Dogan S",Gurkan S,10.3390/app9245415,"Natl Def Univ, Dept Elect & Commun, Army NCO Vocat Sch, TR-10100 Balikesir, Turkey.","Active and passive techniques are two different techniques with which to detect buried explosives. In practice, the most preferred active method works by broadcasting a signal underground. This signal may stimulate the buried explosive and cause it to explode. It is important to eliminate or minimize this drawback to ensure the safety of the detector operator. In this respect, it is important to increase the studies on the passive detection technique which is not currently used in practice. The aim of this study was to passively detect improvised explosive devices without stimulating them, and to classify underground objects as explosive or non-explosive. A fluxgate sensor array having 33 components was used for passive magnetic field measurements, and the nearest neighborhood algorithm was preferred for classifying the resulting data. In experimental studies, 33 different samples having different amounts of ferromagnetic properties were used. Successful imaging and classification were achieved for the measurements up to 20 cm below the surface of soil. Data were recorded as 32 x 25 matrices, and then they were reduced to 32 x 2 matrices having the same features. Samples having explosive properties were distinguished from other underground objects with success rates of 86% and 95% for 32 x 25 and 32 x 2 data matrices, respectively. Classification times for 32 x 25 and 32 x 2 data matrices were 42 ms and 3.62 ms, respectively. For data groups where the best results were obtained for the data matrices, frame numbers classified in one second were calculated as 23.80 and 276.2, respectively. False alarm rate achieved was 5.31%. The experimental results proved the successes of the matrices reduction and classification approach. One of the most common problems encountered in passive detecting techniques is that the sensor position affects the measurements negatively. In this paper, a solution has been proposed for this important problem.","underground object detection,magnetic field measurement,nearest neighbor searches,remote sensing",Article,"MDPI, ST ALBAN-ANLAGE 66, CH-4052 BASEL, SWITZERLAND","Chemistry,Engineering,Materials Science,Physics",,2.736,"LANDMINE,DETECTION,MINE,DETECTION,IDENTIFICATION,CLASSIFICATION,SENSITIVITY",APPLIED SCIENCES-BASEL,https://www.mdpi.com/2076-3417/9/24/5415/pdf,
60,Development of Hybrid Machine Learning Models for Predicting the Critical Buckling Load of I-Shaped Cellular Beams,9,24,,"Hai-Bang Ly,Tien-Thinh Le,Lu Minh Le,Van Quan Tran,Vuong Minh Le,Huong-Lan Thi Vu,Quang Hung Nguyen,Binh Thai Pham","Ly HB,Le TT,Le LM,Tran VQ,Le VM,Vu HLT,Nguyen QH,Pham BT",Pham BT,10.3390/app9245458,"Univ Transport Technol, Hanoi 100000, Vietnam.","The principal purpose of this work is to develop three hybrid machine learning (ML) algorithms, namely ANFIS-RCSA, ANFIS-CA, and ANFIS-SFLA which are a combination of adaptive neuro-fuzzy inference system (ANFIS) with metaheuristic optimization techniques such as real-coded simulated annealing (RCSA), cultural algorithm (CA) and shuffled frog leaping algorithm (SFLA), respectively, to predict the critical buckling load of I-shaped cellular steel beams with circular openings. For this purpose, the existing database of buckling tests on I-shaped steel beams were extracted from the available literature and used to generate the datasets for modeling. Eight inputs, considered as independent variables, including the beam length, beam end-opening distance, opening diameter, inter-opening distance, section height, web thickness, flange width, and flange thickness, as well as one output of the critical buckling load of cellular steel beams considered as a dependent variable, were used in the datasets. Three quality assessment criteria, namely correlation coefficient (R), root mean squared error (RMSE) and mean absolute error (MAE) were employed for assessment of three developed hybrid ML models. The obtained results indicate that all three hybrid ML models have a strong ability to predict the buckling load of steel beams with circular openings, but ANFIS-SFLA (R = 0.960, RMSE = 0.040 and MAE = 0.017) exhibits the best effectiveness as compared with other hybrid models. In addition, sensitivity analysis was investigated and compared with linear statistical correlation between inputs and output to validate the importance of input variables in the models. The sensitivity results show that the most influenced variable affecting beam buckling capacity is the beam length, following by the flange width, the flange thickness, and the web thickness, respectively. This study shows that the hybrid ML techniques could help in establishing a robust numerical tool for beam buckling analysis. The proposed methodology is also promising to predict other types of failure, as well as other types of perforated beams.","I-shaped steel beam,machine learning,circular opening,adaptive neuro-fuzzy inference system,optimization techniques,cellular beam",Article,"MDPI, ST ALBAN-ANLAGE 66, CH-4052 BASEL, SWITZERLAND","Chemistry,Engineering,Materials Science,Physics",,2.736,"BIOGEOGRAPHY-BASED,OPTIMIZATION,ARTIFICIAL,NEURAL-NETWORK,FROG-LEAPING,ALGORITHM,STEEL,BEAMS,SPATIAL,PREDICTION,STRENGTH,DESIGN,SYSTEM,INTELLIGENCE,PERFORMANCE",APPLIED SCIENCES-BASEL,https://www.mdpi.com/2076-3417/9/24/5458/pdf,
