,title,Volume,Issue,Pages,whole__author_name,simply_author_name,reprint author,DOI,reprint address,Abstract,Keywords,Document Type,Publisher,Research Domain,Published Date,impact_factor,Keywords_plus,joural,pdf_link,Download_SuccessOrDefeat
53,Localized prediction of tissue outcome in acute ischemic stroke patients using diffusion- and perfusion-weighted MRI datasets,15,11,,"Grosser Malte,Gellissen Susanne,Borchert Patrick,Sedlacik Jan,Nawabi Jawed,Fiehler Jens,Forkert Nils D.","Grosser M,Gellissen S,Borchert P,Sedlacik J,Nawabi J,Fiehler J,Forkert ND",Grosser M,10.1371/journal.pone.0241917,University of Hamburg,"Background
An accurate prediction of tissue outcome in acute ischemic stroke patients is of high interest for treatment decision making. To date, various machine learning models have been proposed that combine multi-parametric imaging data for this purpose. However, most of these machine learning models were trained using voxel information extracted from the whole brain, without taking differences in susceptibility to ischemia into account that exist between brain regions. The aim of this study was to develop and evaluate a local tissue outcome prediction approach, which makes predictions using locally trained machine learning models and thus accounts for regional differences.
Material and methods
Multi-parametric MRI data from 99 acute ischemic stroke patients were used for the development and evaluation of the local tissue outcome prediction approach. Diffusion (ADC) and perfusion parameter maps (CBF, CBV, MTT, Tmax) and corresponding follow-up lesion masks for each patient were registered to the MNI brain atlas. Logistic regression (LR) and random forest (RF) models were trained employing a local approach, which makes predictions using models individually trained for each specific voxel position using the corresponding local data. A global approach, which uses a single model trained using all voxels of the brain, was used for comparison. Tissue outcome predictions resulting from the global and local RF and LR models, as well as a combined (hybrid) approach were quantitatively evaluated and compared using the area under the receiver operating characteristic curve (ROC AUC), the Dice coefficient, and the sensitivity and specificity metrics.
Results
Statistical analysis revealed the highest ROC AUC and Dice values for the hybrid approach. With 0.872 (ROC AUC; LR) and 0.353 (Dice; RF), these values were significantly higher (p < 0.01) than the values of the two other approaches. In addition, the local approach achieved the highest sensitivity of 0.448 (LR). Overall, the hybrid approach was only outperformed in sensitivity (LR) by the local approach and in specificity by both other approaches. However, in these cases the effect sizes were comparatively small.
Conclusion
The results of this study suggest that using locally trained machine learning models can lead to better lesion outcome prediction results compared to a single global machine learning model trained using all voxel information independent of the location in the brain.","PERFORMANCE,THRESHOLDS,MISMATCH,MODELS,TIME",Article,"PUBLIC LIBRARY SCIENCE, 1160 BATTERY STREET, STE 100, SAN FRANCISCO, CA 94111 USA",Science & Technology - Other Topics,,3.788,"PERFORMANCE,THRESHOLDS,MISMATCH,MODELS,TIME",PLOS ONE,https://journals.plos.org/plosone/article/file?id=10.1371/journal.pone.0241917&type=printable,
54,Measuring adverse events following hip arthroplasty surgery using administrative data without relying on ICD-codes,15,11,,"Magneli Martin,Unbeck Maria,Rogmark Cecilia,Skoldenberg Olof,Gordon Max","Magneli M,Unbeck M,Rogmark C,Skoldenberg O,Gordon M",Magneli M,10.1371/journal.pone.0242008,Danderyds Hospital,"Introduction
Measure and monitor adverse events (AEs) following hip arthroplasty is challenging. The aim of this study was to create a model for measuring AEs after hip arthroplasty using administrative data, such as length of stay and readmissions, with equal or better precision than an ICD-code based model.
Materials and methods
This study included 1 998 patients operated with an acute or elective hip arthroplasty in a national multi-centre study. We collected AEs within 90 days following surgery with retrospective record review. Additional data came from the Swedish Hip Arthroplasty Register, the Swedish National Patient Register and the Swedish National Board of Health and Welfare. We made a 2:1 split of the data into a training and a holdout set. We used the training set to train different machine learning models to predict if a patient had sustained an AE or not. After training and cross-validation we tested the best performing model on the holdout-set. We compared the results with an established ICD-code based measure for AEs.
Results
The best performing model was a logistic regression model with four natural age splines. The variables included in the model were as follows: length of stay at the orthopaedic department, discharge to acute care, age, number of readmissions and ED visits. The sensitivity and specificity for the new model was 23 and 90% for AE within 30 days, compared with 5 and 94% for the ICD-code based model. For AEs within 90 days the sensitivity and specificity were 31% and 89% compared with 16% and 92% for the ICD-code based model.
Conclusion
We conclude that a prediction model for AEs following hip arthroplasty surgery, relying on administrative data without ICD-codes is more accurate than a model based on ICD-codes.","LENGTH-OF-STAY,ORTHOPEDICS",Article,"PUBLIC LIBRARY SCIENCE, 1160 BATTERY STREET, STE 100, SAN FRANCISCO, CA 94111 USA",Science & Technology - Other Topics,,3.788,"LENGTH-OF-STAY,ORTHOPEDICS",PLOS ONE,https://journals.plos.org/plosone/article/file?id=10.1371/journal.pone.0242008&type=printable,
55,Logic-in-memory based on an atomically thin semiconductor,587,7832,72-+,"Migliato Marega Guilherme,Zhao Yanfei,Avsar Ahmet,Wang Zhenyu,Tripathi Mukesh,Radenovic Aleksandra,Kis Andras","Marega GM,Zhao YF,Avsar A,Wang ZY,Tripathi M,Radenovic A,Kis A",Kis A,10.1038/s41586-020-2861-0,Ecole Polytechnique Federale de Lausanne,"The growing importance of applications based on machine learning is driving the need to develop dedicated, energy-efficient electronic hardware. Compared with von Neumann architectures, which have separate processing and storage units, brain-inspired in-memory computing uses the same basic device structure for logic operations and data storage(1-3), thus promising to reduce the energy cost of data-centred computing substantially(4). Although there is ample research focused on exploring new device architectures, the engineering of material platforms suitable for such device designs remains a challenge. Two-dimensional materials(5,6) such as semiconducting molybdenum disulphide, MoS2, could be promising candidates for such platforms thanks to their exceptional electrical and mechanical properties(7-9). Here we report our exploration of large-area MoS2 as an active channel material for developing logic-in-memory devices and circuits based on floating-gate field-effect transistors (FGFETs). The conductance of our FGFETs can be precisely and continuously tuned, allowing us to use them as building blocks for reconfigurable logic circuits in which logic operations can be directly performed using the memory elements. After demonstrating a programmable NOR gate, we show that this design can be simply extended to implement more complex programmable logic and a functionally complete set of operations. Our findings highlight the potential of atomically thin semiconductors for the development of next-generation low-power electronics.
Logic operations and reconfigurable circuits are demonstrated that can be directly implemented using memory elements based on floating-gate field-effect transistors with monolayer MoS2 as the active channel material.","MONOLAYER MOS2,NONVOLATILE,ELECTRONICS,TRANSISTORS,OPERATIONS,CIRCUITS",Article,"NATURE RESEARCH, HEIDELBERGER PLATZ 3, BERLIN, 14197, GERMANY",Science & Technology - Other Topics,,54.637,"MONOLAYER,MOS2,NONVOLATILE,ELECTRONICS,TRANSISTORS,OPERATIONS,CIRCUITS",NATURE,https://www.ncbi.nlm.nih.gov/pmc/articles/PMC7116757,
56,Machine Learning Tools to Predict Hot Injection Syntheses Outcomes for II-VI and IV-VI Quantum Dots,124,44,24298-24305,"Baum Fabio,Pretto Tatiane,Koeche Ariadne,Leite Santos Marcos Jose","Baum F,Pretto T,Koche A,Santos MJL",Baum F,10.1021/acs.jpcc.0c05993,Instituto Federal do Rio Grande do Sul (IFRS),"In order to allow quantum dots with the desired physical and chemical properties, the fine control and prediction of size during chemical syntheses is a challenge that must be addressed. In this work, we applied machine learning algorithms, with information extracted from scientific papers, to identify the most important variables in the synthesis of CdSe, CdS, PbS, PbSe, and ZnSe quantum dots. From the random forest and gradient boosting machine algorithms, the most influential parameters on the final diameter of the quantum dots were the time of reaction, temperature, and metal precursors. Our models were applied to suggest the best reaction parameters for a desired quantum dot size. This methodology shall contribute to the quantum dot community to save time and money while reaching the proper material conditions for their applications.",,Article,"AMER CHEMICAL SOC, 1155 16TH ST, NW, WASHINGTON, DC 20036 USA","Chemistry,Science & Technology - Other Topics,Materials Science",,4.467,,JOURNAL OF PHYSICAL CHEMISTRY C,,
57,Machine Learning Analysis of the Cerebrovascular Thrombi Proteome in Human Ischemic Stroke: An Exploratory Study,11,,,"Dargazanli Cyril,Zub Emma,Deverdun Jeremy,Decourcelle Mathilde,de Bock Frederic,Labreuche Julien,Lefevre Pierre-Henri,Gascou Gregory,Derraz Imad,Riquelme Bareiro Carlos","Dargazanli C,Zub E,Deverdun J,Decourcelle M,de Bock F,Labreuche J,Lefevre PH,Gascou G,Derraz I,Bareiro CR",Dargazanli C; Costalat V; Marchi N,10.3389/fneur.2020.575376,Institut National de la Sante et de la Recherche Medicale (Inserm),"Objective: Mechanical retrieval of thrombotic material from acute ischemic stroke patients provides a unique entry point for translational research investigations. Here, we resolved the proteomes of cardioembolic and atherothrombotic cerebrovascular human thrombi and applied an artificial intelligence routine to examine protein signatures between the two selected groups.
Methods: We specifically used n = 32 cardioembolic and n = 28 atherothrombotic diagnosed thrombi from patients suffering from acute stroke and treated by mechanical thrombectomy. Thrombi proteins were successfully separated by gel-electrophoresis. For each thrombi, peptide samples were analyzed by nano-flow liquid chromatography coupled to tandem mass spectrometry (nano-LC-MS/MS) to obtain specific proteomes. Relative protein quantification was performed using a label-free LFQ algorithm and all dataset were analyzed using a support-vector-machine (SVM) learning method. Data are available via ProteomeXchange with identifier PXD020398. Clinical data were also analyzed using SVM, alone or in combination with the proteomes.
Results: A total of 2,455 proteins were identified by nano-LC-MS/MS in the samples analyzed, with 438 proteins constantly detected in all samples. SVM analysis of LFQ proteomic data delivered combinations of three proteins achieving a maximum of 88.3% for correct classification of the cardioembolic and atherothrombotic samples in our cohort. The coagulation factor XIII appeared in all of the SVM protein trios, associating with cardioembolic thrombi. A combined SVM analysis of the LFQ proteome and clinical data did not deliver a better discriminatory score as compared to the proteome only.
Conclusion: Our results advance the portrayal of the human cerebrovascular thrombi proteome. The exploratory SVM analysis outlined sets of proteins for a proof-of-principle characterization of our cohort cardioembolic and atherothrombotic samples. The integrated analysis proposed herein could be further developed and retested on a larger patients population to better understand stroke origin and the associated cerebrovascular pathophysiology.","stroke,thrombus,cerebrovascular,mechanical thrombectomy,proteome,neuroradiology",Article,"FRONTIERS MEDIA SA, AVENUE DU TRIBUNAL FEDERAL 34, LAUSANNE, CH-1015, SWITZERLAND",Neurosciences & Neurology,,4.189,"COAGULATION-FACTOR-XIII,CLASSIFICATION",FRONTIERS IN NEUROLOGY,https://hal.umontpellier.fr/hal-03226108/file/fneur-11-575376.pdf,
58,A brief review of new data analysis methods of laser-induced breakdown spectroscopy: machine learning,,,,"Zhang Dianxin,Zhang Hong,Zhao Yong,Chen Yongliang,Ke Chuan,Xu Tao,He Yaxiong","Zhang DX,Zhang H,Zhao Y,Chen YL,Ke C,Xu T,He YX",Zhang H,10.1080/05704928.2020.1843175,Southwest Jiaotong University,"Laser-induced breakdown spectroscopy (LIBS) is a technology of content analysis and composition analysis based on the atomic excitation and emission spectrum of materials. It has been intense activity in the field because of its advantages such as fast detection speed, no environmental limitation and no sample pretreatment. The low accuracy of LIBS is a primary problem in current applications, and the better data analysis methods is the key to solve this problem. Recently, machine learning algorithms significantly improve the accuracy of LIBS compared with traditional analysis methods. Therefore, the researchers gradually begin to pay attention to the application of machine learning algorithms in the LIBS data analysis. It is a programming method to study how computers simulate the learning process of human beings to acquire new knowledge and skills and continuously improve their performance. It is widely used in data analysis, pattern recognition, artificial intelligence and other fields. Here, we introduce the basic principle of LIBS and machine learning algorithms, review the research situation and progress of the application of machine learning algorithms to LIBS, and put forward the problems and challenges of its application.","LIBS,laser-induced breakdown spectroscopy,machine learning,atomic emission",Review; Early Access,"TAYLOR & FRANCIS INC, 530 WALNUT STREET, STE 850, PHILADELPHIA, PA 19106 USA","Instruments & Instrumentation,Spectroscopy",,5.771,"SUPPORT,VECTOR,MACHINE,PARTIAL,LEAST-SQUARES,QUANTITATIVE-ANALYSIS,ACCURACY,IMPROVEMENT,IRON-ORE,DISCRIMINATION,LIBS,CLASSIFICATION,IDENTIFICATION,METALS",APPLIED SPECTROSCOPY REVIEWS,,
59,,,,,,,,,,,,,,,,,,,,
60,Visual Question Answering via Combining Inferential Attention and Semantic Space Mapping,207,,,"Liu Yun,Zhang Xiaoming,Huang Feiran,Zhou Zhibo,Zhao Zhonghua,Li Zhoujun","Liu Y,Zhang XM,Huang FR,Zhou ZB,Zhao ZH,Li ZJ",Zhang XM,10.1016/j.knosys.2020.106339,Beihang University,"Visual Question Answering (VQA) has emerged and aroused widespread interest in recent years. Its purpose is to explore the close correlations between the image and question for answer inference. We have two observations about the VQA task: (1) the number of newly defined answers is ever-growing, which means that answer prediction on pre-defined labeled answers may lead to errors, as some unlabeled answers may be the right choice to the question-image pairs; (2) in the process of answering visual questions, the gradual change of human attention has an important guiding role in exploring the correlations between images and questions. Based on these observations, we propose a novel model for VQA, i.e., combining Inferential Attention and Semantic Space Mapping (IASSM). Specifically, our model has two salient aspects: (1) a semantic space shared by both the labeled and unlabeled answers is constructed to learn new answers, where the joint embedding of a question and the corresponding image is mapped and clustered around the answer exemplar; (2) a novel inferential attention model is designed to simulate the learning process of human attention to explore the correlations between the image and question. It focuses on the more important question words and image regions associated with the question. Both the inferential attention and the semantic space mapping modules are integrated into an end-to-end framework to infer the answer. Experiments performed on two public VQA datasets and our newly constructed dataset show the superiority of IASSM compared with existing methods. (C) 2020 Elsevier B.V. All rights reserved.","Visual Question Answering,Inferential attention,Semantic space mapping",Article,"ELSEVIER, RADARWEG 29, 1043 NX AMSTERDAM, NETHERLANDS",Computer Science,,7.842,,KNOWLEDGE-BASED SYSTEMS,,
61,"Printed, Wireless, Soft Bioelectronics and Deep Learning Algorithm for Smart Human-Machine Interfaces",12,44,49398-49406,"Kwon Young-Tae,Kim Hojoong,Mahmood Musa,Kim Yun-Soung,Demolder Carl,Yeo Woon-Hong","Kwon YT,Kim H,Mahmood M,Kim YS,Demolder C,Yeo WH",Yeo WH,10.1021/acsami.0c14193,University System of Georgia,"Recent advances in flexible materials and wearable electronics offer a noninvasive, high-fidelity recording of biopotentials for portable healthcare, disease diagnosis, and machine interfaces. Current device-manufacturing methods, however, still heavily rely on the conventional cleanroom microfabrication that requires expensive, time-consuming, and complicated processes. Here, we introduce an additive nanomanufacturing technology that explores a contactless direct printing of aerosol nanomaterials and polymers to fabricate stretchable sensors and multilayered wearable electronics. Computational and experimental studies prove the mechanical flexibility and reliability of soft electronics, considering direct mounting to the deformable human skin with a curvilinear surface. The dry, skin-conformal graphene biosensor, without the use of conductive gels and aggressive tapes, offers an enhanced biopotential recording on the skin and multiple uses (over ten times) with consistent measurement of electromyograms. The combination of soft bioelectronics and deep learning algorithm allows classifying six classes of muscle activities with an accuracy of over 97%, which enables wireless, real-time, continuous control of external machines such as a robotic hand and a robotic arm. Collectively, the comprehensive study of nanomaterials, flexible mechanics, system integration, and machine learning shows the potential of the printed bioelectronics for portable, smart, and persistent human-machine interfaces.","additive nanomanufacturing,printed bioelectronics,deep learning algorithm,human-machine interface,electromyograms (EMGs)",Article,"AMER CHEMICAL SOC, 1155 16TH ST, NW, WASHINGTON, DC 20036 USA","Science & Technology - Other Topics,Materials Science",,9.57,,ACS APPLIED MATERIALS & INTERFACES,,
62,Introducing Biomedisa as an open-source online platform for biomedical image segmentation,11,1,,"Loesel Philipp D.,van de Kamp Thomas,Jayme Alejandra,Ershov Alexey,Farago Tomas,Pichler Olaf,Jerome Nicholas Tan,Aadepu Narendar,Bremer Sabine,Chilingaryan Suren A.","Losel PD,van de Kamp T,Jayme A,Ershov A,Farago T,Pichler O,Jerome NT,Aadepu N,Bremer S,Chilingaryan SA",Losel PD,10.1038/s41467-020-19303-w,Ruprecht Karls University Heidelberg,"We present Biomedisa, a free and easy-to-use open-source online platform developed for semi-automatic segmentation of large volumetric images. The segmentation is based on a smart interpolation of sparsely pre-segmented slices taking into account the complete underlying image data. Biomedisa is particularly valuable when little a priori knowledge is available, e.g. for the dense annotation of the training data for a deep neural network. The platform is accessible through a web browser and requires no complex and tedious configuration of software and model parameters, thus addressing the needs of scientists without substantial computational expertise. We demonstrate that Biomedisa can drastically reduce both the time and human effort required to segment large images. It achieves a significant improvement over the conventional approach of densely pre-segmented slices with subsequent morphological interpolation as well as compared to segmentation tools that also consider the underlying image data. Biomedisa can be used for different 3D imaging modalities and various biomedical applications. Manual segmentation of biological images is a time-consuming task. Here the authors present Biomedisa, an open-source online platform for segmentation of large volumetric images starting from sparsely presegmented slices.",MRI,Article,"NATURE PORTFOLIO, HEIDELBERGER PLATZ 3, BERLIN, 14197, GERMANY",Science & Technology - Other Topics,,15.805,MRI,NATURE COMMUNICATIONS,https://publikationen.bibliothek.kit.edu/1000125797/91989403,
63,Neuronal diversity and convergence in a visual system developmental atlas,589,7840,88-U93,"ozel Mehmet Neset,Simon Felix,Jafari Shadi,Holguera Isabel,Chen Yen-Chung,Benhra Najate,El-Danaf Rana Naja,Kapuralin Katarina,Malin Jennifer Amy,Konstantinides Nikolaos","Ozel MN,Simon F,Jafari S,Holguera I,Chen YC,Benhra N,El-Danaf RN,Kapuralin K,Malin JA,Konstantinides N",Konstantinides N; Desplan C,10.1038/s41586-020-2879-3,New York University,"Deciphering how neuronal diversity is established and maintained requires a detailed knowledge of neuronal gene expression throughout development. In contrast to mammalian brains(1,2), the large neuronal diversity of the Drosophila optic lobe(3) and its connectome(4-6) are almost completely characterized. However, a molecular characterization of this neuronal diversity, particularly during development, has been lacking. Here we present insights into brain development through a nearly complete description of the transcriptomic diversity of the optic lobes of Drosophila. We acquired the transcriptome of 275,000 single cells at adult and at five pupal stages, and built a machine-learning framework to assign them to almost 200 cell types at all time points during development. We discovered two large neuronal populations that wrap neuropils during development but die just before adulthood, as well as neuronal subtypes that partition dorsal and ventral visual circuits by differential Wnt signalling throughout development. Moreover, we show that the transcriptomes of neurons that are of the same type but are produced days apart become synchronized shortly after their production. During synaptogenesis we also resolved neuronal subtypes that, although differing greatly in morphology and connectivity, converge to indistinguishable transcriptomic profiles in adults. Our datasets almost completely account for the known neuronal diversity of the Drosophila optic lobes, and serve as a paradigm to understand brain development across species.
The neuronal diversity of the Drosophila optic lobe is described throughout pupal development by single-cell sequencing, leading to the discovery of transient extrinsic neurons and a dorsoventral asymmetry of the visual circuits.","DROSOPHILA,EXPRESSION,NOTCH,DIFFERENTIATION,NEUROGENESIS,CIRCUITS,CELLS,MAP",Article,"NATURE RESEARCH, HEIDELBERGER PLATZ 3, BERLIN, 14197, GERMANY",Science & Technology - Other Topics,,54.637,"DROSOPHILA,EXPRESSION,NOTCH,DIFFERENTIATION,NEUROGENESIS,CIRCUITS,CELLS,MAP",NATURE,https://www.ncbi.nlm.nih.gov/pmc/articles/PMC7790857,
64,Structure-Based Synthesizability Prediction of Crystals Using Partially Supervised Learning,142,44,18836-18843,"Jang Jidon,Gu Geun Ho,Noh Juhwan,Kim Juhwan,Jung Yousung","Jang J,Gu GH,Noh J,Kim J,Jung Y",Jung Y,10.1021/jacs.0c07384,Korea Advanced Institute of Science & Technology (KAIST),"Predicting the synthesizability of inorganic materials is one of the major challenges in accelerated material discovery. A widely employed approximate approach is to consider the thermodynamic decomposition stability due to its simplicity of computing, but it is notorious for either producing too many candidates or missing important metastable materials. These results, however, are not unexcepted since the synthesizability is a complex phenomenon, and the thermodynamic stability is just one contributor. Here, we suggest a machine-learning model to quantify the probability of synthesis based on the partially supervised learning of materials database. We adapted the positive and unlabeled machine learning (PU learning) by implementing the graph convolutional neural network as a classifier in which the model outputs crystal-likeness scores (CLscore). The model shows 87.4% true positive (CLscore > 0.5) prediction accuracy for the test set of experimentally reported cases (9356 materials) in the Materials Project. We further validated the model by predicting the synthesizability of newly reported experimental materials in the last 5 years (2015-2019) with an 86.2% true positive rate using the model trained with the database as of the end of year 2014. Our analysis shows that our model captures the structural motif for synthesizability beyond what is possible by E-hull. We find that 71 materials among the top 100 high-scoring virtual materials have indeed been previously synthesized in the literature. With the proposed data-driven metric of the crystal-likeness score, high-throughput virtual screenings and generative models can benefit significantly by effectively reducing the chemical space that needs to be explored experimentally in the future toward more rational materials design.",DESIGN,Article,"AMER CHEMICAL SOC, 1155 16TH ST, NW, WASHINGTON, DC 20036 USA",Chemistry,,15.801,DESIGN,JOURNAL OF THE AMERICAN CHEMICAL SOCIETY,,
