,title,Volume,Issue,Pages,whole__author_name,simply_author_name,reprint author,DOI,reprint address,Abstract,Keywords,Document Type,Publisher,Research Domain,Published Date,impact_factor,Keywords_plus,joural,pdf_link,Download_SuccessOrDefeat
65,Machine Learning for Advanced Additive Manufacturing,3,5,1541-1556,"Jin Zeqing,Zhang Zhizhou,Demir Kahraman,Gu Grace X.","Jin ZQ,Zhang ZZ,Demir K,Gu GX",Gu GX,10.1016/j.matt.2020.08.023,University of California System,"Increasing demand for the fabrication of components with complex designs has spurred a revolution in manufacturing methods. Additive manufacturing stands out as a promising technology when it comes to prototyping multi-functional and multi-material designs. However, challenges still exist in the additive manufacturing process, such as mismatched material properties, lack of build consistency, and pervasive imperfections in the printed part. These inherent challenges can be avoided by implementing algorithms to detect imperfections and modulate printing parameters in real time. In this paper, several algorithms, with a focus on machine learning methods, are reviewed and explored to systematically tackle the three main stages of the additive manufacturing process: geometrical design, process parameter configuration, and in situ anomaly detection. Current challenges and future opportunities for algorithmically driven additive manufacturing processes, as well as potential applications to other manufacturing methods, are also discussed.","SELF-SUPPORTING STRUCTURES,MULTIMATERIAL TOPOLOGY OPTIMIZATION,PROCESS PARAMETERS,STRUCTURE DESIGN,DEFECT DETECTION,COMPOSITES,SIMULATION,STRESS,MODELS,MATTER",Review,"ELSEVIER, RADARWEG 29, 1043 NX AMSTERDAM, NETHERLANDS",Materials Science,,15.589,"SELF-SUPPORTING,STRUCTURES,MULTIMATERIAL,TOPOLOGY,OPTIMIZATION,PROCESS,PARAMETERS,STRUCTURE,DESIGN,DEFECT,DETECTION,COMPOSITES,SIMULATION,STRESS,MODELS,MATTER",MATTER,,
66,Advances in neural networks and potential for their application to steel metallurgy,36,17,1805-1819,Smith J. L.,Smith JL,Smith JL,10.1080/02670836.2020.1839206,University of Cambridge,"This review provides a timely exploration of several novel neural network (NN) architectures and learning methods, following a concise overview of the fundamentals of NNs and some important associated challenges. There are many benefits to using NNs, including deep learning models, in scientific research and, by understanding novel techniques better suited to certain applications, this benefit can be maximised. Finally, a few developed and emerging alternative learning paradigms are surveyed for their potential benefit to future research. The reviewed literature and accompanying discussion are of generic value well beyond steel metallurgy, and there is much to be gained from assessing methods used in other areas of materials science and further afield in order to apply them to steel metallurgy.","Deep learning,steel,metallurgy,modelling,machine learning,neural network,generative adversarial network",Article,"TAYLOR & FRANCIS LTD, 2-4 PARK SQUARE, MILTON PARK, ABINGDON OR14 4RN, OXON, ENGLAND","Materials Science,Metallurgy & Metallurgical Engineering",,2.475,"SOFT,COMPUTING,TECHNIQUES,ARTIFICIAL-INTELLIGENCE,FATIGUE,LIFE,TEMPERATURE,MARTENSITE,PREDICTION,HARDNESS,IMPACT,CARBON",MATERIALS SCIENCE AND TECHNOLOGY,,
67,Multiplexing the aperture of a metasurface: inverse design via deep-learning-forward genetic algorithm,53,45,,"Zhu Ruichao,Qiu Tianshuo,Wang Jiafu,Sui Sai,Li Yongfeng,Feng Mingde,Ma Hua,Qu Shaobo","Zhu RC,Qiu TS,Wang JF,Sui S,Li YF,Feng MD,Ma H,Qu SB",Wang JF,10.1088/1361-6463/aba64f,Air Force Engineering University,"The modern design of advanced functional materials or surfaces has increasingly undergone miniaturization and integration, so as to implement multiple functions using the same aperture. Metasurfaces, as an emerging kind of artificial functional surface, have provided unprecedented freedom in manipulating electomagnetic (EM) waves upon two-dimensional surfaces. It is desirable that the aperture of metasurfaces can be multiplexed with a number of functions for EM waves. Based on previous research, an artificial neural network-forward design can achieve an inverse design. In this paper, we propose an inverse design method of multiplexing metasurface apertures. A deep learning network (DLN) is trained to serve as a forward model for a genetic algorithm (GA), that is, a deep-leaning-forward genetic algorithm (DLF-GA). With the DLF-GA model, the phase of meta-atoms can be predicted for orthogonally linearly polarized waves simultaneously. The DLN was trained by a data set consisting of 70 000 samples with an accuracy of 95% on the test data. To demonstrate the competency of this method, we demonstrate the design of a multiplexed metasurface that can achieve focusing and diffuse scattering for polarization. The metasurface, which consists of 24 x 24 meta-atoms, can be generated monolithically with the input phase profile. A prototype was fabricated and measured. The predicted, simulated, and measured results are well consistent and underscore the validity of this inverse design method. This method provides an efficient and accurate method for the fast design of multiplexed metasurfaces and will find applications in microwave engineering such as in satellite communications.","multiplexed aperture,metasurface,deep learning,genetic algorithm,multifunction,inverse design",Article,"IOP PUBLISHING LTD, TEMPLE CIRCUS, TEMPLE WAY, BRISTOL BS1 6BE, ENGLAND",Physics,,3.041,,JOURNAL OF PHYSICS D-APPLIED PHYSICS,,
68,The 2020 magnetism roadmap,53,45,,"Vedmedenko E. Y.,Kawakami R. K.,Sheka D. D.,Gambardella P.,Kirilyuk A.,Hirohata A.,Binek C.,Chubykalo-Fesenko O.,Sanvito S.,Kirby B. J.","Vedmedenko EY,Kawakami RK,Sheka DD,Gambardella P,Kirilyuk A,Hirohata A,Binek C,Chubykalo-Fesenko O,Sanvito S,Kirby BJ",Berger A,10.1088/1361-6463/ab9d98,"CIC NanoGUNE BRTA, E-20018 Donostia San Sebastian, Spain.","Andreas BergerCICnanoGUNE BRTA Following the success and relevance of the 2014 and 2017 Magnetism Roadmap articles, this 2020 Magnetism Roadmap edition takes yet another timely look at newly relevant and highly active areas in magnetism research. The overall layout of this article is unchanged, given that it has proved the most appropriate way to convey the most relevant aspects of today's magnetism research in a wide variety of sub-fields to a broad readership. A different group of experts has again been selected for this article, representing both the breadth of new research areas, and the desire to incorporate different voices and viewpoints. The latter is especially relevant for thistype of article, in which one's field of expertise has to be accommodated on two printed pages only, so that personal selection preferences are naturally rather more visible than in other types of articles. Most importantly, the very relevant advances in the field of magnetism research in recent years make the publication of yet another Magnetism Roadmap a very sensible and timely endeavour, allowing its authors and readers to take another broad-based, but concise look at the most significant developments in magnetism, their precise status, their challenges, and their anticipated future developments. While many of the contributions in this 2020 Magnetism Roadmap edition have significant associations with different aspects of magnetism, the general layout can nonetheless be classified in terms of three main themes: (i) phenomena, (ii) materials and characterization, and (iii) applications and devices. While these categories are unsurprisingly rather similar to the 2017 Roadmap, the order is different, in that the 2020 Roadmap considers phenomena first, even if their occurrences are naturally very difficult to separate from the materials exhibiting such phenomena. Nonetheless, the specifically selected topics seemed to be best displayed in the order presented here, in particular, because many of the phenomena or geometries discussed in (i) can be found or designed into a large variety of materials, so that the progression of the article embarks from more general concepts to more specific classes of materials in the selected order. Given that applications and devices are based on both phenomena and materials, it seemed most appropriate to close the article with the application and devices section (iii) once again. The 2020 Magnetism Roadmap article contains 14 sections, all of which were written by individual authors and experts, specifically addressing a subject in terms of its status, advances, challenges and perspectives in just two pages. Evidently, this two-page format limits the depth to which each subject can be described. Nonetheless, the most relevant and key aspects of each field are touched upon, which enables the Roadmap as whole to give its readership an initial overview of and outlook into a wide variety of topics and fields in a fairly condensed format. Correspondingly, the Roadmap pursues the goal of giving each reader a brief reference frame of relevant and current topics in modern applied magnetism research, even if not all sub-fields can be represented here. The first block of this 2020 Magnetism Roadmap, which is focussed on (i) phenomena, contains five contributions, which address the areas of interfacial Dzyaloshinskii-Moriya interactions, and two-dimensional and curvilinear magnetism, as well as spin-orbit torque phenomena and all optical magnetization reversal.
All of these contributions describe cutting edge aspects of rather fundamental physical processes and properties, associated with new and improved magnetic materials' properties, together with potential developments in terms of future devices and technology. As such, they form part of a widening magnetism 'phenomena reservoir' for utilization in applied magnetism and related device technology. The final block (iii) of this article focuses on such applications and device-related fields in four contributions relating to currently active areas of research, which are of course utilizing magnetic phenomena to enable specific functions. These contributions highlight the role of magnetism or spintronics in the field of neuromorphic and reservoir computing, terahertz technology, and domain wall-based logic. One aspect common to all of these application-related contributions is that they are not yet being utilized in commercially available technology; it is currently still an open question, whether or not such technological applications will be magnetism-based at all in the future, or if other types of materials and phenomena will yet outperform magnetism. This last point is actually a very good indication of the vibrancy of applied magnetism research today, given that it demonstrates that magnetism research is able to venture into novel application fields, based upon its portfolio of phenomena, effects and materials. This materials portfolio in particular defines the central block (ii) of this article, with its five contributions interconnecting phenomena with devices, for which materials and the characterization of their properties is the decisive discriminator between purely academically interesting aspects and the true viability of real-life devices, because only available materials and their associated fabrication and characterization methods permit reliable technological implementation. These five contributions specifically address magnetic films and multiferroic heterostructures for the purpose of spin electronic utilization, multi-scale materials modelling, and magnetic materials design based upon machine-learning, as well as materials characterization via polarized neutron measurements. As such, these contributions illustrate the balanced relevance of research into experimental and modelling magnetic materials, as well the importance of sophisticated characterization methods that allow for an ever-more refined understanding of materials. As a combined and integrated article, this 2020 Magnetism Roadmap is intended to be a reference point for current, novel and emerging research directions in modern magnetism, just as its 2014 and 2017 predecessors have been in previous years.","applied magnetism,magnetic materials,magnetic phenomena,novel applications of magnetism",Article,"IOP PUBLISHING LTD, TEMPLE CIRCUS, TEMPLE WAY, BRISTOL BS1 6BE, ENGLAND",Physics,,3.041,"DYNAMICS,DRIVEN,SPIN,DYNAMICS,FILMS,STATE,MAGNETIZATION,REVERSAL,EMITTERS,DESIGN,LOGIC,BEAM",JOURNAL OF PHYSICS D-APPLIED PHYSICS,https://pure.mpg.de/pubman/item/item_3252689_2/component/file_3253225/Vedmedenko_2020_J._Phys._D%20_Appl._Phys._53_453001.pdf,
69,Development of Hepatitis Disease Detection System by Exploiting Sparsity in Linear Support Vector Machine to Improve Strength of AdaBoost Ensemble Model,2020,,,"Akbar Wasif,Wu Wei-ping,Saleem Sehrish,Farhan Muhammad,Saleem Muhammad Asim,Javeed Ashir,Ali Liaqat","Akbar W,Wu WP,Saleem S,Farhan M,Saleem MA,Javeed A,Ali L",Akbar W,10.1155/2020/8870240,University of Electronic Science & Technology of China,"Hepatitis disease is a deadliest disease. The management and diagnosis of hepatitis disease is expensive and requires high level of human expertise which poses challenges for the health care system in underdeveloped and developing countries. Hence, development of automated methods for accurate prediction of hepatitis disease is inevitable. In this paper, we develop a diagnostic system which hybridizes a linear support vector machine (SVM) model with adaptive boosting (AdaBoost) model. We exploit sparsity in linear SVM that is caused by L1 regularization. The sparse L1-regularized SVM is capable of eliminating redundant or irrelevant features from feature space. After filtering features through the sparse linear SVM, the output of the SVM is applied to the AdaBoost ensemble model which is used for classification purposes. Two types of numerical experiments are performed on the clinical features of hepatitis disease collected from UCI machine learning repository. In the first experiment, only conventional AdaBoost model is used, while in the second experiment, a feature vector is applied to the sparse linear SVM before its application to the AdaBoost model. Simulation results demonstrate that the strength of a conventional AdaBoost model is enhanced by 6.39% by the proposed method, and its time complexity is also reduced. In addition, the proposed method shows better performance than many previously developed methods for hepatitis disease prediction.","PRINCIPAL COMPONENT ANALYSIS,DISCRIMINANT-ANALYSIS,FEATURE-SELECTION,EXPERT-SYSTEM,B-VIRUS,DIAGNOSIS,PREDICTION,CLASSIFICATION",Article,"HINDAWI LTD, ADAM HOUSE, 3RD FLR, 1 FITZROY SQ, LONDON, W1T 5HF, ENGLAND","Computer Science,Telecommunications",,1.537,"PRINCIPAL,COMPONENT,ANALYSIS,DISCRIMINANT-ANALYSIS,FEATURE-SELECTION,EXPERT-SYSTEM,B-VIRUS,DIAGNOSIS,PREDICTION,CLASSIFICATION",MOBILE INFORMATION SYSTEMS,https://downloads.hindawi.com/journals/misy/2020/8870240.pdf,
70,LV-GAN: A deep learning approach for limited-view optoacoustic imaging based on hybrid datasets,14,2,,"Lu Tong,Chen Tingting,Gao Feng,Sun Biao,Ntziachristos Vasilis,Li Jiao","Lu T,Chen TT,Gao F,Sun B,Ntziachristos V,Li J",Li J,10.1002/jbio.202000325,Tianjin University,"The optoacoustic imaging (OAI) methods are rapidly evolving for resolving optical contrast in medical imaging applications. In practice, measurement strategies are commonly implemented under limited-view conditions due to oversized image objectives or system design limitations. Data acquired by limited-view detection may impart artifacts and distortions in reconstructed optoacoustic (OA) images. We propose a hybrid data-driven deep learning approach based on generative adversarial network (GAN), termed as LV-GAN, to efficiently recover high quality images from limited-view OA images. Trained on both simulation and experiment data, LV-GAN is found capable of achieving high recovery accuracy even under limited detection angles less than 60 degrees. The feasibility of LV-GAN for artifact removal in biological applications was validated by ex vivo experiments based on two different OAI systems, suggesting high potential of a ubiquitous use of LV-GAN to optimize image quality or system design for different scanners and application scenarios.","biomedical applications,deep learning,high quality,limited&#8208,view,optoacoustic imaging",Article,"WILEY-V C H VERLAG GMBH, POSTFACH 101161, 69451 WEINHEIM, GERMANY","Biochemistry & Molecular Biology,Biophysics,Optics",,3.403,TOMOGRAPHY,JOURNAL OF BIOPHOTONICS,,
71,Beyond kappa: an informational index for diagnostic agreement in dichotomous and multivalue ordered-categorical ratings,58,12,3089-3099,"Casagrande Alberto,Fabris Francesco,Girometti Rossano","Casagrande A,Fabris F,Girometti R",Fabris F,10.1007/s11517-020-02261-2,University of Trieste,"Agreement measures are useful tools to both compare different evaluations of the same diagnostic outcomes and validate new rating systems or devices. Cohen's kappa (kappa) certainly is the most popular agreement method between two raters, and proved its effectiveness in the last sixty years. In spite of that, this method suffers from some alleged issues, which have been highlighted since the 1970s; moreover, its value is strongly dependent on the prevalence of the disease in the considered sample. This work introduces a new agreement index, the informational agreement (IA), which seems to avoid some of Cohen's kappa's flaws, and separates the contribution of the prevalence from the nucleus of agreement. These goals are achieved by modelling the agreement-in both dichotomous and multivalue ordered-categorical cases-as the information shared between two raters through the virtual diagnostic channel connecting them: the more information exchanged between the raters, the higher their agreement. In order to test its fair behaviour and the effectiveness of the method, IA has been tested on some cases known to be problematic for kappa, in the machine learning context and in a clinical scenario to compare ultrasound (US) and automated breast volume scanner (ABVS) in the setting of breast cancer imaging.","Diagnostic agreement,Cohen's kappa statistic,Multivalue ordered-categorical ratings,Inter-reader agreement,Information measures",Article,"SPRINGER HEIDELBERG, TIERGARTENSTRASSE 17, D-69121 HEIDELBERG, GERMANY","Computer Science,Engineering,Mathematical & Computational Biology,Medical Informatics",,2.61,"WEIGHTED,KAPPA,TESTS,PERFORMANCE,COEFFICIENT,PREVALENCE,TERMS",MEDICAL & BIOLOGICAL ENGINEERING & COMPUTING,https://www.ncbi.nlm.nih.gov/pmc/articles/PMC7679268,
72,,,,,,,,,,,,,,,,,,,,
73,FLAIR-Wise Machine-Learning Classification and Lateralization of MRI-Negative F-18-FDG PET-Positive Temporal Lobe Epilepsy,11,,,"Beheshti Iman,Sone Daichi,Maikusa Norihide,Kimura Yukio,Shigemoto Yoko,Sato Noriko,Matsuda Hiroshi","Beheshti I,Sone D,Maikusa N,Kimura Y,Shigemoto Y,Sato N,Matsuda H",Matsuda H,10.3389/fneur.2020.580713,"Southern Tohoku Res Inst Neurosci, Cyclotron & Drug Discovery Res Ctr, Koriyama, Fukushima, Japan.","Objective: In this study, we investigated the ability of fluid-attenuated inversion recovery (FLAIR) data coupled with machine-leaning algorithms to differentiate normal and epileptic brains and identify the laterality of focus side in temporal lobe epilepsy (TLE) patients with visually negative MRI.
Materials and Methods: The MRI data were acquired on a 3-T MR system (Philips Medical Systems). After pre-proceeding stage, the FLAIR signal intensities were extracted from specific regions of interest, such as the amygdala, cerebral white matter, inferior temporal gyrus, middle temporal gyrus, parahippocampal gyrus, superior temporal gyrus, and temporal pole, and fed into a classification framework followed by a support vector machine as classifier. The proposed lateralization framework was assessed in a group of MRI-negative unilateral TLE patients (N = 42; 23 left TLE and 19 right TLE) and 34 healthy controls (HCs) based on a leave-one-out cross-validation strategy.
Results: Using the FLAIR data, we obtained a 75% accuracy for discriminating the three groups, as well as 87.71, 83.01, and 76.19% accuracies for HC/right TLE, HC/left TLE, and left TLE/right TLE tasks, respectively.
Interpretation: The experimental results show that FLAIR data can potentially be considered an informative biomarker for improving the pre-surgical diagnostic confidence in patients with MRI-negative TLE.","fluid-attenuated inversion recovery,temporal lobe epilepsy,machine-learning,feature extraction,MRI-negative focal epilepsy",Article,"FRONTIERS MEDIA SA, AVENUE DU TRIBUNAL FEDERAL 34, LAUSANNE, CH-1015, SWITZERLAND",Neurosciences & Neurology,,4.189,"WHITE-MATTER,ABNORMALITIES",FRONTIERS IN NEUROLOGY,https://www.frontiersin.org/articles/10.3389/fneur.2020.580713/pdf,
74,MMHGE: detecting mild cognitive impairment based on multi-atlas multi-view hybrid graph convolutional networks and ensemble learning,24,1,103-113,"Liu Jin,Zeng Dejiao,Guo Rui,Lu Mingming,Wu Fang-Xiang,Wang Jianxin","Liu J,Zeng DJ,Guo R,Lu MM,Wu FX,Wang JX",Liu J; Wang JX,10.1007/s10586-020-03199-8,Central South University,"Currently, it is still a great challenge in clinical practice to accurately detect the early state of Alzheimer's disease (AD), i.e., mild cognitive impairment (MCI) including early MCI (EMCI) and late MCI (LMCI). To address this challenge, we propose a new MCI detection framework based on multi-atlas multi-view hybrid graph convolutional networks and ensemble learning. We first construct nine different graphs based on three brain atlases and three morphological measurements using both imaging and non-imaging data of each subject. Then, in order to integrate the information of different graphs and obtain more discriminative feature representations for detecting MCI, we propose a hybrid graph convolutional network method. Finally, a new ensemble learning method is proposed to perform MCI detection tasks. An evaluation of our proposed framework has been conducted with 369 subjects with cognitively normal (CN), 779 subjects with MCI including 310 subjects with EMCI and 469 subjects with LMCI, and 301 subjects with AD on three classification tasks. Experimental results show that our proposed framework can get an accuracy of 90.8% and an AUC of 0.932 for MCI/CN classification, an accuracy of 88.6% and an AUC of 0.908 for MCI/AD classification, and an accuracy of 83.5% and an AUC of 0.851 for EMCI/LMCI classification, respectively. Compared with some state-of-the-art methods about MCI detection, our proposed framework can get better performance. Overall, our proposed framework is effective and promising for MCI detection in clinical practice.","MCI detection,Multi-atlas multi-view feature representation,Graph convolutional networks,Ensemble learning",Article,"SPRINGER, ONE NEW YORK PLAZA, SUITE 4600, NEW YORK, NY, UNITED STATES",Computer Science,,1.906,"AUTISM,SPECTRUM,DISORDER,VOXEL,BASED,MORPHOMETRY,BRAIN,CONNECTIVITY,MRI,DISEASE,CLASSIFICATION,ALZHEIMER,CORTEX",CLUSTER COMPUTING-THE JOURNAL OF NETWORKS SOFTWARE TOOLS AND APPLICATIONS,,
75,Machine learning driven simulated deposition of carbon films: From low-density to diamondlike amorphous carbon,102,17,,"Caro Miguel A.,Csanyi Gabor,Laurila Tomi,Deringer Volker L.","Caro MA,Csanyi G,Laurila T,Deringer VL",Caro MA,10.1103/PhysRevB.102.174201,Aalto University,"Amorphous carbon (a-C) materials have diverse interesting and useful properties, but the understanding of their atomic-scale structures is still incomplete. Here, we report on extensive atomistic simulations of the deposition and growth of a-C films, describing interatomic interactions using a machine learning (ML) based Gaussian approximation potential model. We expand widely on our initial work [M. A. Caro et al., Phys. Rev. Lett. 120, 166101 (2018)] by now considering a broad range of incident ion energies, thus modeling samples that span the entire range from low-density (sp(2)-rich) to high-density (sp(3)-rich, ""diamondlike"") amorphous forms of carbon. Two different mechanisms are observed in these simulations, depending on the impact energy: low-energy impacts induce sp- and sp(2)-dominated growth directly around the impact site, whereas high-energy impacts induce peening. Furthermore, we propose and apply a scheme for computing the anisotropic elastic properties of the a-C films. Our work provides fundamental insight into this intriguing class of disordered solids, as well as a conceptual and methodological blueprint for simulating the atomic-scale deposition of other materials with ML driven molecular dynamics.","MOLECULAR-DYNAMICS SIMULATIONS,CROSS-SECTIONAL STRUCTURE,AB-INITIO SIMULATIONS,REACTIVE FORCE-FIELD,PLANE-WAVE,ELECTROCHEMICAL DETECTION,STRUCTURAL MOTIFS,TOTAL-ENERGY,GROWTH,POTENTIALS",Article,"AMER PHYSICAL SOC, ONE PHYSICS ELLIPSE, COLLEGE PK, MD 20740-3844 USA","Materials Science,Physics",,3.86,"MOLECULAR-DYNAMICS,SIMULATIONS,CROSS-SECTIONAL,STRUCTURE,AB-INITIO,SIMULATIONS,REACTIVE,FORCE-FIELD,PLANE-WAVE,ELECTROCHEMICAL,DETECTION,STRUCTURAL,MOTIFS,TOTAL-ENERGY,GROWTH,POTENTIALS",PHYSICAL REVIEW B,http://arxiv.org/pdf/2006.09760,
