,title,Volume,Issue,Pages,whole__author_name,simply_author_name,reprint author,DOI,reprint address,Abstract,Keywords,Document Type,Publisher,Research Domain,Published Date,impact_factor,Keywords_plus,joural,pdf_link,Download_SuccessOrDefeat
66,Machine learning in materials design: Algorithm and application*,29,11,,"Song Zhilong);,Chen Xiwen);,Meng Fanbin);,Cheng Guanjian);,Wang Chen);,Sun Zhongti,Yin Wan-Jian","Song ZL,Chen XW,Meng FB,Cheng GJ,Wang C,Sun ZT,Yin WJ",Sun ZT; Yin WJ,10.1088/1674-1056/abc0e3,Suzhou University,"Traditional materials discovery is in 'trial-and-error' mode, leading to the issues of low-efficiency, high-cost, and unsustainability in materials design. Meanwhile, numerous experimental and computational trials accumulate enormous quantities of data with multi-dimensionality and complexity, which might bury critical 'structure-properties' rules yet unfortunately not well explored. Machine learning (ML), as a burgeoning approach in materials science, may dig out the hidden structure-properties relationship from materials bigdata, therefore, has recently garnered much attention in materials science. In this review, we try to shortly summarize recent research progress in this field, following the ML paradigm: (i) data acquisition -> (ii) feature engineering -> (iii) algorithm -> (iv) ML model -> (v) model evaluation -> (vi) application. In section of application, we summarize recent work by following the 'material science tetrahedron': (i) structure and composition -> (ii) property -> (iii) synthesis -> (iv) characterization, in order to reveal the quantitative structure-property relationship and provide inverse design countermeasures. In addition, the concurrent challenges encompassing data quality and quantity, model interpretability and generalizability, have also been discussed. This review intends to provide a preliminary overview of ML from basic algorithms to applications.","machine learning,materials design,structure-property relationship,active learning",Review,"IOP PUBLISHING LTD, TEMPLE CIRCUS, TEMPLE WAY, BRISTOL BS1 6BE, ENGLAND",Physics,,1.262,"DEEP,NEURAL-NETWORKS,PEROVSKITE,SOLAR-CELLS,AB-INITIO,CALCULATIONS,TEMPERATURE,T-G,CRYSTAL-STRUCTURE,TRANSITION-TEMPERATURE,STRUCTURE,PREDICTION,THERMODYNAMIC,STABILITY,ACCELERATED,DISCOVERY,MECHANICAL-PROPERTIES",CHINESE PHYSICS B,,
67,Automatic epileptic EEG classification based on differential entropy and attention model,96,,,"Zhang Jian,Wei Zuochen,Zou Junzhong,Fu Hao","Zhang J,Wei ZC,Zou JZ,Fu H",Zou JZ,10.1016/j.engappai.2020.103975,East China University of Science & Technology,"In epilepsy electroencephalogram (EEG) analysis, clinicians usually interpret EEG page by page, which is time-consuming and brings heavy workload. This paper proposes a novel automatic epileptic EEG classification approach based on differential entropy and attention mechanism, aiming at designing a short-term epileptic EEG classification model with high accuracy and good generalization performance. Firstly, the original EEG recordings are decomposed into five sub-frequency bands which approximately obey the Gaussian distribution. Afterward, a improved attention model framework considering both row and column attention with a shallower VGGNet (AttVGGNet-RC) is put forward as the classifier. Finally, non-patient specific method is employed to evaluate the performance with pre-tuned hypermeters. With 8-fold data, the proposed model yielded 77.33 +/- 2.91% sensitivity, 86.67 +/- 3.70% specificity and 82.00 +/- 1.43% accuracy, and accuracy was increased by 5.34%, 8.99%, 26.24% and 4.47% respectively compared with multi-layer perceptron (MLP), extreme learning machine (ELM), support vector machine (SVM) and Long Short-Term Memory (LSTM). With 10-fold shuffled data, the improved attention model yielded 93.84 +/- 0.63% sensitivity, 95.84 +/- 0.74% specificity and 95.12 +/- 0.20% accuracy, and the accuracy was 1.34%, 16.29%, 27.12% and 8.24% higher than MLP, ELM, SVM and LSTM respectively. The experimental result showed that the attention model achieved high classification accuracy with low standard deviation as well as good generalization performance. Furthermore, compared with state-of-art epilepsy analysis system, the proposed approach also show better performance. Therefore, this study has significant clinical application value in epilepsy analysis.","Electroencephalography,Epilepsy,Differential entropy,Attention mechanism",Article,"PERGAMON-ELSEVIER SCIENCE LTD, THE BOULEVARD, LANGFORD LANE, KIDLINGTON, OXFORD OX5 1GB, ENGLAND","Automation & Control Systems,Computer Science,Engineering",,5.317,"SEIZURE,DETECTION,DECOMPOSITION,PREDICTION",ENGINEERING APPLICATIONS OF ARTIFICIAL INTELLIGENCE,,
68,"Integrating Neighborhood Effect and Supervised Machine Learning Techniques to Model and Simulate Forest Insect Outbreaks in British Columbia, Canada",11,11,,"Harati Saeed,Perez Liliana,Molowny-Horas Roberto","Harati S,Perez L,Molowny-Horas R",Harati S,10.3390/f11111215,Universite de Montreal,"Background and Objectives: Modelling and simulation of forest land cover change due to epidemic insect outbreaks are powerful tools that can be used in planning and preparing strategies for forest management. In this study, we propose an integrative approach to model land cover changes at a provincial level, using as a study case the simulation of the spatiotemporal dynamics of mountain pine beetle (MPB) infestation over the lodgepole pine forest of British Columbia (BC), Canada. This paper aims to simulate land cover change by applying supervised machine learning techniques to maps of MPB-driven deforestation. Materials and Methods: We used a 16-year series (1999-2014) of spatial information on annual mortality of pine trees due to MPB attacks, provided by the BC Ministry of Forests. We used elevation, aspect, slope, ruggedness, and weighted neighborhood of infestation as predictors. We implemented (a) generalized linear regression (GLM), and (b) random forest (RF) algorithms to simulate forestland cover changes due to MPB between 2005 and 2014. To optimize the ability of our models to predict MPB infestation in 2020, a cross-validation procedure was implemented. Results: Simulating infestations from 2008 to 2014, RF algorithms produced less error than GLM. Our simulations for the year 2020 confirmed the predictions from the BC Ministry of Forest by forecasting a slower rate of spread in future MPB infestations in the province. Conclusions: Integrating neighborhood effects as variables in model calibration allows spatiotemporal complexities to be simulated.","land cover change,complex systems,model calibration,random forest,insect outbreaks,regression,machine learning",Article,"MDPI, ST ALBAN-ANLAGE 66, CH-4052 BASEL, SWITZERLAND",Forestry,,2.804,"MOUNTAIN,PINE-BEETLE,CELLULAR-AUTOMATA,ECONOMIC-IMPACT,BOREAL,FOREST,LODGEPOLE,INFESTATION,DISTURBANCE,RISK,FIRE,GIS",FORESTS,https://www.mdpi.com/1999-4907/11/11/1215/pdf,
69,A Machine Learning Model Accurately Predicts Ulcerative Colitis Activity at One Year in Patients Treated with Anti-Tumour Necrosis Factor alpha Agents,56,11,,"Popa Iolanda Valentina,Burlacu Alexandru,Mihai Catalina,Prelipcean Cristina Cijevschi","Popa IV,Burlacu A,Mihai C,Prelipcean CC",Mihai C,10.3390/medicina56110628,Grigore T Popa University of Medicine & Pharmacy,"Background and objectives: The biological treatment is a promising therapeutic option for ulcerative colitis (UC) patients, being able to induce subclinical and long-term remission. However, the relatively high costs and the potential toxicity have led to intense debates over the most appropriate criteria for starting, stopping, and managing biologics in UC. Our aim was to build a machine learning (ML) model for predicting disease activity at one year in UC patients treated with anti-Tumour necrosis factor alpha agents as a useful tool to assist the clinician in the therapeutic decisions. Materials and Methods: Clinical and biological parameters and the endoscopic Mayo score were collected from 55 UC patients at the baseline and one year follow-up. A neural network model was built using the baseline endoscopic activity and four selected variables as inputs to predict whether a UC patient will have an active or inactive endoscopic disease at one year, under the same therapeutic regimen. Results: The classifier achieved an excellent performance predicting the disease activity at one year with an accuracy of 90% and area under curve (AUC) of 0.92 on the test set and an accuracy of 100% and an AUC of 1 on the validation set. Conclusions: Our proposed ML solution may prove to be a useful tool in assisting the clinicians' decisions to increase the dose or switch to other biologic agents after the model's validation on independent, external cohorts of patients.","inflammatory bowel diseases,artificial intelligence,biological therapy,predictive model,disease activity",Article,"MDPI, ST ALBAN-ANLAGE 66, CH-4052 BASEL, SWITZERLAND",General & Internal Medicine,,2.461,"INFLAMMATORY-BOWEL-DISEASE,BIOLOGICAL,THERAPY,INDUCTION",MEDICINA-LITHUANIA,https://www.ncbi.nlm.nih.gov/pmc/articles/PMC7699478,
70,Simultaneous quantitative analysis of non-metallic elements in coal by laser-induced breakdown spectroscopy assisted with machine learning,222,,,"Zhang Lili,Yang Yanwei","Zhang LL,Yang YW",Zhang LL,10.1016/j.ijleo.2020.165449,Lvliang University,"Coal is an important part of national energy structure, and the proportion of non-metallic elements will greatly affect its combustion efficiency. In order to achieve rapid and simultaneous quantitative detection of C, H, N in coal, a hybrid model combining laser-induced breakdown spectroscopy (LIBS) with machine learning algorithm is proposed. The detailed operations are as follows: A Nd: YAG laser with wavelength of 1064 nm is selected as excitation source, 14 kinds of national standard coal samples are ablated in air environment. Then selecting spectral data around the wavelength of elements to be measured and normalizing it as input variable of three algorithms. Finally, linear regression, support vector regression and random forest model are used for calibration and prediction. The results indicate that random forest model is more accurate in predicting non-metallic elements in coal than other two models, and the correlation coefficient (R-2) value of C, H, N were 0.9844, 0.9625 and 0.9829, the root mean square error (RMSE) were 0.2669, 0.2508 and 0.0335 respectively. Hence, LIBS technique based on different machine learning models can be used to accurately and effectively determine the content of non-metallic elements in coal.","Non-metallic elements,Laser-induced breakdown spectroscopy (LIBS),Coal,Machine learning",Article,"ELSEVIER GMBH, HACKERBRUCKE 6, 80335 MUNICH, GERMANY",Optics,,1.955,HEAVY-METALS,OPTIK,,
71,Deep learning for topology optimization of 2D metamaterials,196,,,"Kollmann Hunter T.,Abueidda Diab W.,Koric Seid,Guleryuz Erman,Sobh Nahil A.","Kollmann HT,Abueidda DW,Koric S,Guleryuz E,Sobh NA",Abueidda DW; Koric S,10.1016/j.matdes.2020.109098,University of Illinois System,"Data-driven models are rising as an auspicious method for the geometrical design of materials and structural systems. Nevertheless, existing data-driven models customarily address the optimization of structural designs rather than metamaterial designs. Metamaterials are emerging as promising materials exhibiting tailorable and unprecedented properties for a wide spectrum of applications. In this paper, we develop a deep learning (DL) model based on a convolutional neural network (CNN) that predicts optimal metamaterial designs. The developed DL model non-iteratively optimizes metamaterials for either maximizing the bulk modulus, maximizing the shear modulus, or minimizing the Poisson's ratio (including negative values). The data are generated by solving a large set of inverse homogenization boundary values problems, with randomly generated geometrical features from a specific distribution. Such s data-driven model can play a vital role in accelerating more computationally expensive design problems, such as multiscale metamaterial systems. (c) 2020 The Author(s). Published by Elsevier Ltd.","Architected materials,Auxetic materials,Homogenization,Machine learning,Microstructure,Periodic boundary conditions (PBCs)",Article,"ELSEVIER SCI LTD, THE BOULEVARD, LANGFORD LANE, KIDLINGTON, OXFORD OX5 1GB, OXON, ENGLAND",Materials Science,,7.097,"HOMOGENIZATION,METHOD,NEURAL-NETWORKS,POISSONS,RATIO,DESIGN,STABILITY,MODELS",MATERIALS & DESIGN,https://doi.org/10.1016/j.matdes.2020.109098,
72,Flame spray pyrolysis optimization via statistics and machine learning,196,,,"Paulson Noah H.,Libera Joseph A.,Stan Marius","Paulson NH,Libera JA,Stan M",Paulson NH,10.1016/j.matdes.2020.108972,United States Department of Energy (DOE),"Flame spray pyrolysis (FSP) is an important manufacturing process whereby nanomaterials are produced through the combustion of atomized fuel containing dissolved precursor elements. While FSP has the potential to enable the scalable production of a wide range of next generation energy materials, it also has a multi-scale, multi-physics character, and a large number of processing variables. Optimizing the process for desirable material outcomes by traditional approaches is challenging. In this work, the processing parameter space is explored new and efficient methodology that includes statistical methods such as Latin hypercube design of experiments, machine learning surrogate modeling, and Bayesian optimization. As a result, the FSP process is optimized for hanced performance. Specifically, in-situ particle size measurements are used to tailor the production of nanoparticles for a low spread in particle diameters with respect to the mean particle diameter, resulting improvement of 25.5% over the baseline within 15 experimental trials. In the process, the analysis reveals distinct domains of primary particle and agglomerated particle formation. (c) 2020 The Authors. Published by Elsevier Ltd.","Flame spray pyrolysis,Nanoparticle synthesis,Latin hypercube sampling,Bayesian optimization",Article,"ELSEVIER SCI LTD, THE BOULEVARD, LANGFORD LANE, KIDLINGTON, OXFORD OX5 1GB, OXON, ENGLAND",Materials Science,,7.097,"GLOBAL,OPTIMIZATION,NANOPARTICLES,DISTRIBUTIONS,UNCERTAINTY,SIMULATION,DESIGN",MATERIALS & DESIGN,https://doi.org/10.1016/j.matdes.2020.108972,
73,Highly-efficient quantitative fluorescence resonance energy transfer measurements based on deep learning,13,6,,"Ge Lin,Liu Fei,Luo Jianwen","Ge L,Liu F,Luo JW",Luo JW,10.1142/S1793545820500212,Tsinghua University,"Intensity-based quantitative fluorescence resonance energy transfer (FRET) is a technique to measure the distance of molecules in scale of a few nanometers which is far beyond optical diffraction limit. This widely used technique needs complicated experimental process and manual image analyses to obtain precise results, which take a long time and restrict the application of quantitative FRET especially in living cells. In this paper, a simplified and automatic quantitative FRET (saqFRET) method with high efficiency is presented. In saqFRET, photo-activatable acceptor PA-mCherry and optimized excitation wavelength of donor enhanced green fluorescent protein (EGFP) are used to simplify FRET crosstalk elimination. Traditional manual image analyses are time consuming when the dataset is large. The proposed automatic image analyses based on deep learning can analyze 100 samples within 30 s and demonstrate the same precision as manual image analyses.","Resonance energy transfer,fluorescence,living cells,photoactivatable,deep network",Article,"WORLD SCIENTIFIC PUBL CO PTE LTD, 5 TOH TUCK LINK, SINGAPORE 596224, SINGAPORE","Optics,Radiology, Nuclear Medicine & Medical Imaging",,1.436,,JOURNAL OF INNOVATIVE OPTICAL HEALTH SCIENCES,https://doi.org/10.1142/s1793545820500212,
74,Machine learning applications in production lines: A systematic literature review,149,,,"Kang Ziqiu,Catal Cagatay,Tekinerdogan Bedir","Kang ZQ,Catal C,Tekinerdogan B",Catal C,10.1016/j.cie.2020.106773,Bahcesehir University,"A production line is a set of sequential operations established in a factory where materials are put through a refining process to produce an end-product that is suitable for further usage. Monitoring production lines is essential to ensure that the targeted quality of the production process and the products are achieved. With the increased digitalization, lots of data can now be generated in the overall production line process. In parallel, the generated data sets are used by machine learning techniques for analytics of the production line to improve quality control, evaluate risks, and save cost. This paper aims to identify, assess, and synthesize the reported studies related to the application of machine learning in production lines, to provide a systematic overview of the current state-of-the-art and, as such, paving the way for further research. To this end, we have performed a Systematic Literature Review (SLR) in which we retrieved 271 papers, of which 39 primary studies were selected for a detailed analysis. This SLR presents and categorizes the production line problems addressed by machine learning, identifies the targeted industrial domains, discusses which machine learning algorithms have been used, and explains the adopted independent and dependent variables of the models. The study highlights the open problems that need to be solved and provides the identified research directions.","Machine learning,Production lines,Data analytics,Data mining,Systematic literature review",Review,"PERGAMON-ELSEVIER SCIENCE LTD, THE BOULEVARD, LANGFORD LANE, KIDLINGTON, OXFORD OX5 1GB, ENGLAND","Computer Science,Engineering",,5.518,"NEURAL-NETWORK,QUALITY,PREDICTION,OPTIMIZATION,DIAGNOSIS,SENSOR,SMART",COMPUTERS & INDUSTRIAL ENGINEERING,https://doi.org/10.1016/j.cie.2020.106773,
75,Unsupervised Segmentation of Hyperspectral Images Using 3-D Convolutional Autoencoders,17,11,1948-1952,"Nalepa Jakub,Myller Michal,Imai Yasuteru,Honda Ken-Ichi,Takeda Tomomi,Antoniak Marek","Nalepa J,Myller M,Imai Y,Honda KI,Takeda T,Antoniak M",Nalepa J,10.1109/LGRS.2019.2960945,Silesian University of Technology,"Hyperspectral image analysis has become an important topic widely researched by the remote sensing community. Classification and segmentation of such imagery help understand the underlying materials within a scanned scene since hyperspectral images convey detailed information captured in a number of spectral bands. Although deep learning has established the state-of-the-art in the field, it still remains challenging to train well-generalizing models due to the lack of ground-truth data. In this letter, we tackle this problem and propose an end-to-end approach to segment hyperspectral images in a fully unsupervised way. We introduce a new deep architecture which couples 3-D convolutional autoencoders with clustering. Our multifaceted experimental study-performed over the benchmark and real-life data-revealed that our approach delivers highquality segmentation without any prior class labels.","Autoencoder,clustering,deep learning,hyperspectral imaging (HSI),unsupervised segmentation",Article,"IEEE-INST ELECTRICAL ELECTRONICS ENGINEERS INC, 445 HOES LANE, PISCATAWAY, NJ 08855-4141 USA","Geochemistry & Geophysics,Engineering,Remote Sensing,Imaging Science & Photographic Technology",,3.986,CLASSIFICATION,IEEE GEOSCIENCE AND REMOTE SENSING LETTERS,http://arxiv.org/pdf/1907.08870,
76,Noninvasive Estimation of Macro-Parameters by Deep Learning,4,6,684-695,"Wang Bo,Ruan Dongsheng,Liu Huafeng","Wang B,Ruan DS,Liu HF",Liu HF,10.1109/TRPMS.2020.2979017,Zhejiang University,"The estimation of macro-parameters is a critical step in dynamic positron emission tomography (PET) analyses because these parameters can quantitatively characterize the physiologic state of the tracer in vivo. Numerous algorithms have been proposed to estimate macro-parameters. However, the implementation of these estimation algorithms requires accurate input functions which are difficult to obtain under noninvasive conditions. We developed a novel data-driven framework to estimate the macro-parameter noninvasively without input functions. We took the macro-parameters as a nonlinear function of the activity concentration of the tracer. Deep learning was used to determine this nonlinear function to obtain the macro-parameter directly from dynamic PET data. Our approach was divided into two phases: 1) training and 2) estimation. In the training phase, a deep neural network (DNN) learned the potential relationships between the dynamic PET data and the macro-parameters. In the estimation phase, the macro-parameter could be directly obtained when the dynamic PET data were inputted to the DNN. Experiments based on simulation datasets of F-18-FDG and C-11-FMZ and real datasets were conducted as validation. Our experimental results were compared with those by Patlak or Logan plot, which demonstrated the superior performance of the proposed approach in terms of robustness and accuracy.","Deep learning,distribution of volume,influx constant,macro-parameters estimation,noninvasive method,positron emission tomography (PET)",Article; Proceedings Paper,"IEEE-INST ELECTRICAL ELECTRONICS ENGINEERS INC, 445 HOES LANE, PISCATAWAY, NJ 08855-4141 USA","Radiology, Nuclear Medicine & Medical Imaging",,,"POSITRON-EMISSION-TOMOGRAPHY,CEREBRAL-BLOOD-FLOW,DYNAMIC,PET,GRAPHICAL,ANALYSIS,KINETIC-ANALYSIS,INPUT,FUNCTION,BINDING,PHOSPHORYLATION,TRANSPORT,INVIVO",IEEE TRANSACTIONS ON RADIATION AND PLASMA MEDICAL SCIENCES,,
77,Classification of Neurotransmitter Response in Dynamic PET Data Using Machine Learning Approaches,4,6,708-719,"Fuller Oliver K.,Angelis Georgios I.,Meikle Steven R.","Fuller OK,Angelis GI,Meikle SR",Fuller OK,10.1109/TRPMS.2020.2984259,University of Sydney,"Dynamic positron emission tomography (PET) imaging can be used to quantify changes in synaptic concentrations of endogenous neurotransmitters during cognitive tasks or pharmacological interventions. Existing pharmacokinetic models, such as the linear parametric neurotransmitter PET (lp-ntPET) method, can be used to model the measured dynamic data and characterize small transient changes in neurotransmitter levels. Application of these models to the voxel level is challenging, however, due to the high levels of noise in dynamic data, leading to a high number of false-positive responses (i.e., low specificity). In this article, we investigated the suitability of machine learning algorithms (MLAs), including support vector machine (SVM) classifiers, shallow feedforward neural networks, convolutional neural networks (CNNs) and long short-term memory (LSTM) networks, to detect and classify transient changes in voxel-wise time-activity curves. We also investigated whether the reconstruction framework (post versus direct reconstruction) had any impact on the performance of the MLAs. We used computer simulations to generate dynamic PET data, representing a [C-11]raclopride study, with known activation responses, across a wide range of noise levels. Different simulated data sets were used to train and test the MLAs across a range of noise levels and activation response magnitudes. Results showed the MLAs offered a large improvement in specificity without a corresponding decrease in sensitivity across all noise levels tested compared to direct application of the lp-ntPET model. They also offered a modest benefit over the currently accepted method (statistical F-test combined with cluster size analysis), for both 2-D+time data when incorporated within direct or post-reconstruction frameworks, and 4-D GATE data.","Convolutional neural networks (CNNs),direct reconstruction,feedforward neural network,ligand displacement long short-term memory (LSTM),machine learning,neurotransmitter response,parametric imaging",Article,"IEEE-INST ELECTRICAL ELECTRONICS ENGINEERS INC, 445 HOES LANE, PISCATAWAY, NJ 08855-4141 USA","Radiology, Nuclear Medicine & Medical Imaging",,,"LP-NTPET,DOPAMINE,SENSITIVITY",IEEE TRANSACTIONS ON RADIATION AND PLASMA MEDICAL SCIENCES,,
78,Regression analysis of photodecomposable quencher concentration effects on chemical gradient in chemically amplified extreme ultraviolet resist processes,59,11,,"Azumagawa Kazuki,Kozawa Takahiro","Azumagawa K,Kozawa T",Kozawa T,,Osaka University,"Chemically amplified resists have been used in the state-of-the-art extreme ultraviolet (EUV) lithography. A basic additive has been added to the resist formula as a quencher to control acid diffusion. In this study, the effects of photodecomposable quencher (PDQ) concentration on the chemical gradient (an indicator of line edge roughness) in chemically amplified EUV resist processes were investigated. The chemical gradient was calculated on the basis of the sensitization and reaction mechanisms for different half-pitches, sensitivities, photoacid generator (PAG) concentrations, PDQ concentrations, and effective reaction radii for deprotection. The obtained 130 000 data were analyzed by least squares, lasso, ridge, and elastic net regressions. Regarding the contribution to the chemical gradient, PDQ concentration was apparently symmetric to PAG concentration. Optimum PDQ concentrations were well predicted (accuracy of approximately 10%) within the examined variable ranges even with 495 training data using the fitted parameters obtained by lasso, ridge, and elastic net regressions.","EUV lithography,chemically amplified resist,photodecomposable quencher,line edge roughness,machine learning",Article,"IOP PUBLISHING LTD, TEMPLE CIRCUS, TEMPLE WAY, BRISTOL BS1 6BE, ENGLAND",Physics,,1.362,"ACID,DISTRIBUTION,BASE,DIFFUSION,ADDITIVES",JAPANESE JOURNAL OF APPLIED PHYSICS,,
