,title,Volume,Issue,Pages,whole__author_name,simply_author_name,reprint author,DOI,reprint address,Abstract,Keywords,Document Type,Publisher,Research Domain,Published Date,impact_factor,Keywords_plus,joural,pdf_link,Download_SuccessOrDefeat
45,Associating Multi-Modal Brain Imaging Phenotypes and Genetic Risk Factors via a Dirty Multi-Task Learning Method,39,11,3416-3428,"Du Lei,Liu Fang,Liu Kefei,Yao Xiaohui,Risacher Shannon L.,Han Junwei,Saykin Andrew J.,Shen Li","Du L,Liu F,Liu KF,Yao XH,Risacher SL,Han JW,Saykin AJ,Shen L",Du L,10.1109/TMI.2020.2995510,Northwestern Polytechnical University,"Brain imaging genetics becomes more and more important in brain science, which integrates genetic variations and brain structures or functions to study the genetic basis of brain disorders. The multi-modal imaging data collected by different technologies, measuring the same brain distinctly, might carry complementary information. Unfortunately, we do not know the extent to which the phenotypic variance is shared among multiple imaging modalities, which further might trace back to the complex genetic mechanism. In this paper, we propose a novel dirty multi-task sparse canonical correlation analysis (SCCA) to study imaging genetic problems with multi-modal brain imaging quantitative traits (QTs) involved. The proposed method takes advantages of the multi-task learning and parameter decomposition. It can not only identify the shared imaging QTs and genetic loci across multiple modalities, but also identify the modality-specific imaging QTs and genetic loci, exhibiting a flexible capability of identifying complex multi-SNP-multi-QT associations. Using the state-of-the-art multi-view SCCA and multi-task SCCA, the proposed method shows better or comparable canonical correlation coefficients and canonical weights on both synthetic and real neuroimaging genetic data. In addition, the identified modality-consistent biomarkers, as well as the modality-specific biomarkers, provide meaningful and interesting information, demonstrating the dirty multi-task SCCA could be a powerful alternativemethod inmulti-modal brain imaging genetics.","Brain imaging genetics,sparse canonical correlation analysis,multi-task learning,the dirty multi-task SCCA",Article,"IEEE-INST ELECTRICAL ELECTRONICS ENGINEERS INC, 445 HOES LANE, PISCATAWAY, NJ 08855-4141 USA","Computer Science,Engineering,Imaging Science & Photographic Technology,Radiology, Nuclear Medicine & Medical Imaging",,10.332,"CANONICAL,CORRELATION-ANALYSIS,ALZHEIMERS-DISEASE,SEQUENCE,DIAGNOSIS,GENOTYPE,PROGRESS,ATROPHY",IEEE TRANSACTIONS ON MEDICAL IMAGING,,
46,Semi-Supervised Medical Image Classification With Relation-Driven Self-Ensembling Model,39,11,3429-3440,"Liu Quande,Yu Lequan,Luo Luyang,Dou Qi,Heng Pheng Ann","Liu QD,Yu LQ,Luo LY,Dou Q,Heng PA",Yu LQ,10.1109/TMI.2020.2995518,Chinese University of Hong Kong,"Training deep neural networks usually requires a large amount of labeled data to obtain good performance. However, in medical image analysis, obtaining high-quality labels for the data is laborious and expensive, as accurately annotating medical images demands expertise knowledge of the clinicians. In this paper, we present a novel relation-driven semi-supervised framework for medical image classification. It is a consistency-based method which exploits the unlabeled data by encouraging the prediction consistency of given input under perturbations, and leverages a self-ensembling model to produce high-quality consistency targets for the unlabeled data. Considering that human diagnosis often refers to previous analogous cases to make reliable decisions, we introduce a novel sample relation consistency (SRC) paradigm to effectively exploit unlabeled data by modeling the relationship information among different samples. Superior to existing consistency-based methods which simply enforce consistency of individual predictions, our framework explicitly enforces the consistency of semantic relation among different samples under perturbations, encouraging the model to explore extra semantic information from unlabeled data. We have conducted extensive experiments to evaluate our method on two public benchmark medical image classification datasets, i.e., skin lesion diagnosis with ISIC 2018 challenge and thorax disease classification with ChestX-ray14. Our method outperforms many state-of-the-art semi-supervised learning methods on both single-label and multi-label image classification scenarios.","Semi-supervised learning,medical image classification,sample relation modelling,self-ensembling model",Article,"IEEE-INST ELECTRICAL ELECTRONICS ENGINEERS INC, 445 HOES LANE, PISCATAWAY, NJ 08855-4141 USA","Computer Science,Engineering,Imaging Science & Photographic Technology,Radiology, Nuclear Medicine & Medical Imaging",,10.332,SEGMENTATION,IEEE TRANSACTIONS ON MEDICAL IMAGING,http://arxiv.org/pdf/2005.07377,
47,Known Operator Learning Enables Constrained Projection Geometry Conversion: Parallel to Cone-Beam for Hybrid MR/X-Ray Imaging,39,11,3488-3498,"Syben Christopher,Stimpel Bernhard,Roser Philipp,Doerfler Arnd,Maier Andreas","Syben C,Stimpel B,Roser P,Dorfler A,Maier A",Syben C,10.1109/TMI.2020.2998179,University of Erlangen Nuremberg,"X-ray imaging is a wide-spread real-time imaging technique. Magnetic Resonance Imaging (MRI) offers a multitude of contrasts that offer improved guidance to interventionalists. As such simultaneous real-time acquisition and overlay would be highly favorable for image-guided interventions, e.g., in stroke therapy. One major obstacle in this setting is the fundamentally different acquisition geometry. MRI k-space sampling is associated with parallel projection geometry, while the X-ray acquisition results in perspective distorted projections. The classical rebinning methods to overcome this limitation inherently suffers from a loss of resolution. To counter this problem, we present a novel rebinning algorithm for parallel to cone-beam conversion. We derive a rebinning formula that is then used to find an appropriate deep neural network architecture. Following the known operator learning paradigm, the novel algorithm is mapped to a neural network with differentiable projection operators enabling data-driven learning of the remaining unknown operators. The evaluation aims in two directions: First, we give a profound analysis of the different hypotheses to the unknown operator and investigate the influence of numerical training data. Second, we evaluate the performance of the proposed method against the classical rebinning approach. We demonstrate that the derived network achieves better results than the baseline method and that such operators can be trained with simulated data without losing their generality making them applicable to real data without the need for retraining or transfer learning.","Known operator learning,inverse problems,multi-modal imaging,X-ray,MRI",Article,"IEEE-INST ELECTRICAL ELECTRONICS ENGINEERS INC, 445 HOES LANE, PISCATAWAY, NJ 08855-4141 USA","Computer Science,Engineering,Imaging Science & Photographic Technology,Radiology, Nuclear Medicine & Medical Imaging",,10.332,"RECONSTRUCTION,DOMAIN",IEEE TRANSACTIONS ON MEDICAL IMAGING,,
48,Iterative Augmentation of Visual Evidence for Weakly-Supervised Lesion Localization in Deep Interpretability Frameworks: Application to Color Fundus Images,39,11,3499-3511,"Gonzalez-Gonzalo Cristina,Liefers Bart,van Ginneken Bram,Sanchez Clara I.","Gonzalez-Gonzalo C,Liefers B,van Ginneken B,Sanchez CI",Gonzalez-Gonzalo C,10.1109/TMI.2020.2994463,"Radboudumc, Eye Res Grp A, Diagnost Image Anal Grp, Dept Radiol & Nucl Med, NL-6525 Nijmegen, Netherlands.","Interpretability of deep learning (DL) systems is gaining attention in medical imaging to increase experts' trust in the obtained predictions and facilitate their integration in clinical settings. We propose a deep visualization method to generate interpretability of DL classification tasks in medical imaging by means of visual evidence augmentation. The proposed method iteratively unveils abnormalities based on the prediction of a classifier trained only with image-level labels. For each image, initial visual evidence of the prediction is extracted with a given visual attribution technique. This provides localization of abnormalities that are then removed through selective inpainting. We iteratively apply this procedure until the system considers the image as normal. This yields augmented visual evidence, including less discriminative lesions which were not detected at first but should be considered for final diagnosis. We apply the method to grading of two retinal diseases in color fundus images: diabetic retinopathy (DR) and age-related macular degeneration (AMD). We evaluate the generated visual evidence and the performance of weakly-supervised localization of different types of DR and AMD abnormalities, both qualitatively and quantitatively. We show that the augmented visual evidence of the predictions highlights the biomarkers considered by experts for diagnosis and improves the final localization performance. It results in a relative increase of 11.2 +/- 2.0% per image regarding sensitivity averaged at 10 false positives/image on average, when applied to different classification tasks, visual attribution techniques and network architectures. This makes the proposed method a useful tool for exhaustive visual support of DL classifiers in medical imaging.","Interpretability,deep learning,visualization,weakly-supervised detection,lesion localization,color fundus imaging",Article,"IEEE-INST ELECTRICAL ELECTRONICS ENGINEERS INC, 445 HOES LANE, PISCATAWAY, NJ 08855-4141 USA","Computer Science,Engineering,Imaging Science & Photographic Technology,Radiology, Nuclear Medicine & Medical Imaging",,10.332,"DIABETIC-RETINOPATHY,MACULAR,DEGENERATION,DISEASE,CLASSIFICATION,DRUSEN",IEEE TRANSACTIONS ON MEDICAL IMAGING,https://ieeexplore.ieee.org/ielx7/42/9242349/09103111.pdf,
49,Differentiated Backprojection Domain Deep Learning for Conebeam Artifact Removal,39,11,3571-3582,"Han Yoseob,Kim Junyoung,Ye Jong Chul","Han YS,Kim J,Ye JC",Ye JC,10.1109/TMI.2020.3000341,Korea Advanced Institute of Science & Technology (KAIST),"Conebeam CT using a circular trajectory is quite often used for various applications due to its relative simple geometry. For conebeam geometry, Feldkamp, Davis and Kress algorithm is regarded as the standard reconstruction method, but this algorithm suffers from so-called conebeam artifacts as the cone angle increases. Various model-based iterative reconstruction methods have been developed to reduce the cone-beam artifacts, but these algorithms usually require multiple applications of computational expensive forward and backprojections. In this paper, we develop a novel deep learning approach for accurate conebeam artifact removal. In particular, our deep network, designed on the differentiated backprojection domain, performs a data-driven inversion of an ill-posed deconvolution problem associated with the Hilbert transform. The reconstruction results along the coronal and sagittal directions are then combined using a spectral blending technique to minimize the spectral leakage. Experimental results under various conditions confirmed that our method generalizes well and outperforms the existing iterative methods despite significantly reduced runtime complexity.","Computed Tomography,cone-beam artifact,deep learning,spectral blending",Article,"IEEE-INST ELECTRICAL ELECTRONICS ENGINEERS INC, 445 HOES LANE, PISCATAWAY, NJ 08855-4141 USA","Computer Science,Engineering,Imaging Science & Photographic Technology,Radiology, Nuclear Medicine & Medical Imaging",,10.332,"CONVOLUTIONAL,NEURAL-NETWORK,BEAM,COMPUTED-TOMOGRAPHY,IMAGE-RECONSTRUCTION,FILTERED,BACKPROJECTION,PI-LINES,CT,FRAMELETS,ALGORITHM",IEEE TRANSACTIONS ON MEDICAL IMAGING,http://arxiv.org/pdf/1906.06854,
50,Deep Mining External Imperfect Data for Chest X-Ray Disease Screening,39,11,3583-3594,"Luo Luyang,Yu Lequan,Chen Hao,Liu Quande,Wang Xi,Xu Jiaqi,Heng Pheng-Ann","Luo LY,Yu LQ,Chen H,Liu QD,Wang X,Xu JQ,Heng PA",Chen H,10.1109/TMI.2020.3000949,Chinese University of Hong Kong,"Deep learning approaches have demonstrated remarkable progress in automatic Chest X-ray analysis. The data-driven feature of deep models requires training data to cover a large distribution. Therefore, it is substantial to integrate knowledge from multiple datasets, especially for medical images. However, learning a disease classification model with extra Chest X-ray (CXR) data is yet challenging. Recent researches have demonstrated that performance bottleneck exists in joint training on different CXR datasets, and few made efforts to address the obstacle. In this paper, we argue that incorporating an external CXR dataset leads to imperfect training data, which raises the challenges. Specifically, the imperfect data is in two folds: domain discrepancy, as the image appearances vary across datasets; and label discrepancy, as different datasets are partially labeled. To this end, we formulate the multi-label thoracic disease classification problem as weighted independent binary tasks according to the categories. For common categories shared across domains, we adopt task-specific adversarial training to alleviate the feature differences. For categories existing in a single dataset, we present uncertainty-aware temporal ensembling of model predictions to mine the information from the missing labels further. In this way, our framework simultaneously models and tackles the domain and label discrepancies, enabling superior knowledge mining ability. We conduct extensive experiments on three datasets with more than 360,000 Chest X-ray images. Our method outperforms other competing models and sets state-of-the-art performance on the official NIH test set with 0.8349 AUC, demonstrating its effectiveness of utilizing the external dataset to improve the internal classification.","Chest X-ray classification,partial label,domain discrepancy,adversarial learning,uncertainty",Article,"IEEE-INST ELECTRICAL ELECTRONICS ENGINEERS INC, 445 HOES LANE, PISCATAWAY, NJ 08855-4141 USA","Computer Science,Engineering,Imaging Science & Photographic Technology,Radiology, Nuclear Medicine & Medical Imaging",,10.332,"PROSTATE,LUNG",IEEE TRANSACTIONS ON MEDICAL IMAGING,http://arxiv.org/pdf/2006.03796,
51,Multi-Organ Segmentation Over Partially Labeled Datasets With Multi-Scale Feature Abstraction,39,11,3619-3629,"Fang Xi,Yan Pingkun","Fang X,Yan PK",Yan PK,10.1109/TMI.2020.3001036,Rensselaer Polytechnic Institute,"Shortage of fully annotated datasets has been a limiting factor in developing deep learning based image segmentation algorithms and the problem becomes more pronounced in multi-organ segmentation. In this paper, we propose a unified training strategy that enables a novel multi-scale deep neural network to be trained on multiple partially labeled datasets for multi-organ segmentation. In addition, a new network architecture for multi-scale feature abstraction is proposed to integrate pyramid input and feature analysis into a U-shape pyramid structure. To bridge the semantic gap caused by directly merging features from different scales, an equal convolutional depth mechanism is introduced. Furthermore, we employ a deep supervision mechanism to refine the outputs in different scales. To fully leverage the segmentation features from all the scales, we design an adaptive weighting layer to fuse the outputs in an automatic fashion. All these mechanisms together are integrated into a Pyramid Input Pyramid Output Feature Abstraction Network (PIPO-FAN). Our proposed method was evaluated on four publicly available datasets, including BTCV, LiTS, KiTS and Spleen, where very promising performance has been achieved. The source code of this work is publicly shared at https://github.com/DIAL-RPI/PIPO-FAN to facilitate others to reproduce the work and build their own models using the introduced mechanisms.","Medical image segmentation,multi-scale feature,deep learning,convolutional neural networks,multi-organ segmentation,multiple datasets",Article,"IEEE-INST ELECTRICAL ELECTRONICS ENGINEERS INC, 445 HOES LANE, PISCATAWAY, NJ 08855-4141 USA","Computer Science,Engineering,Imaging Science & Photographic Technology,Radiology, Nuclear Medicine & Medical Imaging",,10.332,,IEEE TRANSACTIONS ON MEDICAL IMAGING,http://arxiv.org/pdf/2001.00208,
52,Deep Learning-Based Spectral Unmixing for Optoacoustic Imaging of Tissue Oxygen Saturation,39,11,3643-3654,"Olefir Ivan,Tzoumas Stratis,Restivo Courtney,Mohajerani Pouyan,Xing Lei,Ntziachristos Vasilis","Olefir I,Tzoumas S,Restivo C,Mohajerani P,Xing L,Ntziachristos V",Ntziachristos V,10.1109/TMI.2020.3001750,Helmholtz Association,"Label free imaging of oxygenation distribution in tissues is highly desired in numerous biomedical applications, but is still elusive, in particular in sub-epidermal measurements. Eigenspectra multispectral optoacoustic tomography (eMSOT) and its Bayesian-based implementation have been introduced to offer accurate label-free blood oxygen saturation (sO(2)) maps in tissues. The method uses the eigenspectra model of light fluence in tissue to account for the spectral changes due to the wavelength dependent attenuation of light with tissue depth. eMSOT relies on the solution of an inverse problem bounded by a number of ad hoc hand-engineered constraints. Despite the quantitative advantage offered by eMSOT, both the non-convex nature of the optimization problem and the possible sub-optimality of the constraints may lead to reduced accuracy. We present herein a neural network architecture that is able to learn how to solve the inverse problem of eMSOT by directly regressing from a set of input spectra to the desired fluence values. The architecture is composed of a combination of recurrent and convolutional layers and uses both spectral and spatial features for inference. We train an ensemble of such networks using solely simulated data and demonstrate how this approach can improve the accuracy of sO(2) computation over the original eMSOT, not only in simulations but also in experimental datasets obtained from blood phantoms and small animals (mice) in vivo. The use of a deep-learning approach in optoacoustic sO(2) imaging is confirmed herein for the first time on ground truth sO(2) values experimentally obtained in vivo and ex vivo.","Optoacoustic/photoacoustic imaging,multispectral optoacoustic tomography,photoacoustic tomography,deep learning,deep neural networks",Article,"IEEE-INST ELECTRICAL ELECTRONICS ENGINEERS INC, 445 HOES LANE, PISCATAWAY, NJ 08855-4141 USA","Computer Science,Engineering,Imaging Science & Photographic Technology,Radiology, Nuclear Medicine & Medical Imaging",,10.332,"QUANTITATIVE,PHOTOACOUSTIC,TOMOGRAPHY,BLOOD,OXYGENATION,RECONSTRUCTION,MICROSCOPY,NETWORKS,BOUNDARY",IEEE TRANSACTIONS ON MEDICAL IMAGING,https://push-zb.helmholtz-muenchen.de/deliver.php?id=29069,
53,Weakly Supervised Deep Nuclei Segmentation Using Partial Points Annotation in Histopathology Images,39,11,3655-3666,"Qu Hui,Wu Pengxiang,Huang Qiaoying,Yi Jingru,Yan Zhennan,Li Kang,Riedlinger Gregory M.,De Subhajyoti,Zhang Shaoting,Metaxas Dimitris N.","Qu H,Wu PX,Huang QY,Yi JR,Yan ZN,Li K,Riedlinger GM,De SB,Zhang ST,Metaxas DN",Qu H,10.1109/TMI.2020.3002244,Rutgers State University New Brunswick,"Nuclei segmentation is a fundamental task in histopathology image analysis. Typically, such segmentation tasks require significant effort to manually generate accurate pixel-wise annotations for fully supervised training. To alleviatesuch tedious and manual effort, in this paper we propose a novel weakly supervised segmentation framework based on partial points annotation, i.e., only a small portion of nuclei locations in each image are labeled. The framework consists of two learning stages. In the first stage, we design a semi-supervised strategy to learn a detection model from partially labeled nuclei locations. Specifically, an extended Gaussian mask is designed to train an initial model with partially labeled data. Then, self-training with background propagation is proposed to make use of the unlabeled regions to boost nuclei detection and suppress false positives. In the second stage, a segmentation model is trained from the detected nuclei locations in a weakly-supervised fashion. Two types of coarse labels with complementary information are derived from the detected points and are then utilized to train a deep neural network. The fully-connected conditional random field loss is utilized in training to further refine the model without introducing extra computational complexity during inference. The proposed method is extensively evaluated on two nuclei segmentation datasets. The experimental results demonstrate that our method can achieve competitive performance compared to the fully supervised counterpart and the state-of-the-art methods while requiring significantly less annotation effort.","Nuclei detection,nuclei segmentation,semi-supervised learning,weakly-supervised learning,deep learning,Voronoi diagram,k-means clustering,conditional random field",Article,"IEEE-INST ELECTRICAL ELECTRONICS ENGINEERS INC, 445 HOES LANE, PISCATAWAY, NJ 08855-4141 USA","Computer Science,Engineering,Imaging Science & Photographic Technology,Radiology, Nuclear Medicine & Medical Imaging",,10.332,MODEL,IEEE TRANSACTIONS ON MEDICAL IMAGING,http://arxiv.org/pdf/2007.05448,
54,Appearance Learning for Image-Based Motion Estimation in Tomography,39,11,3667-3678,"Preuhs Alexander,Manhart Michael,Roser Philipp,Hoppe Elisabeth,Huang Yixing,Psychogios Marios,Kowarschik Markus,Maier Andreas","Preuhs A,Manhart M,Roser P,Hoppe E,Huang YX,Psychogios M,Kowarschik M,Maier A",Preuhs A,10.1109/TMI.2020.3002695,University of Erlangen Nuremberg,"In tomographic imaging, anatomical structures are reconstructed by applying a pseudo- inverse forward model to acquired signals. Geometric information within this process is usually depending on the system setting only, i.e., the scanner position or readout direction. Patient motion therefore corrupts the geometry alignment in the reconstruction process resulting in motion artifacts. We propose an appearance learning approach recognizing the structures of rigid motion independently from the scanned object. To this end, we train a siamese triplet network to predict the reprojection error (RPE) for the complete acquisition as well as an approximate distribution of the RPE along the single views from the reconstructed volume in a multi-task learning approach. The RPE measures the motion-induced geometric deviations independent of the object based on virtual marker positions, which are available during training. We train our network using 27 patients and deploy a 21-4-2 split for training, validation and testing. In average, we achieve a residual mean RPE of 0.013 mm with an inter-patient standard deviation of 0.022 mm. This is twice the accuracy compared to previously published results. In a motion estimation benchmark the proposed approach achieves superior results in comparison with two state-of-the-art measures in nine out of twelve experiments. The clinical applicability of the proposed method is demonstrated on a motion-affected clinical dataset.","rigid motion compensation,reconstruction,interventional CBCT,autofocus,appearance learning",Article,"IEEE-INST ELECTRICAL ELECTRONICS ENGINEERS INC, 445 HOES LANE, PISCATAWAY, NJ 08855-4141 USA","Computer Science,Engineering,Imaging Science & Photographic Technology,Radiology, Nuclear Medicine & Medical Imaging",,10.332,"CONE-BEAM,CT,ARTIFACT,REDUCTION,HEAD,MOTION,RECONSTRUCTION,COMPENSATION,ALGORITHM",IEEE TRANSACTIONS ON MEDICAL IMAGING,http://arxiv.org/pdf/2006.10390,
