,title,Volume,Issue,Pages,whole__author_name,simply_author_name,reprint author,DOI,reprint address,Abstract,Keywords,Document Type,Publisher,Research Domain,Published Date,impact_factor,Keywords_plus,joural,pdf_link,Download_SuccessOrDefeat
65,Embodied carbon analysis and benchmarking emissions of high and ultra-high strength concrete using machine learning algorithms,262,,,"Thilakarathna P. S. M.,Seo S.,Baduge K. S. Kristombu,Lee H.,Mendis P.,Foliente G.","Thilakarathna PSM,Seo S,Baduge KSK,Lee H,Mendis P,Foliente G",Baduge KSK,10.1016/j.jclepro.2020.121281,University of Melbourne,"High strength concrete (HSC) (50-100 MPa) and ultra-high strength concrete (UHSC) (>100 MPa) have been increasingly used in the construction industry due to its inherent performance characteristics. However, these concrete mixes have a higher carbon footprint and it is vital to consider the embodied carbon of the HSC and UHSC due to the massive consumption throughout the world. In this study, embodied carbon analysis, using machine learning algorithms has been carried out to minimize the carbon footprint of concrete without jeopardizing the mechanical properties of the concrete. Machine learning models are developed using experimental results in the literature and used to predict the compressive strength of concrete using the constituent materials. Using the experimental data and machine-learned models for mix designs, embodied carbon emissions were calculated. It is shown that there can be many mix compositions which have the same compressive strength while having significantly different embodied carbon values. Based on experimental and machine learned mix designs, an equation to predict the average embodied carbon value for concrete mixes is proposed. The study suggested proposed intervals for the benchmark function in order to propose a region where the embodied carbon value of a concrete mix should lie while achieving the desired compressive strength. Finally, it is shown that machine learning can be used successfully to identify the high strength concrete mixes while minimizing the embodied carbon value of that mix composition. Finally, guidelines are presented to produce a concrete mix within proposed benchmark limits while achieving the desirable strength grade. (C) 2020 Elsevier Ltd. All rights reserved.","High strength concrete,Machine learning,Artificial neural networks,Gaussian process regression,Embodied carbon,Sustainable concrete",Article,"ELSEVIER SCI LTD, THE BOULEVARD, LANGFORD LANE, KIDLINGTON, OXFORD OX5 1GB, OXON, ENGLAND","Science & Technology - Other Topics,Engineering,Environmental Sciences & Ecology",,9.444,"HIGH,PERFORMANCE,CONCRETE,LIFE-CYCLE,ASSESSMENT,BLAST-FURNACE,SLAG,MECHANICAL-PROPERTIES,COARSE-AGGREGATE,FLY-ASH,COMPRESSIVE,STRENGTH,GEOPOLYMER,CONCRETE,ELASTIC-MODULUS,DESIGN,METHOD",JOURNAL OF CLEANER PRODUCTION,,
66,Machine Learning for 3D Particle Tracking in Granular Gases,32,5,897-906,"Puzyrev Dmitry,Harth Kirsten,Trittel Torsten,Stannarius Ralf","Puzyrev D,Harth K,Trittel T,Stannarius R",Puzyrev D,10.1007/s12217-020-09800-4,Otto von Guericke University,"Dilute ensembles of granular matter (so-called granular gases) are nonlinear systems which exhibit fascinating dynamical behavior far from equilibrium, including non-Gaussian distributions of velocities and rotational velocities, clustering, and violation of energy equipartition. In order to understand their dynamic properties, microgravity experiments were performed in suborbital flights and drop tower experiments. Up to now, the experimental images were evaluated mostly manually. Here, we introduce an approach for automatic 3D tracking of positions and orientations of rod-like particles in a dilute ensemble, based on two-view video data analysis. A two-dimensional (2D) localization of particles is performed using a Mask R-CNN neural network trained on a custom data set. The problem of 3D matching of the particles is solved by minimization of the total reprojection error, and finally, particle trajectories are tracked so that ensemble statistics are extracted. Depending on the required accuracy, the software can work fully self-sustainingly or serve as a base for subsequent manual corrections. The approach can be extended to other 3D and 2D particle tracking problems.","Machine learning,Granular gas,Particle tracking,Object detection,Mask-CNN",Article,"SPRINGER, ONE NEW YORK PLAZA, SUITE 4600, NEW YORK, NY, UNITED STATES","Engineering,Thermodynamics,Mechanics",,1.697,"VIBRATIONS,FLOW",MICROGRAVITY SCIENCE AND TECHNOLOGY,https://link.springer.com/content/pdf/10.1007/s12217-020-09800-4.pdf,
67,Detecting helicobacter pylori in whole slide images via weakly supervised multi-task learning,79,35-36,26787-26815,"Yang Yongquan,Yang Yiming,Yuan Yong,Zheng Jiayi,Zheng Zhongxi","Yang YQ,Yang YM,Yuan Y,Zheng JY,Zheng ZX",Zheng ZX,10.1007/s11042-020-09185-x,Sichuan University,"Due to the difficulty to accurately define the morphologies of Helicobacter Pylori (H. pylori) and the complexity of dealing with the whole slide images (WSIs), no computer-aided solution has currently been presented for detectingH. pyloriinfection in WSIs. We present the first image semantic segmentation solution for the computer-aided detection ofH. pyloriin WSIs. The solution only requires polygon annotations as weak supervision, which roughly, instead of pixel-level accurately, label theH. pyloriinfected areas in WSIs. We propose a new weakly supervised multi-task learning framework (WSMLF) that aims to improve the segmentation performance by more effectively exploiting the weak supervision. To make more effective usage of the weak supervision, we extract multiple inaccurate targets representing different modes of the true target from the available weak annotations. For improvement of the segmentation performance, we design a weakly supervised multi-task learning algorithm that can automatically learn from the weighted summarization of the extracted multiple inaccurate targets. These two advances constitute the resulting technique WSMLF. Introducing the proposed WSMLF to several common deep image semantic segmentation approaches for the detection ofH. pyloriin WSIs, we observe that WSMLF can enable these approaches to achieve more reasonable segmentation results, which eventually improve the detection performance ofH. pyloriby at most 6%. WSMLF provides new thoughts for more effectively employing weak supervision to achieve more effective results for image semantic segmentation.","Helicobacter pylori,Image semantic segmentation,Multi-task learning,Weakly supervised learning",Article,"SPRINGER, VAN GODEWIJCKSTRAAT 30, 3311 GZ DORDRECHT, NETHERLANDS","Computer Science,Engineering",,2.517,"SEGMENTATION,DIAGNOSIS,CLASSIFICATION,NETWORK",MULTIMEDIA TOOLS AND APPLICATIONS,,
68,Registration of presurgical MRI and histopathology images from radical prostatectomy via RAPSODI,47,9,4177-4188,"Rusu Mirabela,Shao Wei,Kunder Christian A.,Wang Jeffrey B.,Soerensen Simon J. C.,Teslovich Nikola C.,Sood Rewa R.,Chen Leo C.,Fan Richard E.,Ghanouni Pejman","Rusu M,Shao W,Kunder CA,Wang JB,Soerensen SJC,Teslovich NC,Sood RR,Chen LC,Fan RE,Ghanouni P",Rusu M,10.1002/mp.14337,Stanford University,"Purpose Magnetic resonance imaging (MRI) has great potential to improve prostate cancer diagnosis; however, subtle differences between cancer and confounding conditions render prostate MRI interpretation challenging. The tissue collected from patients who undergo radical prostatectomy provides a unique opportunity to correlate histopathology images of the prostate with preoperative MRI to accurately map the extent of cancer from histopathology images onto MRI. We seek to develop an open-source, easy-to-use platform to align presurgical MRI and histopathology images of resected prostates in patients who underwent radical prostatectomy to create accurate cancer labels on MRI. Methods Here, we introduceRAdiologyPathologySpatialOpen-Source multi-DimensionalIntegration (RAPSODI), the first open-source framework for the registration of radiology and pathology images. RAPSODI relies on three steps. First, it creates a three-dimensional (3D) reconstruction of the histopathology specimen as a digital representation of the tissue before gross sectioning. Second, RAPSODI registers corresponding histopathology and MRI slices. Third, the optimized transforms are applied to the cancer regions outlined on the histopathology images to project those labels onto the preoperative MRI. Results We tested RAPSODI in a phantom study where we simulated various conditions, for example, tissue shrinkage during fixation. Our experiments showed that RAPSODI can reliably correct multiple artifacts. We also evaluated RAPSODI in 157 patients from three institutions that underwent radical prostatectomy and have very different pathology processing and scanning. RAPSODI was evaluated in 907 corresponding histpathology-MRI slices and achieved a Dice coefficient of 0.97 +/- 0.01 for the prostate, a Hausdorff distance of 1.99 +/- 0.70 mm for the prostate boundary, a urethra deviation of 3.09 +/- 1.45 mm, and a landmark deviation of 2.80 +/- 0.59 mm between registered histopathology images and MRI. Conclusion Our robust framework successfully mapped the extent of cancer from histopathology slices onto MRI providing labels from training machine learning methods to detect cancer on MRI.","cancer labels,histopathology,MRI,prostate cancer,registration",Article,"WILEY, 111 RIVER ST, HOBOKEN 07030-5774, NJ USA","Radiology, Nuclear Medicine & Medical Imaging",,3.767,"CANCER,FRAMEWORK,HISTOLOGY,SECTIONS",MEDICAL PHYSICS,https://www.ncbi.nlm.nih.gov/pmc/articles/PMC7586964,
69,Automatic arterial input function selection in CT and MR perfusion datasets using deep convolutional neural networks,47,9,4199-4211,"Winder Anthony,d'Esterre Christopher D.,Menon Bijoy K.,Fiehler Jens,Forkert Nils D.","Winder A,d'Esterre CD,Menon BK,Fiehler J,Forkert ND",Forkert ND,10.1002/mp.14351,University of Calgary,"Purpose The computation of perfusion parameter images requires knowledge of the arterial blood flow in the form of an arterial input function (AIF). This work proposes a novel method to automatically identify AIFs in computed tomography perfusion (CTP) and dynamic susceptibility contrast perfusion-weighted MRI (PWI) datasets using a deep convolutional neural network (CNN). Methods One-hundred CTP and 100 PWI datasets of acute ischemic stroke patients were available for model development and evaluation. For each modality, 50 datasets were used for CNN training and 20 for validation using manually selected AIFs and non-arterial tissue concentration time curves. Model evaluation was performed using the remaining 30 independent validation datasets from each modality with manual AIF selections provided by two experts as ground truth. Additionally, AIFs were also extracted using an established automatic shape-based algorithm for comparison purposes. The extracted AIFs were compared using normalized cross-correlation and shape features as well as using the Dice similarity metric and volume of the corresponding hypoperfusion (Tmax > 6 s) lesions. Results The cross-correlation values comparing the manual AIFs and those extracted by the proposed CNN method were significantly greater than those comparing the manual AIFs to the shape-based comparison method. Likewise, hypoperfusion lesions generated using the manually selected AIFs and CNN-based AIFs showed higher Dice values compared to hypoperfusion lesions generated using the comparison AIF extraction method. Shape features for AIFs generated by the proposed method did not differ significantly from the manual AIFs, with the exception that the CNN-derived AIFs for the PWI datasets showed marginally greater peak heights. Conclusion Deep convolutional neural network models are viable for the automatic extraction of the AIF from CTP and PWI datasets.","ischemic stroke,machine learning,perfusion imaging",Article,"WILEY, 111 RIVER ST, HOBOKEN 07030-5774, NJ USA","Radiology, Nuclear Medicine & Medical Imaging",,3.767,"ACUTE,ISCHEMIC-STROKE,CEREBRAL-BLOOD-FLOW,PENUMBRAL,FLOW,QUANTIFICATION,VALIDATION,LOCATION,MODEL,TOOL",MEDICAL PHYSICS,,
70,FecalNet: Automated detection of visible components in human feces using deep learning,47,9,4212-4222,"Li Qiaoliang,Li Shiyu,Liu Xinyu,He Zhuoying,Wang Tao,Xu Ying,Guan Huimin,Chen Runmin,Qi Suwen,Wang Feng","Li QL,Li SY,Liu XY,He ZY,Wang T,Xu Y,Guan HM,Chen RM,Qi SW,Wang F",Qi SW,10.1002/mp.14352,Shenzhen University,"Purpose To automate the detection and identification of visible components in feces for early diagnosis of gastrointestinal diseases, we propose FecalNet, a method using multiple deep neural networks. Methods FecalNet uses the ResNet152 residual network to extract and learn the characteristics of visible components in fecal microscopic images, acquire feature maps in combination with the feature pyramid network, apply the full convolutional network to classify and locate the fecal components, and implement the improved focal loss function to reoptimize the classification results. This allowed the complete automation of the detection and identification of the visible components in feces. Results We validated this method using a fecal database of 1,122 patients. The results indicated a mean average precision (mAP) of 92.16% and an average recall (AR) of 93.56%. The average precision (AP) and AR of erythrocyte, leukocyte, intestinal mucosal epithelial cells, hookworm eggs, ascarid eggs, and whipworm eggs were 92.82% and 93.38%, 93.99% and 96.11%, 90.71% and 92.41%, 89.95% and 93.88%, 96.90% and 91.21%, and 88.61% and 94.37%, respectively. The average times required by the GPU and the CPU to analyze a fecal microscopic image are approximately 0.14 and 1.02 s, respectively. Conclusion FecalNet can automate the detection and identification of visible components in feces. It also provides a detection and identification framework for detecting several other types of cells in clinical practice.","automatic identification,deep learning,Fecal components,FecalNet,neural network",Article,"WILEY, 111 RIVER ST, HOBOKEN 07030-5774, NJ USA","Radiology, Nuclear Medicine & Medical Imaging",,3.767,"RECOGNITION,EGGS",MEDICAL PHYSICS,,
71,Classification of digital pathological images of non-Hodgkin's lymphoma subtypes based on the fusion of transfer learning and principal component analysis,47,9,4241-4253,"Zhang Jianfei,Cui Wensheng,Guo Xiaoyan,Wang Bo,Wang Zhen","Zhang JF,Cui WS,Guo XY,Wang B,Wang Z",Cui WS,10.1002/mp.14357,Qiqihar University,"Purpose Non-Hodgkin's lymphoma (NHL) is a serious malignant disease. Delayed diagnosis will cause anemia, increased intracranial pressure, organ failure, and even lead to death. The current main trend in this area is to use deep learning (DL) for disease diagnosis. Extracting classification information from the digital pathology images by DL may realize the automated qualitative and quantitative analysis of NHL. Previously, DL has been used to classify NHL digital pathology images with some success. However, shortcomings still exist in the data preprocessing methods and feature extraction. Therefore, this paper presents a method for the classification of NHL subtypes based on the fusion of transfer learning (TL) and principal component analysis (PCA). Methods First, the NHL digital pathology images were preprocessed by image division and segmentation and then input into the transfer models for fine-tuning and feature extraction. Second, PCA was used to map the extracted features. Finally, a neural network was used as a classifier to classify the mapped features. During the fine-tuning of the transfer models, two methods, freezing all feature extraction layers and fine-tuning all layers, were employed to select the optimal model with the best classification result among all the preselected transfer models. On this basis, the use of freezing the layers' location was discussed and analyzed. Results The results show that the proposed method achieved average fivefold cross-validation accuracies of 100%, 99.73%, and 99.20% for chronic lymphocytic leukemia (CLL), follicular lymphoma (FL), and mantle cell lymphoma (MCL) tumor, and each category has standard deviations 0.00, 0.53, and 0.65, respectively, in the NHL reference dataset. The overall classification accuracy for fivefold cross-validation is 98.93%, which is an increase of 1.26% compared to the latest reported methods, having a lower standard deviation (1.00). Conclusion The method proposed in this paper achieves a high classification accuracy and strong model generalization for the classification of NHL, which makes it possible to conduct intelligent classification of NHL in clinical practice. Our proposed method has definite clinical value and research significance.","computer-aided diagnosis (CAD),deep learning algorithm,lymphoma,principal component analysis (PCA),transfer learning (TL)",Article,"WILEY, 111 RIVER ST, HOBOKEN 07030-5774, NJ USA","Radiology, Nuclear Medicine & Medical Imaging",,3.767,"COMPUTER-AIDED,DETECTION,DEEP,VALIDATION,DIAGNOSIS,AFRICA,CARE",MEDICAL PHYSICS,,
72,Optimization of process variables of laser sensor assisted robotic GMAW process for mild steel material,35,15,1690-1700,"Rout Amruta,Deepak B. B. V. L.,Biswal Bibhuti Bhusan","Rout A,Deepak BBVL,Biswal BB",Rout A,10.1080/10426914.2020.1784934,National Institute of Technology (NIT System),"In manufacturing industries, industrial robots have been introduced for performing welding process to accommodate intelligent, flexible, and automate welding. It is essential to integrate sensors and welding process parameter modeling for achieving higher weld quality, productivity and reduced cycle time in robotic arc welding process. A new approach formed by combining fuzzy-regression with Enhanced Teaching Learning Based Optimization (ETLBO) algorithm logic has been used in this paper to get optimal robotic welding parameter settings for achieving best weld quality measures. The weld joint quality has been determined by considering measures like weld bead features consisting of depth of penetration, width, height of weld bead, mechanical attributes like ultimate strength, yield strength and microstructural properties microhardness, and Heat Affected Zone (HAZ) width simultaneously. The laser sensor for seam finding has been mounted on welding torch for achieving positional accuracy in every cycle. ANOVA analysis has been performed to detect the crucial welding process variables affecting weld quality for robotic welding significantly. The proposed model has been validated through experimentation with MOTOMAN MA 1440 A welding robot and ArcWorld of C-50 Series arc welding setup and maximized values of weld quality has been obtained.","Fuzzy,regression,ETLBO,laser,sensor,seam,finding,weld,quality,robotic,welding",Article,"TAYLOR & FRANCIS INC, 530 WALNUT STREET, STE 850, PHILADELPHIA, PA 19106 USA","Engineering,Materials Science",,3.942,"WELDING,PROCESS,PARAMETERS,NEURAL-NETWORK,MODEL,PREDICTION,JOINT,RSM,GA",MATERIALS AND MANUFACTURING PROCESSES,,
73,,,,,,,,,,,,,,,,,,,,
74,Learning-based tongue detection for automatic tongue color diagnosis system,25,3,363-369,"Tang Qichao,Yang Tingxiao,Yoshimura Yuichiro,Namiki Takao,Nakaguchi Toshiya","Tang QC,Yang TX,Yoshimura Y,Namiki T,Nakaguchi T",Yang TX,10.1007/s10015-020-00623-5,Chiba University,"Tongue diagnosis is expected to be used for preventive medicine, because it can check the health condition comprehensively. For the computer-assisted tongue diagnosis, automatic tongue detection from the facial pictures is needed. In this study, we employed deep learning-based tongue detection and compared its performance with a conventional machine learning method. We found that the deep learning-based method can detect the tongue perfectly from the stably captured facial pictures. Besides, this study clarified that it can detect the tongue quite accurately from freely captured facial pictures as well by giving appropriate training datasets.","Tongue detection,Deep learning,Automatic diagnosis",Article,"SPRINGER, ONE NEW YORK PLAZA, SUITE 4600, NEW YORK, NY, UNITED STATES",Robotics,,,"FEATURES,NETWORKS",ARTIFICIAL LIFE AND ROBOTICS,,
75,Quantitative Assessment of Traumatic Upper-Limb Peripheral Nerve Injuries Using Surface Electromyography,8,,,"Tang Weidi,Zhang Xu,Sun Yong,Yao Bo,Chen Xiang,Chen Xun,Gao Xiaoping","Tang WD,Zhang X,Sun Y,Yao B,Chen X,Chen X,Gao XP",Zhang X,10.3389/fbioe.2020.00795,Chinese Academy of Sciences,"Background There is a great demand for convenient and quantitative assessment of upper-limb traumatic peripheral nerve injuries (PNIs) beyond their clinical routine. This would contribute to improved PNI management and rehabilitation. Objective The aim of this study was to develop a novel surface EMG examination method for quantitatively evaluating traumatic upper-limb PNIs. Methods Experiments were conducted to collect surface EMG data from forearm muscles on both sides of seven male subjects during their performance of eight designated hand and wrist motion tasks. All participants were clinically diagnosed as unilateral traumatic upper-limb PNIs on the ulnar nerve, median nerve, or radial nerve. Ten healthy control participants were also enrolled in the study. A novel framework consisting of two modules was also proposed for data analysis. One module was first used to identify whether a PNI occurs on a tested forearm using a machine learning algorithm by extracting and classifying features from surface EMG data. The second module was then used to quantitatively evaluate the degree of injury on three individual nerves on the examined arm. Results The evaluation scores yielded by the proposed method were highly consistent with the clinical assessment decisions for three nerves of all 34 examined arms (7 x 2 + 10 x 2), with a sensitivity of 81.82%, specificity of 98.90%, and significate linear correlation (p< 0.05) in quantitative decision points between the proposed method and the routine clinical approach. Conclusion This study offers a useful tool for PNI assessment and helps to promote extensive clinical applications of surface EMG.","clinical assessment,peripheral nerve injury,surface electromyography,non-invasive examination,machine learning",Article,"FRONTIERS MEDIA SA, AVENUE DU TRIBUNAL FEDERAL 34, LAUSANNE, CH-1015, SWITZERLAND","Biotechnology & Applied Microbiology,Science & Technology - Other Topics",,5.973,"AMYOTROPHIC-LATERAL-SCLEROSIS,MUSCLE,SYNERGIES",FRONTIERS IN BIOENGINEERING AND BIOTECHNOLOGY,https://www.ncbi.nlm.nih.gov/pmc/articles/PMC7379167,
76,Histopathological distinction of non-invasive and invasive bladder cancers using machine learning approaches,20,1,,"Yin Peng-Nien,Kishan K. C.,Wei Shishi,Yu Qi,Li Rui,Haake Anne R.,Miyamoto Hiroshi,Cui Feng","Yin PN,Kishan KC,Wei SS,Yu Q,Li R,Haake AR,Miyamoto H,Cui F",Cui F,10.1186/s12911-020-01185-z,Rochester Institute of Technology,"Background One of the most challenging tasks for bladder cancer diagnosis is to histologically differentiate two early stages, non-invasive Ta and superficially invasive T1, the latter of which is associated with a significantly higher risk of disease progression. Indeed, in a considerable number of cases, Ta and T1 tumors look very similar under microscope, making the distinction very difficult even for experienced pathologists. Thus, there is an urgent need for a favoring system based on machine learning (ML) to distinguish between the two stages of bladder cancer. Methods A total of 1177 images of bladder tumor tissues stained by hematoxylin and eosin were collected by pathologists at University of Rochester Medical Center, which included 460 non-invasive (stage Ta) and 717 invasive (stage T1) tumors. Automatic pipelines were developed to extract features for three invasive patterns characteristic to the T1 stage bladder cancer (i.e., desmoplastic reaction, retraction artifact, and abundant pinker cytoplasm), using imaging processing software ImageJ and CellProfiler. Features extracted from the images were analyzed by a suite of machine learning approaches. Results We extracted nearly 700 features from the Ta and T1 tumor images. Unsupervised clustering analysis failed to distinguish hematoxylin and eosin images of Ta vs. T1 tumors. With a reduced set of features, we successfully distinguished 1177 Ta or T1 images with an accuracy of 91-96% by six supervised learning methods. By contrast, convolutional neural network (CNN) models that automatically extract features from images produced an accuracy of 84%, indicating that feature extraction driven by domain knowledge outperforms CNN-based automatic feature extraction. Further analysis revealed that desmoplastic reaction was more important than the other two patterns, and the number and size of nuclei of tumor cells were the most predictive features. Conclusions We provide a ML-empowered, feature-centered, and interpretable diagnostic system to facilitate the accurate staging of Ta and T1 diseases, which has a potential to apply to other types of cancer.","Machine learning,Deep learning,Bladder cancer,Histopathology images",Article,"BMC, CAMPUS, 4 CRINAN ST, LONDON N1 9XW, ENGLAND",Medical Informatics,,3.394,"CLASSIFICATION,PROGNOSIS,IMAGE",BMC MEDICAL INFORMATICS AND DECISION MAKING,https://europepmc.org/articles/pmc7367328?pdf=render,
