,title,Volume,Issue,Pages,whole__author_name,simply_author_name,reprint author,DOI,reprint address,Abstract,Keywords,Document Type,Publisher,Research Domain,Published Date,impact_factor,Keywords_plus,joural,pdf_link,Download_SuccessOrDefeat
68,,23,3,131-139,,,,10.17116/profmed202023031131,,"Введение. Компенсация сочетанных микронутриентных дефицитов - важнейшее направление поддержки врожденного противовирусного иммунитета, особенно в условиях пандемии COVID-19. Цель работы - анализ всех имеющихся в базах данных PubMed научных публикаций по изучению коронавирусов. Материал и методы. Проведен анализ 17 362 публикаций, посвященных коронавирусам (включая 2920 работ, касающихся коронавируса SARS-CoV-2). Анализ осуществлялся с применением системы искусственного интеллекта. Результаты. Показано, что повышение обеспеченности органима человека цинком, витаминами А, С, D, E является перспективным подходом для повышения резистентности к коронавирусу SARS-CoV-2. Результаты анализа протеома подтвеждают важность цинка как кофактора 118 белков противовирусной защиты организма человека, в том числе 11 белков интерферон-I-зависимой защиты против коронавирусов. Заключение. Обеспеченность организма цинком может способствовать торможению формирования так называемого цитокинового шторма, характерного для COVID-19, снижению системного хронического воспаления и компенсации коморбидных патологий, в том числе сердечно-сосудистых, у пациентов с COVID-19.",цинк; коронавирусы; системная биология; машинное обучение; цинкит,Review,,,,,,,,
69,The Effect of Image Resolution on Deep Learning in Radiography.,2,1,e190015,",","Sabottke Carl F,Spieler Bradley M",,10.1148/ryai.2019190015,,"Purpose: To examine variations of convolutional neural network (CNN) performance for multiple chest radiograph diagnoses and image resolutions.Materials and Methods: This retrospective study examined CNN performance using the publicly available National Institutes of Health chest radiograph dataset comprising 112 120 chest radiographic images from 30 805 patients. The network architectures examined included ResNet34 and DenseNet121. Image resolutions ranging from 32 * 32 to 600 * 600 pixels were investigated. Network training paradigms used 80% of samples for training and 20% for validation. CNN performance was evaluated based on area under the receiver operating characteristic curve (AUC) and label accuracy. Binary output networks were trained separately for each label or diagnosis under consideration.Results: Maximum AUCs were achieved at image resolutions between 256 * 256 and 448 * 448 pixels for binary decision networks targeting emphysema, cardiomegaly, hernias, edema, effusions, atelectasis, masses, and nodules. When comparing performance between networks that utilize lower resolution (64 * 64 pixels) versus higher (320 * 320 pixels) resolution inputs, emphysema, cardiomegaly, hernia, and pulmonary nodule detection had the highest fractional improvements in AUC at higher image resolutions. Specifically, pulmonary nodule detection had an AUC performance ratio of 80.7% ± 1.5 (standard deviation) (0.689 of 0.854) whereas thoracic mass detection had an AUC ratio of 86.7% ± 1.2 (0.767 of 0.886) for these image resolutions. 2020 by the Radiological Society of North America, Inc.",,Journal Article,,,,,,,,
70,Machine Learning Classification of Cerebral Aneurysm Rupture Status with Morphologic Variables and Hemodynamic Parameters.,2,1,e190077,",,,,,,,","Tanioka Satoru,Ishida Fujimaro,Yamamoto Atsushi,Shimizu Shigetoshi,Sakaida Hiroshi,Toyoda Mitsuru,Kashiwagi Nobuhisa,Suzuki Hidenori",,10.1148/ryai.2019190077,,"Materials and Methods: Between 2011 and 2019, 226 (112 ruptured and 114 unruptured) cerebral aneurysms in 188 consecutive patients were retrospectively analyzed with computational fluid dynamics (CFD). A random forest ML algorithm was applied to the results to create three classification models consisting of only morphologic variables (model 1), only hemodynamic parameters (model 2), and both morphologic variables and hemodynamic parameters (model 3). The accuracy of rupture status classification and the importance of each variable or parameter in the models were computed.Results: The accuracy was 77.0% in model 1, 71.2% in model 2, and 78.3% in model 3. The three most important features were projection ratio, size ratio, and aspect ratio in model 1; low shear area ratio, oscillatory shear index, and oscillatory velocity index in model 2; and projection ratio, irregular shape, and size ratio in model 3. 2020 by the Radiological Society of North America, Inc.",,Journal Article,,,,,,,,
71,Computer-aided Assessment of Catheters and Tubes on Radiographs: How Good Is Artificial Intelligence for Assessment?,2,1,e190082,",,,","Yi Xin,Adams Scott J,Henderson Robert D E,Babyn Paul",,10.1148/ryai.2020190082,," 2020 by the Radiological Society of North America, Inc.",,Journal Article; Review,,,,,,,,
72,,20,4,552-559,,,,10.17586/2226-1494-2020-20-4-552-559,,"Предмет исследования. Обнаружение дефектов изделия является современной и сложной задачей в сфере аддитивных технологий. Данная процедура позволяет сократить расходы на время и материалы, предотвращает причины возникновения брака. В связи с этим автоматизация контроля качества поверхности изделий 3D-печати является необходимым этапом изготовления как для крупных производственных предприятий, так и для частных пользователей. Предложен метод контроля качества изделий при 3D-печати на основе анализа изображений их поверхности с применением алгоритмов машинного обучения. Метод. Изображения изделий, полученных при 3D-печати, формируются и обрабатываются на установке, включающей видеокамеру и одноплатный микрокомпьютер. Метод обнаружения дефектов на поверхности изделий основан на применении алгоритмов предварительной обработки изображения, последующего машинного обучения и метода опорных векторов. Основные результаты. Предложенный метод позволяет обнаруживать и классифицировать дефекты вида «избыточная экструзия» и «недостаточная экструзия» на поверхности изготавливаемых объектов с высокой точностью. Практическая значимость. Применение разработанного метода обеспечивает упрощение процедуры 3D-печати как для частных пользователей устройств, так и для предприятий, которые изготавливают или используют данный вид устройств, за счет облегчения настройки параметров, сохранения отчетности о параметрах изделия, удобства и скорости решения проблем, возникших в ходе печати. Разработанный метод визуального контроля качества поверхности изделий 3D-печати может принести существенную пользу в расширении возможностей автоматизации процесса быстрого прототипирования и вывести его на новый уровень.",3D-печать; система технического зрения; машинное обучение; метод опорных векторов; алгоритмы; обнаружение дефектов; контроль качества; экструзия; метод послойного наплавления,Article,,,,,,,https://ntv.ifmo.ru/file/article/19791.pdf,
73,,,2,153-161,,,,10.24937/2542-2324-2020-2-392-153-161,,"Объект и цель научной работы. Объектом исследования являются методы прогнозирования рисков ухудшения технического состояния сложной морской техники. Целью работы является разработка предложений в части разработки и внедрения системы непрерывного мониторинга, сбора и статистического анализа диагностических данных судового оборудования для диагностирования и прогнозирования его технического состояния в соответствии с требованиями Российского морского регистра судоходства. Материалы и методы. С использованием статистического моделирования исследован метод квантильного регрессионного анализа значений контролируемых параметров судового оборудования. Также исследована возможность применения данного метода для оценки рисков ухудшения технического состояния судового оборудования на базе матриц рисков и структурных схем надежности. Основные результаты. На базе квантильного регрессионного анализа, матриц рисков контролируемых параметров и структурных схем надежности судового оборудования предложен и обоснован метод, а также описан разработанный на его основе программный комплекс, предназначенный для диагностирования и прогнозирования технического состояния судна и соответствующих рисков. Заключение. Предложенный метод прогнозирования рисков ухудшения технического состояния сложной морской техники соответствует техническим требованиям и рекомендациям Международной ассоциации классификационных обществ и Международной морской организации, а также Российского морского регистра судоходства.",морская техника; квантильная регрессия; машинное обучение; матрица рисков; надежность; диагностика; прогноз; статистическое моделирование,Article,,,,,,,https://doi.org/10.24937/2542-2324-2020-2-392-153-161,
74,Robust Segmentation of 3D Brain MRI Images in Cross Datasets by Integrating Supervised and Unsupervised Learning,,,194-201,"Wang Xiaoxue,Guo Chengan,Zhou Xiangjun","Wang XX,Guo CG,Zhou XJ",Wang XX,,Dalian University of Technology,"With the rapid development of machine learning technology in recent years, image segmentation technology based on supervised learning or unsupervised learning has also made important progress and achieved many successful applications, such as the applications to medical imaging in the same time. However, both supervised and unsupervised segmentation methods have their own strong and weak points. In order to address this dilemma, in this paper, we proposed a robust method for 3D image segmentation that can not only maintain the advantages of the two kinds of learning methods, but also overcome their disadvantages, by integrating supervised and unsupervised learning technologies into one method effectively. The proposed method has been applied to brain MRI image segmentation with a variety of experiments on several open 3D brain MR1 datasets. Experimental results obtained in the work show that the proposed method, with strong adaptability and robustness, outperforms other state of the art segmentation approaches including both the supervised and unsupervised ones when applied to a new MRI dataset or a cross dataset without needing to be retrained by using the annotation information of the dataset.","Keywords Segmentation,Robust Segmentation,MRI,Cross Datasets,Integration of Supervised and Unsupervised Learning",Proceedings Paper,"IEEE, 345 E 47TH ST, NEW YORK, NY 10017 USA",Computer Science,,,"VECTOR,QUANTIZATION,TUMOR",,,
75,Research and Implementation of Breast Cancer Intelligent Recognition Algorithm Based on Deep Convolutional Neural Network,1634,,,"Chen Taixing,Wang Lidan,Li Yunfei,Duan Shukai","Chen TX,Wang LD,Li YF,Duan SK",Duan SK,10.1088/1742-6596/1634/1/012176,Southwest University - China,"Breast cancer is one of the most dangerous cancers with a particularly high mortality rate for women. In the face of thousands of female pathological pictures, how to use computer related control algorithms to quickly and efficiently intelligently idently female breast cancer images has become an urgent problem in the world. With the development of computer vision and deep convolutional neural networks, this paper applies the convolutional neural network (CNN) algorithm to solve the classification and recognition computer tasks of histological images for breast cancer, aiming to learn from tens of thousands of histological images features for breast cancer, and to assist doctors in diagnosing patients' disease was found by computer control algorithm. There are many well-known neural network computer algorithms, such as AlexNet, Inception-Net, ResNet. Image recognition for breast is a binary classification problem, and it is not appropriate to use a ResNet network with a large amount of parameters. Therefore, this paper borrowed Alexnet algorithm and redesigned the algorithm, then used it for breast cancer experiments. We compared with the capsule algorithm used by Anupama authors. Our experiment improves the accuracy rate by 2%, and reduces the amount of neural network parameters, which greatly speeds up the training time.",,Proceedings Paper,"IOP PUBLISHING LTD, DIRAC HOUSE, TEMPLE BACK, BRISTOL BS1 6BE, ENGLAND",Computer Science,,,,,https://doi.org/10.1088/1742-6596/1634/1/012176,
76,An efficient method to identify thermal conductivity of orthotropic material based on BP neural network algorithm,1634,,,"Li Xiang,Ma Rui-feng,Tang Zhi-Yin","Li X,Ma RF,Tang ZY",Li X,10.1088/1742-6596/1634/1/012044,Wuhan Naval University of Engineering,"BP neural network algorithm is used to identify the three-dimensional orthotropic thermal conductivity. The finite volume method is used to solve the forward heat transfer problem, and the training samples for neural network inversion identification are obtained. According to the identification results, the temperature field is reconstructed. Through the analysis of the calculation results, it is found that the accurate identification of three-dimensional orthotropic thermal conductivity can be realized by using BP neural network algorithm. When the temperature measurement error is less than 0.5., the maximum identification error of thermal conductivity is only 3.5%.",,Proceedings Paper,"IOP PUBLISHING LTD, DIRAC HOUSE, TEMPLE BACK, BRISTOL BS1 6BE, ENGLAND",Computer Science,,,,,https://doi.org/10.1088/1742-6596/1634/1/012044,
77,Research on Container Throughput Forecast Based on ARIMA-BP Neural Network,1634,,,"Zhang Yifei,Fu Yuhui,Li Genghua","Zhang YF,Fu YH,Li GH",Zhang YF,10.1088/1742-6596/1634/1/012024,Dalian Maritime University,"In order to improve the accuracy of the container throughput, the paper proposed a prediction method based on ARIMA-BP neural network for the container throughput, and compared with the combined prediction method based on ARIMA-BP neural network, from the perspective of simple weighting and residual optimization. It is applied to the container throughput prediction of the Qingdao port statistics for a total of 24 quarters from 2014-2019. The results show that the prediction accuracy of the combination prediction method based on residual optimization was the highest. Compared with other prediction models, the evaluation indexes RMSE(Root Mean Square Error), MAE(Mean Absolute Error), and MAPE(Mean Absolute Percentage Error) were 15.95, 13.31 and 2.52% respectively and the prediction accuracy based on the BP neural network was lowest. The prediction method proposed in this paper for container throughput can provide guidance for the related personnel.",HYBRID ARIMA,Proceedings Paper,"IOP PUBLISHING LTD, DIRAC HOUSE, TEMPLE BACK, BRISTOL BS1 6BE, ENGLAND",Computer Science,,,"HYBRID,ARIMA",,https://doi.org/10.1088/1742-6596/1634/1/012024,
78,An Effective CNN Method for Fully Automated Segmenting Subcutaneous and Visceral Adipose Tissue on CT Scans,48,1,312-328,"Wang Zheng,Meng Yu,Weng Futian,Chen Yinghao,Lu Fanggen,Liu Xiaowei,Hou Muzhou,Zhang Jie","Wang Z,Meng Y,Weng FT,Chen YH,Lu FG,Liu XW,Hou MZ,Zhang J",Hou MZ,10.1007/s10439-019-02349-3,Central South University,"One major role of an accurate distribution of abdominal adipose tissue is to predict disease risk. This paper proposes a novel effective three-level convolutional neural network (CNN) approach to automate the selection of abdominal computed tomography (CT) images on large-scale CT scans and automatically quantify the visceral and subcutaneous adipose tissue. First, the proposed framework employs support vector machine (SVM) classifier with a configured parameter to cluster abdominal CT images from screening patients. Second, a pyramid dilation network (DilaLab) is designed based on CNN, to address the complex distribution and non-abdominal internal adipose tissue problems of biomedical image segmentation in visceral adipose tissue. Finally, since the trained DilaLab implicitly encodes the fat-related learning, the transferred DilaLab learning and a simple decoder constitute a new network (DilaLabPlus) for quantifying subcutaneous adipose tissue. The networks are trained not only all available CT images but also with a limited number of CT scans, such as 70 samples including a 10% validation subset. All networks are yielding more precise results. The mean accuracy of the configured SVM classifier yields promising performance of 99.83%, while DilaLabPlus achieves a remarkable performance improvement an with average of 98.08 +/- 0.84% standard deviation and 0.7 +/- 0.8% standard deviation false-positive rate. The performance of DilaLab yields average 97.82 +/- 1.34% standard deviation and 1.23 +/- 1.33% standard deviation false-positive rate. This study demonstrates considerable improvement in feasibility and reliability for the fully automated recognition of abdominal CT slices and segmentation of selected abdominal CT in subcutaneous and visceral adipose tissue, and it has a high agreement with a manually annotated biomarker.","Convolutional neural network (CNN),Support vector machine (SVM),Subcutaneous adipose tissue (SAT),Visceral adipose tissue (VAT)",Article,"SPRINGER, ONE NEW YORK PLAZA, SUITE 4600, NEW YORK, NY, UNITED STATES",Engineering,,,"BODY-FAT,ABDOMINAL,FAT,OBESITY,CLASSIFICATION,SEGMENTATION,ACCUMULATION,DISEASE,BENEFIT,IMAGES,RISK",ANNALS OF BIOMEDICAL ENGINEERING,,
79,A Biomarker for Discriminating Between Migraine With and Without Aura: Machine Learning on Functional Connectivity on Resting-State EEGs,48,1,403-412,"Frid Alex,Shor Meirav,Shifrin Alla,Yarnitsky David,Granovsky Yelena","Frid A,Shor M,Shifrin A,Yarnitsky D,Granovsky Y",Frid A,10.1007/s10439-019-02357-3,Technion Israel Institute of Technology,"Advanced analyses of electroencephalography (EEG) are rapidly becoming an important tool in understanding the brain's processing of pain. To date, it appears that none have been explored as a way of distinguishing between migraine patients with aura (MWA) vs. those without aura (MWoA). In this work, we apply a mixture of predictive, e.g., classification methods and attribute-selection techniques, and traditional explanatory, e.g., statistical, analyses on functional connectivity measures extracted from EEG signal acquired from at-rest participants (N = 52) during their interictal period and tested them against the distinction between MWA and MWoA. We show that a functional connectivity metric of EEG data obtained during resting state can serve as a sole biomarker to differentiate between MWA and MWoA. Using the proposed analysis, we not only have been able to present high classification results (average classification of 84.62%) but also to discuss the underlying neurophysiological mechanisms upon which our technique is based. Additionally, a more traditional statistical analysis on the selected features reveals that MWoA patients show higher than average connectivity in the Theta band (p = 0.03) at rest than MWAs. We propose that our data-driven analysis pipeline can be used for resting-EEG analysis in any clinical context.","EEG functional connectivity analysis,EEG classification,Resting state EEG,Migraine classification,Biomarker",Article,"SPRINGER, ONE NEW YORK PLAZA, SUITE 4600, NEW YORK, NY, UNITED STATES",Engineering,,,"FAST,FOURIER-TRANSFORM,PHASE",ANNALS OF BIOMEDICAL ENGINEERING,,
80,Training of Deep Convolutional Neural Networks to Identify Critical Liver Alterations in Histopathology Image Samples,10,1,,"Arjmand Alexandros,Angelis Constantinos T.,Christou Vasileios,Tzallas Alexandros T.,Tsipouras Markos G.,Glavas Evripidis,Forlano Roberta,Manousou Pinelopi,Giannakeas Nikolaos","Arjmand A,Angelis CT,Christou V,Tzallas AT,Tsipouras MG,Glavas E,Forlano R,Manousou P,Giannakeas N",Arjmand A; Giannakeas N,10.3390/app10010042,University of Ioannina,"Nonalcoholic fatty liver disease (NAFLD) is responsible for a wide range of pathological disorders. It is characterized by the prevalence of steatosis, which results in excessive accumulation of triglyceride in the liver tissue. At high rates, it can lead to a partial or total occlusion of the organ. In contrast, nonalcoholic steatohepatitis (NASH) is a progressive form of NAFLD, with the inclusion of hepatocellular injury and inflammation histological diseases. Since there is no approved pharmacotherapeutic solution for both conditions, physicians and engineers are constantly in search for fast and accurate diagnostic methods. The proposed work introduces a fully automated classification approach, taking into consideration the high discrimination capability of four histological tissue alterations. The proposed work utilizes a deep supervised learning method, with a convolutional neural network (CNN) architecture achieving a classification accuracy of 95%. The classification capability of the new CNN model is compared with a pre-trained AlexNet model, a visual geometry group (VGG)-16 deep architecture and a conventional multilayer perceptron (MLP) artificial neural network. The results show that the constructed model can achieve better classification accuracy than VGG-16 (94%) and MLP (90.3%), while AlexNet emerges as the most efficient classifier (97%).","liver biopsies,fatty liver,hepatocyte ballooning,deep learning,convolutional neural networks,computer vision",Article,"MDPI, ST ALBAN-ANLAGE 66, CH-4052 BASEL, SWITZERLAND","Chemistry,Engineering,Materials Science,Physics",,2.736,"DISEASE,QUANTIFICATION,CLASSIFICATION,STEATOSIS,BIOPSIES,FAT",APPLIED SCIENCES-BASEL,https://www.mdpi.com/2076-3417/10/1/42/pdf,
