,title,Volume,Issue,Pages,whole__author_name,simply_author_name,reprint author,DOI,reprint address,Abstract,Keywords,Document Type,Publisher,Research Domain,Published Date,impact_factor,Keywords_plus,joural,pdf_link,Download_SuccessOrDefeat
62,,14,4,91-99,,,,10.14357/19922264200413,,"Моделирование тепловых свойств слоистых структур в настоящее время стало востребованным направлением научных исследований. Это связано с постоянно растущей скоростью работы микроэлектронных элементов на основе слоистых структур, выделяющих при работе все большее количество энергии в виде тепла, которое требуется отводить, чтобы избежать перегрева и потери функциональных свойств устройств. В работе представлен интеграционный подход, позволяющий объединить методы многомасштабного моделирования и анализа данных. Применение данного подхода дает возможность получить новое качество при решении задачи построения модели теплопереноса в двухслойной структуре GaAs/AlAs. Показана эффективность применения методов машинного обучения для анализа зависимости эффективного коэффициента теплопроводности слоистых материалов от структурных особенностей и внешних факторов. Развитие предложенного подхода сможет обеспечить формирование информации для обоснованного подбора материалов слоистых структур для микроэлектронных устройств.",многомасштабное моделирование; интеграционный подход; слоистые структуры; предсказательное моделирование; кинетическое уравнение Больцмана; коэффициент теплопроводности; методы анализа данных,Article,,,,,,,,
63,,,2,72-80,,,,10.37690/1811-0193-2020-2-72-80,,"Введение. Для оценки длительности всей операции в целом по удалению мочевых конкрементов с целью выбора тактики проведения операции, рационального планирования использования операционного помещения и высокотехнологического оборудования, применяемого при лечении уролитиаза, требуется знание времени, затрачиваемого на дробление мочевых конкрементов. Это время в свою очередь состоит из интервала времени собственно разрушения камня и времени, затрачиваемого на дополнительные действия: осмотр места дробления, перемещение лазерного волокна к смещенному в результате ретропульсии камню, промывания области дробления и проч. В настоящее время отсутствуют методы расчета или прогнозирования этих интервалов времени. Цель: разработать способ прогнозирования времени разрушения мочевых камней с учетом дополнительных затратвремени при использовании контактной литотрипсии гольмиевым лазером, чтобы на основе знания времени операции рационально выстраивать тактику лечения, планировать варианты операционного пособия и загрузку операционного помещения и высокотехнологического оборудования.Материалы и методы. В работе приведены собственные результаты измерений in vivo интервалов времени, зарачиваемых на собственно разрушение мочевого камня и на вспомогательные действия, необходимые при проведении трансуретральной контактной литотрипсии, а также общее время полного разрушения конкремента. Дробление камней осуществлялось с помощью полуригидного и гибкого уретероскопов в мочеточнике и чашечно-лоханочной системе. В ряде случаев прибегали к перкутанному минидренированию ЧЛС. Использованы методы статистической обработки данных и пакет Statistics and Machine Learning Toolbox системы Матлаб для прогнозирования длительности процедуры разрушения конкрементов гольмиевым литотриптером Triple («Медоптотех»). Результаты. Для прогнозирования общего времени, затрачиваемого на дробление мочевого камня предложена линейная регрессионная модель, в которой общее время представлено в виде суммы времени, затрачиваемого на собственно процесс дробления, и времени дополнительных затрат на выполнение вспомогательных манипуляций. К вспомогательным действиям относятся: промывание области дробления, репозиционирование оптического волокна по причине смещения его из-за ретропульсии камня и дыхательной экскурсии и проч. Время непосредственного дробления камня определяется на основе массы камня, рассчитанной по измеренным при КТ объеме и плотности, а также удельной скорости потери массы камня при дроблении гольмиевым лазером, энергии и частоты импульсов лазерного литотриптера. Время дополнительных затрат представлено в виде произведения времени непосредственного дробления камня на коэффициент дополнительных затрат. Путем измерений in vivo и статистической обработки данных получены средние и максимально допустимые значения коэффициентов дополнительных затрат при дроблении в различных частях мочевыделительной системы. Средние значения этих коэффициентов составляют: 5,44±2,42 при дроблении камней в ЧЛС полуригидным уретероскопом; 3,86±1,95 при использовании гибкого УРС; 8,92±3,13 при дроблении камней в различных отделах мочеточника и 1,36±0,62 при использовании методики mini drainage. Заключение. Получены данные экспериментальных исследований длительностей дробления мочевых конкрементов и интервалов времени дополнительных затрат на проведение вспомогательных манипуляций, выполняемых наряду с процедурой собственно дробления камней, а также предложен способ дополнительного промывания полости дробления, позволяющий сократить время дополнительных затрат при дроблении не менее, чем в 4 раза. Разработана математическая модель для вычисления продолжительности общих затрат на дробление, позволяющая более точно прогнозировать длительность операции контактной литотрипсии гольмиевым лазером в целом.",контактная литотрипсия; гольмиевый лазер; мочевые камни; МКБ; дополнительное промывание; прогнозирование длительности литотрипсии,Article,,,,,,,,
64,,8,3,317-326,,,,10.17816/PTORS34150,,"Обоснование. Несмотря на широкий спектр зарубежных исследований по созданию автоматизированного метода измерения угла Кобба на рентгенограмме позвоночника, отечественного вспомогательного инструмента, позволяющего оптимизировать процесс определения степени тяжести сколиотической деформации и выбора эффективного метода лечения, до сих пор не существует. Цель - исследовать алгоритмы выделения на рентгеновском снимке позвоночного столба, позвонков и построения касательных к межпозвонковым дискам для последующего автоматизированного анализа рентгенограмм позвоночника пациентов, страдающих идиопатическим сколиозом, с целью оценки степени тяжести. Материалы и методы. Расчерчены ручным методом сертифицированным врачом-рентгенологом и включены в датасет для обучения нейросети 300 цифровых рентгенограмм позвоночника детей и подростков с идиопатическим сколиозом для определения степени сколиоза на основании величины угла Кобба. Использовали два методологических подхода - детерминированный метод скользящих окон и алгоритм на базе нейронной сети, апробация которых показала значительное преимущество последнего. Результаты. Созданы основы компьютерной системы автоматизации анализа медицинских рентгенологических изображений позвоночного столба. Особый подход к обучению и аугментации данных, а также разметка одним квалифицированным специалистом позволили обучить нейронную сеть и добиться правильного распознавания угла Кобба более чем на 85 % рентгенограмм. Заключение. Сделан первый шаг к созданию современного отечественного инновационного продукта, основанного на технологии глубоких нейронных сетей - распознавания и 2D-изображений позвоночника и автоматического расчерчивания углов Кобба.",позвоночник; сколиоз; рентгенограмма; автоматизация анализа,Article,,,,,,,https://journals.eco-vector.com/turner/article/download/34150/31577,
65,,,7,5-18,,,,10.30791/1028-978X-2020-7-5-18,,"Проведено прогнозирование новых халькошпинелей наиболее распространенных составов: AIBIIICIVX4 (X - S или Se) и AIIBIIICIIIS4 (A, B и C - разные химические элементы), перспективных для поиска новых материалов для магнитооптических элементов памяти, сенсоров и анодов в натрий-ионных батареях, и оценены значения параметра их кристаллической решетки “a”. При прогнозировании использовали только значения свойств химических элементов, входящих в состав еще не полученных соединений. Расчеты проведены с применением программ машинного обучения, входящих в состав разработанной авторами информационно-аналитической системы (различных комитетов алгоритмов бинарных решающих деревьев, линейной машины, формирования логических закономерностей, опорных векторов, линейного дискриминанта Фишера, k-ближайших соседей, обучения многослойного перцептрона и нейронной сети), - для прогнозирования еще не полученных халькошпинелей, а также обширного семейства регрессионных методов, представленных в пакете scikit-learn для языка Python, и предложенных авторами многоуровневых методов машинного обучения - для оценки значения параметра кристаллической решетки новых халькошпинелей. Точность прогнозов новых халькошпинелей по результатам скользящего контроля не ниже 80 %, а точность прогнозов параметра их кристаллической решетки (по результатам расчета средней абсолютной ошибки при скользящем контроле в режиме leave-one-out) - ± 0,1 A. Показана эффективность использования многоуровневых методов машинного обучения для прогнозирования физических свойств веществ.",халькошпинель; параметр кристаллической решетки; прогнозирование; обучение ЭВМ,Article,,,,,,,,
66,,,8,4-9,,,,10.35627/2219-5238/2020-329-8-4-9,,"Введение. Переход к машинному обучению, персонализированной медицине, высокотехнологичному здравоохранению требует современных медицинских кадров. Высшая медицинская школа трансформирует систему подготовки специалистов с использованием современных цифровых технологий, начинает образование в ассоциированных с ней предуниверсариях. В связи с этим актуально изучение влияния современных технологий на функциональное состояние старшеклассников. Материалы и методы. В апреле 2019 года на основании добровольного информированного согласия был обследован 181 здоровый обучающийся медицинского предуниверсария Сеченовского университета в возрасте 15-17 лет. Проведена оценка влияния обучения на состояние центральной нервной системы (ЦНС), костно-мышечной системы и зрительного анализатора. Результаты. Традиционные уроки в предуниверсарии сочетаются с проектной деятельностью и освоением практических навыков. Для формирования практических знаний и умений используются фантомные и симуляционные технологии, модульное построение учебного расписания. Учебная нагрузка выше гигиенических нормативов - 38-40 часов в неделю. Индивидуальная проектная деятельность в малых группах (до 5 человек) с преподавателями занимает 20 часов в неделю. Симуляционные занятия проводятся 1 раз в неделю после основных занятий и длятся 90 минут с 5-минутным перерывом. Занятия с использованием симуляционных технологий не всегда являются гигиенически рациональными. Учебные нагрузки, особенности расписания и технологии обучения, приближенные к университетским, адекватны функциональным возможностям организма обучающихся медицинского предуниверсария. Симуляционные занятия не вызывают выраженных отклонений со стороны нервно-мышечного аппарата обучающихся. Также в большем проценте случаев демонстрируется высокая стрессоустойчивость и большая мотивационная готовность к данному виду деятельности. Напряжение эмоциональной сферы и высокие показатели тревожности обнаруживаются примерно в одинаковом проценте случаев как при традиционных уроках, так и при симуляционной деятельности на фантомах. Выводы. Целесообразно шире использовать современные цифровые (симуляционные, фантомные, виртуальные) и проектно-исследовательские технологии обучения, в том числе в медицинских классах общеобразовательных организаций",предуниверсарий; старшеклассники; профильное обучение; электронные устройства; риски здоровью,Article,,,,,,,https://zniso.fcgie.ru/jour/article/download/239/232,
67,,,1,51-56,,,,,,"Введение. Поиск специфических молекулярно-генетических маркеров риска развития осложнений инфекционных заболеваний является актуальным направлением современной медико-биологической науки. Материалы и методы. Для решения этой задачи нами разработана программа для ЭВМ MiDA. В программе реализован комплексный подход, позволяющий проводить отбор потенциальных маркеров на основании показателей изменения уровня экспрессии ряда генов в группах сравнения и значимости признака для классификации - отнесения образцов к анализируемым группам. Результаты исследования. С помощью программы MiDA проведен поиск молекулярно-генетических маркеров риска развития тяжелой формы течения лихорадки денге и хронической формы бруцеллеза. В результате исследования в качестве маркера риска осложнения лихорадки денге предложен ген HSPA6, экспрессия которого в периферической крови пациентов с тяжелой формой течения болезни снижалась. К маркерам хронической формы течения бруцеллеза отнесли снижение экспрессии микроРНК hsa-miR-198 и hsa-miR-501-3p, а также повышение экспрессии микроРНК hsa-miR-618 в CD4+ Т-лимфоцитах. Выводы. Продемонстрирована возможность применения программы MiDA для анализа больших данных, полученных с помощью современных технологий (секвенирование, биочипы и др.). Возможно расширение сферы применения программы для анализа экспрессии генов, транскриптов и белков при заболеваниях различного генеза, определения молекулярных механизмов реализации патологического процесса, поиска диагностических и прогностических маркеров заболевания, а также потенциальных мишеней для разработки средств таргетной терапии.",анализ данных; биочип; Большие Данные; бруцеллез; лихорадка Денге; машинное обучение; программа для ЭВМ; риск осложнений,Article,,,,,,,,
