,title,Volume,Issue,Pages,whole__author_name,simply_author_name,reprint author,DOI,reprint address,Abstract,Keywords,Document Type,Publisher,Research Domain,Published Date,impact_factor,Keywords_plus,joural,pdf_link,Download_SuccessOrDefeat
23,Quantized Deep Residual Convolutional Neural Network for Image-Based Dietary Assessment,8,,111875-111888,"Tan Ren Zhang,Chew Xinying,Khaw Khai Wah","Tan RZ,Chew XY,Khaw KW",Chew XY,10.1109/ACCESS.2020.3003518,Universiti Sains Malaysia,"Vegetable intake is an essential element to maintain a healthy body of a human. However, research shows most people do not consume an adequate intake of vegetables per day. An ameliorate dietary assessment for vegetable intake is needed to increase awareness and assist users to improve their vegetable consumption. In this paper, we proposed a novel Quantized Deep Residual Convolutional Neural Network (DRCNN) model to ameliorate the fundamental task of dietary assessment. The proposed deep learning strategy integrating a deep residual architecture and a deep learning model, i.e. convolutional neural network, to apply for image-based dietary assessment. The proposed DRCNN model is then deeply fused with post-training quantization techniques to quantize the network weights of the proposed DRCNN model into low-bit fixed-point representations. Extensive experiments have been done to evaluate the proposed model. Results show that the proposed Quantized DRCNN model outperformed the state-of-the-arts, which include the conventional CNN models and also the machine learning models. Those experiments also indicate the effectiveness of the proposed Quantized DRCNN model. Finally, we further evaluate our model with cross-dataset validation to verify the generalization of the proposed model. The experimental result proves that the proposed Quantized DRCNN model is general enough to predict unseen cases and it works well on a wide range of food images.","Convolutional neural network,deep learning,deep residual network,image-based dietary assessment,machine learning,quantized model",Article,"IEEE-INST ELECTRICAL ELECTRONICS ENGINEERS INC, 445 HOES LANE, PISCATAWAY, NJ 08855-4141 USA","Computer Science,Engineering,Telecommunications",,3.671,"FOOD,RECOGNITION,FEATURES,CLASSIFICATION,DESIGN,SYSTEM,NOISE,CNN",IEEE ACCESS,https://ieeexplore.ieee.org/ielx7/6287639/8948470/09119989.pdf,
24,Application of Deep Learning Algorithm in Clinical Analysis of Patients With Serum Electrolyte Disturbance,8,,124646-124660,"Wang Jian,Wang Yan Ping,Chen Yao,Huang Peiji","Wang J,Wang YP,Chen Y,Huang PJ",Wang J,10.1109/ACCESS.2020.3001212,Fujian Medical University,"This article analyzes the serum electrolyte disturbances of patients through deep learning algorithms. Among the 104 patients with electrolyte disturbances, 6 cases of serum potassium, sodium, chloride, calcium, phosphorus, and magnesium electrolyte disturbances have occurred, the proportion of occurrence The order is sodium > chlorine > calcium > potassium > phosphorus > magnesium. This paper proposes a deep learning algorithm for serum electrolyte disorder, and analyzes and implements the functions at various levels according to the characteristics of the Hadoop framework. The system includes electronic medical records shared storage, distributed realization of definite learning algorithms, classification and recognition of myocardial ischemia by deep learning, and Web system assisting doctor diagnosis, which lays the foundation for the construction of serum electrolyte disorder scientific research data center. In order to explore this relationship, without artificially extracting features, a deep learning model of convolution and long-term and short-term memory circulation neural network cascade was proposed to determine the positive or negative myocardial ischemia by classifying serum disorders. Conduct clinical experiments, including patients with suspected coronary heart disease and coronary angiography as the research object, taking coronary angiography results as the detection standard. Experimental results show that the model has an accuracy of 89.0% for detecting myocardial ischemia, a sensitivity of 91.7%, and a specificity of 81.5%. A linear combination model of CNN and LSTM is proposed to classify and recognize serum electrolyte disorders. Determine the learning theory to dynamically model the ST-T segment in the ECG to obtain serum electrolyte disturbance, which more vividly shows the changes in electrical information under myocardial ischemia. In order to reveal the relationship between serum electrolyte disturbance and myocardial ischemia, this paper builds a neural network model to learn and train serum electrolyte disturbance data to realize the classification of positive or negative myocardial ischemia. Tests on serum electrolyte disturbance data collected in clinical experiments show that this model can better achieve early detection of myocardial ischemia.","Electrolytes,Sodium,Heart,Classification algorithms,Myocardium,Peptides,Deep learning,Deep learning,serum,electrolyte disturbance,clinical analysis",Article,"IEEE-INST ELECTRICAL ELECTRONICS ENGINEERS INC, 445 HOES LANE, PISCATAWAY, NJ 08855-4141 USA","Computer Science,Engineering,Telecommunications",,3.671,"HEART-FAILURE,DIAGNOSIS,GUIDELINES,CARE,IDENTIFICATION,ASSOCIATION,MANAGEMENT,MEDICINE,NETWORKS,SOCIETY",IEEE ACCESS,https://ieeexplore.ieee.org/ielx7/6287639/8948470/09113261.pdf,
25,Pathological Image Classification Based on Hard Example Guided CNN,8,,114249-114258,"Wang Ying,Peng Ting,Duan Jiajia,Zhu Chuang,Liu Jun,Ye Jiandong,Jin Mulan","Wang Y,Peng T,Duan JJ,Zhu C,Liu J,Ye JD,Jin ML",Jin ML,10.1109/ACCESS.2020.3003070,Capital Medical University,"The diagnosis of biopsy tissue with hematoxylin and eosin (H&E) stained images has been widely used by pathologists to detect the lesions and assess the malignancy. Nevertheless, the diagnostic result relies on the visual observation of pathologists which may vary from person to person under different circumstances. With the advantage of automatically and adaptively learning features at multiple levels of abstraction, Convolutional Neural Networks (CNNs) have rapidly become promising alternatives for pathological image analysis. Therefore, in this paper, we propose an effective method for tumor classification called Hard Example Guided CNN. Our contribution is twofold: firstly, to optimize image representation, we design the CNN architecture as dual-branch, used for extracting global features and local features simultaneously. Secondly, we propose a re-weight training algorithm, which improves learning accuracy and accelerates the convergence by increasing the weight of hard examples. Extensive experiments on multiple datasets demonstrate the superiority of our proposed classification method.","Feature extraction,Training,Cancer,Pathology,Lesions,Task analysis,Pathological image classification,feature fusion,re-weight training,deep learning",Article,"IEEE-INST ELECTRICAL ELECTRONICS ENGINEERS INC, 445 HOES LANE, PISCATAWAY, NJ 08855-4141 USA","Computer Science,Engineering,Telecommunications",,3.671,,IEEE ACCESS,https://ieeexplore.ieee.org/ielx7/6287639/8948470/09119412.pdf,
26,An Innovative Scoring System for Predicting Major Adverse Cardiac Events in Patients With Chest Pain Based on Machine Learning,8,,124076-124083,"Wu Chieh-Chen,Hsu Wen-Ding,Wang Yao-Chin,Kung Woon-Man,Tzeng I-Shiang,Huang Chih-Wei,Huang Chu-Ya,Li Yu-Chuan","Wu CC,Hsu WD,Wang YC,Kung WM,Tzeng IS,Huang CW,Huang CY,Li YC",Li YC,10.1109/ACCESS.2020.3004405,Taipei Medical University,"Chest pain is a common complaint in the emergency department, but this may prevent a diagnosis of major adverse cardiac events, a composite of all-cause mortality associated with cardiovascular-related illnesses. To determine potential predictors of major adverse cardiac events in Taiwan, a pilot study was performed, involving the data from 268 patients with major adverse cardiac events, which was by an artificial neural network method. Nine biomarkers were selected for identifying non-ST-elevation myocardial infarction from common chest pain patients. By using a machine learning-based feature selection technique, five biomarkers were chosen from a set of 37 candidate variables. A full and a reduced risk stratification model were built. The full model was based on the characteristics of both invasive (i.e., creatinine and troponin I) and non-invasive (i.e., age, coronary artery disease risk factors, and corrected QT interval) variables, and the reduced model was based only on non-invasive variable characteristics. The full model showed a sensitivity of 0.948 and a specificity of 0.546 when the cutoff was set at 2 points, with a missed major adverse cardiac events rate of 1.32%, a positive predictive value of 0.228, and a negative predictive value of 0.987. High performance was also obtained with the five major biomarkers in the predictor built by the machine learning algorithm. The full model had the highest performance, but the reduced model can be applied as a quick and reasonably performing diagnostic tool.","Chest pain,emergency department,scoring system,major adverse cardiac events,ST-elevation myocardial infarction,non-ST-elevation myocardial infarction,risk stratification,machine learning",Article,"IEEE-INST ELECTRICAL ELECTRONICS ENGINEERS INC, 445 HOES LANE, PISCATAWAY, NJ 08855-4141 USA","Computer Science,Engineering,Telecommunications",,3.671,"EMERGENCY-DEPARTMENT,RISK,SCORES,PROSPECTIVE,VALIDATION,QT,INTERVAL,HEART,SCORE,STRATIFICATION,PROLONGATION,MORTALITY,GRACE",IEEE ACCESS,https://doi.org/10.1109/access.2020.3004405,
27,Deep Learning-Based Earlier Detection of Esophageal Cancer Using Improved Empirical Wavelet Transform From Endoscopic Image,8,,123765-123772,"Xue Yuan,Li Na,Wei Xiaojie,Wan Ren'An,Wang Chunyan","Xue Y,Li N,Wei XJ,Wan RA,Wang CY",Wang CY,10.1109/ACCESS.2020.3006106,"Rizhao Peoples Hosp, Rizhao 276800, Peoples R China.","In the current scenario, the research perspective on esophageal cancer becomes severe, high-prognosis malignancy; poor prognosis is primarily attributed to the fact that most tumors remain asymptomatic and unrelated before it grows through the esophagus. Significant decreases in mortality from esophageal cancer may require effective approaches to detect and nurse more patients at early, curable stages. A new Improved Empirical Wavelet Transform (IEWT) dependent on feature extraction approach and a consistent homology for the diagnosis of early esophageal endoscopic cancer have been proposed in this article. The approach is to convert an input endoscope image into CIE colored spaces L * x * y, and the x* and y* components to create a fusion image for analysis. Further, the two kinds of wavelets are obtained by adding the two forms to the fusion signal. Another is the lower-frequency component provided by the improved empirical wavelet transformation of the wave, and the other is the high- components generated from the Deep Learning-based Complex Empirical Wavelet Transformation (DL-CEWT). The fractal sizes are determined using the box interpolation method for each small block, and the abnormal regions are defined for the basis of their fractal sizes. Binary pictures are obtained by the complex threshold in each frequency variable and then divided into small blocks in every binary image. Using the homology of every block to obtain the new features in the entry image. The extraction strategies for this application are comprehensive and preliminary findings indicate that the method is effective for the early detection of esophageal cancer in an image.","Esophageal cancer,empirical wavelet transformation,binary images,endoscopic image,detection and nursing",Article,"IEEE-INST ELECTRICAL ELECTRONICS ENGINEERS INC, 445 HOES LANE, PISCATAWAY, NJ 08855-4141 USA","Computer Science,Engineering,Telecommunications",,3.671,,IEEE ACCESS,https://ieeexplore.ieee.org/ielx7/6287639/8948470/09129721.pdf,
28,ECG Signal Reconstruction via Doppler Sensor by Hybrid Deep Learning Model With CNN and LSTM,8,,130551-130560,"Yamamoto Kohei,Hiromatsu Ryosuke,Ohtsuki Tomoaki","Yamamoto K,Hiromatsu R,Ohtsuki T",Yamamoto K,10.1109/ACCESS.2020.3009266,"Grad Sch Sci & Technol, Grad Sch Sci & Technol, Yokohama, Kanagawa 2238522, Japan.","An Electrocardiogram (ECG) is a typical method used to detect heartbeat, and an ECG signal analysis enables the detection of some heart diseases. However, the ECG-based heartbeat detection requires device attachment, which is not preferred for daily use. A Doppler sensor could be a device used to enable the non-contact heartbeat detection. In this paper, we propose a Doppler sensor-based ECG signal reconstruction method by a hybrid deep learning model with Convolutional Neural Network (CNN) and Long Short-Term Memory (LSTM). An ECG signal can be reconstructed by relating features of a heartbeat signal obtained by a Doppler sensor to those of the ECG signal. Thus, we construct the deep learning model that extracts the spatial and temporal features from the heartbeat signal by CNN and LSTM. Based on the extracted features, the ECG signal is reconstructed. We conducted experiments to observe heartbeat against 9 healthy subjects without heart disease. The experimental results showed that our method performed ECG signal reconstruction with a correlation coefficient of 0.86 between the reconstructed and actual ECG signals, even without attaching devices. The results indicate that it is possible to remotely reconstruct an ECG signal from a heartbeat signal via a Doppler sensor.","Heart beat,Electrocardiography,Doppler effect,Feature extraction,Signal reconstruction,Machine learning,Heartbeat,microwaves,Doppler sensor,ECG,deep learning",Article,"IEEE-INST ELECTRICAL ELECTRONICS ENGINEERS INC, 445 HOES LANE, PISCATAWAY, NJ 08855-4141 USA","Computer Science,Engineering,Telecommunications",,3.671,"HEART-RATE-VARIABILITY,RECOGNITION,TRANSFORM",IEEE ACCESS,https://ieeexplore.ieee.org/ielx7/6287639/8948470/09139941.pdf,
29,Non-Contact Heartbeat Detection by Heartbeat Signal Reconstruction Based on Spectrogram Analysis With Convolutional LSTM,8,,123603-123613,"Yamamoto Kohei,Ohtsuki Tomoaki","Yamamoto K,Ohtsuki T",Yamamoto K,10.1109/ACCESS.2020.3006107,Keio University,"Heartbeat detection is one of key techniques to monitor our health condition in daily life, and demands for this technique have increased year and year. Thanks to the non-contact and non-invasive features, various Doppler sensor-based detection methods have been investigated so far. However, the heartbeat detection accuracy of the conventional methods could get degraded due to the low SNR (Signal-to-Noise Ratio) of heartbeat components. Thus, even after some signal processing, non-heartbeat components still remain over such processed signal, which could degrade the heartbeat detection accuracy. In particular for the subjects with low HR (Heart Rate), the estimated HR tends to be higher than the ground truth HR due to such non-heartbeat components, though the conventional methods have mainly focused on the heartbeat detection against the subjects with the normal HR higher than 50 bpm (Beats Per Minute). In this paper, to accurately detect heartbeat even with low HR via a Doppler sensor, we propose a heartbeat detection method based on heartbeat signal reconstruction with convolutional LSTM (Bidirectional-Long Short-Term Memory). In the proposed method, to reconstruct a heartbeat signal based on the periodicity of heartbeat and the spectrum distribution peculiar to heartbeat, successive spectrograms that might be due to heartbeat is used as an input to convolutional LSTM. In addition, for better reconstruction of a heartbeat signal, the previously estimated RRI (R-R Interval) is also used as a feature in the proposed deep learning model with convolutional LSTM. Through the experiments, we confirmed that our proposed method accurately detected heartbeat against 17 subjects including the ones with the HR lower than 50 bpm.","Doppler sensor,heartbeat,spectrogram,deep learning,convolutional LSTM",Article,"IEEE-INST ELECTRICAL ELECTRONICS ENGINEERS INC, 445 HOES LANE, PISCATAWAY, NJ 08855-4141 USA","Computer Science,Engineering,Telecommunications",,3.671,"RECOGNITION,TRANSFORM,DISEASE",IEEE ACCESS,https://ieeexplore.ieee.org/ielx7/6287639/8948470/09129737.pdf,
30,Using a Patch-Wise M-Net Convolutional Neural Network for Tissue Segmentation in Brain MRI Images,8,,120946-120958,"Yamanakkanavar Nagaraj,Lee Bumshik","Yamanakkanavar N,Lee B",Lee B,10.1109/ACCESS.2020.3006317,Chosun University,"Accurate segmentation of brain tissues, such as gray matter (GM), white matter (WM), and cerebrospinal fluid (CSF), in magnetic resonance imaging (MRI) images, is helpful for the diagnosis of neurological disorders, such as schizophrenia, Alzheimer's disease, and dementia. Studies on MRI-based brain segmentation have received significant attention in recent years based on the non-invasive imaging and good soft-tissue contrast provided by MRI. A number of studies have used conventional machine learning strategies, as well as convolutional neural network approaches. In this paper, we propose a patch-wise M-net architecture for the automatic segmentation of brain MRI images. In the proposed brain segmentation method, slices from a brain MRI scan are divided into non-overlapping patches, which are then fed into an M-net model with corresponding ground-truth patches to train the network, which is composed of two encoder-decoder processes. Dilated convolutional kernels with different sizes are used in the encoder and decoder modules to derive abundant semantic features from brain MRI scans. The proposed patch-wise M-net overcomes the drawbacks of conventional methods and provides greater retention of fine details. The proposed M-net model was trained and tested on the open-access series of imaging studies dataset. The performance was measured quantitatively using the Dice similarity coefficient. Experimental results demonstrate that the proposed method achieves average segmentation accuracies of 94.81% for CSF, 95.44% for GM, and 96.33% for WM, meaning it outperforms state-of-the-art methods.","Brain MRI,convolutional neural network,M-net,tissue segmentation",Article,"IEEE-INST ELECTRICAL ELECTRONICS ENGINEERS INC, 445 HOES LANE, PISCATAWAY, NJ 08855-4141 USA","Computer Science,Engineering,Telecommunications",,3.671,"AUTOMATIC,SEGMENTATION,CEREBRAL-CORTEX,EXTRACTION,CLASSIFICATION,CNN",IEEE ACCESS,https://ieeexplore.ieee.org/ielx7/6287639/8948470/09130719.pdf,
31,Diverse Region-Based CNN for Tongue Squamous Cell Carcinoma Classification With Raman Spectroscopy,8,,127313-127328,"Yan Hao,Yu Mingxin,Xia Jiabin,Zhu Lianqing,Zhang Tao,Zhu Zhihui,Sun Guangkai","Yan H,Yu MX,Xia JB,Zhu LQ,Zhang T,Zhu ZH,Sun GK",Zhu LQ,10.1109/ACCESS.2020.3006567,Beijing Information Science & Technology University,"Border discrimination is very important in the treatment of tongue squamous cell carcinoma (TSCC). This study proposes an ensemble convolutional neural network (CNN) framework based on fiber optic Raman spectroscopy and deep learning techniques to distinguish between TSCC and non-tumor tissue frameworks. First, the data used in the experiments was collected by a fiber optic Raman system. A total of 44 tissues of 22 patients were collected for Raman spectroscopy, with TSCC and adjacent normal tissues each accounting for half. The spectral data range used in the model from a full spectrum of 600-4000 cm(-1). Then, the ensemble CNN model was used in the experiment. By using two convolution kernels, the model is able to extract nonlinear feature representations from different spectral regions. It has two advantages, on the one hand, it reduces the generation of noise, on the other hand, it obtains a stronger distinguishing ability. Finally, a feature vector is formed by the fusion layer, and is sent to the fully connected layer for the TSCC classification task. The results showed that the sensitivity and specificity of the model were 99.2% and 99.2%, respectively. In addition, comparison with existing methods shows that our method achieves the highest accuracy of TSCC classification. By comparing the different channels, the results show that the spectral range of 1380-2250cm(-1) data has the greatest impact on the results. Therefore, Raman spectroscopy combined with the ensemble CNN model has great potential and can provide a useful technique for intraoperative evaluation of the margins of oral tongue squamous cell carcinoma.","Ensemble convolutional neural networks,fiber optic Raman system,Raman spectroscopy,tongue squamous cell carcinoma",Article,"IEEE-INST ELECTRICAL ELECTRONICS ENGINEERS INC, 445 HOES LANE, PISCATAWAY, NJ 08855-4141 USA","Computer Science,Engineering,Telecommunications",,3.671,"OPTICAL,PATHOLOGY,SURGICAL,MARGINS,FROZEN-SECTIONS,CANCER,RESECTION,TISSUE,GUIDANCE,SURGERY,WATER",IEEE ACCESS,https://ieeexplore.ieee.org/ielx7/6287639/8948470/09131705.pdf,
32,Enhanced Automated Diagnosis of Coronary Artery Disease Using Features Extracted From QT Interval Time Series and ST-T Waveform,8,,129510-129524,"Yao Lianke,Liu Changchun,Li Peng,Wang Jikuo,Liu Yuanyuan,Li Wang,Wang Xinpei,Li Han,Zhang Huan","Yao LK,Liu CC,Li P,Wang JK,Liu YY,Li W,Wang XP,Li H,Zhang H",Liu CC,10.1109/ACCESS.2020.3008965,Shandong University,"There is a growing interest in automated diagnosis of coronary artery disease (CAD) with the application of machine learning (ML) methods to the body surface electrocardiograph (ECG). Although prior studies have documented associations of CAD with increased QT variability and ST-T segment abnormalities such as T-wave inversion and ST-segment elevation or depression, their efficacy in automated CAD detection has not been fully investigated. To validate their usefulness, a dataset containing related clinical characteristics and 5-min single-lead ECGs of 107 healthy controls and 93 CAD patients was first constructed. Based on this dataset, simultaneous analyses were then conducted in five scenarios, in which different ML algorithms were applied to classify the two groups with various features derived from the RR and QT interval time-series and ST-T segment waveforms. Compared with utilizing features obtained from the RR interval time-series, better classification results were achieved utilizing that obtained from the QT interval time-series. The classification results were elevated with combining utilization of features derived from both the RR and QT interval time-series. By further fusing features extracted from ST-T segment waveforms, the best performance was achieved with 96.16% accuracy, 95.75% sensitivity, and 96.40% specificity. Based the best performance, an automated CAD detection system was developed with extreme gradient boosting, an ensemble ML algorithm, and the residual neural network, namely, a deep learning method. The results of this study support the potential of information derived from the QT interval time-series and ST-T segment waveforms in ECG-based automated CAD detection.","Coronary artery disease (CAD),QT interval variability (QTV),heart rate variability (HRV),ST-T waveform,signal decomposition",Article,"IEEE-INST ELECTRICAL ELECTRONICS ENGINEERS INC, 445 HOES LANE, PISCATAWAY, NJ 08855-4141 USA","Computer Science,Engineering,Telecommunications",,3.671,"SUDDEN,CARDIAC,DEATH,MYOCARDIAL-INFARCTION,SEGMENT,DEPRESSION,CARDIOVASCULAR-DISEASE,NONLINEAR,FEATURES,PROGNOSTIC,VALUE,CLINICAL-VALUE,HEART-DISEASE,VARIABILITY,ECG",IEEE ACCESS,https://ieeexplore.ieee.org/ielx7/6287639/8948470/09139514.pdf,
