,title,Volume,Issue,Pages,whole__author_name,simply_author_name,reprint author,DOI,reprint address,Abstract,Keywords,Document Type,Publisher,Research Domain,Published Date,impact_factor,Keywords_plus,joural,pdf_link,Download_SuccessOrDefeat
70,A Method of Dividing Clinical Data Set for Medical Image AI Training,11318,,,"Zheng Dezhong,Yang Yuanyuan,Li Wentao","Zheng DZ,Yang YY,Li WT",Yang YY,10.1117/12.2549552,Chinese Academy of Sciences,"In the AI training, the data set is always divided into training set and test set at random, but the clinical image data from hospitals is different from the public data set. The division of public data set is reasonably divided and evenly distributed after many experiments. Accurate understanding of the data distribution directly affects the training model quality. So we proposed a new method of dividing clinical data set based on distance metric learning of the Gaussian mixture model to obtain more reasonable data set divisions. The distance metric learning based on deep neural network, first embeds data into a new metric space, then in the metric space uses in-depth mining based on data characteristics, calculates the distance between samples, finally compares the differences. The method can accurately know the data distribution characteristics to a certain extent. Under the condition of understanding the data distribution characteristics, more reasonable divisions can be obtained. That can greatly affect the accuracy and generalization performance of the models we trained.","AI training,data set division,deep neural network,distance metric learning of the Gaussian mixture model",Proceedings Paper,"SPIE-INT SOC OPTICAL ENGINEERING, 1000 20TH ST, PO BOX 10, BELLINGHAM, WA 98227-0010 USA","Engineering,Optics,Radiology, Nuclear Medicine & Medical Imaging",,,,,,
71,Identification of early cancerous lesion of esophagus with endoscopic images by Convolutional Neural Network,11214,,,"Yang Tsung-Yu,Syu Hao-Yi,Wu I-Chen,Wang Hsiang-Chen","Yang TY,Syu HY,Wu IC,Wang HC",Yang TY,10.1117/12.2544889,National Chung Cheng University,"Esophageal cancer is less predictive than other diseases, and patients are usually diagnosed at an advanced stage, so effective treatment is usually too late. Therefore, this experiment proves that AI detects esophageal cancer. The diagnostic ability of the number of phases is expected to assist doctors in using endoscopy plus artificial intelligence to increase the accuracy of diagnosis of esophageal cancer.
This study provided 936 images of esophageal cancer endoscopy as a training image, including 498 white light endoscopes (WLI) and 438 narrow-band imaging endoscopes (NBI) images. According to the esophageal cancerization process, it is divided into four types: metaplasia (Dysplasia), metaplasia and esophageal cancer (Dysplasia-ECA), and esophageal cancer (ECA). A Single Shot Multibox Detector (SSD) was constructed by Convolutional Neural Network (CNN), and 264 test images were prepared to evaluate the accuracy of the model diagnosis.
We developed a system called DNN-CAD to identify neoplastic or hyperplastic colorectal polyps less than 5 mm. The system classified polyps with a PPV of 89.6%, and a NPV of 91.5%, and in a shorter time than endoscopists. This deep-learning model has potential for not only endoscopic image recognition but for other forms of medical image analysis, including sonography, computed tomography, and magnetic resonance images.
The construction of an SSD system for detecting esophageal cancer can analyze stored endoscopic images with high sensitivity in a short time, but more training can improve the accuracy of diagnosis. The system can facilitate early detection in practice and thus have a better diagnosis in the future.","Esophageal cancer,Narrow-band imaging (NBI),Convolutional Neural Network (CNN),Single Shot Multibox Detector (SSD),DNN-CAD",Proceedings Paper,"SPIE-INT SOC OPTICAL ENGINEERING, 1000 20TH ST, PO BOX 10, BELLINGHAM, WA 98227-0010 USA","Microscopy,Optics,Radiology, Nuclear Medicine & Medical Imaging",,,,,,
72,Machine Learning Applications in Polymer Composites,2205,,,"Hamidi Youssef K.,Berrado Abdelaziz,Altan M. Cengiz","Hamidi YK,Berrado A,Altan MC",Hamidi YK,10.1063/1.5142946,University of Houston System,"The primary interest in numerous research problems in both polymer composites and Machine Learning (ML) is to develop predictive models for one or more variables of interest using relevant independent variables, or inputs. However, these two fields have often adopted different approaches, where modeling of composite behavior is often based on physics-based models and phenomenological theories. These physical models are more precise and robust, but often suffer from restricted predictive capability since they are confined to a specific set of conditions. ML models, on the other hand, can be more efficient during the design phase as they allow managing massive and high dimensional data sets to extract the best lit or a predictive behavior for the application at hand.
In this context, material scientists would benefit from understanding and implementing some of the powerful ML methods, in order to predict or characterize a behavior of interest of a polymer composite. In this paper, we present a general methodology aimed at employing supervised machine learning models for predicting the properties of polymer composites, including thermo-mechanical properties, environmental effects such as moisture saturation level, durability, or other important behavior, based on the composite constituents, manufacturing processes, relevant process parameters, and expected life-span of the composite product.","Polymer Composites,Behavior Prediction,machine learning",Proceedings Paper,"AMER INST PHYSICS, 2 HUNTINGTON QUADRANGLE, STE 1NO1, MELVILLE, NY 11747-4501 USA",,,,"MECHANICAL-PROPERTIES,MOISTURE,ABSORPTION,ADHESION",,https://aip.scitation.org/doi/pdf/10.1063/1.5142946,
73,Utilizing a transfer model to classify epithelium and stroma on digital histopathological images for ovarian cancer patients,11241,,,"Chen Xuxin,Zhang Roy,Fung Kar-Ming,Liu Hong,Zheng Bin,Qiu Yuchen","Chen XX,Zhang R,Fung KM,Liu H,Zheng B,Qiu YC",Qiu YC,10.1117/12.2547512,University of Oklahoma System,"Automatic classification of epithelium and stroma regions on histopathological images is critically important in digital pathology. Although many studies have been conducted in this research area, few investigations have been focused on model generalizability between different types of tissue samples. The objective of this study is to initially verify the classification effectiveness of a sufficiently optimized transfer model. Accordingly, two datasets were assembled, which contain 157 breast cancer images (Dataset I) and 11 ovarian cancer images (Dataset II), respectively. A computer aided detection (CAD) scheme was developed for this classification task. The scheme first divided each image into small regions of interest (ROI) containing only epithelium or stroma tissues, using multi-resolution super-pixel algorithm. Then, a total of 26 quantitative features were computed for each ROI, which were used as the input of five different machine learning classifiers, namely, linear support vector machine (SVM), linear discriminant analysis (LDA), logistic regression, decision tree and k-nearest neighbors (KNN). The scheme was trained and optimized on Dataset I, and five-fold cross validation strategy was utilized for performance evaluation. After the scheme was sufficiently optimized on Dataset I, it was applied ""as is"" on dataset II. The results of the breast cancer dataset show that linear SVM achieved the highest classification accuracy of 0.910. When applied on the 11 ovarian cancer cases (Dataset II), the SVM model achieved an average classification accuracy of 0.744. This preliminary study initially demonstrates the model transfer performance for epithelium-stroma classification task.","Epithelium-stroma classification,transfer model,ovarian cancer,machine learning,digital pathology",Proceedings Paper,"SPIE-INT SOC OPTICAL ENGINEERING, 1000 20TH ST, PO BOX 10, BELLINGHAM, WA 98227-0010 USA","Plant Sciences,Oncology,Immunology,Medical Laboratory Technology,Optics",,,"CLASSIFICATION,RATIO",,,
74,A Perspective on Using Machine Learning in 3D Bioprinting,6,1,,"Yu Chunling,Jiang Jingchao","Yu CL,Jiang JC",Jiang JC,10.18063/ijb.v6i1.253,University of Auckland,"Recently, three-dimensional (3D) printing technologies have been widely applied in industry and our daily lives. The term 3D bioprinting has been coined to describe 3D printing at the biomedical level. Machine learning is currently becoming increasingly active and has been used to improve 3D printing processes, such as process optimization, dimensional accuracy analysis, manufacturing defect detection, and material property prediction. However, few studies have been found to use machine learning in 3D bioprinting processes. In this paper, related machine learning methods used in 3D printing are briefly reviewed and a perspective on how machine learning can also benefit 3D bioprinting is discussed. We believe that machine learning can significantly affect the future development of 3D bioprinting and hope this paper can inspire some ideas on how machine learning can be used to improve 3D bioprinting.","3D printing,Bioprinting,Machine learning",Article,"WHIOCE PUBLISHING PTE LTD, SINGAPORE, 7030 ANG MO KIO AVE 5, 04-15 NORTHSTAR AMK, SINGAPORE, 569880, SINGAPORE","Engineering,Materials Science",,6.633,"SUPPORT,STRUCTURES,OPTIMIZATION,TRENDS",INTERNATIONAL JOURNAL OF BIOPRINTING,https://doi.org/10.18063/ijb.v6i1.253,
75,Task Decomposition and Synchronization for Semantic Biomedical Image Segmentation,29,,7497-7510,"Ren Xuhua,Ahmad Sahar,Zhang Lichi,Xiang Lei,Nie Dong,Yang Fan,Wang Qian,Shen Dinggang","Ren XH,Ahmad S,Zhang LC,Xiang L,Nie D,Yang F,Wang Q,Shen DG",Wang Q,10.1109/TIP.2020.3003735,Shanghai Jiao Tong University,"Semantic segmentation is essentially important to biomedical image analysis. Many recent works mainly focus on integrating the Fully Convolutional Network (FCN) architecture with sophisticated convolution implementation and deep supervision. Such complex networks need large training datasets, a requirement which is challenging for medical image analysis. In this paper, we propose to decompose the single segmentation task into three subsequent sub-tasks, including (1) pixel-wise image semantic segmentation, (2) prediction of the instance class labels of the objects within the image, and (3) classification of the scene the image belonging to. While these three sub-tasks are trained to optimize their individual loss functions at different perceptual levels, we propose to allow their interaction within the task-task context ensemble. Moreover, we propose a novel sync-regularization to penalize the deviation between the outputs of the pixel-wise semantic segmentation and the instance class prediction tasks. These effective regularizations help FCN utilize context information comprehensively and attain accurate segmentation, even though the number of images for training may be limited in many biomedical applications. We have successfully applied our framework to three diverse 2D/3D medical image datasets, including Robotic Scene Segmentation Challenge 18 (ROBOT18), Brain Tumor Segmentation Challenge 18 (BRATS18), and Retinal Fundus Glaucoma Challenge (REFUGE18). We have achieved outperformed or comparable performance in all the three challenges. Our code, typical data and trained models are available at https://github.com/xuhuaren/TDSNet.","Semantic segmentation,fully convolutional network,task decomposition,sync-regularization,deep learning",Article,"IEEE-INST ELECTRICAL ELECTRONICS ENGINEERS INC, 445 HOES LANE, PISCATAWAY, NJ 08855-4141 USA","Computer Science,Engineering",,11.491,,IEEE TRANSACTIONS ON IMAGE PROCESSING,http://arxiv.org/pdf/1905.08720,
76,Triaxial Accelerometer-Based Falls and Activities of Daily Life Detection Using Machine Learning,20,13,,"Althobaiti Turke,Katsigiannis Stamos,Ramzan Naeem","Althobaiti T,Katsigiannis S,Ramzan N",Katsigiannis S,10.3390/s20133777,University of West Scotland,"The detection of activities of daily living (ADL) and the detection of falls is of utmost importance for addressing the issue of serious injuries and death as a consequence of elderly people falling. Wearable sensors can provide a viable solution for monitoring people in danger of falls with minimal external involvement from health or care home workers. In this work, we recorded accelerometer data from 35 healthy individuals performing various ADLs, as well as falls. Spatial and frequency domain features were extracted and used for the training of machine learning models with the aim of distinguishing between fall and no fall events, as well as between falls and other ADLs. Supervised classification experiments demonstrated the efficiency of the proposed approach, achieving an F1-score of 98.41% for distinguishing between fall and no fall events, and an F1-score of 88.11% for distinguishing between various ADLs, including falls. Furthermore, the created dataset, named ""ShimFall&ADL"" will be publicly released to facilitate further research on the field.","activities of daily living,fall detection,accelerometer,wearable sensors,machine learning",Article,"MDPI, ST ALBAN-ANLAGE 66, CH-4052 BASEL, SWITZERLAND","Chemistry,Engineering,Instruments & Instrumentation",,3.735,"ACTIVITY,RECOGNITION,PLATFORM,SYSTEM",SENSORS,https://www.ncbi.nlm.nih.gov/pmc/articles/PMC7378757,
77,Received Power Prediction for Suburban Environment based on Neural Network,,,35-39,"Wu Lina,He Danping,Guan Ke,Ai Bo,Briso-Rodriguez Cesar,Shui Tianyun,Liu Chenji,Zhu Liju,Shen Xiaopeng","Wu LN,He DP,Guan K,Ai B,Briso-Rodriguez C,Shui TY,Liu CJ,Zhu LJ,Shen XP",Ai B,,Beijing Jiaotong University,"Accurate received power prediction is important to wireless network planning and optimization, and appropriate channel modeling approach is highly demanded. The existing channel modeling approaches mainly include deterministic models and stochastic models. The deterministic models usually require detailed three-dimensional (3D) environment model including geometry and material information. The stochastic models are based on mathematical expressions which are difficult in describing complex environments. For mountaineous and suburban scenarios, where the environment is complex and difficult to reconstructed, both channel modeling approaches are limited. In this work, back propagation (BP) neural network which is the most widely used artificial neural network (ANN), is employed to accurately predict received power in the suburban scenario. An environmental feature is defined, which can describe the propagation environment only by using limited environmental types instead of complex 3D environment reconstruction. Furthermore, the low-dimensional environmental feature is generated by principal component analysis (PCA). From the measurements, the information of base station (BS) and the receiver (Rx), including 3D locations, frequency, transmitted power, angle information of antenna, and the received power of all the locations are obtained. The information of BS and Rx is combined with environmental features to form datasets for ANN training and testing. The training samples are randomly selected with different percentage from the formed datasets. The mean error, standard deviation and the prediction accuracy of BP networks are explored in the work, which will help researchers to carry out network planning and communication system design.","artificial neural network,environmental feature,principal component analysis,received power prediction",Proceedings Paper,"IEEE, 345 E 47TH ST, NEW YORK, NY 10017 USA",Computer Science,,,,2020 34TH INTERNATIONAL CONFERENCE ON INFORMATION NETWORKING (ICOIN 2020),,
78,Cost-Sensitive Feature Selection using Particle Swarm Optimization: A Post-Processing Approach,,,97-101,"Ali Syed Imran,Khan Wajahat Ali,Lee Sungyoung,Lee Sang-Ho","Ali SI,Khan WA,Lee S,Lee SH",Ali SI,,Kyung Hee University,"Feature selection is one of the important tasks in machine learning. Feature selection task deals with selecting a subset of feature from an original feature set. An important consideration in feature selection is the usefulness of a feature i.e. a set of feature which is selected is neither irrelevant nor redundant. Most of the existing algorithms in the domain of feature selection are designed to optimize the aforementioned objective. In our research we have addressed a third dimension of usefulness i.e. cost of the feature. Cost-effectives of a solution is most apt in cases where there is an asymmetric cost of data acquisition such as medical diagnosis applications. In this regard, our research deals with enhancing the existing feature selection techniques with a post-processing stage in which cost consideration is also accounted for. The resultant solution is optimized for both important as well as cost-effective features. We have used particle swarm optimization with post processing over chronic kidney disease dataset for generating a feature subset set which is both salient and cost-effective.","Cost-sensitive Feature Selection,Particle Swarm Optimization,Post Processing,Data Classification",Proceedings Paper,"IEEE, 345 E 47TH ST, NEW YORK, NY 10017 USA",Computer Science,,,,2020 34TH INTERNATIONAL CONFERENCE ON INFORMATION NETWORKING (ICOIN 2020),,
79,Evaluation of Feature Engineering on Wearable Sensor-based Fall Detection,,,110-114,"Ramachandran Anita,Ramesh Adarsh,Karuppiah Anupama","Ramachandran A,Ramesh A,Karuppiah A",Ramachandran A,,Birla Institute of Technology & Science Pilani (BITS Pilani),"Internet of Things (IoT) enabled geriatric healthcare systems have gained importance in the recent years due to an increase in the number of elderly people living alone. The application of machine learning (ML) in areas of geriatric healthcare such as fall detection, has, consequently been an area of active research. Wearable systems for fall detection has the advantage of being light-weight and low power-consuming, yet reasonably accurate without being overly intrusive. However, the accuracy of fall detection using wearable systems depends, among other factors, on the types of sensors embedded in them. The use of inertial motion unit (IMU) sensors for fall detection, combined with machine learning classifiers applied on datasets collected from IMU sensors is an area of active research. In this paper, we analyze the impact of using IMU sensor parameters in combination with vital signs parameters, on the performance of ML algorithms for fall detection. We compare the performance of various ML algorithms on the dataset we collected for this purpose. We also perform statistical analysis to examine the relative importance of the various features on the behavior of ML classifiers.","Fall detection,machine learning,wearable systems",Proceedings Paper,"IEEE, 345 E 47TH ST, NEW YORK, NY 10017 USA",Computer Science,,,,2020 34TH INTERNATIONAL CONFERENCE ON INFORMATION NETWORKING (ICOIN 2020),,
80,Fundamental band gap and alignment of two-dimensional semiconductors explored by machine learning,29,4,,",,,,",",,,,",,,Zhu Zhen,"Two-dimensional (2D) semiconductors isoelectronic to phosphorene have been drawing much attention recently due to their promising applications for next-generation (opt)electronics. This family of 2D materials contains more than 400 members, including (a) elemental group-V materials, (b) binary III-VII and IV-VI compounds, (c) ternary III-VI-VII and IV-V-VII compounds, making materials design with targeted functionality unprecedentedly rich and extremely challenging. To shed light on rational functionality design with this family of materials, we systemically explore their fundamental band gaps and alignments using hybrid density functional theory (DFT) in combination with machine learning. First, calculations are performed using both the Perdew-Burke-Ernzerhof exchange-correlation functional within the generalgradient- density approximation (GGA-PBE) and Heyd-Scuseria-Ernzerhof hybrid functional (HSE) as a reference. We find this family of materials share similar crystalline structures, but possess largely distributed band-gap values ranging approximately from 0 eV to 8 eV. Then, we apply machine learning methods, including linear regression (LR), random forest regression (RFR), and support vector machine regression (SVR), to build models for the prediction of electronic properties. Among these models, SVR is found to have the best performance, yielding the root mean square error (RMSE) less than 0.15 eV for the predicted band gaps, valence-band maximums (VBMs), and conduction-band minimums (CBMs) when both PBE results and elemental information are used as features. Thus, we demonstrate that the machine learning models are universally suitable for screening 2D isoelectronic systems with targeted functionality, and especially valuable for the design of alloys and heterogeneous systems.","two-dimensional semiconductors; ,machine learning",Article,,,,,,,,
81,OFF-eNET: An Optimally Fused Fully End-to-End Network for Automatic Dense Volumetric 3D Intracranial Blood Vessels Segmentation,29,,7192-7202,"Nazir Anam,Cheema Muhammad Nadeem,Sheng Bin,Li Huating,Li Ping,Yang Po,Jung Younhyun,Qin Jing,Kim Jinman,Feng David Dagan","Nazir A,Cheema MN,Sheng B,Li HT,Li P,Yang P,Jung YY,Qin J,Kim JM,Feng DD",Sheng B,10.1109/TIP.2020.2999854,Shanghai Jiao Tong University,"Intracranial blood vessels segmentation from computed tomography angiography (CTA) volumes is a promising biomarker for diagnosis and therapeutic treatment in cerebrovascular diseases. These segmentation outputs are a fundamental requirement in the development of automated decision support systems for preoperative assessment or intraoperative guidance in neuropathology. The state-of-the-art in medical image segmentation methods are reliant on deep learning architectures based on convolutional neural networks. However, despite their popularity, there is a research gap in the current deep learning architectures optimized to address the technical challenges in blood vessel segmentation. These challenges include: (i) the extraction of concrete brain vessels close to the skull; and (ii) the precise marking of the vessel locations. We propose an Optimally Fused Fully end-to-end Network (OFF-eNET) for automatic segmentation of the volumetric 3D intracranial vascular structures. OFF-eNET comprises of three modules. In the first module, we exploit the up-skip connections to enhance information flow, and dilated convolution for detailed preservation of spatial feature map that are designed for thin blood vessels. In the second module, we employ residual mapping along with inception module for speedy network convergence and richer visual representation. For the third module, we make use of the transferred knowledge in the form of cascaded training strategy to gradually optimize the three segmentation stages (basic, complete, and enhanced) to segment thin vessels located close to the skull. All these modules are designed to be computationally efficient. Our OFF-eNET, evaluated using 70 CTA image volumes, resulted in 90.75% performance in the segmentation of intracranial blood vessels and outperformed the state-of-the-art counterparts.","Image segmentation,Three-dimensional displays,Biomedical imaging,Convolution,Blood vessels,Computer architecture,Feature extraction,Convolution neural network,computed tomography angiography,dilated convolution,inception module,up-skip connection,intracranial vessels segmentation",Article,"IEEE-INST ELECTRICAL ELECTRONICS ENGINEERS INC, 445 HOES LANE, PISCATAWAY, NJ 08855-4141 USA","Computer Science,Engineering",,11.491,,IEEE TRANSACTIONS ON IMAGE PROCESSING,https://eprints.whiterose.ac.uk/161477/1/FINAL%20%281%29.pdf,
82,Automated Gleason grading of prostate cancers via deep learning in label-free multiphoton microscopic images,11244,,,"Cai Jianyong,Yang Qinqin,Xu Zhexin,Chen Hong,Zhu Xiaoqin","Cai JY,Yang QQ,Xu ZX,Chen H,Zhu XQ",Zhu XQ,10.1117/12.2545881,Fujian Normal University,"In the current clinical care, Gleason grading system based on the architectural pattern of cancerous epithelium in histological images is the most powerful prognostic predictor for prostate cancers (PCa). However, the standard procedure of histological examination often includes complicated tissue fixation and staining, which are time-consuming and may delay the diagnosis and surgery. In this study, the unstained prostate tissues were investigated with multi-photon microscopy (MPM) to produce subcellular-resolution images. And then, a deep learning network (AlexNet) was introduced for automated Gleason grading. We achieved an average accuracy of Gleason grading of 78.1%+/- 3.4% for classification. And the area under the curve (AUC) in test set achieves 0.943 which indicates that the proposed model is effective in Gleason grading. At the end, the heat map was performed to visualize the Gleason score of tumour. Our results suggested that MPM, combined with deep learning method, holds the potential to be used as a real-time clinical diagnostic tool for PCa diagnosis.","Multiphoton microscopy,prostate cancer,Gleason grading,Gleason score,deep learning",Proceedings Paper,"SPIE-INT SOC OPTICAL ENGINEERING, 1000 20TH ST, PO BOX 10, BELLINGHAM, WA 98227-0010 USA","Engineering,Microscopy,Optics",,,"CONVOLUTIONAL,NEURAL-NETWORKS,HISTOPATHOLOGY,INTEROBSERVER,STAIN",,,
