,title,Volume,Issue,Pages,whole__author_name,simply_author_name,reprint author,DOI,reprint address,Abstract,Keywords,Document Type,Publisher,Research Domain,Published Date,impact_factor,Keywords_plus,joural,pdf_link,Download_SuccessOrDefeat
45,Evaluating the Implementation of Deep Learning in LibreHealth Radiology on Chest X-Rays,943,,648-657,"Purkayastha Saptarshi,Buddi Surendra Babu,Nuthakki Siddhartha,Yadav Bhawana,Gichoya Judy W.","Purkayastha S,Buddi SB,Nuthakki S,Yadav B,Gichoya JW",Purkayastha S,10.1007/978-3-030-17795-9_47,Indiana University System,"Respiratory diseases are the dominant cause of deaths worldwide. In the US, the number of deaths due to chronic lung infections (mostly pneumonia and tuberculosis), lung cancer and chronic obstructive pulmonary disease has increased. Timely and accurate diagnosis of the disease is highly imperative to diminish the deaths. Chest X-ray is a vital diagnostic tool used for diagnosing lung diseases. Delay in X-Ray diagnosis is run-of-the-mill milieu and the reasons for the impediment are mostly because the X-ray reports are arduous to interpret, due to the complex visual contents of radiographs containing superimposed anatomical structures. A shortage of trained radiologists is another cause of increased workload and thus delay. We integrated CheXNet, a neural network algorithm into the LibreHealth Radiology Information System, which allows physicians to upload Chest X-rays and identify diagnosis probabilities. The uploaded images are evaluated from labels for 14 thoracic diseases. The turnaround time for each evaluation is about 30 s, which does not affect clinical workflow. A Python Flask application hosted web service is used to upload radiographs into a GPU server containing the algorithm. Thus, the use of this system is not limited to clients having their GPU server, but instead, we provide a web service. To evaluate the model, we randomly split the dataset into training (70%), validation (10%) and test (20%) sets. With over 86% accuracy and turnaround time under 30 s, the application demonstrates the feasibility of a web service for machine learning based diagnosis of 14-lung pathologies from Chest X-rays.","Deep learning,Radiology,LibreHealth,Chest X-ray,CheXNet",Proceedings Paper,"SPRINGER INTERNATIONAL PUBLISHING AG, GEWERBESTRASSE 11, CHAM, CH-6330, SWITZERLAND","Computer Science,Engineering",,,,,https://scholarworks.iupui.edu/bitstream/1805/18297/1/paper_258.pdf,
46,The Effectiveness of Distinctive Information for Cancer Cell Analysis Through Big Data,944,,57-68,"Baniya Babu Kaji,Gnimpieba Etienne Z.","Baniya BK,Gnimpieba EZ",Baniya BK,10.1007/978-3-030-17798-0_7,University of Louisiana System,"In the healthcare system, a huge volume of multi-structured patient data is generated from in-hospital clinical examinations, wearable body sensors, and doctor memos. These data play a deterministic role in finding the patient's cause of disease and corresponding cure. However, there are many challenges underlying healthcare system such as integration of different data format, appropriate selection of healthcare parameters and disease prediction. Besides these, concern whether this data is equally significant for decision making or not exists. To address these problems, we introduced the infinite latent feature selection (ILFS) to find highly informative gene from a gene pool and feed it to the classifier. We adopted a hybrid approach for gene classification. The hybrid scheme integrated two (sophisticated) algorithms: speed advantage of extreme learning machine (ELM) and accuracy advantage of sparse representation classifier (SRC). We validated our proposed model with 198 tumor samples of global cancer map (GCM) dataset and divided them into 14 common tumor categories having 11,370 expression level of genes. The performance of this system was measured using five different matrices (i.e., accuracy, sensitivity, specificity, precision, and F-score). This achieved a notable improvement of accuracies in both scenarios in selective (considering only highly expressive genes) and original genes (74.75% and 81.82% respectively).","Precision,Recall,Sensitivity,Predication,Multi-structure",Proceedings Paper,"SPRINGER INTERNATIONAL PUBLISHING AG, GEWERBESTRASSE 11, CHAM, CH-6330, SWITZERLAND","Computer Science,Engineering",,,HEALTH-CARE,,,
47,Gait Monitoring System for Stroke Prediction of Aging Adults,973,,93-97,"Park Hongkyu,Hong Seunghee,Hussain Iqram,Kim Damee,Seo Young,Park Se Jin","Park H,Hong S,Hussain I,Kim D,Seo Y,Park SJ",Park SJ,10.1007/978-3-030-20476-1_11,Korea Research Institute of Standards & Science (KRISS),"Health has become a major concern nowadays. People pass significant amount of time of daily life on walking, moving here and there and so on. Some health complexity happens during walking like heart problem, stroke etc. Stroke patient has unbalanced gait pattern compared to normal person. The Internet of Things (IoT) plays an important role in the development of connected people, which offers cloud connectivity, smartphone integration, safety, security, and healthcare services. Insole Foot Pressure sensor and accelerometer will be attached to the foot for gait speed, foot pressure and other gait pattern. Gait parameters of 68 Stroke patients and 208 Elderly healthy persons have been gathered in Chungnam National University Hospital Rehabilitation Center, Daejeon, South Korea. Gait parameters are foot pressure, gait acceleration etc. Dynafoot2 Insole sensor used for data acquisition. Subjects walked and perform activities like walking, sitting, standing, doing some regular activities during gait data acquisition. Area under curve (AUC) of performance curve for C4.5, SVM, Random Tree, Logistic Regression, LSVM, CART algorithms are 0.98, 0.976, 0.935, 0.909 and 0.906, 0.87 respectively. A gait monitoring system has been proposed for stroke onset prediction for stroke patient. IoT sensors are used to gather gait data and machine learning algorithms are used to classify gait pattern of stroke patient group and normal healthy group. In future, sensors such as EEG, EMG will be used to improve system reliability.","Stroke,Gait,Health monitoring,Classification algorithms",Proceedings Paper,"SPRINGER INTERNATIONAL PUBLISHING AG, GEWERBESTRASSE 11, CHAM, CH-6330, SWITZERLAND",Computer Science,,,,,,
48,Data-driven Computational Mechanics:a Review,41,1,1-14,",,,,,","Jie Yang,Rui Xu,Qun Huang,Qian Shao,Wei Huang,Heng Hu",,,Jie Yang,"The concept of big data with digital twin and artificial intelligence is profoundly influencing the fourth industrial revolution.At the same time,facing severe challenges in advanced manufacturing and safety assessment of high-performance materials and structures,classical computational mechanics has more and more limitations in achieving the goal ofhalf-time and half-costof R&D cycle.Data-driven computational mechanics emerged in this context and showed great vitality.This paper aims to discuss and analyze the trend of data-driven computational mechanics by reviewing recent research achievements.In this paper,the algorithms in the framework of data-driven computational mechanics are summarized into two categories:the first one is based on energy functional,the key point of which is to construct the constitutive relationship by using material data;while the second category is based on distance functional,the specificity of which lies in directly embedding the material data into mechanical simulations.Several related data-driven algorithms of each category are briefly recalled,and the challenges and prospects of data-driven computational mechanics are discussed.","data-driven; computational mechanics; database; ,machine learning,material, genome; structural genome",Review,,,,,,,,
49,Real-Time Quality Assessment of Pediatric MRI via Semi-Supervised Deep Nonlocal Residual Neural Networks,29,,7697-7706,"Liu Siyuan,Thung Kim-Han,Lin Weili,Yap Pew-Thian,Shen Dinggang","Liu SY,Thung KH,Lin WL,Yap PT,Shen DG",Yap PT; Shen DG,10.1109/TIP.2020.2992079,University of North Carolina,"In this paper, we introduce an image quality assessment (IQA) method for pediatric T1- and T2-weighted MR images. IQA is first performed slice-wise using a nonlocal residual neural network (NR-Net) and then volume-wise by agglomerating the slice QA results using random forest. Our method requires only a small amount of quality-annotated images for training and is designed to be robust to annotation noise that might occur due to rater errors and the inevitable mix of good and bad slices in an image volume. Using a small set of quality-assessed images, we pre-train NR-Net to annotate each image slice with an initial quality rating (i.e., pass, questionable, fail), which we then refine by semi-supervised learning and iterative self-training. Experimental results demonstrate that our method, trained using only samples of modest size, exhibit great generalizability, capable of real-time (milliseconds per volume) large-scale IQA with near-perfect accuracy.","Training,Semisupervised learning,Standards,Quality assessment,Annotations,Deep learning,Kernel,Image quality assessment,nonlocal residual networks,semi-supervised learning,self-training",Article,"IEEE-INST ELECTRICAL ELECTRONICS ENGINEERS INC, 445 HOES LANE, PISCATAWAY, NJ 08855-4141 USA","Computer Science,Engineering",,11.491,"CLASSIFICATION,ARTIFACTS,NOISE",IEEE TRANSACTIONS ON IMAGE PROCESSING,http://arxiv.org/pdf/1904.03639,
50,Stability of the Deep Neural Networks Learning Process in the Recognition Problems of the Material Microstructure,78,,307-313,"Klyuev A. V,Stolbov V. Yu,Gitman M. B.,Klestov R. A.","Klyuev AV,Stolbov VY,Gitman MB,Klestov RA",Klestov RA,10.1007/978-3-030-22493-6_27,Perm National Research Polytechnic University,"The paper investigates the algorithmic stability of learning a deep neural network in problems of recognition of the materials microstructure. It is shown that at 8% of quantitative deviation in the basic test set the algorithm trained network loses stability. This means that with such a quantitative or qualitative deviation in the training or test sets, the results obtained with such trained network can hardly be trusted.
Although the results of this study are applicable to the particular case, i.e. problems of recognition of the microstructure using ResNet-152, the authors propose a cheaper method for studying stability based on the analysis of the test, rather than the training set.","Deep neural networks,Image recognition,Deep learning,Algorithmic stability",Proceedings Paper,"SPRINGER INTERNATIONAL PUBLISHING AG, GEWERBESTRASSE 11, CHAM, CH-6330, SWITZERLAND",Computer Science,,,"STRENGTH,PROPERTIES",,,
51,Skin Cancer Segmentation and Classification with Improved Deep Convolutional Neural Network,11318,,,"Alom Md Zahangir,Aspiras Theus,Taha Tarek M.,Asari Vijayan K.","Alom MZ,Aspiras T,Taha TM,Asari VK",Alom MZ,10.1117/12.2550146,University of Dayton,"In the last few years, Deep Learning (DL) has been showing superior performance in different modalities of bio-medical image analysis. Several DL architectures have been proposed for classification, segmentation, and detection tasks in medical imaging and computational pathology. In this paper, we propose a new DL architecture, the NABLA-N network (del(N)-Net), with better feature fusion techniques in decoding units for dermoscopic image segmentation tasks. The del(N)-Net has several advances for segmentation tasks. First, this model ensures better feature representation for semantic segmentation with a combination of low to high-level feature maps. Second, this network shows better quantitative and qualitative results with the same or fewer network parameters compared to other methods. In addition, the Inception Recurrent Residual Convolutional Neural Network (IRRCNN) model is used for skin cancer classification. The proposed del(N)-Net network and IRRCNN models are evaluated for skin cancer segmentation and classification on the benchmark datasets from the International Skin Imaging Collaboration 2018 (ISIC-2018). The experimental results show superior performance on segmentation tasks compared to the Recurrent Residual U-Net (R2U-Net). The classification model shows around 87% testing accuracy for dermoscopic skin cancer classification on ISIC2018 dataset.","Skin Cancer Segmentation,Deep Learning,R2U-Net,NABLA-N Net,IRRCNN,Medical Imaging",Proceedings Paper,"SPIE-INT SOC OPTICAL ENGINEERING, 1000 20TH ST, PO BOX 10, BELLINGHAM, WA 98227-0010 USA","Engineering,Optics,Radiology, Nuclear Medicine & Medical Imaging",,,,,,
52,Imaging Epigenetics Study of Schizophrenia with Structure-enforced Collaborative Regression,11318,,,"Bai Yuntong,Lian Isabelle,Zhang Xiao,Liu Anqi,Calhoun Vince D.,Wang Yu-Ping","Bai YT,Lian I,Zhang X,Liu AQ,Calhoun C,Wang YP",Wang YP,10.1117/12.2549651,Tulane University,"In the study of complex mental disorders like schizophrenia (SZ), while imaging genetics has achieved great success, imaging epigenetics is attracting increasing attention as it considers the impact of environmental factors on gene expression and resulting phenotypic changes. In this study, we aimed to fill the gap by jointly analyzing imaging and epigenetics data to study SZ. More specifically, we proposed a novel structure-enforced collaborative regression model (SCoRe) to extract co-expressed discriminative features related to SZ from fMRI and DNA methylation data. SCoRe can utilize phenotypical information while enforce an agreement between multiple data views. Moreover, it also considers the group structure within each view of data. The brain network based on fMRI data can be divided into 116 regions of interests (ROIs) based on anatomical structures of the brain and the DNA methylation data can be grouped based on pathway information, which are used as prior knowledge to be incorporated into the learning model. After validation through simulation test, we applied the model to SZ study with data collected by MIND Clinical Imaging Consortium (MCIC). Through integrating fMRI and DNA methylation data of 184 participants (104 SZ and 80 healthy subjects), we succeeded in identifying 8 important brain regions and 3 genes associated with SZ. This study can shed light on the understanding of SZ from both brain imaging and epigenomics, complementary to imaging genomics.","Multi-view learning,imaging epigenetics,fMRI,DNA methylation,schizophrenia,correlative analysis",Proceedings Paper,"SPIE-INT SOC OPTICAL ENGINEERING, 1000 20TH ST, PO BOX 10, BELLINGHAM, WA 98227-0010 USA","Engineering,Optics,Radiology, Nuclear Medicine & Medical Imaging",,,"DOPAMINE,RECEPTOR,EXPRESSION,SELECTION,GENES,GYRUS",,,
53,Preprocessing of clinical neuro-oncology MRI studies for big data applications,11318,,,"Chakrabarty Satrajit,LaMontagne Pamela,Marcus Daniel S.,Milchenko Mikhail","Chakrabarty S,LaMontagne P,Marcus DS,Milchenko M",Chakrabarty S,10.1117/12.2548371,Washington University (WUSTL),"Clinically acquired, multimodal and multi-site MRI datasets are widely used for neuro-oncology research. However, manual preprocessing of such data is extremely tedious and error prone due to high intrinsic heterogeneity. Automatic standardization of such datasets is therefore important for data-hungry applications like deep learning. Despite rapid advances in MRI data acquisition and processing algorithms, only limited effort was dedicated to automatic methodologies for standardization of such data.
To address this challenge, we augment our previously developed Multimodal Glioma Analysis (MGA) pipeline with automation tools to achieve processing scale suitable for big data applications. This new pipeline implements a natural language processing (NLP) based scan-type classifier, with features constructed from DICOM metadata based on bag-of-words model. The classifier automatically assigns one of 18 pre-defined scan types to all scans in MRI study.
Using the described data model, we trained three types of classifiers: logistic regression, linear SVM, and multi-layer artificial neural network (ANN) on the same dataset Their performance was validated on four datasets from multiple sources. ANN implementation achieved the highest performance, yielding an average classification accuracy of over 99%. We also built a Jupyter notebook based graphical user interface (GUI) which is used to run MGA in semi-automatic mode for progress tracking purposes and quality control to ensure reproducibility of the analyses based thereof. MGA has been implemented as a Docker container image to ensure portability and easy deployment. The application can run in a single or batch study mode, using either local DICOM data or XNAT cloud storage.","Clinical MRI,Neuro-oncology imaging,Translational research,Natural Language Processing,MRI scan classifier,Docker,Jupyter Notebook",Proceedings Paper,"SPIE-INT SOC OPTICAL ENGINEERING, 1000 20TH ST, PO BOX 10, BELLINGHAM, WA 98227-0010 USA","Engineering,Optics,Radiology, Nuclear Medicine & Medical Imaging",,,,,,
54,Exploiting biomedical literature to mine out a large multimodal dataset of rare cancer studies,11318,,,"Dhrangadhariya Anjani,Jimenez-del-Toro Oscar,Andrearczyk Vincent,Atzori Manfredo,Mueller Henning","Dhrangadhariya A,Jimenez-del-Toro O,Andrearczyk V,Atzori M,Muller H",Dhrangadhariya A,10.1117/12.2549565,University of Applied Sciences & Arts Western Switzerland,"The overall lower survival rate of patients with rare cancers can be explained, among other factors, by the limitations resulting from the scarce available information about them. Large biomedical data repositories, such as PubMed Central Open Access (PMC-OA), have been made freely available to the scientific community and could be exploited to advance the clinical assessment of these diseases. A multimodal approach using visual deep learning and natural language processing methods was developed to mine out 15,028 light microscopy human rare cancer images. The resulting data set is expected to foster the development of novel clinical research in this field and help researchers to build resources for machine learning.","PubMed Central,rare cancer,multimodal classification,natural language processing",Proceedings Paper,"SPIE-INT SOC OPTICAL ENGINEERING, 1000 20TH ST, PO BOX 10, BELLINGHAM, WA 98227-0010 USA","Engineering,Optics,Radiology, Nuclear Medicine & Medical Imaging",,,,,,
55,Breast Cancer Classification from Digital Breast Tomosynthesis Using a 3D Multi-Subvolume Approach,11318,,,"Doganay Emine,Li Puchen,Luo Yahong,Chai Ruimei,Guo Yuan,Wu Shandong","Doganay E,Li PC,Luo YH,Chai RM,Guo Y,Wu SD",Wu SD,10.1117/12.2551376,Pennsylvania Commonwealth System of Higher Education (PCSHE),"Digital mammography (DM) was the most common image guided diagnostic tool in breast cancer detection up till recent years. However, digital breast tomosynthesis (DBT) imaging, which presents more accurate results than DM, is going to replace DM in clinical practice. As in many medical image processing applications, Artificial Intelligence (AI) has been shown promising in reducing radiologists reading time with enhanced cancer diagnostic accuracy. In this paper, we implemented a 3D network using deep learning algorithms to detect breast cancer malignancy using DBT craniocaudal (CC) view images. We created a multi-sub-volume approach, in which the most representative slice (MRS) for malignancy scans is manually selected/defined by expert radiologists. We specifically compared the effects on different selections of the MRS by two radiologists and the resulting model performance variations. The results indicate that our scheme is relatively robust for all three experiments.","breast cancer,digital breast tomosynthesis,3D deep learning,weakly supervised classification",Proceedings Paper,"SPIE-INT SOC OPTICAL ENGINEERING, 1000 20TH ST, PO BOX 10, BELLINGHAM, WA 98227-0010 USA","Engineering,Optics,Radiology, Nuclear Medicine & Medical Imaging",,,,,,
56,Impact of data augmentation techniques on a deep learning based medical imaging task,11318,,,"Dutta Sandeep,Prakash Prakhar,Matthews Christopher G.","Dutta S,Prakash P,Matthews CG",Dutta S,10.1117/12.2549806,General Electric,"For any deep learning (DL) based task, model generalization and prediction performance improve as a function of training data set size and variety. However, its application to medical imaging is still challenging because of the limited availability of high-quality and sufficiently diverse annotated data. Data augmentation techniques can improve the model performance when the available dataset size is limited. Anatomy region localization from medical images can be automated with deep learning and is important for tasks such as organ segmentation and lesion detection. Different data augmentation methods were compared for DL based anatomy region localization with computed tomography images. The impact of different neural network architectures was also explored. The prediction accuracy on an independent test set improved from 88% to 97% with optimal selection of data augmentation and architecture while using the same training dataset Data augmentation steps such as zoom, translation and flips had incremental effect on classifier performance whereas sample-wise mean shift appeared to degrade the classifier performance. Global average pooling improved classifier accuracy compared to fully-connected layer when limited data augmentation was used. All model architectures converged to an optimal performance with the right combination of augmentation steps. Prediction inaccuracies were mostly observed in the boundary regions between anatomies. The networks also successfully localized anatomy for Positron Emission Tomography studies reaching an accuracy of up to 97%. Similar impact of data augmentation and pooling layer was also observed.","medical imaging,convolutional neural networks,data augmentation,global average pooling,batch normalization,dropout,deep learning,classification",Proceedings Paper,"SPIE-INT SOC OPTICAL ENGINEERING, 1000 20TH ST, PO BOX 10, BELLINGHAM, WA 98227-0010 USA","Engineering,Optics,Radiology, Nuclear Medicine & Medical Imaging",,,ARTIFICIAL-INTELLIGENCE,,,
57,SNIPR: Stroke Neuroimaging Phenotype Repository,11318,,,"Foroushani Hossein Mohammadian,Dhar Rajat,Chen Yasheng,Gurney Jenny,Hamzehloo Ali,Lee Jin-Moo,Marcus Daniel S.","Foroushani HM,Dhar R,Chen YS,Gurney J,Hamzehloo A,Lee JM,Marcus DS",Foroushani HM,10.1117/12.2549622,Washington University (WUSTL),"Gaining a deeper understanding of stroke pathophysiology is critical for discovery and evaluation of emerging stroke treatments. However, such discovery requires deeper phenotyping of stroke and its complications, a Big Data model for integration of demographic, clinical, genetic and imaging phenotypes with sophisticated processing pipelines at massive scale. The Stroke Neuroimaging Phenotype Repository (SNIPR) is a large multi-center centralized imaging repository of clinical CT and MRI scans from stroke patients worldwide, based on open source Extensible Neuroimaging Archive Toolkit (XNAT) imaging informatics platform. The aims of this repository are to: (i) Create a central repository to host and provide secure access to data from anonymized acute stroke patients with serial imaging; (ii) Facilitate extraction and analysis of multiple stroke phenotypes via image processing and data aggregation techniques; and (iii) Expedite the development of containerized pipelines to perform large-scale analysis of complications after stroke. Currently, SNIPR hosts 8 projects, 2245 subjects, and 6148 imaging exams from Washington University Medical Center's clinical image archive as well as contributions from collaborators in different countries, including US, Finland, Poland, and Spain. Moreover, we have used XNAT's standard XML Schema extension mechanism to create data type extensions to support stroke studies, including clinical phenotypes such as NIHSS and imaging phenotypes such as infarct and cerebrospinal fluid (CSF) volume and extent of midline shift or hemorrhagic transformation. We have developed containerized pipelines to facilitate image processing and analysis and deployed these pipelines through XNAT's container service. The container service enables these pipelines to execute at large scale with Docker Swarm on an attached compute cluster. Our pipelines include a scan-type classifier which uses a convolutional neural network (CNN) approach and natural language processing to automatically categorize uploaded CT sequences into defined classes to facilitate selection of appropriate sequences for further analyses. This containerized classifier was deployed within a broader pipeline to facilitate big data analysis of cerebral edema after stroke and produced 99.4 % test accuracy on 10000 scans. SNIPR enables automated pipelines to use this automatic scan selection to derive imaging phenotypes and couple them with clinical and genetic data with the overarching aim of enabling a broad understanding of stroke progression and pathophysiology.","Containerized pipeline,convolutional neural network (CNN),big data,informatics,phenotype repository,stroke neuroimaging,XNAT",Proceedings Paper,"SPIE-INT SOC OPTICAL ENGINEERING, 1000 20TH ST, PO BOX 10, BELLINGHAM, WA 98227-0010 USA","Engineering,Optics,Radiology, Nuclear Medicine & Medical Imaging",,,PREVENT,,,
