,title,Volume,Issue,Pages,whole__author_name,simply_author_name,reprint author,DOI,reprint address,Abstract,Keywords,Document Type,Publisher,Research Domain,Published Date,impact_factor,Keywords_plus,joural,pdf_link,Download_SuccessOrDefeat
43,Rail Weld Defect Prediction and Related Condition-Based Maintenance,8,,103746-103758,"Yao Nan,Jia Yuejun,Tao Kai","Yao N,Jia YJ,Tao K",Yao N,10.1109/ACCESS.2020.2999385,"China Acad Railway Sci Corp Ltd, Beijing 100081, Peoples R China.","Rail weld defects are major threats to railroad transportation. Enormous resources have been required for related maintenance. This paper presents a creative solution to predict weld defects and to classify railroads into different conditions based on the predictions. The results are based on features extracted from manufacturing technologies of welds, from related materials and from influential factors in the environments. Features such as marks for welding engineers are defined. Maintenance can be selectively implemented based on the predicted conditions. Safety is the foundation of the railroad business, and a very strict safety requirement is utilized as one of the main constraints in this research. Additionally, 11 key risk factors leading to rail defects and their risk levels are identified. Extreme learning machine (ELM), random forest, logistic regression, principal component analysis (PCA), support vector machine (SVM) and other data science approaches are utilized. The evaluation results show that the related rail maintenance workload can decrease significantly under high safety standards. Labor costs of weld inspection will be reduced substantially because of the decreased workload for the sections predicted to not have any defects with a 100% recall rateyyy (approximately 30% of the total sections), contributing to a massive cost reduction. Consequently, rail companies are expected to achieve enhanced management and operation.","Condition-based maintenance,extreme learning machine,logistic regression,rail weld defect prediction,random forests,support vector machine",Article,"IEEE-INST ELECTRICAL ELECTRONICS ENGINEERS INC, 445 HOES LANE, PISCATAWAY, NJ 08855-4141 USA","Computer Science,Engineering,Telecommunications",,3.671,"EXTREME,LEARNING-MACHINE,REGRESSION",IEEE ACCESS,https://ieeexplore.ieee.org/ielx7/6287639/8948470/09106330.pdf,
44,Detection of Cutaneous Tumors in Dogs Using Deep Learning Techniques,965,,83-91,"Zapata Lorena,Chalco Lorena,Aguilar Lenin,Pimbosa Esmeralda,Ramirez-Morales Ivan,Hidalgo Jairo,Yandun Marco,Arias-Flores Hugo,Guevara Cesar","Zapata L,Chalco L,Aguilar L,Pimbosa E,Ramirez-Morales I,Hidalgo J,Yandun M,Arias-Flores H,Guevara C",Guevara C,10.1007/978-3-030-20454-9_8,"Univ Indoamer, Inst Res Dev & Innovat MIST, EC-170301 Quito, Ecuador.","Cytological diagnosis is useful in the practical context compared to the histopathology, since it can classify pathologies among the cutaneous masses, the samples can be collected easily without anesthetizing the patient, at very low cost. However, an experimented veterinarian performs the cytological diagnosis in approximately 25 min. Artificial intelligence is being used for the diagnosis of many pathologies in human medicine, the experience gained by years of work in the area of work allow to issue correct diagnoses, this experience can be trained in an intelligent system. In this work, we collected a total of 1500 original cytologic images, performed some preliminary tests and also propose a deep learning based approach for image analysis and classification using convolutional neural networks (CNN). To adjust the parameters of the classification model, we recommend to perform a random and grid search will be applied, modifying the batch size of images for training, the number of layers, the learning speed and the selection of three optimizers: Adadelta, RMSProp and SGD. The performance of the classifiers will be evaluated by measuring the accuracy and two loss functions: cross-categorical entropy and mean square error. These metrics will be evaluated in a set of images different from those with which the model was trained (test set). By applying this model, an image classifier can be generated that efficiently identifies a cytology diagnostic in a short time and with an optimal detection rate. This is the first approach for the development of a more complex model of skin mass detection in all its types.","Deep learning,Cancer,Veterinary,Cytology,Convolutional Neural Networks",Proceedings Paper,"SPRINGER INTERNATIONAL PUBLISHING AG, GEWERBESTRASSE 11, CHAM, CH-6330, SWITZERLAND",Computer Science,,,"ARTIFICIAL,NEURAL-NETWORKS,CANCER",,,
45,Cascading Convolutional Neural Network for Steel Surface Defect Detection,965,,202-212,"Lin Chih-Yang,Chen Cheng-Hsun,Yang Ching-Yuan,Akhyar Fityanul,Hsu Chao-Yung,Ng Hui-Fuang","Lin CY,Chen CH,Yang CY,Akhyar F,Hsu CY,Ng HF",Lin CY,10.1007/978-3-030-20454-9_20,Yuan Ze University,"Steel is the most important material in the world of engineering and construction. Modern steelmaking relies on computer vision technologies, like optical cameras to monitor the production and manufacturing processes, which helps companies improve product quality. In this paper, we propose a deep learning method to automatically detect defects on the steel surface. The architecture of our proposed system is separated into two parts. The first part uses a revised version of single shot multibox detector (SSD) model to learn possible defects. Then, deep residual network (ResNet) is used to classify three types of defects: Rust, Scar, and Sponge. The combination of these two models is investigated and discussed thoroughly in this paper. This work additionally employs a real industry dataset to confirm the feasibility of the proposed method and make sure it is applicable to real-world scenarios. The experimental results show that the proposed method can achieve higher precision and recall scores in steel surface defect detection.","Fully convolutional networks,Defect detection,SSD,ResNet",Proceedings Paper,"SPRINGER INTERNATIONAL PUBLISHING AG, GEWERBESTRASSE 11, CHAM, CH-6330, SWITZERLAND",Computer Science,,,,,,
46,Multimodal fNIRS-EEG Classification Using Deep Learning Algorithms for Brain-Computer Interfaces Purposes,953,,209-220,"Saadati Marjan,Nelson Jill,Ayaz Hasan","Saadati M,Nelson J,Ayaz H",Saadati M,10.1007/978-3-030-20473-0_21,George Mason University,"The development of brain-computer interface (BCI) systems has received considerable attention from neuroscientists in recent years. BCIs can serve as a means of communication and for the restoration of motor function for patients with motor disorders. An essential part of the design of a BCI is correctly classifying the brain signals, historically collected using electroen-cephalography (EEG). However, recent studies have shown more robust classification results when EEG is combined with other neuroimaging methods such as fNIRS. Conventional classification methods need a priori feature preprocessing to train the model; such feature selection is a difficult and heavily studied problem. By using deep neural networks (DNN), in which recordings can be fed directly to the algorithm for training, we avoid the need for feature selection. In this study, the capabilities of DNNs in the classification of the hybrid EEG-fNIRS recordings of motor imagery (MI) and mental workload (MWL) tasks are investigated. A five-layer fully connected network is used for classification. This study makes use of two open-source meta-datasets collected at the Technische Universitat Berlin. The first dataset includes brain activity recordings of 26 healthy participants during three cognitive tasks: (1) n-back (0-, 2- and 3-back), (2) discrimination/selection response task (DSR) and (3) word generation (WG) tasks. The second dataset, motor imagery, consists of left and right-hand motor imagery tasks, each for 29 healthy participants. Our results show that classification accuracy is considerably higher for multimodal recordings when compared to EEG or fNIRS recordings alone. The proposed algorithm improves classification performance relative to a conventional support vector machine (SVM), reaching 90% average accuracy for both tasks, 8% higher than SVM performance. These results demonstrate the feasibility of achieving strong classification performance using multimodal BCI and deep learning.","EEG,fNIRS,Deep neural networks,Deep learning,Brain imaging,Brain computer interfaces,Human machine interfaces",Proceedings Paper,"SPRINGER INTERNATIONAL PUBLISHING AG, GEWERBESTRASSE 11, CHAM, CH-6330, SWITZERLAND","Computer Science,Neurosciences & Neurology",,,PERFORMANCE,,,
47,Convolutional Neural Network for Hybrid fNIRS-EEG Mental Workload Classification,953,,221-232,"Saadati Marjan,Nelson Jill,Ayaz Hasan","Saadati M,Nelson J,Ayaz H",Saadati M,10.1007/978-3-030-20473-0_22,George Mason University,"The classification of workload memory tasks based on fNIRS and EEG signals requires solving high-dimensional pattern classification problems with a relatively small number of training patterns. In the use of conventional machine learning algorithms, feature selection is a fundamental difficulty given the large number of possible features and the small amount of available data. In this study, we bypass the challenges of feature selection and investigate the use of Convolutional Neural Networks (CNNs) for classifying workload memory tasks. CNNs are well suited for learning from the raw data without any a priori feature selection. CNNs take as input two-dimensional images, which differ in structure from the neural time series obtained on the scalp surface using EEG and fNIRS. Therefore, both the existing CNN architectures and fNIRS-EEG input must be adapted to allow fNIRS-EEG input to a CNN. In this work, we describe this adaptation, evaluate the performance of CNN classification of mental workload tasks. This study makes use of an open-source meta-dataset collected at the Technische Universitat Berlin; including simultaneous EEG and fNIRS recordings of 26 healthy participants during n-back tests. A CNN with three convolution layers and two fully connected layers is adapted to suit the given dataset. ReLU and ELU activation functions are employed to take advantage of their better dampening property in the vanishing gradient problem, fast convergence, and higher accuracy. The results achieved with the two activation functions are compared to select the best performing function. The proposed CNN approach achieves a considerable average improvement relative to conventional methods such as Support Vector Machines. The results across differences in time window length, activation functions, and other hyperparameters are benchmarked for each task. The best result is obtained with a three-second window and the ELU activation function, for which the CNN yields 89% correct classification, while the SVM achieves only 82% correct classification.","EEG,fNIRS,Convolutional neural networks,Deep learning,Brain imaging,Brain computer interfaces,Human machine interfaces",Proceedings Paper,"SPRINGER INTERNATIONAL PUBLISHING AG, GEWERBESTRASSE 11, CHAM, CH-6330, SWITZERLAND","Computer Science,Neurosciences & Neurology",,,PERFORMANCE,,,
48,On Stability of Feature Selection Based on MALDI Mass Spectrometry Imaging Data and Simulated Biopsy,1033,,82-93,"Wilk Agata,Gawin Marta,Fratczak Katarzyna,Widlak Piotr,Fujarewicz Krzysztof","Wilk A,Gawin M,Fratczak K,Widlak P,Fujarewicz K",Fujarewicz K,10.1007/978-3-030-29885-2_8,Silesian University of Technology,"In this work we analyse MALDI mass spectrometry imaging data for thyroid cancer samples. Such a data, containing information about spatial distribution of proteins/peptides, makes possible to make a virtual analysis how a technique of fine needle aspiration (FNA) biopsy, a routine diagnosis procedure for thyroid, influences the outcome i.e. a set of discriminative features between cancerous and normal tissue. We hypothesised that an impure dataset (consisting of normal cell contaminated cancer samples) would be beneficial in the terms of stable feature selection. We compared several methods of predictor selection on different datasets to perform an in-depth feature ranking stability analysis for thyroid cancer mass spectrometry data. Furthermore we examined the impact of sample contamination level on the selection.","MALDI imaging mass spectrometry,Machine learning,Feature selection,Fine needle biopsy",Proceedings Paper,"SPRINGER INTERNATIONAL PUBLISHING AG, GEWERBESTRASSE 11, CHAM, CH-6330, SWITZERLAND","Computer Science,Engineering,Medical Laboratory Technology",,,PROFILES,,,
49,Detection of Epileptic Seizures via Deep Long Short-Term Memory,1033,,166-178,"Patan Krzysztof,Rutkowski Grzegorz","Patan K,Rutkowski G",Patan K,10.1007/978-3-030-29885-2_15,University of Zielona Gora,"The paper deals with the designing and implementation of a computer-aided system capable to detect seizures by classification of EEG records. The system is based on deep learning method using a recurrent long short-term memory neural network. The main purpose of the system is to help neurologists in detecting seizures fast and reliably. The research was carried out using real EEG recordings of epileptic patients as well as healthy subjects prepared with the cooperation of the medical staff of the Clinical Ward of Neurology of the University Hospital of Zielona Gora, Poland.","EEG signals,Seizure detection,Deep learning,Long short-term memory,Classification",Proceedings Paper,"SPRINGER INTERNATIONAL PUBLISHING AG, GEWERBESTRASSE 11, CHAM, CH-6330, SWITZERLAND","Computer Science,Engineering,Medical Laboratory Technology",,,"FEATURE-EXTRACTION,CLASSIFICATION",,,
50,RMID: A Novel and Efficient Image Descriptor for Mammogram Mass Classification,945,,229-240,"Obaidullah Sk Md,Ahmed Sajib,Goncalves Teresa,Rato Luis","Obaidullah SM,Ahmed S,Goncalves T,Rato L",Obaidullah SM,10.1007/978-3-030-18058-4_18,University of Evora,"For mammogram image analysis, feature extraction is the most crucial step when machine learning techniques are applied. In this paper, we propose RMID (Radon-based Multi-resolution Image Descriptor), a novel image descriptor for mammogram mass classification, which perform efficiently without any clinical information. For the present experimental framework, we found that, in terms of area under the ROC curve (AUC), the proposed RMID outperforms, upto some extent, previous reported experiments using histogram based hand-crafted methods, namely Histogram of Oriented Gradient (HOG) and Histogram of Gradient Divergence (HGD) and also Convolution Neural Network (CNN). We also found that the highest AUC value (0.986) is obtained when using only the carniocaudal (CC) view compared to when using only the mediolateral oblique (MLO) (0.738) or combining both views (0.838). These results thus proves the effectiveness of CC view over MLO for better mammogram mass classification.","Image descriptor,Mammogram image,Breast cancer,Classification",Proceedings Paper,"SPRINGER INTERNATIONAL PUBLISHING AG, GEWERBESTRASSE 11, CHAM, CH-6330, SWITZERLAND","Computer Science,Physics",,,"AUTOMATIC,DETECTION,MICROCALCIFICATIONS,ALGORITHM,FILM",,,
51,Optimization methods for deep neural networks classifying OCT images to detect dental caries,11217,,,"Salehi Hassan S.,Barchini Majd,Mandian Mina","Salehi HS,Barchini M,Mandian M",Salehi HS,10.1117/12.2545421,California State University System,"Dental caries are common chronic infectious oral diseases affecting most teenagers and adults worldwide. Optical coherence tomography (OCT) has been studied extensively for the detection of early carious lesions. Deep learning techniques are a rapidly emerging new area of biomedical research and have yielded impressive results in diagnosis and prediction in the field of oral radiology. Deep learning models particularly deep convolutional neural networks (CNN) can be employed along with OCT imaging system to more accurately identify early dental caries. In this work, after OCT data acquisition, data augmentation was performed to obtain a large amount of training data in order to effectively learn, where collection of such training data is often expensive and laborious. For the backpropagation process, seven optimization methods, namely Adadelta, AdaGrad, Adam, AdaMax, Nadam, RMSProp, and Stochastic Gradient Descent (SGD) were utilized to improve the accuracy of a CNN classifier for diagnosing dental caries. In this study, 75% of the data were utilized for training and 25% for testing. The diagnostic accuracy, sensitivity, specificity, positive predictive value, negative predictive value, and receiver operating characteristic (ROC) curve were calculated for detection and diagnostic performance of the deep CNN algorithm. This study highlighted the performance of various optimization methods for deep CNN models with OCT images to detect dental caries.","optimization methods,image processing,machine learning,deep learning,convolutional neural networks,optical coherence tomography,dental caries detection",Proceedings Paper,"SPIE-INT SOC OPTICAL ENGINEERING, 1000 20TH ST, PO BOX 10, BELLINGHAM, WA 98227-0010 USA","Dentistry, Oral Surgery & Medicine,Optics",,,"OPTICAL,COHERENCE,TOMOGRAPHY,SEGMENTATION,ENAMEL",,,
52,Dynamic entropy-based pattern learning to identify emotions from EEG signals across individuals,150,,,"Lu Yun,Wang Mingjiang,Wu Wanqing,Han Yufei,Zhang Qiquan,Chen Shixiong","Lu Y,Wang MJ,Wu WQ,Han YF,Zhang QQ,Chen SX",Wang MJ,10.1016/j.measurement.2019.107003,Harbin Institute of Technology,"Emotion plays an important role in mental and physical health, decision-making, and social communication. An accurate detection of human emotions is critical to ensure effective interaction and activate proper emotional feedback. In the existing emotion recognition methods, poor generalization capability caused by individual differences in emotion experiences is still a problem. This article proposes a new framework of dynamic entropy-based pattern learning to enable subject-independent emotion recognition from electroencephalogram (EEG) signals with good generalization. Firstly, we exploit dynamic entropy measures in quantitative EEG measurement to extract consecutive entropy values from EEG signals over time. Then, based on the concatenation of consecutive entropy values to form feature vectors, the dynamic entropy-based patterning learning can be able to achieve subject-independent emotion recognition across individuals to obtain excellent identification accuracy. Experiment results show that the best average accuracy of 85.11% is reached to identify the negative and positive emotions. Besides, by comparison with the recent researches, the results have fully demonstrated that our method can achieve excellent performance for emotion recognition across individuals. In summary, an universal and subject-independent emotion recognition method with excellent generalization capability is developed by the proposed dynamic entropy-based pattern learning, which may have the great application potential to address the emotion detection in healthcare decision-making and human-computer interaction systems. (C) 2019 Elsevier Ltd. All rights reserved.","Emotion recognition,Entropy measures,Sample entropy,Machine learning,EEG,SEED dataset",Article,"ELSEVIER SCI LTD, THE BOULEVARD, LANGFORD LANE, KIDLINGTON, OXFORD OX5 1GB, OXON, ENGLAND","Engineering,Instruments & Instrumentation",,3.778,"APPROXIMATE,ENTROPY,FEATURE-SELECTION,SAMPLE,ENTROPY,RECOGNITION,SYSTEM,RESPONSES,EMG",MEASUREMENT,,
53,X-ray luminescence imaging for small-animals,11224,,,"Lun Michael C.,Cong Wenxiang,Arifuzzaman Md,Ranasinghe Meenakshi,Bhattacharya Sriparna,Anker Jeffrey,Wang Ge,Li Changqing","Lun MC,Cong WX,Arifuzzaman M,Ranasinghe M,Bhattacharya S,Anker J,Wang G,Li CQ",Li CQ,10.1117/12.2544601,University of California System,"X-ray luminescence imaging emerged for about a decade and combines both the high spatial resolution of x-ray imaging with the high measurement sensitivity of optical imaging, which could result in a great molecular imaging tool for small animals. So far, there are two types of x-ray luminescence computed tomography (XLCT) imaging. One uses a pencil beam x-ray for high spatial resolution at a cost of longer measurement time. The other uses cone beam x-ray to cover the whole mouse to obtain XLCT images at a very short time but with a compromised spatial resolution. Here we review these two methods in this paper and highlight the synthesized nanophosphors by different research groups.
We are building a focused x-ray luminescence tomography (FXLT) imaging system, developing a machinelearning based FXLT reconstruction algorithm, and synthesizing nanophosphors with different emission wavelengths. In this paper, we will report our current progress from these three aspects. Briefly, we mount all main components, including the focused x-ray tube, the fiber detector, and the x-ray tube and x-ray detector for a microCT system, on a rotary which is a heavy-duty ring track. A microCT scan will be performed before FXLT scan. For a FXLT scan, we will have four PMTs to measure four fiber detectors at two different wavelengths simultaneously for each linear scan position. We expect the spatial resolution of the FXLT imaging will be around 100 micrometers and a limit of detection of approximately 2 mu g/mL (for Gd2O2S:Eu).","x-ray luminescence computed tomography,optical imaging,x-ray imaging,optical tomography,tomographic imaging,mice imaging",Proceedings Paper,"SPIE-INT SOC OPTICAL ENGINEERING, 1000 20TH ST, PO BOX 10, BELLINGHAM, WA 98227-0010 USA",Optics,,,"FLUORESCENCE,MOLECULAR,TOMOGRAPHY,SENSITIVITY",,https://www.ncbi.nlm.nih.gov/pmc/articles/PMC7875188,
54,Automated Classification and Measurement of Fetal Ultrasound Images with Attention Feature Pyramid Network,11427,,,"Liu Pengfei,Zhao Huaici,Li Peixuan,Cao Feidao","Liu PF,Zhao HC,Li PX,Cao FD",Liu PF,10.1117/12.2552701,Chinese Academy of Sciences,"Segmentation of anatomical structures in ultrasound images required radiological technology and a great deal of ultrasonic experience. The manual segmentation is often dependent on expertise of clinicians and time-consuming. Therefore, we present an automatic system for segmentation and measurement of ultrasound images. We propose a scale attention feature pyramid network (SAFNet) for fetal biometric measurements from two-dimensional ultrasound images. The scale attention module is steered to form feature pyramid at each level. Auxiliary layer is used to learn object boundary definition with deep supervision. Further, we present a two-stage framework which is an automatic classification measurement system (ACMS), firstly classifies the image type which has three labels: head, abdomen and femur. Then outputs the final segmentation result. The SAFNet results better performance on our datasets compared to the baseline U-Net. Experiments show that the ACMS results in classification accuracy of 95.27%/90.94%/94.93% of fetal head, abdomen and femur test set, respectively. Feature pyramid and attention mechanism inside the network for feature selection results in improvement in the segmentation accuracy. The ACMS can conveniently obtain segmentation result no matter what type is given.","Fetal biometric measurement,ultrasound image segmentation,attention mechanism,deep supervision",Proceedings Paper,"SPIE-INT SOC OPTICAL ENGINEERING, 1000 20TH ST, PO BOX 10, BELLINGHAM, WA 98227-0010 USA","Computer Science,Optics",,,,,,
55,Ultrasonic characterization of thermal barrier coatings porosity through BP neural network optimizing Gaussian process regression algorithm,100,,,"Ma Zhiyuan,Zhang Wei,Luo Zhongbing,Sun Xu,Li Zongyi,Lin Li","Ma ZY,Zhang W,Luo ZB,Sun X,Li ZY,Lin L",Lin L,10.1016/j.ultras.2019.105981,Dalian University of Technology,"Porosity is an integral part of thermal barrier coatings (TBCs) and is required to provide thermal insulation and to accommodate operational thermal stresses. Accurate characterization of the TBCs porosity is difficult due to the complex pore morphology and ultra-thin coating thickness. In this paper, a BP neural network optimizing Gaussian process regression (GPR) algorithm, termed BP-GPR, is presented to characterize the TBCs porosity based on a constructed ultrasonic reflection coefficient amplitude spectrum (URCAS). The characteristic parameters of URCAS are optimized through the BP neural network combined with a high determination coefficient R-2 rule. Then the optimized parameters are utilized to train the GPR algorithm for predicting the unknown TBCs porosity. The proposed BP-GPR method was demonstrated through a series of finite element method (FEM) simulations, which were implemented on random pore models (RPMs) of plasma spraying ZrO2 coating with a thickness of 300 mu m and porosities of 1%, 3%, 5%, 7%, and 9%. Simulation results indicated the relative errors of the predicted porosity of RPMs were 6.37%, 7.62%, 1.07%, and 1.07%, respectively, which has 32% and 48% accuracy higher than that predicted only by BP neural network or GPR algorithm. It is verified that the proposed BP-GPR method can accurately characterize the porosity of TBCs with complex pore morphology.","Thermal barrier coating,Porosity,Ultrasonic,BP neural network,Gaussian process regression",Article,"ELSEVIER, RADARWEG 29, 1043 NX AMSTERDAM, NETHERLANDS","Acoustics,Radiology, Nuclear Medicine & Medical Imaging",,2.786,"NONDESTRUCTIVE,MEASUREMENT,ELASTIC-MODULUS,COEFFICIENT",ULTRASONICS,,
