,title,Volume,Issue,Pages,whole__author_name,simply_author_name,reprint author,DOI,reprint address,Abstract,Keywords,Document Type,Publisher,Research Domain,Published Date,impact_factor,Keywords_plus,joural,pdf_link,Download_SuccessOrDefeat
68,Accelerated Development of Refractory Nanocomposite Solar Absorbers using Bayesian Optimization,5,29-30,1537-1545,"Guan Qiangshun,Alketbi Afra S.,Raza Aikifa,Zhang TieJun","Guan QS,Alketbi AS,Raza A,Zhang TJ",Zhang TJ,10.1557/adv.2019.468,Khalifa University of Science & Technology,"Machine learning-based approach is desired for accelerating materials design, development and discovery in combination with high-throughput experiments and simulation. In this work we propose to apply a Bayesian optimization method to design ultrathin multilayer tungsten-silicon carbide (W-SiC) nanocomposite absorber for high-temperature solar power generation. Based on a semi-analytical scattering matrix method, the design of spectrally selective absorber is optimized over a variety of layer thicknesses to maximize the overall solar absorptance. Our nanofabrication and experimental characterization results demonstrate the capability of the proposed approach for accelerated development of refractory light-absorbing materials. Comparison with other global optimization methods, such as random search, simulated annealing and particle swarm optimization, shows that the Bayesian optimization method can expedite the design of multilayer nanocomposite absorbers and significantly reduce the development cost. This work sheds light on the discovery of novel materials for solar energy and sustainability applications.","DESIGN,FABRICATION,COATINGS",Article,"CAMBRIDGE UNIV PRESS, 32 AVENUE OF THE AMERICAS, NEW YORK, NY 10013-2473 USA",Materials Science,,,"DESIGN,FABRICATION,COATINGS",MRS ADVANCES,,
69,Prediction of physical properties of thermosetting resin by using machine learning and structural formulas of raw materials,5,29-30,1567-1575,"Nakajin Kokin,Minami Takuya,Kawata Masaaki,Fujita Toshio,Murofushi Katsumi,Uchida Hiroshi,Omori Kazuhiro,Okuno Yoshishige","Nakajin K,Minami T,Kawata M,Fujita T,Murofushi K,Uchida H,Omori K,Okuno Y",Nakajin K,10.1557/adv.2020.266,"Res Assoc High Throughput Design & Dev Adv Funct, Tsukuba, Ibaraki 3058568, Japan.","Thermosetting resins are one of the most widely used functional materials in industrial applications. Although some of the physical properties of thermosetting resins are controlled by changing the functional groups of the raw materials or adjusting their mixing ratios, it was conventionally challenging to construct machine learning (ML) models, which include both mixing ratio and chemical information such as functional groups. To overcome this problem, we propose a machine learning approach based on extended circular fingerprint (ECFP) in this study. First, we predicted the classification of raw materials by the random forest, where ECFP was used as the explanatory variable. Then, we aggregated ECFP for each classification predicted by the random forest. After that, we constructed the prediction model by using the aggregated ECFP, feature quantities of reaction intermediates, and curing conditions of resin as explanatory variables. As a result, the model was able to predict in high accuracy (R boolean AND 2 = 0.8), for example, the elastic modulus of thermosetting resins. Furthermore, we also show the result of verification of prediction accuracy in first step, such as using the one-hot-encording. Therefore, we confirmed that the properties of thermosetting resins could be predicted using mixed raw materials by the proposed method.",POLYMER,Article,"CAMBRIDGE UNIV PRESS, 32 AVENUE OF THE AMERICAS, NEW YORK, NY 10013-2473 USA",Materials Science,,,POLYMER,MRS ADVANCES,,
70,Small Angle Scattering Data Analysis Assisted by Machine Learning Methods,5,29-30,1577-1584,"Do Changwoo,Chen Wei-Ren,Lee Sangkeun","Do C,Chen WR,Lee S",Do C,10.1557/adv.2020.130,United States Department of Energy (DOE),"Small angle scattering (SAS) is a widely used technique for characterizing structures of wide ranges of materials. For such wide ranges of applications of SAS, there exist a large number of ways to model the scattering data. While such analysis models are often available from various suites of SAS data analysis software packages, selecting the right model to start with poses a big challenge for beginners to SAS data analysis. Here, we present machine learning (ML) methods that can assist users by suggesting scattering models for data analysis. A series of one-dimensional scattering curves have been generated by using different models to train the algorithms. The performance of the ML method is studied for various types of ML algorithms, resolution of the dataset, and the number of the dataset. The degree of similarities among selected scattering models is presented in terms of the confusion matrix. The scattering model suggestions with prediction scores provide a list of scattering models that are likely to succeed. Therefore, if implemented with extensive libraries of scattering models, this method can speed up the data analysis workflow by reducing search spaces for appropriate scattering models.","small angle scattering,data analysis,machine learning",Article,"SPRINGER HEIDELBERG, TIERGARTENSTRASSE 17, D-69121 HEIDELBERG, GERMANY",Materials Science,,,"MATERIALS,DISCOVERY,RETRIEVAL,MODEL",MRS ADVANCES,https://www.osti.gov/biblio/1633165,
71,Selected problems of image data preprocessing used to perform examination in Parkinson's disease,11442,,,"Bialek Kamila,Jakubowski Jacek,Potulska-Chromik Anna,Chmielinska Jolanta,Majda-Zdancewicz Ewelina);,Nojszewska Monika,Kostera-Pruszczyk Anna,Dobrowolski Andrzej","Bialek K,Jakubowski J,Potulska-Chromik A,Chmielinska J,Majda-Zdancewicz E,Nojszewska M,Kostera-Pruszczyk A,Dobrowolski A",Bialek K,10.1117/12.2565138,Military University of Technology in Warsaw,"Engineering support in the field of distinguishing Parkinson's disease from other diseases, diagnosing its progression and monitoring the effectiveness of drug treatment is nowadays implemented by way of recording and analyzing equipment fitted with motion sensors. The time series they provide enable quantitative evaluation of a set of symptoms describing daily activities and motor abilities of patients. The paper presents the preliminary results of fundamental research, which based on known medical observations indicating the diminution of facial expressions and micrographic apart from general motor deterioration, suggest that the clinical studies could utilize the techniques of processing image data acquired during the medical history taking. The image data includes video recording of the face and limbs conducted in the course of the coercions suggested in the study and manual drawings by patients. The image data are redundant and require processing for presentations facilitating their interpretation by a physician and enabling efficient utilization of machine learning algorithms in the next study stage. Within the framework of preliminary processing of acquired images, attempts were made to determine the quantitative measures, such as, e g blinking frequency and the indicators generated as a result of analyzing the position of characteristic points within the facial image. In the case of limbs, it is suggested to reproduce the motion on the image using a time series acquired thanks to the fixed markers. Preliminary processing of data coming from a graphic tablet also guarantees the generation of time series for images created by patients.","Parkinson's disease,image processing,analysis of handwriting,biosignals",Proceedings Paper,"SPIE-INT SOC OPTICAL ENGINEERING, 1000 20TH ST, PO BOX 10, BELLINGHAM, WA 98227-0010 USA","Engineering,Optics",,,,,https://www.spiedigitallibrary.org/conference-proceedings-of-spie/11442/114420G/Selected-problems-of-image-data-preprocessing-used-to-perform-examination/10.1117/12.2565138.pdf,
72,Interpretable Diagnosis of Breast Cancer from Histological Images Using Siamese Neural Networks,11433,,,"Hradel Dominik,Hudec Lukas,Benesova Wanda","Hradel D,Hudec L,Benesova W",Hradel D,10.1117/12.2557802,Slovak University of Technology Bratislava,"Breast cancer is one of the most widespread causes of women's death worldwide. Successful treatment can be achieved only by the early and accurate tumor diagnosis. The main method of tissue diagnosis taken by biopsy is based on the observation of its significant structures. We propose a novel approach of classifying microscopy tissue images into 4 main cancer classes (normal, benign, In Situ and invasive). Our method is based on comparing and determining the similarity of the new tissue sample with previously by specialists annotated examples that are compiled in the collection with other labeled samples. The most probable class is statistically determined by comparing a new sample with several annotated samples. The usual problem of medical datasets is the small number of training images. We have applied suitable dataset augmentation techniques, using the fact that flipping or mirroring of the sample does not change the information about the diagnosis. Our other contribution is that we show the histopathologist the reason why the algorithm has classified tissue into the particular cancer class by ordering the collection of correctly annotated samples by their similarity to the input sample. Histopathologists can focus on searching for the key structures corresponding to the predicted classes.","Breast cancer,biopsy image analysis,Siamese neural networks,classification interpretation",Proceedings Paper,"SPIE-INT SOC OPTICAL ENGINEERING, 1000 20TH ST, PO BOX 10, BELLINGHAM, WA 98227-0010 USA",Optics,,,,,,
73,Multi-modal Brain Tumor Segmentation Utilizing Convolutional Neural Networks,11433,,,"Jakab Marek,Stevuliak Marek,Benesova Wanda","Jakab M,Stevuliak M,Benesova W",Jakab M,10.1117/12.2557599,Slovak University of Technology Bratislava,"In this work, we deal with a brain tumor segmentation problem from magnetic resonance imaging (MRI), considered financially and time demanding when carrying out manually. To tackle this specific and complex domain problem, convolutional networks have proved competent due to significantly better performance than standard segmentation approaches. Therefore, within our research, we propose an approach which is dealing with tumor segmentation. During the elaboration, we propose multiple architectures, training phases and evaluation metrics in order to facilitate reliable and automatic delineation of tumorous tissues. For this purpose, we proposed a novel adaptation of the Tversky index loss formula to avoid label imbalance.","tumor segmentation,medical imaging,image processing,deep learning,neural networks",Proceedings Paper,"SPIE-INT SOC OPTICAL ENGINEERING, 1000 20TH ST, PO BOX 10, BELLINGHAM, WA 98227-0010 USA",Optics,,,,,,
74,Convolutional Neural Network for Early Detection of Gastric Cancer by Endoscopic Video Analysis,11433,,,"Lebedev Anton,Khryashchev Vladimir,Stefanidi Anton,Stepanova Olga,Kashin Sergey,Kuvaev Roman","Lebedev A,Khryashchev V,Stefanidi A,Stepanova O,Kashin S,Kuvaev R",Lebedev A,10.1117/12.2559446,Yaroslavl State University,"Computer-aided diagnosis of cancer based on endoscopic image analysis is a promising area in the field of computer vision and machine learning. Convolutional neural networks are one of the most popular approaches in the endoscopic image analysis. The paper presents an endoscopic video analysis algorithm based on the use of convolutional neural network. To analyze the quality of the algorithm on the video data from the endoscope, the intersection over union (IoU) metric for object detection is used. The experimental results shows that the average value of IoU coefficient for the developed algorithm is 0.767, which corresponds to a high degree of intersection of areas identified by an expert and the algorithm.","Machine learning,convolution neural network,endoscopic image analyses,gastric cancer",Proceedings Paper,"SPIE-INT SOC OPTICAL ENGINEERING, 1000 20TH ST, PO BOX 10, BELLINGHAM, WA 98227-0010 USA",Optics,,,,,,
75,Detecting Pneumonia in Chest Radiographs Using Convolutional Neural Networks,11433,,,"Ureta Jennifer,Aran Oya,Rivera Pauline","Ureta J,Aran O,Rivera P",Ureta J,10.1117/12.2559527,De La Salle University,"Pneumonia is an infection of the lungs that can cause mild to severe illness and affects millions of people worldwide. Imaging studies are therefore crucial for the detection and management of patients with pneumonia, and radiography is currently the best method for diagnosis. However, clinical diagnosis of chest X-rays can be a challenging task as it requires interpretation by highly trained clinicians. This study uses deep learning to perform binary classification of frontal-view chest X-ray images to detect signs of childhood pneumonia. The effectiveness of the classifiers was validated using a dataset that was collected by [5] containing 5,856 labeled X-ray images from children. The classifiers were able to identify the presence or absence of childhood pneumonia with an accuracy between 96-97%.","Convolutional Neural Networks,pneumonia detection,chest radiographs",Proceedings Paper,"SPIE-INT SOC OPTICAL ENGINEERING, 1000 20TH ST, PO BOX 10, BELLINGHAM, WA 98227-0010 USA",Optics,,,"COMPUTER-AIDED,DIAGNOSIS",,,
76,Outlier Generation and Anomaly Detection Based on Intelligent One-Class Techniques over a Bicomponent Mixing System,950,,399-410,"Jove Esteban,Casteleiro-Roca Jose-Luis,Quintian Hector,Albino Mendez-Perez Juan,Luis Calvo-Rolle Jose","Jove E,Casteleiro-Roca JL,Quintian H,Mendez-Perez JA,Calvo-Rolle JL",Jove E,10.1007/978-3-030-20055-8_38,Universidade da Coruna,"One of the most important points to improve the profits in an industrial process lies on the fact of achieving a good optimisation and applying a smart maintenance plan. Under this circumstances an early anomaly plays an important role. Then, the implementation of classifiers for anomaly detection is an important challenge. As many of the anomalies that can occur in a plant have an unknown behaviour, it is necessary to generate artificial outliers to check these classifiers. This work presents different one-class intelligent techniques to perform anomaly detection in an industrial facility, used to obtain the main material for wind generator blades production. Furthermore, artificial anomaly data are generated to check the performance of each technique. The final results achieved are successful in general terms.","Anomaly detection,Control system,Outlier generation",Proceedings Paper,"SPRINGER INTERNATIONAL PUBLISHING AG, GEWERBESTRASSE 11, CHAM, CH-6330, SWITZERLAND",Computer Science,,,"ASSIST,MODEL",,,
77,Ensemble-Based Machine Learning Algorithms for Classifying Breast Tissue Based on Electrical Impedance Spectroscopy,965,,260-266,"Rahman Sam Matiur,Ali Md Asraf,Altwijri Omar,Alqahtani Mahdi,Ahmed Nasim,Ahamed Nizam U.","Rahman SM,Ali MA,Altwijri O,Alqahtani M,Ahmed N,Ahamed NU",Rahman SM,10.1007/978-3-030-20454-9_26,Daffodil International University,"The initial identification of breast cancer and the prediction of its category have become a requirement in cancer research because they can simplify the subsequent clinical management of patients. The application of artificial intelligence techniques (e.g., machine learning and deep learning) in medical science is becoming increasingly important for intelligently transforming all available information into valuable knowledge. Therefore, we aimed to classify six classes of freshly excised tissues from a set of electrical impedance measurement variables using five ensemble-based machine learning (ML) algorithms, namely, the random forest (RF), extremely randomized trees (ERT), decision tree (DT), gradient boosting tree (GBT) and AdaBoost (Adaptive Boosting) (ADB) algorithms, which can be subcategorized as bagging and boosting methods. In addition, the ranked order of the variables based on their importance differed across the ML algorithms. The results demonstrated that the three bagging ensemble ML algorithms, namely, RF ERT and DT, yielded better classification accuracies (78-86%) compared with the two boosting algorithms, GBT and ADB (60-75%). We hope that these our results would help improve the classification of breast tissue to allow the early prediction of cancer susceptibility.","Breast tissue,Machine learning,Ensemble learning,Classification,Electrical impedance",Proceedings Paper,"SPRINGER INTERNATIONAL PUBLISHING AG, GEWERBESTRASSE 11, CHAM, CH-6330, SWITZERLAND",Computer Science,,,"CANCER,CLASSIFICATION,PREDICTION,IMPEDIVITY",,,
78,Automated Clash Free Rebar Design in Precast Concrete Exterior Wall via Generative Adversarial Network and Multi-agent Reinforcement Learning,965,,546-558,"Liu Pengkun,Liu Jiepeng,Feng Liang,Wu Wenbo,Lan Hao","Liu PK,Liu JP,Feng L,Wu WB,Lan H",Liu JP,10.1007/978-3-030-20454-9_54,Chongqing University,"The adoption of precast concrete elements (PCEs) are becoming popular in civil infrastructures. Since quality of connections determines the structure property, design of rebar in PCEs is a mandatory stage in constructions. Due to large number of rebar, complicated shapes of PCEs and complicated rules for arrangement, it is labor-intensive and error-prone for designers to avoid all clashes even using computer software. With the aid of BIM, it is desirable to have an automated and clash-free rebar design. Taking this cue, we introduce a framework with generative adversarial network (GAN) and multi-agent reinforcement learning (MARL) for generating design and automatically avoiding clash of rebar in PCES. We use GAN to generate 2D rebar designs. Then, 2D rebar designs are transformed into digital environments for MARL. In addition, layout of rebar is modelled as path planning of agents in MARL. An illustrative example is presented to test the proposed framework.","Building information modeling,Generative adversarial network,Reinforcement learning,Multi-agent,Rebar design,Clash free,Precast concrete elements,Precast concrete exterior wall",Proceedings Paper,"SPRINGER INTERNATIONAL PUBLISHING AG, GEWERBESTRASSE 11, CHAM, CH-6330, SWITZERLAND",Computer Science,,,,,,
79,Fast Brain Volumetric Segmentation from T1 MRI Scans,943,,402-415,"Anand Ananya,Anand Namrata","Anand A,Anand N",Anand A,10.1007/978-3-030-17795-9_30,Brown University,"In this paper, we train a state-of-the-art deep neural network segmentation model to do fast brain volumetric segmentation from T1 MRI scans. We use image data from the ADNI and OASIS image collections and corresponding FreeSurfer automated segmentations to train our segmentation model. The model is able to do whole brain segmentation across 13 anatomical classes in seconds; in contrast, FreeSurfer takes several hours per volume. We show that this trained model can be used as a prior for other segmentation tasks, and that pre-training the model in this manner leads to better brain structure segmentation performance on a small dataset of expert-given manual segmentations.","Magnetic resonance imaging,Neural networks (computer),Artificial intelligence,Computer vision systems",Proceedings Paper,"SPRINGER INTERNATIONAL PUBLISHING AG, GEWERBESTRASSE 11, CHAM, CH-6330, SWITZERLAND","Computer Science,Engineering",,,SYSTEM,,,
80,An Attention-Based CNN for ECG Classification,943,,671-677,"Kuvaev Alexander,Khudorozhkov Roman","Kuvaev A,Khudorozhkov R",Kuvaev A,10.1007/978-3-030-17795-9_49,Gazprom,"The paper considers the problem of improving the interpretability of a convolutional neural network on the example of ECG classification task. This is done by using an architecture based on attention modules. Each module generates a mask that selects only those features that are required to make the final prediction. By visualizing these masks, areas of the signal that are important for decision-making can be identified. The model was trained both on raw signals and on their logarithmic spectrograms. In the case of raw signals, generated masks did not perform any meaningful feature maps filtering, but in the case of spectrograms, interpretable masks responsible for noise reduction and arrhythmic parts detection were obtained.","Convolutional neural networks,Attention mechanism,ECG classification",Proceedings Paper,"SPRINGER INTERNATIONAL PUBLISHING AG, GEWERBESTRASSE 11, CHAM, CH-6330, SWITZERLAND","Computer Science,Engineering",,,,,,
81,Forecasting Food Sales in a Multiplex Using Dynamic Artificial Neural Networks,944,,69-80,"Ganesan V. Adithya,Divi Siddharth,Moudhgalya Nithish B.,Sriharsha Uppu,Vijayaraghavan Vineeth","Ganesan VA,Divi S,Moudhgalya NB,Sriharsha U,Vijayaraghavan V",Divi S,10.1007/978-3-030-17798-0_8,SSN College of Engineering,"In India, food sales are emerging to be a major revenue generator for multiplex operators currently amounting to over $367 million a year. Efficient food sales forecasting techniques are the need of the hour as they help minimize the wastage of resources for the multiplex operators. In this paper, the authors propose a model to make a day-ahead prediction of food sales in one of the top multiplexes in India. Online learning and feature engineering by data correlative analysis in conjecture with a densely connected Neural Network, address the concept drifts and latent time correlations present in the data respectively. A scale independent metric, eta(comp) is also introduced to measure the success of the models across all food items from the business perspective. The proposed model performs better than the traditional time-series models, and also performs better than the corporate's currently existing model by a factor of 7.7%. This improved performance also leads to a saving of 170 units of food everyday.","Time-series,Neural networks,Concept drift,Forecasting,Feature engineering,Online learning",Proceedings Paper,"SPRINGER INTERNATIONAL PUBLISHING AG, GEWERBESTRASSE 11, CHAM, CH-6330, SWITZERLAND","Computer Science,Engineering",,,,,,
82,Automatic Nucleus Segmentation with Mask-RCNN,944,,399-407,Johnson Jeremiah W.,Johnson JW,Johnson JW,10.1007/978-3-030-17798-0_32,University System Of New Hampshire,"Mask-RCNN is a recently proposed state-of-the-art algorithm for object detection, object localization, and object instance segmentation of natural images. In this paper, it is demonstrated that Mask-RCNN can be used to perform highly effective and efficient automatic segmentations of a wide range of microscopy images of cell nuclei, for a variety of cells acquired under a variety of conditions. In addition, it is shown that a cyclic learning rate regime allows effective training of a Mask-RCNN model without any need to finetune the learning rate, thereby eliminating a manual and time-consuming aspect of the training procedure. The results presented here will be of interest to those in the medical imaging field and to computer vision researchers more generally.","Deep learning,Neural networks,Microscopy,Instance segmentation,Detection,Mask-RCNN",Proceedings Paper,"SPRINGER INTERNATIONAL PUBLISHING AG, GEWERBESTRASSE 11, CHAM, CH-6330, SWITZERLAND","Computer Science,Engineering",,,,,,
83,Performance Evaluation of Autoencoders for One-Shot Classification of Infectious Chlamydospore,944,,436-446,"Alampay Raphael B.,Ong Josh Daniel,Estuar Regina Justina E.,Abu Patricia Angela R.","Alampay RB,Ong JD,Estuar RJE,Abu PAR",Alampay RB,10.1007/978-3-030-17798-0_35,Ateneo de Manila University,"In the Philippines, there is a growing need for the protection of banana plantation from various diseases that directly affects the livelihood of farmers, markets and overall ecosystem. One such fatal disease is Fusarium oxysporum cubense (TR4 Chlamydospores) which allows growth of such fungi in banana crops that permanently damages the soil for further fertility. As of this writing, there is very small visual distinction between TR4 Chlamydospores and non-infectious Chlamydospores. This paper proposes the use of autoencoders to engineer relevant features in order to distinguish Fusarium Oxysporum from similar fungi or other artifacts present in the soil. Furthermore, the paper tries to address the problem with minimal data available for supervised learning as opposed to traditional methods that require thousands of data points for classification. The purpose of the experiments presented here will aid towards the creation of more sophisticated models to visually discriminate Fusarium Oxysporum.","Autoencoders,Fusarium oxysporum,One-shot learning,Computer vision",Proceedings Paper,"SPRINGER INTERNATIONAL PUBLISHING AG, GEWERBESTRASSE 11, CHAM, CH-6330, SWITZERLAND","Computer Science,Engineering",,,,,,
