,title,Volume,Issue,Pages,whole__author_name,simply_author_name,reprint author,DOI,reprint address,Abstract,Keywords,Document Type,Publisher,Research Domain,Published Date,impact_factor,Keywords_plus,joural,pdf_link,Download_SuccessOrDefeat
65,Machine Learning Approaches for Municipal Solid Waste Generation Forecasting,38,6,489-499,Oguz-Ekim Pinar,Oguz-Ekim P,Oguz-Ekim P,10.1089/ees.2020.0232,Izmir Ekonomi Universitesi,"Municipal solid waste (MSW) generation forecasting can be considered as the biggest challenge of integrated solid waste management systems, particularly for developing countries where data collection is limited. In this study, three different machine learning algorithms, namely backpropagation neural network (BPNN), support vector regression (SVR), and general regression neural network, were applied for different countries. Comparative evaluation of these different algorithms based on gross domestic product, domestic material consumption, and resource productivity were given through the optimum solution. Moreover, the algorithms were tested for the case of Turkey. The results of this study are expected to represent a general outline for stakeholders of Turkey for improving MSW management strategies all over the country, and these results can be extended to similar developing countries across the world. It can be concluded that BPNN and SVR methods can be applied successfully for the case of Turkey and other countries across the world to predict the MSW generation, whereas BPNN is slightly better. If the input and output variables are identified well, machine learning approaches can give a good projection for waste generation, and this projection can be utilized for different countries. Furthermore, the developing countries with missing data can develop more realistic strategies for MSW management by not relying solely on international databases such as Eurostat to forecast MSW generation.","artificial neural networks,backpropagation neural network,general regression neural network,support vector regression,waste generation forecasting",Article,"MARY ANN LIEBERT, INC, 140 HUGUENOT STREET, 3RD FL, NEW ROCHELLE, NY 10801 USA","Engineering,Environmental Sciences & Ecology",,2.104,"SUPPORT,VECTOR,MACHINE,NEURAL-NETWORKS,PREDICTION,MANAGEMENT",ENVIRONMENTAL ENGINEERING SCIENCE,,
66,Virtual Monoenergetic CT Imaging via Deep Learning,1,8,,"Cong Wenxiang,Xi Yan,Fitzgerald Paul,De Man Bruno,Wang Ge","Cong WX,Xi Y,Fitzgerald P,De Man B,Wang G",Wang G,10.1016/j.patter.2020.100128,Rensselaer Polytechnic Institute,"Conventional single-spectrum computed tomography (CT) reconstructs a spectrally integrated attenuation image and reveals tissues morphology without any information about the elemental composition of the tissues. Dual-energy CT (DECT) acquires two spectrally distinct datasets and reconstructs energy-selective (virtual monoenergetic [VM]) and material-selective (material decomposition) images. However, DECT increases system complexity and radiation dose compared with single-spectrum CT. In this paper, a deep learning approach is presented to produce VM images from single-spectrum CT images. Specifically, a modified residual neural network (ResNet) model is developed to map single-spectrum CT images to VM images at pre-specified energy levels. This network is trained on clinical DECT data and shows excellent convergence behavior and image accuracy compared with VM images produced by DECT. The trained model produces high-quality approximations of VM images with a relative error of less than 2%. This method enables multi-material decomposition into three tissue classes, with accuracy comparable with DECT.","DUAL-ENERGY CT,TOMOGRAPHY PHYSICAL PRINCIPLES,LOW-DOSE CT,COMPUTED-TOMOGRAPHY,ATTENUATION COEFFICIENTS,DECOMPOSITION,NETWORK,USAGE",Article,"ELSEVIER, RADARWEG 29, 1043 NX AMSTERDAM, NETHERLANDS",Computer Science,,,"DUAL-ENERGY,CT,TOMOGRAPHY,PHYSICAL,PRINCIPLES,LOW-DOSE,CT,COMPUTED-TOMOGRAPHY,ATTENUATION,COEFFICIENTS,DECOMPOSITION,NETWORK,USAGE",PATTERNS,https://www.ncbi.nlm.nih.gov/pmc/articles/PMC7691386,
67,Chemical Robotics Enabled Exploration of Stability in Multicomponent Lead Halide Perovskites via Machine Learning,5,11,3426-3436,"Higgins Kate,Valleti Sai Mani,Ziatdinov Maxim,Kalinin Sergei V,Ahmadi Mahshid","Higgins K,Valleti SM,Ziatdinov M,Kalinin SV,Ahmadi M",Ahmadi M,10.1021/acsenergylett.0c01749,University of Tennessee System,"Metal halide perovskites have attracted immense interest as a promising material for a variety of optoelectronic and sensing applications. However, issues regarding long-term stability have emerged as the key bottleneck for commercialization. Here, we develop an automated experimental workflow based on combinatorial synthesis and rapid throughput characterization to explore long-term stability of these materials in ambient conditions. We apply it to four model perovskite systems: MA(x)FA(y)Cs(1-x-)(y)PbBr(3), MA(x)FA(y)Cs(1-x-)(y)PbI(3), Cs(x)FA(y)MA(1-x-y)Pb(Brx+yI1-x-y)(3), and Cs(x)MA(y)FA(1-x-y)Pb(Ix+yBr1-x-y)(3). Non-negative matrix factorization and Gaussian process regression are used to interpolate the photoluminescent behavior of the phase diagram. This interpolative regression analysis helps to distinguish mixtures that form solid solutions from those that segregate into multiple materials, pointing out the most stable regions of the phase diagram. We find stability dependence on composition to be nonuniform within the composition space, suggesting the presence of potential preferential compositional regions. This proposed workflow is universal and can be applied to other solution-processable materials.",,Article,"AMER CHEMICAL SOC, 1155 16TH ST, NW, WASHINGTON, DC 20036 USA","Chemistry,Electrochemistry,Energy & Fuels,Science & Technology - Other Topics,Materials Science",,22.423,,ACS ENERGY LETTERS,,
68,The Future of Memristors: Materials Engineering and Neural Networks,31,8,,"Sun Kaixuan,Chen Jingsheng,Yan Xiaobing","Sun KX,Chen JS,Yan XB",Yan XB,10.1002/adfm.202006773,Hebei University,"From Deep Blue to AlphaGo, artificial intelligence and machine learning are booming, and neural networks have become the hot research direction. However, due to the size limit of complementary metal-oxide-semiconductor (CMOS) transistors, von Neumann-based computing systems are facing multiple challenges (such as memory walls). As the number of transistors required by the neural network increases, the development of neural networks based on the von Neumann computer is limited by volume and energy consumption. As the fourth basic circuit element, memristor shines in the field of neuromorphic computing. The new computer architecture based on memristor is widely considered as a substitute for the von Neumann architecture and has great potential to deal with the neural network and big data era challenge. This article reviews existing materials and structures of memristors, neurophysiological simulations based on memristors, and applications of memristor-based neural networks. The feasibility and advancement of implementing neural networks using memristors are discussed, the difficulties that need to be overcome at this stage are put forward, and their development prospects and challenges faced are also discussed.","artificial synapses,memristor,neural networks,neuromorphic calculations,resistive switching mechanism",Review,"WILEY-V C H VERLAG GMBH, POSTFACH 101161, 69451 WEINHEIM, GERMANY","Chemistry,Science & Technology - Other Topics,Materials Science,Physics",,18.125,"RESISTIVE,SWITCHING,MEMORY,PHASE-CHANGE,MATERIALS,FUNCTIONALIZED,GRAPHENE,PATTERN-CLASSIFICATION,DEPENDENT,PLASTICITY,SYNAPTIC,PLASTICITY,ARTIFICIAL,SYNAPSES,TERM-MEMORY,OXIDE,DEVICES",ADVANCED FUNCTIONAL MATERIALS,,
69,Update on coronary CT-more than just anatomical imaging? Current guidelines and functional CT techniques for the quantification of stenoses,60,12,1131-1141,"Soschynski Martin,Taron Jana,Schlett Christopher L.,Bamberg Fabian,Krauss Tobias","Soschynski M,Taron J,Schlett CL,Bamberg F,Krauss T",Soschynski M,10.1007/s00117-020-00767-2,University of Freiburg,"Background Coronary CT angiography (cCTA) has a high negative predictive value for ruling out significant coronary stenoses. However, it is limited in determining hemodynamic significance of a stenosis and hence to prove the indication for therapy. Objectives When and how is cCTA used according to current guidelines? Which functional CT techniques are available to test for hemodynamic significance of coronary stenoses? Materials and methods The value of cCTA is explained on the basis of current guidelines by the European Society of Cardiology (ESC) for the diagnosis of chronic coronary syndromes. Functional CT techniques which test for hemodynamic significance of coronary stenoses are myocardial CT-perfusion (CT-P) and CT-based fractional flow reserve (CT-FFR). Results The new ESC guidelines classify cCTA as a class 1 recommendation for diagnosing coronary artery disease in symptomatic patients with low clinical likelihood. If clinical likelihood is high or an at least moderate stenosis is detected with cCTA, noninvasive functional (stress) imaging is preferred. There is a large body of evidence for CT-P and CT-FFR as functional tests. Conclusion In the current guidelines, cCTA is highly recommended for the diagnosis of coronary artery disease. The functional CT techniques CT-P and CT-FFR have shown high diagnostic accuracy for myocardial ischemia of coronary stenoses in many clinical studies. However, these methods are not part of current guidelines yet and clinical adoption is still low.","Coronary artery disease,Myocardial CT perfusion,Fractional flow reserve,Machine learning,Evidence",Article,"SPRINGER HEIDELBERG, TIERGARTENSTRASSE 17, D-69121 HEIDELBERG, GERMANY","Radiology, Nuclear Medicine & Medical Imaging",,0.526,"COMPUTED-TOMOGRAPHY,HEART-DISEASE,TASK-FORCE,CARDIOLOGY,SOCIETY,ANGIOGRAPHY,ASSOCIATION,RADIOLOGY",RADIOLOGE,,
70,Modelling burning thermonuclear plasma,378,2184,,"Rose S. J.,Hatfield P. W.,Scott R. H. H.","Rose SJ,Hatfield PW,Scott RHH",Rose SJ,10.1098/rsta.2020.0014,Imperial College London,"Considerable progress towards the achievement of thermonuclear burn using inertial confinement fusion has been achieved at the National Ignition Facility in the USA in the last few years. Other drivers, such as the Z-machine at Sandia, are also making progress towards this goal. A burning thermonuclear plasma would provide a unique and extreme plasma environment; in this paper we discuss (a) different theoretical challenges involved in modelling burning plasmas not currently considered, (b) the use of novel machine learning-based methods that might help large facilities reach ignition, and (c) the connections that a burning plasma might have to fundamental physics, including quantum electrodynamics studies, and the replication and exploration of conditions that last occurred in the first few minutes after the Big Bang. This article is part of a discussion meeting issue 'Prospects for high gain inertial fusion energy (part 1)'.","fusion,plasma,machine learning",Article,"ROYAL SOC, 6-9 CARLTON HOUSE TERRACE, LONDON SW1Y 5AG, ENGLAND",Science & Technology - Other Topics,,4.542,FUSION,PHILOSOPHICAL TRANSACTIONS OF THE ROYAL SOCIETY A-MATHEMATICAL PHYSICAL AND ENGINEERING SCIENCES,http://purl.org/net/epubs/manifestation/47775685/STFC-AAM-2020-057.pdf,
71,Toward Learning Machines at a Mother and Baby Unit,11,,,"Boman Magnus,Downs Johnny,Karali Abubakrelsedik,Pawlby Susan","Boman M,Downs J,Karali A,Pawlby S",Boman M,10.3389/fpsyg.2020.567310,Royal Institute of Technology,"Agnostic analyses of unique video material from a Mother and Baby Unit were carried out to investigate the usefulness of such analyses to the unit. The goal was to improve outcomes: the health of mothers and their babies. The method was to implement a learning machine that becomes more useful over time and over task. A feasible set-up is here described, with the purpose of producing intelligible and useful results to healthcare professionals at the unit by means of a vision processing pipeline, grouped together with multi-modal capabilities of handling annotations and audio. Algorithmic bias turned out to be an obstacle that could only partly be handled by modern pipelines for automated feature analysis. The professional use of complex quantitative scoring for various mental health-related assessments further complicated the automation of laborious tasks. Activities during the MBU stay had previously been shown to decrease psychiatric symptoms across diagnostic groups. The implementation and first set of experiments on a learning machine for the unit produced the first steps toward explaining why this is so, in turn enabling decision support to staff about what to do more and what to do less of.","learning machine,machine learning,multi-modal learning,mental health,maternal unresponsiveness,mind-mindedness",Article,"FRONTIERS MEDIA SA, AVENUE DU TRIBUNAL FEDERAL 34, LAUSANNE, CH-1015, SWITZERLAND",Psychology,,3.618,"FACIAL,EXPRESSION,RECOGNITION,HEALTH",FRONTIERS IN PSYCHOLOGY,https://kclpure.kcl.ac.uk/ws/files/140710952/fpsyg_11_567310.pdf,
72,,,,,,,,,,,,,,,,,,,,
73,,,,,,,,,,,,,,,,,,,,
74,,,,,,,,,,,,,,,,,,,,
75,An Efficient Deep Learning Scheme To Predict the Electronic Structure of Materials and Molecules: The Example of Graphene-Derived Allotropes,124,45,9496-9502,"del Rio Beatriz G.,Kuenneth Christopher,Huan Doan Tran,Ramprasad Rampi","del Rio BG,Kuenneth C,Tran HD,Ramprasad R",Ramprasad R,10.1021/acs.jpca.0c07458,University System of Georgia,"Computations based on density functional theory (DFT) are transforming various aspects of materials research and discovery. However, the effort required to solve the central equation of DFT, namely the Kohn-Sham equation, which remains a major obstacle for studying large systems with hundreds of atoms in a practical amount of time with routine computational resources. Here, we propose a deep learning architecture that systematically learns the input-output behavior of the Kohn-Sham equation and predicts the electronic density of states, a primary output of DFT calculations, with unprecedented speed and chemical accuracy. The algorithm also adapts and progressively improves in predictive power and versatility as it is exposed to new diverse atomic configurations. We demonstrate this capability for a diverse set of carbon allotropes spanning a large configurational and phase space. The electronic density of states, along with the electronic charge density, may be used downstream to predict a variety of materials properties, bypassing the Kohn-Sham equation, leading to an ultrafast and high-fidelity DFT emulator.","TOTAL-ENERGY CALCULATIONS,DENSITY,LITHIUM,DESIGN",Article,"AMER CHEMICAL SOC, 1155 16TH ST, NW, WASHINGTON, DC 20036 USA","Chemistry,Physics",,2.725,"TOTAL-ENERGY,CALCULATIONS,DENSITY,LITHIUM,DESIGN",JOURNAL OF PHYSICAL CHEMISTRY A,,
76,Use of remote sensing to track postindustrial vegetation development,32,3,1426-1439,"Wozniak Gabriela,Dyderski Marcin K.,Kompala-Baba Agnieszka,Jagodzinski Andrzej M.,Pasierbinski Andrzej,Blonska Agnieszka,Bierza Wojciech,Magurno Franco,Sierka Edyta","Wozniak G,Dyderski MK,Kompala-Baba A,Jagodzinski AM,Pasierbinski A,Blonska A,Bierza W,Magurno F,Sierka E",Blonska A,10.1002/ldr.3789,University of Silesia in Katowice,"The effects of natural processes on deposited mineral material of postindustrial sites is underestimated. Natural vegetation development on mineral material substratum is an unappreciated way of site management. Due to the classification-based approach to assembly of plant community diversity, remote sensing methods have limited application. We aimed to assess whether remotely sensed data allow for building predictive models, able to recognise vegetation variability along the main gradients of species composition. We assessed vegetation in 321 study plots on four coal-mine spoil heaps in Silesia (S Poland). We determined the main gradients of species composition using detrended correspondence analysis (DCA), and we identified how DCA scores describe vegetation variability. DCA axes explained 38.5%, 35.4%, 31.4%, and 20.1% of species composition variability. We built machine learning models of DCA scores using multispectral satellite images and airborne laser scanning data as predictors. We obtained good predictive power of models for the first two DCA axes (R-2 = 0.393 and 0.443, root mean square errors, RMSE = 0.571 and 0.526) and low power for the third and fourth DCA axes (R-2 = 0.216 and 0.064, RMSE = 0.513 and 0.361). These scores allowed us to prepare a vegetation map based on DCA scores, and distinguish meadow-like from forest-edge-like vegetation, and to identify thermophilous and highly productive vegetation patches. Our approach allowed us to account for species composition gradients, which improved remote sensing-based vegetation surveys. This method may be used for planning future management.","coal mine,digital elevation model,ordination,random forest,vegetation continuum,WORLDVIEW&#8208,2",Article,"WILEY, 111 RIVER ST, HOBOKEN 07030-5774, NJ USA","Environmental Sciences & Ecology,Agriculture",,5.291,"PLANT,FUNCTIONAL,TYPES,SPONTANEOUS,SUCCESSION,SPECIES,COMPOSITION,SPOIL,HEAPS,BIOMASS,LAYER,LEAF,SPECTROSCOPY,REFLECTANCE,COMMUNITIES",LAND DEGRADATION & DEVELOPMENT,,
77,Thermodynamic g(E) Models and Equations of State for Electrolytes in a Water-Poor Medium: A Review,65,11,5073-5082,Held Christoph,Held C,Held C,10.1021/acs.jced.0c00812,Dortmund University of Technology,"Research on the thermodynamics of electrolytes is timeless, and modeling an electrolyte solution might be considered to be a golden oldie, which was, is, and will be important in the design of processes and new materials in the future. The reason is that electrolytes play important roles in different scientific disciplines, such as material development, technical processes (chemical industry, biotechnology, and pharma and food industries), and most recently the energy sector. Closely connected is the further development of advanced thermodynamic models. The age of digitalization requires robust physical models as the basis for static and dynamic process modeling, and that will provide the basis for surrogate approaches in future machine learning developments. This all brings thermodynamic modeling to a consideration of its most important feature. There are many thermodynamic approaches which have been developed to correlate, model, and predict the properties and phase behavior of electrolytes. Usually, this has been very successful for aqueous electrolyte solutions. However, for solutions with poor water content, electrolyte modeling is challenging. This mini-review summarizes the recent advance of thermodynamic models for electrolyte solutions in a water-poor medium and suggests the required theoretical framework.",,Review,"AMER CHEMICAL SOC, 1155 16TH ST, NW, WASHINGTON, DC 20036 USA","Thermodynamics,Chemistry,Engineering",,2.685,,JOURNAL OF CHEMICAL AND ENGINEERING DATA,,
78,Weakly supervised retinal vessel segmentation algorithm without groundtruth,56,23,1235-+,"Lu Zheng,Chen Dali,Xue Dingyu","Lu Z,Chen DL,Xue DY",Chen DL,10.1049/el.2020.1893,Northeastern University - China,"In the current image processing field, medical image segmentation needs a lot of groundtruths, and the process of making these groundtruths is time-consuming and laborious. Thus, a novel retinal vessel segmentation algorithm without groundtruth is proposed in this Letter. The hierarchical clustering algorithm is first used to binary classify vessel and non-vessel pixels. Then classification results based on DRIVE databases are used as pseudo groundtruths to train the neural networks and transfer learning is considered for subsequent processing. Next the trained network is used as the feature extraction tool, by calculating and comparing the difference of image features between the target domain data (DRIVE database) and the source domain data (STARE, CHASE DB1, and HRF databases) extracted from the network. The data required for training is expanded based on semi-supervised clustering in this image feature space, finally the deep neural network is further fine-tuned. Experiments on the publicly available fundus image dataset DRIVE demonstrate that the proposed method outperforms many other state-of-the-art weakly supervised and unsupervised methods.","BLOOD-VESSELS,IMAGES",Article,"INST ENGINEERING TECHNOLOGY-IET, MICHAEL FARADAY HOUSE SIX HILLS WAY STEVENAGE, HERTFORD SG1 2AY, ENGLAND",Engineering,,1.261,"BLOOD-VESSELS,IMAGES",ELECTRONICS LETTERS,,
79,Lateral confinement of high-impedance surface-waves through reinforcement learning,56,23,1262-+,"Morocho-Cayamcela M. E.,Lim W.","Morocho-Cayamcela ME,Lim W",Lim W,10.1049/el.2020.1977,Kumoh National University Technology,"The authors present a model-free policy-based reinforcement learning model that introduces perturbations on the pattern of a metasurface. The objective is to learn a policy that changes the size of the patches, and therefore the impedance in the sides of an artificially structured material. The proposed iterative model assigns the highest reward when the patch sizes allow the transmission along a constrained path and penalties when the patch sizes make the surface wave radiate to the sides of the metamaterial. After convergence, the proposed model learns an optimal patch pattern that achieves lateral confinement along the metasurface. Simulation results show that the proposed learned-pattern can effectively guide the electromagnetic wave through a metasurface, maintaining its instantaneous eigenstate when the homogeneity is perturbed. Moreover, the pattern learned to prevent reflections by changing the patch sizes adiabatically. The reflection coefficient S-1,S- 2 shows that most of the power gets transferred from the source to the destination with the proposed design.",,Article,"INST ENGINEERING TECHNOLOGY-IET, MICHAEL FARADAY HOUSE SIX HILLS WAY STEVENAGE, HERTFORD SG1 2AY, ENGLAND",Engineering,,1.261,,ELECTRONICS LETTERS,,
80,,,,,,,,,,,,,,,,,,,,
81,The joint automated repository for various integrated simulations (JARVIS) for data-driven materials design,6,1,,"Choudhary Kamal,Garrity Kevin F.,Reid Andrew C. E.,DeCost Brian,Biacchi Adam J.,Hight Walker Angela R.,Trautt Zachary,Hattrick-Simpers Jason,Kusne A. Gilad,Centrone Andrea","Choudhary K,Garrity KF,Reid ACE,DeCost B,Biacchi AJ,Walker AHR,Trautt Z,Hattrick-Simpers J,Kusne AG,Centrone A",Choudhary K,10.1038/s41524-020-00440-1,National Institute of Standards & Technology (NIST) - USA,"The Joint Automated Repository for Various Integrated Simulations (JARVIS) is an integrated infrastructure to accelerate materials discovery and design using density functional theory (DFT), classical force-fields (FF), and machine learning (ML) techniques. JARVIS is motivated by the Materials Genome Initiative (MGI) principles of developing open-access databases and tools to reduce the cost and development time of materials discovery, optimization, and deployment. The major features of JARVIS are: JARVIS-DFT, JARVIS-FF, JARVIS-ML, and JARVIS-tools. To date, JARVIS consists of approximate to 40,000 materials and approximate to 1 million calculated properties in JARVIS-DFT, approximate to 500 materials and approximate to 110 force-fields in JARVIS-FF, and approximate to 25 ML models for material-property predictions in JARVIS-ML, all of which are continuously expanding. JARVIS-tools provides scripts and workflows for running and analyzing various simulations. We compare our computational data to experiments or high-fidelity computational methods wherever applicable to evaluate error/uncertainty in predictions. In addition to the existing workflows, the infrastructure can support a wide variety of other technologically important applications as part of the data-driven materials design paradigm. The JARVIS datasets and tools are publicly available at the website: https://jarvis.nist.gov.","TOTAL-ENERGY CALCULATIONS,THROUGHPUT,TOOL,LIBRARY",Article,"NATURE RESEARCH, HEIDELBERGER PLATZ 3, BERLIN, 14197, GERMANY","Chemistry,Materials Science",,13.993,"TOTAL-ENERGY,CALCULATIONS,THROUGHPUT,TOOL,LIBRARY",NPJ COMPUTATIONAL MATERIALS,https://www.nature.com/articles/s41524-020-00440-1.pdf,
