,title,Volume,Issue,Pages,whole__author_name,simply_author_name,reprint author,DOI,reprint address,Abstract,Keywords,Document Type,Publisher,Research Domain,Published Date,impact_factor,Keywords_plus,joural,pdf_link,Download_SuccessOrDefeat
34,A deep learning oriented method for automated 3D reconstruction of carotid arterial trees from MR imaging,,,2408-2411,"Tsakanikas Vassilis D.,Siogkas Panagiotis K.,Mantzaris Michalis D.,Potsika Vassiliki T.,Kigka Vassiliki I,Exarchos Themis P.,Koncar Igor B.,Jovanovic Marija,Vujcic Aleksandra,Ducic Stefan","Tsakanikas VD,Siogkas PK,Mantzaris MD,Potsika VT,Kigka VI,Exarchos TP,Koncar IB,Jovanovic M,Vujcic A,Ducic S",Siogkas PK,,University of Ioannina,"The scope of this paper is to present a new carotid vessel segmentation algorithm implementing the U-net based convolutional neural network architecture. With carotid atherosclerosis being the major cause of stroke in Europe, new methods that can provide more accurate image segmentation of the carotid arterial tree and plaque tissue can help improve early diagnosis, prevention and treatment of carotid disease. Herein, we present a novel methodology combining the U-net model and morphological active contours in an iterative framework that accurately segments the carotid lumen and outer wall. The method automatically produces a 3D meshed model of the carotid bifurcation and smaller branches, using multispectral MR image series obtained from two clinical centres of the TAXINOMISIS study. As indicated by a validation study, the algorithm succeeds high accuracy (99.1% for lumen area and 92.6% for the perimeter) for lumen segmentation. The proposed algorithm will be used in the TAXINOMISIS study to obtain more accurate 3D vessel models for improved computational fluid dynamics simulations and the development of models of atherosclerotic plaque progression.","MAGNETIC-RESONANCE IMAGES,LUMEN SEGMENTATION,WALL,QUANTIFICATION",Proceedings Paper,"IEEE, 345 E 47TH ST, NEW YORK, NY 10017 USA",Engineering,,,"MAGNETIC-RESONANCE,IMAGES,LUMEN,SEGMENTATION,WALL,QUANTIFICATION",,https://zenodo.org/record/3968549/files/EMBC_2020_TAXINOMISIS.pdf,
35,An online deep convolutional polyp lesion prediction over Narrow Band Imaging (NBI),,,2412-2415,"Sierra Franklin,Gutierrez Yesid,Martinez Fabio","Sierra F,Gutierrez Y,Martinez F",Martinez F,,Universidad Industrial de Santander,"Polyps, represented as abnormal protuberances along intestinal track, are the main biomarker to diagnose gastrointestinal cancer. During routine colonoscopies such polyps are localized and coarsely characterized according to microvascular and surface textural patterns. Narrow-band imaging (NBI) sequences have emerged as complementary technique to enhance description of suspicious mucosa surfaces according to blood vessels architectures. Nevertheless, a high number of misleading polyp characterization, together with expert dependency during evaluation, reduce the possibility of effective disease treatments. Additionally, challenges during colonoscopy, such as abrupt camera motions, changes of intensity and artifacts, difficult the diagnosis task. This work introduces a robust frame-level convolutional strategy with the capability to characterize and predict hyperplastic, adenomas and serrated polyps over NBI sequences. The proposed strategy was evaluated over a total of 76 videos achieving an average accuracy of 90,79% to distinguish among these three classes. Remarkably, the approach achieves a 100% of accuracy to differentiate intermediate serrated polyps, whose evaluation is challenging even for expert gastroenterologist. The approach was also favorable to support polyp resection decisions, achieving perfect score on evaluated dataset.","Colorectal cancer,Narrow Band Imaging,online polyp classification",Proceedings Paper,"IEEE, 345 E 47TH ST, NEW YORK, NY 10017 USA",Engineering,,,"COLORECTAL,POLYPS,CLASSIFICATION,CANCER",,,
36,Development and Evaluation of Machine Learning Models for Recovery Prediction after Treatment for Traumatic Brain Injury,,,2416-2420,"Radabaugh Hannah L.,Bonnell Jerry,Dietrich W. Dalton,Bramlett Helen M.,Schwartz Odelia,Sarkar Dilip","Radabaugh HL,Bonnell J,Dietrich WD,Bramlett HM,Schwartz O,Sarkar D",Radabaugh HL,,University of Miami,"Traumatic brain injury (TBI) is a leading cause of death and disability yet treatment strategies remain elusive. Advances in machine learning present exciting opportunities for developing personalized medicine and informing laboratory research. However, their feasibility has yet to be widely assessed in animal research where data are typically limited or in the TBI field where each patient presents with a unique injury. The Operation Brain Trauma Therapy (OBTT) has amassed an animal dataset that spans multiple types of injury, treatment strategies, behavioral assessments, histological measures, and biomarker screenings. This paper aims to analyze these data using supervised learning techniques for the first time by partitioning the dataset into acute input metrics (i.e. 7 days post-injury) and a defined recovery outcome (i.e. memory retention). Preprocessing is then applied to transform the raw OBTT dataset, e.g. developing a class attribute by histogram binning, eliminating borderline cases, and applying principal component analysis (PCA). We find that these steps are also useful in establishing a treatment ranking; Minocycline, a therapy with no significant findings in the OBTT analyses, yields the highest percentage recovery in our ranking. Furthermore, of the seven classifiers we have evaluated, Naive Bayes achieves the best performance (67%) and yields significant improvement over our baseline model on the preprocessed dataset with borderline elimination. We also investigate the effect of testing on individual treatment groups to evaluate which groups are difficult to classify, and note the interpretive qualities of our model that can be clinically relevant.",,Proceedings Paper,"IEEE, 345 E 47TH ST, NEW YORK, NY 10017 USA",Engineering,,,,,,
37,Automated Assessment of Neonatal Endotracheal Intubation Measured by a Virtual Reality Simulation System,,,2429-2433,"Xiao Xiao,Zhao Shang,Zhang Xiaoke,Soghier Lamia,Hahn James","Xiao X,Zhao S,Zhang XK,Soghier L,Hahn J",Xiao X,,George Washington University,"Manual assessment from experts in neonatal endotracheal intubation (ETI) training is a time-consuming and tedious process. Such subjective, highly variable, and resource-intensive assessment method may not only introduce inter-rater/intra-rater variability, but also represent a serious limitation in many large-scale training programs. Moreover, poor visualization during the procedure prevents instructors from observing the events occurring within the manikin or the patient, which introduces an additional source of error into the assessment. In this paper, we propose a physics-based virtual reality (VR) ETI simulation system that captures the entire motions of the laryngoscope and the endotracheal tube (ETT) in relation to the internal anatomy of the virtual patient. Our system provides a complete visualization of the procedure, offering instructors with comprehensive information for accurate assessment. More importantly, an interpretable machine learning algorithm was developed to automatically assess the ETI performance by training on the performance parameters extracted from the motions and the scores rated by experts. Our results show that the leave-one-out-cross-validation (LOOCV) classification accuracy of the automated assessment algorithm is 80%, which indicates that our system can reliably conduct a consistent and standardized assessment for ETI training.","OROTRACHEAL INTUBATION,MANNEQUIN,SKILLS",Proceedings Paper,"IEEE, 345 E 47TH ST, NEW YORK, NY 10017 USA",Engineering,,,"OROTRACHEAL,INTUBATION,MANNEQUIN,SKILLS",,https://www.ncbi.nlm.nih.gov/pmc/articles/PMC7538655,
38,Subject Independent Dementia Risk Prediction Models Using Paralinguistic and Memory Test Features with Feature Warping,,,2540-2543,"Sriskandaraja Kaavya,Ahmed Beena,Valenzuela Michael","Sriskandaraja K,Ahmed B,Valenzuela M",Sriskandaraja K,,University of New South Wales Sydney,"Clinical and biological changes during the prodromal stages of dementia are both complicated and expensive. A biomarker for cognitive reserve exposure would be highly useful as a dementia risk predictor, but has eluded researchers. Speech, which exhibits disfluencies due to dementia, is a good candidate as it is easy to collect and non-invasive. However, previous studies have only looked at the impact of dementia on speech after diagnosis. Here we extend our previous work that showed paralinguistic features extracted from audio recordings of older participants completing the LOGOS episodic memory test can be used to discriminate between high vs low cognitive reserve, hence low vs high risk of dementia. Specifically, we use the clinically validated Lifetime of Experiences Questionnaire (LEQ) to refine our ground truth estimate of cognitive reserve instead of an abridged version. Also, we improve the generalizability of our system by using feature warping to normalize across speakers. Our k-nearest neighbours (KNN) based classifier achieved an accuracy of 84% when trained with paralinguistic features alone and 91% with paralinguistic and episodic memory features.","COGNITIVE LIFE-STYLE,DISEASE,SPEECH",Proceedings Paper,"IEEE, 345 E 47TH ST, NEW YORK, NY 10017 USA",Engineering,,,"COGNITIVE,LIFE-STYLE,DISEASE,SPEECH",,,
39,Preliminary Results on Density Poincare Plot Based Atrial Fibrillation Detection from Premature Atrial/Ventricular Contractions,,,2594-2597,"Bashar Syed Khairul,Han Dong,Zieneddin Fearass,Ding Eric,Walkey Allan J.,McManus David D.,Chon Ki H.","Bashar SK,Han D,Zieneddin F,Ding E,Walkey AJ,McManus DD,Chon KH",Bashar SK,,University of Connecticut,"Detection of Atrial fibrillation (AF) from premature atrial contraction (PAC) and premature ventricular contraction (PVC) is challenging as frequent occurrences of these ectopic beats can mimic the typical irregular patterns of AF. In this paper, we present a preliminary study of using density Poincare plot based machine learning method to detect AF from PAC/PVCs using electrocardiogram (ECG) recordings. First, we propose creation of this new density Poincare plot which is derived from the difference of the heart rate. Next, from this density Poincare plot, template correlation and discrete wavelet transform are used to extract suitable image-based features, which is followed by infinite latent feature selection algorithm to rank the features. Finally, classification of AF vs PAC/PVC is performed using K-Nearest Neighbor, discriminant analysis and support vector machine (SVM) classifiers. Our method is developed and validated using a subset of Medical Information Mart for Intensive Care (MIMIC) III database containing 8 AF and 8 PAC/PVC subjects. Both 10-fold and leave-one-subject-out cross validations are performed to show the robustness of our proposed method. During the 10-fold cross-validation, SVM achieved the best performance with 99.49% sensitivity, 94.51% specificity and 97.29% accuracy with the extracted features while for the leave-one-subject-out, the highest overall accuracy is 90.91%. Moreover, when compared with two state-of-the-art methods, the proposed algorithm achieves superior AF vs. PAC/PVC discrimination performance.","WAVELET TRANSFORM,CLASSIFICATION",Proceedings Paper,"IEEE, 345 E 47TH ST, NEW YORK, NY 10017 USA",Engineering,,,"WAVELET,TRANSFORM,CLASSIFICATION",,,
40,Schrodinger Spectrum Based PPG Features for the Estimation of the Arterial Blood Pressure,,,2683-2686,"Li Peihao,Laleg-Kirati Taous-Meriem","Li PH,Laleg-Kirati TM",Li PH,,King Abdullah University of Science & Technology,"In this paper, photoplethysmogram (PPG) features are combined with supervised machine learning algorithms to estimate arterial blood pressure (ABP). Three algorithms for the estimation of cuffless ABP using PPG signals are compared. Since PPG signals are measured non-invasively, this method guarantees an individuals comfort while not omitting important ABP information. The proposed framework predicts the ABP values by processing PPG signals with semi-classical signal analysis (SCSA) method, extracting several categories of features, which reflect the PPG signal morphology variations. Then, regression algorithms are selected for the ABP estimation. The proposed method is evaluated based on a virtual dataset with more than four thousand subjects and MIMIC II database with over eight thousand subjects for model training and testing. Mean average error (MAE) and standard deviation (STD) are evaluated for different machine learning algorithms during the prediction and estimation process. Multiple linear regression (MLR) meets the AAMI standard in terms of estimation accuracy, which proves that the ABP can be accurately estimated in a nonintrusive fashion. Given the easy implementation of the ABP estimation method, we regard that the proposed features and machine learning algorithms for the cuffless estimation of the ABP can potentially provide the means for mobile healthcare equipment to monitor the ABP continuously.",WAVES,Proceedings Paper,"IEEE, 345 E 47TH ST, NEW YORK, NY 10017 USA",Engineering,,,WAVES,,,
41,Cuffless Blood Pressure Estimation Using Features Extracted from Carotid Dual-Diameter Waveforms,,,2719-2722,"Ramakrishna Prashanth,Nabeel P. M.,Kiran Raj V,Joseph Jayaraj,Sivaprakasam Mohanasankar","Ramakrishna P,Nabeel PM,Kiran VR,Joseph J,Sivaprakasam M",Ramakrishna P,,New York University,"The major challenges in deep learning approaches to cuffless blood pressure estimation is selecting the most appropriate representative of the blood pulse waveform and extraction of relevant features for data collection. This paper performs an analysis of a novel dataset consisting of 71 features from the carotid dual- diameter waveforms and 4 blood pressure parameters. In particular, the analysis uses gradient boosting and graph-theoretic algorithms to determine (1) features with high predictive power and (2) potential to be pruned. Identifying such features and understanding their physiological significance is important for building blood pressure estimation models using machine learning that is robust across diverse clinical environments and patient sets.",,Proceedings Paper,"IEEE, 345 E 47TH ST, NEW YORK, NY 10017 USA",Engineering,,,,,,
42,Prediction of atherosclerotic disease progression combining computational modelling with machine learning,,,2760-2763,"Sakellarios Antonis I.,Pezoulas Vasileios C.,Bourantas Christos,Naka Katerina K.,Michalis Lampros K.,Serruys Patrick W.,Stone Gregg,Garcia-Garcia Hector M.,Fotiadis Dimitrios I.","Sakellarios AI,Pezoulas VC,Bourantas C,Naka KK,Michalis LK,Serruys PW,Stone G,Garcia-Garcia HM,Fotiadis DI",Fotiadis DI,,University of Ioannina,"Non-invasive serial computed tomography coronary angiography (CTCA) was acquired from 32 patients and 3D reconstruction of 58 coronary arteries was achieved. The arterial geometries were utilized for blood flow and LDL transport modelling. Navier-Stokes and convection-diffusion equations were employed for simulation of blood flow and LDL transport, respectively. Disease progression was assessed comparing the follow-up and baseline arterial models after co-registration using side branches as anatomical landmarks. A machine learning model for predicting disease progression was built using the Gradient Boosted Trees (GBT) algorithm. The Accuracy, Sensitivity, Specificity and AUC of the developed methodology for predicting lumen area decrease equal was 0.68, 0.56, 0.34 and 0.59, respectively. The best results were found for the prediction of plaque area increase by 20%, with 0.73, 0.67, 0.86, and 0.76 accuracy, sensitivity, specificity andAUC, respectively. This approach outperforms significantly the predictive capability of models based on binary logistic regression.","CORONARY ATHEROSCLEROSIS,PLAQUE DEVELOPMENT,NATURAL-HISTORY",Proceedings Paper,"IEEE, 345 E 47TH ST, NEW YORK, NY 10017 USA",Engineering,,,"CORONARY,ATHEROSCLEROSIS,PLAQUE,DEVELOPMENT,NATURAL-HISTORY",,,
43,Prediction of Septic Shock Onset in ICU by Instantaneous Monitoring of Vital Signs,,,2768-2771,"Mollura Maximiliano,Romano Stefano,Mantoan Giulio,Lehman Li-wei,Barbieri Riccardo","Mollura M,Romano S,Mantoan G,Lehman LW,Barbieri R",Mollura M,,Polytechnic University of Milan,"Septic Shock is a critical pathological state that affects patients entering the intensive care unit (ICU). Many studies have been directed to characterize and predict the onset of the septic shock, both in ICU and in the Emergency Department employing data extracted from the Electronic Health Records. Recently, machine learning algorithms have been successfully employed to help characterize septic shock in a more objective and automatic fashion. Only a few of these studies employ information contained in the continuously recorded vital signs such as electrocardiogram and arterial blood pressure. In particular, we have devised a novel feature estimation procedure able to consider instantaneous dynamics related to cardiovascular control. This work aims at developing a short-term prediction algorithm for identifying patients experiencing septic shock among a population of 100 septic patients extracted from the MIMIC-III clinical and waveform database. Among all the results obtained from several trained machine learning models, the best performance reached an AUC on the test set equal to 0.93 (Accuracy=0.85, Sensitivity=0.89 and Specificity=0.82).","INTERNATIONAL CONSENSUS DEFINITIONS,HEART-RATE-VARIABILITY,BLOOD-PRESSURE,SEPSIS,IDENTIFICATION",Proceedings Paper,"IEEE, 345 E 47TH ST, NEW YORK, NY 10017 USA",Engineering,,,"INTERNATIONAL,CONSENSUS,DEFINITIONS,HEART-RATE-VARIABILITY,BLOOD-PRESSURE,SEPSIS,IDENTIFICATION",,,
44,Site specific prediction of PCI stenting based on imaging and biomechanics data using gradient boosting tree ensembles,,,2812-2815,"Kigka Vassiliki I.,Sakellarios Antonis I.,Georga Eleni I.,Siogkas Panagiotis,Tsompou Panagiota,Kyriakidis Savvas,Rocchiccioli Silvia,Pelosi Gualtiero,Naka Katerina,Michalis Lampros K.","Kigka VI,Sakellarios AI,Georga EI,Siogkas P,Tsompou P,Kyriakidis S,Rocchiccioli S,Pelosi G,Naka K,Michalis LK",Fotiadis DI,,University of Ioannina,"Cardiovascular diseases are nowadays considered as the main cause of morbidity and mortality worldwide. Coronary Artery Disease (CAD), the most typical form of cardiovascular disease is diagnosed by a variety of imaging modalities, both invasive and non-invasive, which involve either risk implications or high cost. Therefore, several attempts have been undertaken to early diagnose and predict either the high CAD risk patients or the cardiovascular events, implementing machine learning techniques. The purpose of this study is to present a classification scheme for the prediction of Percutaneous Coronary Intervention (PCI) stenting placement, using image-based data. The proposed classification model is a gradient boosting classifier, incorporated into a class imbalance handling technique, the Easy ensemble scheme and aims to classify coronary segments into high CAD risk and low CAD risk, based on their PCI placement. Through this study, we investigate the importance of image based features, concluding that the combination of the coronary degree of stenosis and the fractional flow reserve achieves accuracy 78%.",,Proceedings Paper,"IEEE, 345 E 47TH ST, NEW YORK, NY 10017 USA",Engineering,,,,,,
45,Classification of Aortic Stenosis Before and After Transcatheter Aortic Valve Replacement Using Cardio-mechanical Modalities,,,2820-2823,"Yang Chenxi,Ojha Banish,Aranoff Nicole D.,Green Philip,Tavassolian Negar","Yang CX,Ojha B,Aranoff ND,Green P,Tavassolian N",Tavassolian N,,Stevens Institute of Technology,"This paper reports our study on the impact of transcatheter aortic valve replacement (TAVR) on the classification of aortic stenosis (AS) patients using cardio-mechanical modalities. Machine learning algorithms such as decision tree, random forest, and neural network were applied to conduct two tasks. Firstly, the pre- and post-TAVR data are evaluated with the classifiers trained in the literature. Secondly, new classifiers are trained to classify between pre- and post-TAVR data. Using analysis of variance, the features that are significantly different between pre- and post-TAVR patients are selected and compared to the features used in the pre-trained classifiers. The results suggest that pre-TAVR subjects could be classified as AS patients but post-TAVR could not be classified as healthy subjects. The features which differentiate pre- and post-TAVR patients reveal different distributions compared to the features that classify AS patients and healthy subjects. These results could guide future work in the classification of AS as well as the evaluation of the recovery status of patients after TAVR treatment.",,Proceedings Paper,"IEEE, 345 E 47TH ST, NEW YORK, NY 10017 USA",Engineering,,,,,,
46,Detecting mTBI by Learning Spatio-temporal Characteristics of Widefield Calcium Imaging Data Using Deep Learning,,,2917-2920,"Koochaki Fatemeh,Shamsi Foroogh,Najafizadeh Laleh","Koochaki F,Shamsi F,Najafizadeh L",Koochaki F,,Rutgers State University New Brunswick,"Early diagnosis of mild traumatic brain injury (mTBI) is of great interest to the neuroscience and medical communities. Widefield optical imaging of neuronal populations over the cerebral cortex in animals provides a unique opportunity to study injury-induced alternations in brain function. Using this technique, along with deep learning, the goal of this paper is to develop a framework for the detection of mTBI. Cortical activities in transgenic calcium reporter mice expressing GCaMP6s are obtained using widefield imaging from 8 mice before and after inducing an injury. Two deep learning models for differentiating mTBI from normal conditions are proposed. One model is based on the convolutional neural network-long short term memory (CNN-LSTM), and the second model is based on a 3D-convolutional neural network (3D-CNN). These two models offer the ability to capture features both in the spatial and temporal domains. Results for the average classification accuracy for the CNN-LSTM and the 3D-CNN are 97.24% and 91.34%, respectively. These results are notably higher than the case of using the classical machine learning methods, demonstrating the importance of utilizing both the spatial and temporal information for early detection of mTBI.",TRAUMATIC BRAIN-INJURY,Proceedings Paper,"IEEE, 345 E 47TH ST, NEW YORK, NY 10017 USA",Engineering,,,"TRAUMATIC,BRAIN-INJURY",,,
47,A Multi-view CNN with Novel Variance Layer for Motor Imagery Brain Computer Interface,,,2950-2953,"Mane Ravikiran,Robinson Neethu,Vinod A. P.,Lee Seong-Whan,Guan Cuntai","Mane R,Robinson N,Vinod AP,Lee SW,Guan CT",Guan CT,,Nanyang Technological University & National Institute of Education (NIE) Singapore,"Accurate and robust classification of Motor Imagery (MI) from Electroencephalography (EEG) signals is among the most challenging tasks in Brain-Computer Interface (BCI) field. To address this challenge, this paper proposes a novel, neuro-physiologically inspired convolutional neural network (CNN) named Filter-Bank Convolutional Network (FBCNet) for MI classification. Capturing neurophysiological signatures of MI, FBCNet first creates a multi-view representation of the data by bandpass-filtering the EEG into multiple frequency bands. Next, spatially discriminative patterns for each view are learned using a CNN layer. Finally, the temporal information is aggregated using a new variance layer and a fully connected layer classifies the resultant features into MI classes. We evaluate the performance of FBCNet on a publicly available dataset from Korea University for classification of left vs right hand MI in a subject-specific 10-fold cross-validation setting. Results show that FBCNet achieves more than 6.7% higher accuracy compared to other state-of-the-art deep learning architectures while requiring less than 1% of the learning parameters. We explain the higher classification accuracy achieved by FBCNet using feature visualization where we show the superiority of FBCNet in learning interpretable and highly generalizable discriminative features. We provide the source code of FBCNet for reproducibility of results.",,Proceedings Paper,"IEEE, 345 E 47TH ST, NEW YORK, NY 10017 USA",Engineering,,,,,,
