,title,Volume,Issue,Pages,whole__author_name,simply_author_name,reprint author,DOI,reprint address,Abstract,Keywords,Document Type,Publisher,Research Domain,Published Date,impact_factor,Keywords_plus,joural,pdf_link,Download_SuccessOrDefeat
63,Reinforcement Learning based Decoding Using Internal Reward for Time Delayed Task in Brain Machine Interfaces,,,3351-3354,"Shen Xiang,Zhang Xiang,Huang Yifan,Chen Shuhang,Wang Yiwen","Shen X,Zhang X,Huang YF,Chen SH,Wang YW",Wang YW,,Hong Kong University of Science & Technology,"Reinforcement learning (RL) algorithm interprets neural signals into movement intentions with the guidance of the reward in Brain-machine interfaces (BMIs). Current RL algorithms generally work for the tasks with immediate rewards delivery, and lack of efficiency in delayed reward task. Prefrontal cortex, including medial prefrontal cortex(mPFC), has been demonstrated to assign credit to intermediate steps, which reinforces preceding action more efficiently. In this paper, we propose to simulate the functionality of mPFC activities as intermediate rewards to train a RL based decoder in a two-step movement task. A support vector machine (SVM) is adopted to verify if the subject expects a reward due to the accomplishment of a subtask from mPFC activity. Then this discrimination result will be utilized to guide the training of the RL decoder for each step respectively. Here, we apply the Sarsa-style attention-gated reinforcement learning (SAGREL) as the decoder to interpret motor cortex(M1) activity to action states. We test on in vivo primary motor cortex (M1) and mPFC data collected from rats, where the rats need to first trigger the start and then press lever for rewards using M1 signals. SAGREL using intermediate rewards from mPFC activities achieves a prediction accuracy of 66.8% +/- 2.0.% (mean +/- std) %, which is significantly better than the one using the reward by the end of trial (45.9.% +/- 1.2%). This reveals the potentials of modelling mPFC activities as intermediate rewards for the delayed reward tasks.",NEURONS,Proceedings Paper,"IEEE, 345 E 47TH ST, NEW YORK, NY 10017 USA",Engineering,,,NEURONS,,,
64,Enhancing performance of SSVEP-based BCI by unsupervised learning information from test trials,,,3359-3362,"Wang Lijie,Xu Minpeng,Mei Jie,Han Jin,Wang Yijun,Jung Tzyy-Ping,Ming Dong","Wang LJ,Xu MP,Mei J,Han J,Wang YJ,Jung TP,Ming D",Xu MP,,Tianjin University,"Steady-State Visual Evoked Potentials (SSVEPs) have become one of the most used neural signals for brain-computer interfaces (BCIs) due to their stability and high signal-to-noise rate. However, the performance of SSVEP-based BCIs would degrade with a few training samples. This study was proposed to enhance the detection of SSVEP by combining the supervised learning information from training samples and the unsupervised learning information from the trial to be tested. A new method, i.e. cyclic shift trials (CST), was proposed to generate new calibration samples from the test data, which were furtherly used to create the templates and spatial filters of task-related component analysis (TRCA). The test-trial templates and spatial filters were combined with training-sample templates and spatial filters to recognize SSVEP. The proposed algorithm was tested on a benchmark dataset. As a result, it reached significantly higher classification accuracy than traditional TRCA when only two training samples were used. Specifically, the accuracy was improved by 9.5% for 0.7s data. Therefore, this study demonstrates CST is effective to improve the performance of SSVEP-BCI.","Steady-State Visual Evoked Potentials (SSVEPs),Brain-Computer Interfaces (BCIs),cyclic shift trials(CST),task-related component analysis (TRCA)",Proceedings Paper,"IEEE, 345 E 47TH ST, NEW YORK, NY 10017 USA",Engineering,,,STEADY-STATE,,,
65,Electrophysiological Correlates of Brain Health Help Diagnose Epilepsy and Lateralize Seizure Focus,,,3460-3464,"Varatharajah Yogatheesan,Berry Brent,Joseph Boney,Balzekas Irena,Kremen Vaclav,Brinkmann Benjamin,Worrell Gregory,Iyer Ravishankar","Varatharajah Y,Berry B,Joseph B,Balzekas I,Kremen V,Brinkmann B,Worrell G,Iyer R",Varatharajah Y,,University of Illinois System,"The absence of epileptiform activity in a scalp electroencephalogram (EEG) recorded from a potential epilepsy patient can cause delays in clinical care delivery. Here we present a machine-learning-based approach to find evidence for epilepsy in scalp EEGs that do not contain any epileptiform activity, according to expert visual review (i.e., ""normal"" EEGs). We found that deviations in the EEG features representing brain health, such as the alpha rhythm, can indicate the potential for epilepsy and help lateralize seizure focus, even when commonly recognized epileptiform features are absent. Hence, we developed a machine-learning-based approach that utilizes alpha-rhythm-related features to classify 1) whether an EEG was recorded from an epilepsy patient, and 2) if so, the seizure-generating side of the patient's brain. We evaluated our approach using ""normal"" scalp EEGs of 48 patients with drug-resistant focal epilepsy and 144 healthy individuals, and a naive Bayes classifier achieved area under ROC curve (AUC) values of 0.81 and 0.72 for the two classification tasks, respectively. These findings suggest that our methodology is useful in the absence of interictal epileptiform activity and can enhance the probability of diagnosing epilepsy at the earliest possible time.","EEG,CLASSIFICATION,RECURRENCE,ACCURACY",Proceedings Paper,"IEEE, 345 E 47TH ST, NEW YORK, NY 10017 USA",Engineering,,,"EEG,CLASSIFICATION,RECURRENCE,ACCURACY",,,
66,Deep Canonical Correlation Analysis For Decoding The Auditory Brain,,,3505-3508,"Katthi Jaswanth Reddy,Ganapathy Sriram,Kothinti Sandeep,Slaney Malcolm","Katthi JR,Ganapathy S,Kothinti S,Slaney M",Katthi JR,,Indian Institute of Science (IISC) - Bangalore,"The process of decoding the auditory brain for an acoustic stimulus involves finding the relationship between the audio input and the brain activity measured in terms of Electroencephalography (EEG) recordings. Prior methods focus on linear analysis methods like Canonical Correlation Analysis (CCA) to establish a relationship. In this paper, we present a deep learning framework that is learned to maximize correlation. For dealing with high levels of noise in EEG data, we employ regularization techniques and experiment with various model architectures. With a paired dataset of audio envelope and EEG, we perform several experiments with deep correlation analysis using forward and backward correlation models. In these experiments, we show that regularized deep CCA is consistently able to outperform the linear models in terms of providing improved correlation (up to 9% absolute improvement in Pearson correlation which is statistically significant). We present an analysis that highlights the benefits of using dropouts for neural network regularization in the deep CCA model.",,Proceedings Paper,"IEEE, 345 E 47TH ST, NEW YORK, NY 10017 USA",Engineering,,,,,,
67,Temporal dependency in automatic sleep scoring via deep learning based architectures: An empirical study,,,3509-3512,"Fiorillo Luigi,Wand Michael,Marino Italo,Favaro Paolo,Faraci Francesca D.","Fiorillo L,Wand M,Marino I,Favaro P,Faraci FD",Fiorillo L,,"Univ Appl Sci & Arts Southern Switzerland, Inst Informat Syst & Networking, Manno, Switzerland.","The present study evaluates how effectively a deep learning based sleep scoring system does encode the temporal dependency from raw polysomnography signals. An exhaustive range of neural networks, including state of the art architecture, have been used in the evaluation. The architectures have been assessed using a single-channel EEG Fpz-Cz from the open source Sleep-EDF expanded database. The best performing model reached an overall accuracy of 85.2% and a Cohen's kappa of 0.8, with an F1-score of stage N1 equal to 50.2%. We have introduced a new metric, delta(norm), to better evaluate temporal dependencies. A simple feed forward architecture not only achieves comparable performance to most up-to-date complex architectures, but also does better encode the continuous temporal characteristics of sleep.",,Proceedings Paper,"IEEE, 345 E 47TH ST, NEW YORK, NY 10017 USA",Engineering,,,,,,
68,Parametric evaluation of deep brain stimulation parameter configurations for Parkinson's disease using a conformal wearable and wireless inertial sensor system and machine learning,,,3606-3611,"LeMoyne Robert,Mastroianni Timothy,Whiting Donald,Tomycz Nestor","LeMoyne R,Mastroianni T,Whiting D,Tomycz N",LeMoyne R,,Northern Arizona University,"Deep brain stimulation enables highly specified patient-unique therapeutic intervention ameliorating the symptoms of Parkinson's disease. Inherent to the efficacy of deep brain stimulation is the acquisition of an optimal parameter configuration. Using conventional methods, the optimization process for tuning the deep brain stimulation system parameters can intrinsically induce strain on clinical resources. An advanced means of quantifying Parkinson's hand tremor and distinguishing between parameter settings would be highly beneficial. The conformal wearable and wireless inertial sensor system, such as the BioStamp nPoint, has a volumetric profile on the order of a bandage that readily enables convenient quantification of Parkinson's disease hand tremor. Furthermore, the BioStamp nPoint has been certified by the FDA as a 510(k) medical device for acquisition of medical grade data. Parametric variation of the amplitude parameter for deep brain stimulation can be quantified through the BioStamp nPoint conformal wearable and wireless inertial sensor system mounted to the dorsum of the hand. The acquired inertial sensor signal data can be wirelessly transmitted to a secure Cloud computing environment for post-processing. The quantified inertial sensor data for the parametric study of the effects of varying amplitude can be distinguished through machine learning classification. Software automation through Python can consolidate the inertial sensor data into a suitable feature set format. Using the multilayer perceptron neural network considerable machine learning classification accuracy is attained to distinguish multiple parametric settings of amplitude for deep brain stimulation, such as 4.0 mA, 2.5 mA, 1.0 mA, and 'Off' status representing a baseline. These findings constitute an advance toward the pathway of attaining real-time closed loop automated parameter configuration tuning for treatment of Parkinson's disease using deep brain stimulation.","Parkinson's disease,movement disorder,deep brain stimulation,parameter configuration,amplitude,optimization,conformal wearable,wireless inertial sensor,Cloud computing,BioStamp nPoint,Python,machine learning,multilayer perceptron neural network",Proceedings Paper,"IEEE, 345 E 47TH ST, NEW YORK, NY 10017 USA",Engineering,,,"MOVEMENT-DISORDERS,ESSENTIAL,TREMOR,THALAMOTOMY,QUANTIFICATION,NUCLEUS,GAIT",,,
69,Estimation of Parkinson's disease severity from voice features of vowels and consonant,,,3666-3669,"Viswanathan Rekha,Arjunan Sridhar P.,Kempster Peter);,Raghav Sanjay,Kumar Dinesh","Viswanathan R,Arjunan SP,Kempster P,Raghav S,Kumar D",Arjunan SP,,SRM Institute of Science & Technology Chennai,"This study has investigated the efficiency of voice features in estimating the motor Unified Parkinson's Disease Rating Scale (UPDRS) score in Parkinson's disease (PD) patients. A total of 26 PD patients (mean age = 72) and 22 control subjects (mean age = 66.91) were recruited for the study. The sustained phonation /a/, /u/ and /m/ were collected in both off-state and on-state of Levodopa medication. The average motor UPDRS for PD off-state patients was 27.31, on-state was 20.42 and that of controls was 2.63. Voice features were extracted from the phonation tasks and were reduced to the most relevant 6 features for each phonation task using the Least Absolute Shrinkage and Selection Operator (LASSO) feature ranking method. The correlation between the reduced features and motor UPDRS was tested using the Spearman correlation coefficient test. AdaBoost regression learner was trained and used for automatically estimating the motor UPDRS score using the voice features. The results show that the vocal features for /m/ performed best by estimating the motor UPDRS score for PD off-state with the mean absolute error (MAE) of 3.52 and 5.90 for PD on-state. This study shows that assessment of voice can be used for day to day remote monitoring of PD patients.","SPEECH,PROGRESSION,LEVODOPA",Proceedings Paper,"IEEE, 345 E 47TH ST, NEW YORK, NY 10017 USA",Engineering,,,"SPEECH,PROGRESSION,LEVODOPA",,,
70,A Classification Approach to Recognize the Firing of Spinal Motoneurons in Amyotrophic Lateral Sclerosis,,,3680-3683,"Abdelaal Amr Y.,Mousa Mohamed H.,Gamal Mai,Khalil Mahmoud I.,Elbasiouny Sherif M.,Eldawlatly Seif","Abdelaal AY,Mousa MH,Gamal M,Khalil MI,Elbasiouny SM,Eldawlatly S",Elbasiouny SM,,Wright State University Dayton,"Amyotrophic Lateral Sclerosis (ALS) is a fatal neurodegenerative disease that affects the nervous system causing muscle weakness, paralysis, leading to death. Given that abnormalities in spinal motoneuron (MN) excitability begin long before symptoms manifest, developing an approach that could recognize fluctuations in MN firing could help in early diagnosis of ALS. This paper introduces a machine learning approach to discriminate between ALS and normal MN firing. The approach is based on two electrophysiological markers; namely, spiking latency and the spike-triggered average signal. The method is examined using data generated from a computational model under systematic variation of MN properties. Such variations mimic the differential dynamic changes in cellular properties that different MN types experience during ALS progression. Our results demonstrate the ability of the approach to accurately recognize ALS firing patterns across the spectrum of examined variations in MN properties.",,Proceedings Paper,"IEEE, 345 E 47TH ST, NEW YORK, NY 10017 USA",Engineering,,,,,,
71,Towards understanding spatio-temporal parkinsonian patterns from salient regions of a 3D convolutional network,,,3688-3691,"Guayacan Luis Carlos,Rangel Edgar,Martinez Fabio","Guayacan LC,Rangel E,Martinez F",Martinez F,,Universidad Industrial de Santander,"Gait motion patterns such as step length, flexed posture, absent arm swing and bradykinesia, constitute the main source of information to describe and quantify Parkinson disease. Nevertheless, such quantification is commonly developed under marker based protocols, losing natural motion gestures, and only taking into account a limited description of the locomotion process. This work introduces a 3D convolutional gait representation, that uses markerless video sequences to automatically predict parkinsonian behaviours. A remarkable contribution herein presented is the quantification of spatio-temporal salient maps, that stand out body regions related with Parkinson disease, and result from activations that mainly contribute on the classification task. For doing so, a convolutional architecture is trained from a set of walking videos, recorded from parkinsonian and control subjects. Then, a prediction of disease is obtained according to motion patterns computed by convolutional learned scheme. Salience motion patterns are obtained by retro-propagating the output softmax network prediction over the video space. From a total of 22 patients, and a total of 176 video sequences, the proposed approach achieved an average accuracy score of 88%. Interestingly enough, the recovered salience maps focus the attention on relevant parkinsonian biomarkers such as the head motion and trunk posture, that namely is excluded on classical gait analysis.",GAIT,Proceedings Paper,"IEEE, 345 E 47TH ST, NEW YORK, NY 10017 USA",Engineering,,,GAIT,,,
72,Deep Learning for Interictal Epileptiform Spike Detection from scalp EEG frequency sub bands,,,3703-3706,"Prasanth Thangavel,Thomas John,Yuvaraj R.,Jing Jing,Cash Sydney S.,Chaudhari Rima,Leng Tan Yee,Rathakrishnan Rahul,Rohit Srivastava,Saini Vinay","Prasanth T,Thomas J,Yuvaraj R,Jing J,Cash SS,Chaudhari R,Leng TY,Rathakrishnan R,Rohit S,Saini V",Prasanth T,,Nanyang Technological University & National Institute of Education (NIE) Singapore,"Epilepsy diagnosis through visual examination of interictal epileptiform discharges (IEDs) in scalp electroencephalogram (EEG) signals is a challenging problem. Deep learning methods can be an automated way to perform this task. In this work, we present a new approach based on convolutional neural network (CNN) to detect IEDs from EEGs automatically. The input to CNN is a combination of raw EEG and frequency sub-bands, namely delta, theta, alpha and, beta arranged as a vector for one-dimensional (1D) CNN or matrix for two-dimensional (2D) CNN. The proposed method is evaluated on 554 scalp EEGs. The database consists of 18,164 IEDs marked by two neurologists. Five-fold cross-validation was performed to assess the IED detectors. The resulting 1D CNN based IED detector with multiple sub-bands achieved a false positive rate per minute of 0.23 and a precision of 0.79 at 90% sensitivity. Further, the proposed system is evaluated on datasets from three other clinics, and the features extracted from CNN outputs could significantly discriminate (p-values < 0.05) the EEGs with and without IEDs. We have proposed an optimized method with better performance than the literature that could aid clinicians to diagnose epilepsy expeditiously, and thereby devise proper treatment.",,Proceedings Paper,"IEEE, 345 E 47TH ST, NEW YORK, NY 10017 USA",Engineering,,,,,https://www.ncbi.nlm.nih.gov/pmc/articles/PMC7545315,
73,Brunnstrom Stage Automatic Evaluation for Stroke Patients by Using Multi-Channel sEMG,,,3763-3766,"Wang Fengyan,Zhang Daohui,Hu Shaokang,Zhu Bo,Han Fei,Zhao Xingang","Wang FY,Zhang DH,Hu SK,Zhu B,Han F,Zhao XG",Zhao XG,,Chinese Academy of Sciences,"Rehabilitation level evaluation is an important part of the automatic rehabilitation training system. As a general rule, this process is manually performed by rehabilitation doctors using chart-based ordinal scales which can be both subjective and inefficient. In this paper, a novel approach based on ensemble learning is proposed which automatically evaluates stroke patients' rehabilitation level using multi-channel sEMG signals to this problem. The correlation between rehabilitation levels and rehabilitation training actions is investigated and actions suitable for rehabilitation assessment are selected. Then, features are extracted from the selected actions. Finally, the features are used to train the stacking classification model. Experiments using sEMG data collected from 24 stroke patients have been carried out to examine the validity and feasibility of the proposed method. The experiment results show that the algorithm proposed in this paper can improve the classification accuracy of 6 Brunnstrom stages to 94.36%, which can promote the application of home-based rehabilitation training in practice.",REHABILITATION,Proceedings Paper,"IEEE, 345 E 47TH ST, NEW YORK, NY 10017 USA",Engineering,,,REHABILITATION,,,
74,Regression of Hand Movements from sEMG Data with Recurrent Neural Networks,,,3783-3787,"Koch Philipp,Dreier Mark,Larsen Anna,Parbs Tim J.,Maass Marco,Huy Phan,Mertins Alfred","Koch P,Dreier M,Larsen A,Parbs TJ,Maass M,Phan H,Mertins A",Koch P,,University of Lubeck,"Most wearable human-machine interfaces concerning hand movements only focus on classifying a limited number of hand gestures. With the introduction of deep learning, surface electromyography based hand gesture classification systems improved drastically. Therefore, it is worth investigating whether the classification can be replaced by a movement regression of all the different movable hand parts. As recurrent neural networks based approaches have proven their abilities of solving the classification problem we also choose them for the regression problem. Experiments were conducted with multiple different network architectures on several databases. Furthermore, due to the lack of a reliable measure to compare different gesture regression approaches we propose an interpretable and reproducible new error measure that can even handle noisy ground truth data. The results reveal the general possibility of regressing detailed hand movements. Even with the relatively simple networks the hand gestures can be regressed quite accurately.",,Proceedings Paper,"IEEE, 345 E 47TH ST, NEW YORK, NY 10017 USA",Engineering,,,,,,
75,Machine Learning-Based Physical Activity Tracking with a view to Frailty Analysis,,,3917-3920,"Abbas Manuel,Somme Dominique,Jeannes Regine Le Bouquin","Abbas M,Somme D,Jeannes RL",Abbas M,,Institut National de la Sante et de la Recherche Medicale (Inserm),"Frailty in old age is defined as the individual intrinsic susceptibility of having bad outcomes following a health problem. It relies on sarcopenia, mobility and activity. Recognizing and monitoring a range of physical activities is a necessary step which precedes the analysis of this syndrome. This paper investigates the optimal tools for this recognition in terms of type and placement of wearable sensors. Two machine learning procedures are proposed and compared on a public dataset. The first one is based on deep learning, where feature extraction is done manually, by constructing activity images from raw signals and applying convolutional neural networks to learn optimal features from these images. The second one is based on shallow learning, where hundreds of handcrafted features are extracted manually, followed by a novel feature selection approach to retain the most discriminant subset.",,Proceedings Paper,"IEEE, 345 E 47TH ST, NEW YORK, NY 10017 USA",Engineering,,,,,,
76,Improving Energy Expenditure Estimation through Activity Classification and Walking Speed Estimation Using a Smartwatch,,,3940-3944,"Aziz Omar,Zihajehzadeh Shaghayegh,Park Aerin,Tae Chul-Gyu,Park Edward J.","Aziz O,Zihajehzadeh S,Park A,Tae CG,Park EJ",Park EJ,,Simon Fraser University,"Energy expenditure (EE) estimation is an important factor in tracking personal activity and preventing chronic diseases, such as obesity and diabetes. The challenge is to provide accurate EE estimations in free-living environment through portable and unobtrusive devices. In this paper, we present an experimental study to estimate energy expenditure during sitting, standing and treadmill walking using a smartwatch. We introduce a novel methodology, which aims to improve the EE estimation by first separating sedentary (sitting and standing) and non-sedentary (walking) activities, followed by estimating the walking speeds and then calculating the energy expenditure using advanced machine learning based regression models. Ten young adults participated in the experimental trials. Our results showed that combining activity type and walking speed information with the acceleration counts substantially improved the accuracy of regression models for estimating EE. On average, the activity-based models provided 7% better EE estimation than the traditional acceleration-based models.","PHYSICAL-ACTIVITY,STEADY-STATE,ACCELEROMETERS,VALIDATION,MOVEMENT",Proceedings Paper,"IEEE, 345 E 47TH ST, NEW YORK, NY 10017 USA",Engineering,,,"PHYSICAL-ACTIVITY,STEADY-STATE,ACCELEROMETERS,VALIDATION,MOVEMENT",,,
77,A Novel Approach towards Early Detection of Obliteration in Lumbar Lordosis,,,4042-4045,"Divya Veena K.,Mukherjee Devanshu,Shree Vidhya,Roy Somali,Raghavan Venkat,Rajasree P. M.,Devaraj Deepashree,Renumadhavi C. H.,Lakshman Vasanth Raj,Subramanya K. N.","Divya KV,Mukherjee D,Shree V,Roy S,Raghavan V,Rajasree PM,Devaraj D,Renumadhavi CH,Lakshman VR,Subramanya KN",Divya KV,,R.V. College of Engineering,"The millennial age group (18 to 30 years) spend at least 6 hours sitting, either in college or at their workspace. High screen time as a routine, is the major cause for numerous spinal problems. Despite the wide research carried out on postural abnormalities, there exists numerous unrequited queries with regards to lumbar lordosis estimations, due to indeterminate parameters such as age, gender, lifestyle and diet. This work emphasizes the proficient method by observing the posture of a person for early detection of obliteration in Lumbar Lordosis. This further contributes to efficient diagnosis and treatment of spine ailments. With a novel approach to hardware using the myRIO hardware coupled with LabVIEW for interactive interface, the calibration is enhanced using machine learning (ML) - kNN Classifier. The use of machine learning accounts for the variations in the ideal angles of segmented sagittal measures with respect to different subjects. The device is developed to be a non-invasive, user friendly instrument to analyse the casual seated posture trends of the subject. The male subjects are expected to show the tilt angles in the range of - 16.3 to -17.2 degrees and similar threshold for females are -15.8 to -16.8 degrees. Out of 120 subjects taken into consideration, the device could accurately classify subjects with obliterated or normal lumbar lordosis). An accuracy and f1- score of 94% and 90% respectively was achieved by the ML model.",,Proceedings Paper,"IEEE, 345 E 47TH ST, NEW YORK, NY 10017 USA",Engineering,,,,,,
