,title,Volume,Issue,Pages,whole__author_name,simply_author_name,reprint author,DOI,reprint address,Abstract,Keywords,Document Type,Publisher,Research Domain,Published Date,impact_factor,Keywords_plus,joural,pdf_link,Download_SuccessOrDefeat
57,BAT Algorithm With fuzzy C-Ordered Means (BAFCOM) Clustering Segmentation and Enhanced Capsule Networks (ECN) for Brain Cancer MRI Images Classification,8,,201741-201751,"Alhassan Afnan M.,Zainon Wan Mohd Nazmee Wan","Alhassan AM,Zainon WMNW",Alhassan AM,10.1109/ACCESS.2020.3035803,Universiti Sains Malaysia,"Cancer is a second foremost life-threatening disease next to cardiovascular diseases. In particular, brain cancer holds the least rate of survival than all other cancer types. The categorization of a brain tumor depends upon the various factors such as texture, shape and location. The medical experts have preferred the appropriate treatment to the patients, based on the accurate identification of tumor type. The process of segmenting the Magnetic Resonance Imaging (MRI) has high complicacy during the analysis of brain tumor, owing to its variable shape, location, size, and texture. The physicians and radiologists can easily detect and categorize the tumors if there exists a system by combining Computer Assisted Diagnosis (CAD) as well as Artificial Intelligence (AI). An approach of automated segmentation has proposed in this paper, which enables the segmentation of tumor out of MRI images, besides enhances the efficiency of segmentation and classification. The initial functions of this approach include preprocessing and segmentation processes for segmenting tumor or tissue of benign and malignant by expanding a range of data and clustering. A modern learning-based approach has suggested in this study, in order to process the automated segmentation in multimodal MRI images to identify brain tumor, hence the clustering algorithm of Bat Algorithm with Fuzzy C-Ordered Means (BAFCOM) has recommended segmenting the tumor. The Bat Algorithm calculates the initial centroids and distance within the pixels in the clustering algorithm of BAFCOM, which also acquires the tumor through determining the distance among tumor Region of Interest (RoI) and non-tumor RoI. Afterwards, the MRI image has analyzed by the Enhanced Capsule Networks (ECN) method to categorize it as normal and brain tumor. Ultimately, the algorithm of ECN has assessed the performance of proposed approach by distinguishing the two categories of the tumor over MRI images, besides the suggested ECN classifier has assessed by the measurement factors of accuracy, precision, recall, and F1-score. In addition, the genetic algorithm has applied to process the automatic tumor stage classification, which in turn classification accuracy enhanced.","Machine learning,enhanced capsule networks (ECN),brain tumor,bat algorithm with fuzzy c-ordered means (BAFCOM),magnetic resonance imaging (MRI) images",Article,"IEEE-INST ELECTRICAL ELECTRONICS ENGINEERS INC, 445 HOES LANE, PISCATAWAY, NJ 08855-4141 USA","Computer Science,Engineering,Telecommunications",,3.671,,IEEE ACCESS,https://ieeexplore.ieee.org/ielx7/6287639/6514899/09247957.pdf,
58,Ensemble Convolutional Neural Networks With Knowledge Transfer for Leather Defect Classification in Industrial Settings,8,,198600-198614,"Aslam Masood,Khan Tariq M.,Naqvi Syed Saud,Holmes Geoff,Naffa Rafea","Aslam M,Khan TM,Naqvi SS,Holmes G,Naffa R",Aslam M,10.1109/ACCESS.2020.3034731,COMSATS University Islamabad (CUI),"Leather defect analysis is important for leather quality grading which directly effects the leather exports. Automated leather sample classification is vital due to slow and subjective nature of the manual process. The major challenges that exist in visual inspection of leather samples for categorization are: the morphology of defects significantly differs and their close examples are not available for transfer learning, unavailability of publicly available data and a benchmark. In this paper, we discuss three important aspects in the identification of industrial leather defects, i.e. the creation of an annotated wet-blue leather image dataset, the transfer of information from different domains to the leather image domain and the design of ensemble networks tailored to the task. We are therefore introducing a new database of wet-blue leather images (Wet-blue Leather Image Dataset (WBLID)) for the classification of defects along with expert annotation data. We proposed a new network EfficientNet-B3+ ResNext-101. The proposed EfficientNet-B3+ ResNext-101 ensemble architecture significantly outperforms all other state-of-the-art methods in terms of AUC and F1-score.","Feature extraction,Task analysis,Inspection,Visualization,Knowledge transfer,Deep learning,Training data,Leather defects,visual inspection,convolutional neural networks,transfer learning,classification",Article,"IEEE-INST ELECTRICAL ELECTRONICS ENGINEERS INC, 445 HOES LANE, PISCATAWAY, NJ 08855-4141 USA","Computer Science,Engineering,Telecommunications",,3.671,,IEEE ACCESS,https://doi.org/10.1109/access.2020.3034731,
59,SIR-Net: Self-Supervised Transfer for Inverse Rendering via Deep Feature Fusion and Transformation From a Single Image,8,,201861-201873,"Bi Tianteng,Ma Junjie,Liu Yue,Weng Dongdong,Wang Yongtian","Bi TT,Ma JJ,Liu Y,Weng DD,Wang YT",Liu Y,10.1109/ACCESS.2020.3035213,Beijing Institute of Technology,"Measuring the material, geometry, and ambient lighting of surfaces is a key technology in the object's appearance reconstruction. In this article, we propose a novel deep learning-based method to extract such information to reconstruct the object's appearance from an RGB image. Firstly, we design new deep convolutional neural network architectures to improve the performance by fusing complementary features from hierarchical layers and different tasks. Then we generate a synthetic dataset to train the proposed model to tackle the problem of the absence of the ground-truth. To transfer the domain from the synthetic data to the specific real image, we introduce a self-supervised test-time training strategy to finetune the trained model. The proposed architecture only requires one image as input when inferring the material, geometry, and ambient lighting. The experiments are conducted to evaluate the proposed method on both the synthetic data and real data. The results show that our trained model outperforms the existing baselines in each task and presents obvious improvement in final appearance reconstruction, which verifies the effectiveness of the proposed methods.","Inverse rendering,attention,feature fusion,lighting recovery,deep learning,image-based rendering",Article,"IEEE-INST ELECTRICAL ELECTRONICS ENGINEERS INC, 445 HOES LANE, PISCATAWAY, NJ 08855-4141 USA","Computer Science,Engineering,Telecommunications",,3.671,REFLECTANCE,IEEE ACCESS,https://ieeexplore.ieee.org/ielx7/6287639/6514899/09246498.pdf,
60,A Dynamic Filtering DF-RNN Deep-Learning-Based Approach for EEG-Based Neurological Disorders Diagnosis,8,,206992-207007,"Bouallegue Ghaith,Djemal Ridha,Alshebeili Saleh A.,Aldhalaan Hesham","Bouallegue G,Djemal R,Alshebeili SA,Aldhalaan H",Alshebeili SA,10.1109/ACCESS.2020.3037995,King Saud University,"Filtering of unwanted signals has a great impact on the performance of EEG signal processing applied to neurological disorders diagnosis. It is so difficult to remove undesirable noises using static filtering approaches as the performance of such techniques is strongly relying on specific EEG signal sub-bands, whose locations differ from one subject to another. In this paper, we present a novel dynamic filtering approach, which makes use of Finite and Infinite Impulse Response (FIR and IIR) filters along with a Recurrent Neural Networks using a Gated-Recurrent Unit (RNN-GRU), to identify and preprocess the most informative sub-bands pertaining to a particular neurological disorder. This combination of RNN with GRU requires more hidden layers than for conventional NN structures, and therefore offers much higher capacity to learn fitting and extract features from highly complex EEG data recording to afford better harmonization of the diagnosis process. Followed by an Independent Component Analysis (ICA) algorithm, all extracted features become independent to facilitate classification of clinical disorders using Convolutional Neural Network (CNN). The proposed diagnosis system achieves an average of 100% classification accuracy for epilepsy according to an offline diagnosis process using Bonn and MIT datasets, and when the same system is applied to autism provides an average accuracy of 99.5% using KAU dataset. The presented dynamic deep-learning approach applied to EEG classification pipeline, which includes artifact removal, feature extraction and classification, leads to significant improvements in the accuracy of the diagnosis classification regarding the targeted neurological pathologies.","Electroencephalography,Feature extraction,Autism,Epilepsy,Neurological diseases,Time-frequency analysis,Medical diagnostic imaging,Electroencephalography (EEG),deep learning,recurrent neural networks (RNN),convolutional neural network (CNN),dynamic filtering",Article,"IEEE-INST ELECTRICAL ELECTRONICS ENGINEERS INC, 445 HOES LANE, PISCATAWAY, NJ 08855-4141 USA","Computer Science,Engineering,Telecommunications",,3.671,"NEURAL-NETWORK,COMPONENT,ANALYSIS,SEIZURE,DETECTION,AUTISM,CLASSIFICATION,ALGORITHMS,METHODOLOGY,FRACTALITY,TRANSFORM",IEEE ACCESS,https://doi.org/10.1109/access.2020.3037995,
61,A Novel Approach to Objectively Quantify the Subjective Perception of Pain Through Electroencephalogram Signal Analysis,8,,199920-199930,"Elsayed Mahmoud,Sim Kok Swee,Tan Shing Chiang","Elsayed M,Sim KS,Tan SC",Tan SC,10.1109/ACCESS.2020.3032153,Multimedia University,"Pain is a complex subjective unpleasant experience that can potentially cause tissue damage. In clinical practice, the main method used for assessing pain is self-report; however, it is not possibly adopted in a huge number of vulnerable populations or by non-communicative patients such as those with disorders of speech and consciousness. Thus, the availability of an objective measure of the subjective pain's perception that complements the self-report pain assessments is a great significant demand in several clinical applications. The aim of this paper is to propose a novel approach to objectively quantify the subjective perception of pain. We integrated signal processing techniques and machine learning principles to learn brain signals associated with pain and classify them into one of four pain intensities (no pain, low, moderate, and high). We found that the signal processing revealed a direct correlation between Alpha frequency band power and the pain intensity, and the classifier could achieve an accuracy of 94.83%. This study provides a clue for the betterment of the collective scientific understanding of the brain's activities inflicted by the physical pain and helps in building a reliable automated prediction of pain.","Pain,Electroencephalography,Signal processing,Containers,Machine learning,Correlation,Reliability,Physical pain,alpha frequency band,signal processing,artificial neural networks",Article,"IEEE-INST ELECTRICAL ELECTRONICS ENGINEERS INC, 445 HOES LANE, PISCATAWAY, NJ 08855-4141 USA","Computer Science,Engineering,Telecommunications",,3.671,"EEG,OSCILLATIONS,THETA,SENSITIVITY,MATRIX",IEEE ACCESS,https://ieeexplore.ieee.org/ielx7/6287639/6514899/09229386.pdf,
62,KEBOT: An Artificial Intelligence Based Comprehensive Analysis System for FUE Based Hair Transplantation,8,,200461-200476,"Erdogan Koray,Acun Onur,Kucukmanisa Ayhan,Duvar Ramazan,Bayramoglu Alp,Urhan Oguzhan","Erdogan K,Acun O,Kucukmanisa A,Duvar R,Bayramoglu A,Urhan O",Kucukmanisa A,10.1109/ACCESS.2020.3035637,Kocaeli University,"Robots and artificial intelligence technologies have become very important in the health applications as in many other fields. The proposed system in this work aims to provide detailed analysis of pre-op and post-op stage of FUE hair transplant procedures to enable surgeon to plan and assess success of the operations. In order to achieve this target, a robotic and vision-based system imaging and AI based analysis approach is developed. The proposed system performs analyses in three main stages: initialization, scanning, and analysis. At the initialization stage, 3D model of the patient's head generated at first by locating a depth camera in various positions around the patient by the help of a collaborative robot. At the second stage, where high resolution image capturing is performed in a loop with the usage of the 3D model, raw images are processed by a deep learning based object detection algorithm where follicles in pre-op and extracted follicle positions (i.e. holes) and placed grafts in post-op is detected. At the last stage, thickness of each hair is computed at the detected hair follicle positions using another deep learning-based segmentation approach. These data are combined to obtain objective evaluation criteria to generate patient report. Experimental results show that the developed system can be used successfully in hair transplantation operations.","FUE,hair transplantation,deep learning,artificial intelligence",Article,"IEEE-INST ELECTRICAL ELECTRONICS ENGINEERS INC, 445 HOES LANE, PISCATAWAY, NJ 08855-4141 USA","Computer Science,Engineering,Telecommunications",,3.671,,IEEE ACCESS,https://ieeexplore.ieee.org/ielx7/6287639/6514899/09247217.pdf,
63,Machine Learning Application With Quantitative Digital Subtraction Angiography for Detection of Hemorrhagic Brain Arteriovenous Malformations,8,,204573-204584,"Hong Jia-Sheng,Lin Chung-Jung,Lin Yue-Hsin,Lee Cheng-Chia,Yang Huai-Che,Meng Ling-Hsuan,Lin Te-Ming,Hu Yong-Sin,Guo Wan-Yuo,Chu Wei-Fa","Hong JS,Lin CJ,Lin YH,Lee CC,Yang HC,Meng LH,Lin TM,Hu YS,Guo WY,Chu WF",Wu YT,10.1109/ACCESS.2020.3036692,National Yang Ming Chiao Tung University,"Clinical features are the primary measures used for risk assessment of cerebrovascular diseases. However, clinical features, especially angioarchitecture, in digital subtraction angiography require further interpretation by specialized radiologists. This approach for risk assessment requires multivariable analysis and is, therefore, challenging when completed manually. In this study, we employed three machine learning models, namely the random forest, naive Bayes classifier, and support vector machine, for the detection of hemorrhagic brain arteriovenous malformations using digital subtraction angiography. Quantitative measurements from digital subtraction angiography were used as features, and the chi-squared test, minimum redundancy maximum relevance, ReliefF, and two-sample t tests were used for feature selection. Bayesian optimization was conducted to optimize the hyperparameters of the three models. The random forest model outperformed the other two models. As a human control, three radiologists diagnosed an independent testing data set. The random forest model had a computation time of less than a second for the whole data set for classification. Accuracy and the area under the receiver operating characteristic curve were 92.7% and 0.98 for the training data set and 85.7% and 0.97 for the independent testing data set, respectively. Compared with the mean diagnosis time of approximately half a minute per patient and the highest accuracy of 76.2% for the three radiologists, the random forest model was faster and more accurate for our data set. These results suggest that the machine learning model based on hemodynamic features from quantitative digital subtraction angiography is a promising tool for detecting hemorrhagic brain arteriovenous malformations.","Brain arteriovenous malformation,digital subtraction angiography,machine learning,quantitative analysis,rupture risk,time-density curve",Article,"IEEE-INST ELECTRICAL ELECTRONICS ENGINEERS INC, 445 HOES LANE, PISCATAWAY, NJ 08855-4141 USA","Computer Science,Engineering,Telecommunications",,3.671,"VENOUS,DRAINAGE,TRANSIT-TIME,HEMODYNAMICS,DIAGNOSIS,CONTRAST,DSA",IEEE ACCESS,https://doi.org/10.1109/access.2020.3036692,
64,Explainable Prediction of Acute Myocardial Infarction Using Machine Learning and Shapley Values,8,,210410-210417,"Ibrahim Lujain,Mesinovic Munib,Yang Kai-Wen,Eid Mohamad A.","Ibrahim L,Mesinovic M,Yang KW,Eid MA",Yang KW,10.1109/ACCESS.2020.3040166,"New York Univ Abu Dhabi, Div Engn, Abu Dhabi, U Arab Emirates.","The early and accurate detection of the onset of acute myocardial infarction (AMI) is imperative for the timely provision of medical intervention and the reduction of its mortality rate. Machine learning techniques have demonstrated great potential in aiding disease diagnosis. In this paper, we present a framework to predict the onset of AMI using 713,447 extracted ECG samples and associated auxiliary data from the longitudinal and comprehensive ECG-ViEW II database, previously unexplored in the field of machine learning in healthcare. The framework is realized with two deep learning models, a convolutional neural network (CNN) and a recurrent neural network (RNN), and a decision-tree based model, XGBoost. Synthetic minority oversampling technique (SMOTE) was utilized to address class imbalance. High prediction accuracy of 89.9%, 84.6%, 97.5% and ROC curve areas of 90.7%, 82.9%, 96.5% have been achieved for the best CNN, RNN, and XGBoost models, respectively. Shapley values were utilized to identify the features that contributed most to the classification decision with XGBoost, demonstrating the high impact of auxiliary inputs such as age and sex. This paper demonstrates the promising application of explainable machine learning in the field of cardiovascular disease prediction.","Electrocardiography,Myocardium,Machine learning,Predictive models,Databases,Training,Feature extraction,Machine learning,biomedical informatics,predictive models,acute myocardial infarction",Article,"IEEE-INST ELECTRICAL ELECTRONICS ENGINEERS INC, 445 HOES LANE, PISCATAWAY, NJ 08855-4141 USA","Computer Science,Engineering,Telecommunications",,3.671,"SYMPTOM,PRESENTATION,ECG,DISEASE,SEX,AGE",IEEE ACCESS,https://ieeexplore.ieee.org/ielx7/6287639/6514899/09268965.pdf,
65,ELS-Net: A New Approach to Forecast Decomposed Intrinsic Mode Functions of Electricity Load,8,,198935-198949,"Javaid Nadeem,Naz Aqdas,Khalid Rabiya,Almogren Ahmad,Shafiq Muhammad,Khalid Adia","Javaid N,Naz A,Khalid R,Almogren A,Shafiq M,Khalid A",Almogren A,10.1109/ACCESS.2020.3034113,King Saud University,"The significance of electricity cannot be overlooked as all fields of life like material production, health care, educational sector, etc., depend upon it to render consistent and high-quality services, increase productivity and business continuity. To this end, energy operators have experienced a continuous increasing trend in the electricity demand for the past few decades. This may cause many issues like load shedding, increased electricity bills, imbalance between supply and demand, etc. Therefore, forecasting of electricity demand using efficient techniques is crucial for the energy operators to decide about optimal unit commitment and to make electricity dispatch plans. It also helps to avoid wastage as well as the shortage of energy. In this study, a novel forecasting model, known as ELS-net is proposed, which is a combination of an Ensemble Empirical Mode Decomposition (EEMD) method, multi-model Ensemble Bi Long Short-Term Memory (EBiLSTM) forecasting technique and Support Vector Machine (SVM). In the proposed model, EEMD is used to distinguish between linear and non-linear intrinsic mode functions (IMFs), EBiLSTM is used to forecast the non-linear IMFs and SVM is employed to forecast the linear IMFs. Using separate forecasting techniques for linear and non-linear IMFs decreases the computational complexity of the model. Moreover, SVM requires low computational time as compared to EBiLSTM for linear IMFs. Simulations are performed to examine the effectiveness of the proposed model using two different datasets: New South Wales (NSW) and Victoria (VIC). For performance evaluation, Root Mean Square Error (RMSE), Mean Absolute Error (MAE) and Mean Absolute Percentage Error (MAPE) are used as performance metrics. From the simulation results, it is obvious that the proposed ELS-net model outperforms the start-of-the-art techniques, such as EMD-BILSTM-SVM, EMD-PSO-GA-SVR, BiLSTM, MLP and SVM in terms of forecasting accuracy and minimum execution time.","Forecasting,Time series analysis,Support vector machines,Computational modeling,Load forecasting,Predictive models,Deep learning,Smart grid,electricity consumption,decomposition,forecasting,deep learning,machine learning,seasonal data variations",Article,"IEEE-INST ELECTRICAL ELECTRONICS ENGINEERS INC, 445 HOES LANE, PISCATAWAY, NJ 08855-4141 USA","Computer Science,Engineering,Telecommunications",,3.671,"ARTIFICIAL,NEURAL-NETWORKS,SUPPORT,VECTOR,REGRESSION,CONDITIONAL,DEMAND,OPTIMIZATION,PREDICTION,NOISE",IEEE ACCESS,https://doi.org/10.1109/access.2020.3034113,
66,StomachNet: Optimal Deep Learning Features Fusion for Stomach Abnormalities Classification,8,,197969-197981,"Khan Muhammad Attique,Sarfraz Muhammad Shahzad,Alhaisoni Majed,Albesher Abdulaziz A.,Wang Shuihua,Ashraf Imran","Khan MA,Sarfraz MS,Alhaisoni M,Albesher AA,Wang SH,Ashraf I",Ashraf I,10.1109/ACCESS.2020.3034217,NITEC University,"A fully automated design is proposed in this work employing optimal deep learning features for classifying gastrointestinal infections. Here, three prominent infections- ulcer, bleeding, polyp and a healthy class are considered as class labels. In the initial stage, the contrast is improved by fusing bi-directional histogram equalization with top-hat filtering output. The resultant fusion images are then passed to ResNet101 pre-trained model and trained once again using deep transfer learning. However, there are challenges involved in extracting deep learning features including impertinent information and redundancy. To mitigate this problem, we took advantage of two metaheuristic algorithms- Enhanced Crow Search and Differential Evolution. These algorithms are implemented in parallel to obtain optimal feature vectors. Following this, a maximum correlation-based fusion approach is applied to fuse optimal vectors from the previous step to obtain an enhanced vector. This final vector is given as input to Extreme Learning Machine (ELM) classifier for final classification. The proposed method is evaluated on a combined database. It accomplished an accuracy of 99.46%, which shows significant improvement over preceding techniques and other neural network architectures.","Licenses,Stomach infections,contrast stretching,deep learning,optimization,fusion",Article,"IEEE-INST ELECTRICAL ELECTRONICS ENGINEERS INC, 445 HOES LANE, PISCATAWAY, NJ 08855-4141 USA","Computer Science,Engineering,Telecommunications",,3.671,"WIRELESS,CAPSULE,ENDOSCOPY,GASTROINTESTINAL-DISEASES,ENHANCEMENT,CHALLENGES,IMAGES",IEEE ACCESS,https://doi.org/10.1109/access.2020.3034217,
67,Breast Mass Classification Using eLFA Algorithm Based on CRNN Deep Learning Model,8,,197312-197323,"Kim Chang-Min,Park Roy C.,Hong Ellen J.","Kim CM,Park RC,Hong EJ",Hong EJ,10.1109/ACCESS.2020.3034914,Yonsei University,"Breast cancer is known to be common in many developed countries. It is reported as the most common type of cancer in the US, affecting one in eight women. In Korea, thyroid cancer is the most common type of cancer, followed by breast cancer in women. Considering this, early detection and accurate diagnosis of breast cancer are crucial for reducing the associated death rate. Recently, cancer diagnosis systems using medical images have attracted significant attention. Medical imaging methods, such as computed tomography and magnetic resonance imaging, can reveal the overall shape, heterogeneity, and growth speed of carcinoma and are, thus, more commonly employed for diagnoses. Medical imaging has gained popularity since a recent study identified that it could reflect the gene phenotype of a patient. However, an aided diagnosis system based on medical images requires high-specification equipment to analyze high-resolution data. Therefore, this article proposes an edge extraction algorithm and a modified convolutional recurrent neural network (CRNN) model to accurately assess breast cancer based on medical imaging. The proposed algorithm extracts line-segment information from a breast mass image. The extracted line segments were classified into 16 types. Each type was uniquely labeled and compressed. The image compressed in this process was used as the input for the modified CRNN model. Traditional deep learning models were used to evaluate the performance of the proposed algorithm. The results show that the proposed model had the highest accuracy and lowest loss (99.75% and 0.0257, respectively).","Computer aided diagnosis system,line feature analysis,CRNN,breast cancer,deep learning",Article,"IEEE-INST ELECTRICAL ELECTRONICS ENGINEERS INC, 445 HOES LANE, PISCATAWAY, NJ 08855-4141 USA","Computer Science,Engineering,Telecommunications",,3.671,"ULTRASOUND,IMAGES,TEXTURE,ANALYSIS,CANCER",IEEE ACCESS,https://doi.org/10.1109/access.2020.3034914,
