,title,Volume,Issue,Pages,whole__author_name,simply_author_name,reprint author,DOI,reprint address,Abstract,Keywords,Document Type,Publisher,Research Domain,Published Date,impact_factor,Keywords_plus,joural,pdf_link,Download_SuccessOrDefeat
68,Automated Maxillofacial Segmentation in Panoramic Dental X-Ray Images Using an Efficient Encoder-Decoder Network,8,,207822-207833,"Kong Zhengmin,Xiong Feng,Zhang Chenggang,Fu Zhuolin,Zhang Maoqi,Weng Jingxin,Fan Mingzhe","Kong ZM,Xiong F,Zhang CG,Fu ZL,Zhang MQ,Weng JX,Fan MZ",Xiong F,10.1109/ACCESS.2020.3037677,Wuhan University,"The panoramic dental X-ray images are an essential diagnostic tool used by dentists to detect the symptoms in an early stage and develop appropriate treatment plans. In recent years, deep learning methods have been applied to achieve tooth segmentation of dental X-rays, which aims to assist dentists in making clinical decisions. Because the original images contain plenty of useless information, it is necessary to extract the region-of-interest (ROI) to obtain more accurate results by focusing on the maxillofacial region. However, a fast and accurate maxillofacial segmentation without hand-crafted features is challenging due to the poor image quality. In this study, we create a large maxillofacial dataset and propose an efficient encoder-decoder network model named EED-Net to solve this problem. This dataset consists of 2602 panoramic dental X-ray images and corresponding segmentation masks annotated by the trained experts. Based on the original structure of U-Net, our model structure contains three major modules: a feature encoder, a corresponding decoder, and a multipath feature extractor that connects the encoding path and the decoding path. In order to obtain more semantic features from the depth and breadth, we replace the convolution layer with the residual block in the encoder and adopt Inception-ResNet block in the multipath feature extractor. Inspired by the skip connection in FCN-8s, the lightweight decoder has the same channel dimension as the number of segmented objects. Besides, a weighted loss function is used to enhance segmentation accuracy. The comprehensive experimental results on the new dataset demonstrate that our model achieves better accuracy and speed trade-offs for maxillofacial segmentation than the latest methods.","Image segmentation,X-ray imaging,Dentistry,Teeth,Feature extraction,Decoding,Annotations,Maxillofacial segmentation,panoramic radiographs,deep learning,encoder-decoder network",Article,"IEEE-INST ELECTRICAL ELECTRONICS ENGINEERS INC, 445 HOES LANE, PISCATAWAY, NJ 08855-4141 USA","Computer Science,Engineering,Telecommunications",,3.671,"TEETH,MODEL",IEEE ACCESS,https://doi.org/10.1109/access.2020.3037677,
69,Real-Time Ultrasound Image Despeckling Using Mixed-Attention Mechanism Based Residual UNet,8,,195327-195340,"Lan Yancheng,Zhang Xuming","Lan YC,Zhang XM",Zhang XM,10.1109/ACCESS.2020.3034230,Huazhong University of Science & Technology,"Ultrasound imaging has been widely used for clinical diagnosis. However, the inherent speckle noise will degrade the quality of ultrasound images. Existing despeckling methods cannot deliver sufficient speckle reduction and preserve image details well at high noise corruption and they cannot realize real-time ultrasound image denoising. With the popularity of deep learning, supervised learning for image denoising has recently attracted considerable attention. In this paper, we have proposed a novel residual UNet using mixed-attention mechanism (MARU) for real-time ultrasound image despeckling. In view of the signal-dependent characteristics of speckle noise, we have designed an encoder-decoder network to reconstruct the despeckled image by extracting features from the noisy image. Furthermore, a lightweight mixed-attention block is proposed to effectively enhance the image features and suppress some speckle noise during the encoding phase by using separation and re-fusion strategy for channel and spatial attention. Besides, we have graded the speckle noise levels with a certain interval and designed an algorithm to estimate the noise levels for despeckling real ultrasound images. Experiments have been done on the natural images, the synthetic image, the image simulated using Field II and the real ultrasound images. Compared with existing despeckling methods, the proposed network has achieved the state-of-the-art despeckling performance in terms of subjective human vision and such quantitative indexes as peak signal to noise ratio (PSNR), structural similarity (SSIM), equivalent number of looks (ENL) and contrast-to-noise ratio (CNR).","Ultrasonic imaging,Speckle,Real-time systems,Image denoising,Noise reduction,Deep learning,Feature extraction,Ultrasound image,speckle noise,supervised learning,mixed-attention mechanism,residual UNet",Article,"IEEE-INST ELECTRICAL ELECTRONICS ENGINEERS INC, 445 HOES LANE, PISCATAWAY, NJ 08855-4141 USA","Computer Science,Engineering,Telecommunications",,3.671,"SPECKLE,NOISE,CNN",IEEE ACCESS,https://doi.org/10.1109/access.2020.3034230,
70,Deep Learning in Skin Disease Image Recognition: A Review,8,,208264-208280,"Li Ling-Fang,Wang Xu,Hu Wei-Jian,Xiong Neal N.,Du Yong-Xing,Li Bao-Shan","Li LF,Wang X,Hu WJ,Xiong NN,Du YX,Li BS",Hu WJ; Du YX,10.1109/ACCESS.2020.3037258,Inner Mongolia University of Science & Technology,"The application of deep learning methods to diagnose diseases has become a new research topic in the medical field. In the field of medicine, skin disease is one of the most common diseases, and its visual representation is more prominent compared with the other types of diseases. Accordingly, the use of deep learning methods for skin disease image recognition is of great significance and has attracted the attention of researchers. In this study, we review 45 research efforts on the identification of skin disease by using deep learning technology since 2016. We analyze these studies from the aspects of disease type, data set, data processing technology, data augmentation technology, model for skin disease image recognition, deep learning framework, evaluation indicators, and model performance. Moreover, we summarize the traditional and machine learning-based skin disease diagnosis and treatment methods. We also analyze the current progress in this field and predict four directions that may become the research topic in the future. Our results show that the skin disease image recognition method based on deep learning is better than those of dermatologists and other computer-aided treatment methods in skin disease diagnosis, especially the multi deep learning model fusion method has the best recognition effect.","Deep learning,Analytical models,Image recognition,Skin,Data models,Medical diagnosis,Diseases,Deep learning,image recognition,review,skin disease",Review,"IEEE-INST ELECTRICAL ELECTRONICS ENGINEERS INC, 445 HOES LANE, PISCATAWAY, NJ 08855-4141 USA","Computer Science,Engineering,Telecommunications",,3.671,"MALIGNANT-MELANOMA,ABCD,RULE,CLASSIFICATION,DIAGNOSIS,CANCER,DERMATOLOGISTS,DERMATOSCOPY,DERMOSCOPY,CHECKLIST,ALGORITHM",IEEE ACCESS,https://doi.org/10.1109/access.2020.3037258,
71,Identification of Colon Cancer Using Multi-Scale Feature Fusion Convolutional Neural Network Based on Shearlet Transform,8,,208969-208977,"Liang Meiyan,Ren Zhuyun,Yang Jiamiao,Feng Wenxiang,Li Bo","Liang MY,Ren ZY,Yang JM,Feng WX,Li B",Liang MY,10.1109/ACCESS.2020.3038764,Shanxi University,"Colon cancer identification is of great significance in medical diagnosis. Real-time, objective and accurate inspection results will facilitate medical professionals to explore symptomatic treatment promptly. However, the existing methods depend on hand-crafted features which require extensive professional expertise and long inspection period. Therefore, we propose a multi-scale feature fusion convolutional neural network (MFF-CNN) based on shearlet transform to identify histopathological image of colon cancer. The characteristic of the framework is the shearlet coefficients of histopathological image in multiple decomposition scales were extracted as supplementary feature which were also fed to the network with the original pathological image. After feature learning and feature fusion, the MFF-CNN based on shearlet transform can achieve the identification accuracy of 96% and average F-1 score of 0.9594 for colorectal adenocarcinoma epithelium (TUM) and normal colon mucosa (NORM). The false negative rate and false positive rate can be reduced to 5.5% and 2.5%, respectively. The superior performance of the network opens a new perspectives for real-time, objective and accurate diagnosis of cancer.","Feature extraction,Colon,Cancer,Transforms,Pathology,Training,Matrix decomposition,Colon cancer,shearlet transform,convolutional neural network,multi-scale feature fusion",Article,"IEEE-INST ELECTRICAL ELECTRONICS ENGINEERS INC, 445 HOES LANE, PISCATAWAY, NJ 08855-4141 USA","Computer Science,Engineering,Telecommunications",,3.671,"CLASSIFICATION,HYBRID",IEEE ACCESS,https://ieeexplore.ieee.org/ielx7/6287639/6514899/09261395.pdf,
72,Esophagus Segmentation in Computed Tomography Images Using a U-Net Neural Network With a Semiautomatic Labeling Method,8,,202459-202468,"Lou Xiao,Zhu Youzhe,Punithakumar Kumaradevan,Le Lawrence H.,Li Baosheng","Lou X,Zhu YZ,Punithakumar K,Le LH,Li BS",Li BS,10.1109/ACCESS.2020.3035772,Southeast University - China,"Esophagus segmentation in computed tomography images is challenging due to the complex shape and low contrast of the esophagus. Fully automated segmentation is feasible with recent convolutional neural network approaches, such as U-Net, which reduce variability and increase reproducibility. However, these supervised deep learning methods require radiologists to laboriously interpret and label images, which is time-consuming, at the expense of patient care. We propose an esophagus segmentation method using a U-Net neural network combined with several variations of backbones. We also propose a semiautomatic labeling method with detection and execution components to solve the labeling problem. The detection component identifies the category to which each slice belongs using the bag-of-features method. The edges in each category are clustered using contour moments and their topological levels as features. In the execution component, the assumed esophageal contours are predicted by the clustered model. A convex hull approach and level set algorithm yield the final esophageal contours, which are employed to train the neural network. Several backbones are implemented as the encoder of the U-Net network to extract features. The predictions are then compared with those obtained via manual labeling by a radiologist and the segmentation results generated by the proposed semiautomatic method. The experimental evaluations demonstrate that the utilization of ResneXt50 and InceptionV3 as backbones with U-Net is more effective than that with other backbones. A three-dimensional rendering of the segmented model is performed to exhibit the prediction. The results demonstrate that the proposed method outperforms previously published methods.","Computed tomography,deep learning,esophagus,segmentation,U-Net",Article,"IEEE-INST ELECTRICAL ELECTRONICS ENGINEERS INC, 445 HOES LANE, PISCATAWAY, NJ 08855-4141 USA","Computer Science,Engineering,Telecommunications",,3.671,CANCER,IEEE ACCESS,https://doi.org/10.1109/access.2020.3035772,
73,Two Derivative Algorithms of Gradient Boosting Decision Tree for Silicon Content in Blast Furnace System Prediction,8,,196112-196122,"Luo Shihua,Chen Tianxin","Luo SH,Chen TX",Chen TX,10.1109/ACCESS.2020.3034566,Jiangxi University of Finance & Economics,"The background of the present study complies with silicon content prediction in hot metal in the blast furnace system. The blast furnace system is a highly complex industrial reactor in the conventional process. The system is subject to several problems (e.g., system automation, the thermal state of the blast furnace, and the life prediction of blast furnace) that should be addressed by professionals. To determine the prediction state of the heat in the blast furnace, the silicon content in the blast furnace molten iron commonly acts as a key indicator. Based on the assumption that the blast furnace system exhibits a stable state, the accuracy of hot metal silicon is analyzed by using a range of machine learning algorithms. In the present study, two derivative algorithms of gradient boosting decision tree are adopted to develop a strong boosting predictor based on the extreme gradient boosting (XGBoost) algorithm and the light gradient boosting machine (LightGBM) algorithm for prediction. Compared with the conventional algorithms (e.g., lasso, random forest, support vector machine and gradient boosting decision tree), the prediction by using the two boosting algorithms is capable of more effectively guiding and determining the state of the blast furnace. As revealed from experimentally simulated results, the mentioned two boosting algorithms exhibit better comprehensive prediction performance than the conventional algorithms on the datasets of two practical blast furnace systems, demonstrating that the R-square of the two blast furnaces in the training set is over 0.7. The mentioned two algorithms are of certain guiding significance for exploring blast furnace problems.","Prediction algorithms,Silicon,Iron,Blast furnaces,Predictive models,Boosting,Decision trees,XGBoost,LightGBM,gradient boosting decision tree,silicon content,blast furnace system",Article,"IEEE-INST ELECTRICAL ELECTRONICS ENGINEERS INC, 445 HOES LANE, PISCATAWAY, NJ 08855-4141 USA","Computer Science,Engineering,Telecommunications",,3.671,"ARTIFICIAL,NEURAL-NETWORK,MODEL,XGBOOST,MACHINE",IEEE ACCESS,https://doi.org/10.1109/access.2020.3034566,
74,Microelectronic CMOS Implementation of a Machine Learning Technique for Sensor Calibration,8,,207367-207376,"Martinez-Nieto Javier A.,Teresa Sanz-Pascual Maria,Medrano N.,Calvo Lopez Belen,Antolin Canada Diego","Martinez-Nieto JA,Sanz-Pascual MT,Medrano N,Lopez BC,Canada DA",Martinez-Nieto JA,10.1109/ACCESS.2020.3038052,University of Zaragoza,"An integrated machine-learning based adaptive circuit for sensor calibration implemented in standard 0.18 mu m CMOS technology with 1.8V power supply is presented in this paper. In addition to linearizing the device response, the proposed system is also capable to correct offset and gain errors. The building blocks conforming the adaptive system are designed and experimentally characterized to generate numerical high-level models which are used to verify the proper performance of each analog block within a defined multilayer perceptron architecture. The network weights, obtained from the learning phase, are stored in a microcontroller EEPROM memory, and then loaded into each of the registers of the proposed integrated prototype. In order to verify the proposed system performance, the non-linear characteristic of a thermistor is compensated as an application example, achieving a relative error e(r) below 3% within an input span of 130 degrees C, which is almost 6 times less than the uncorrected response. The power consumption of the whole system is 1.4mW and it has an active area of 0.86mm(2). The digital programmability of the network weights provides flexibility when a sensor change is required.","Calibration,CMOS technology,Machine learning,Power demand,Microelectronics,Semiconductor device modeling,Neurons,Adaptive signal processing,artificial neural networks,CMOS,sensor conditioning",Article,"IEEE-INST ELECTRICAL ELECTRONICS ENGINEERS INC, 445 HOES LANE, PISCATAWAY, NJ 08855-4141 USA","Computer Science,Engineering,Telecommunications",,3.671,"A%2FD,CONVERTER,LINEARIZATION",IEEE ACCESS,https://zaguan.unizar.es/record/97416/files/texto_completo.pdf,
75,A Machine Learning Approach to Perform Physical Activity Classification Using a Sensorized Crutch Tip,8,,210023-210034,"Mesanza Asier Brull,Lucas Sergio,Zubizarreta Asier,Cabanes Itziar,Portillo Eva,Rodriguez-Larrad Ana","Mesanza AB,Lucas S,Zubizarreta A,Cabanes I,Portillo E,Rodriguez-Larrad A",Mesanza AB,10.1109/ACCESS.2020.3039885,University of Basque Country,"In recent years, interest in monitoring Physical Activity (PA) has increased due to its positive effect on health. New technological devices have been proposed for this purpose, mainly focused on sports, which include Machine Learning algorithms to identify the type of PA being performed. However, PA monitoring can also provide data useful for assessing the recovery process of people with impaired lower-limbs. In this work, a Machine-Learning based Physical Activity classifier design procedure is proposed, which makes use of the data provided by a Sensorized Tip that can be adapted to different Assistive Devices for Walking (ADW) such as canes or crutches. The procedure is based on three main stages: 1) defining a wide set of potential features to perform the classification; 2) optimizing the number of features by a Random-Forest approach, detecting the most relevant ones to classify five relevant activities (walking at a normal pace, walking fast, standing still, going up stairs and going down stairs); 3) training the ML-based classifiers considering the optimized feature set. A comparative analysis is carried out to evaluate the proposed procedure, using three ML-based classifier (Support Vector Machines, K-Nearest Neighbour and Artificial Neural Networks), demonstrating that the proposed approach can provide very high success rates if proper feature selection is carried out. This work presents four relevant contributions to the PA monitoring area: 1) the approach is focused on people that require ADW, which are not considered in other approaches; 2) an analysis of the features to characterize gait in people that require ADW is carried out; 3) a design procedure to optimize the number of features using a Random-Forest approach is used, avoiding a typical ""brute force"" procedure; and 4) a comparative analysis is carried out to demonstrate the validity of the approach.","Monitoring,Feature extraction,Legged locomotion,Stairs,Performance evaluation,Force,Support vector machines,Instrumented crutch,rehabilitation,machine learning,physical activity classification,random forest,artificial neural network,support vector machine,K-nearest neighbor",Article,"IEEE-INST ELECTRICAL ELECTRONICS ENGINEERS INC, 445 HOES LANE, PISCATAWAY, NJ 08855-4141 USA","Computer Science,Engineering,Telecommunications",,3.671,"QUALITY-OF-LIFE,ACTIVITY,RECOGNITION,MULTIPLE-SCLEROSIS,GAIT,IDENTIFICATION,MOVEMENT,MOBILITY,NETWORK,MOTION",IEEE ACCESS,https://ieeexplore.ieee.org/ielx7/6287639/6514899/09269370.pdf,
76,Accurate Detection of Septal Defects With Fetal Ultrasonography Images Using Deep Learning-Based Multiclass Instance Segmentation,8,,196160-196174,"Nurmaini Siti,Rachmatullah Muhammad Naufal,Sapitri Ade Iriani,Darmawahyuni Annisa,Jovandy Adithia,Firdaus Firdaus,Tutuko Bambang,Passarella Rossi","Nurmaini S,Rachmatullah MN,Sapitri AI,Darmawahyuni A,Jovandy A,Firdaus F,Tutuko B,Passarella R",Nurmaini S,10.1109/ACCESS.2020.3034367,Universitas Sriwijaya,"Accurate screening for septal defects is important for supporting radiologists' interpretative work. Some previous studies have proposed semantic segmentation and object detection approaches to carry out fetal heart detection; unfortunately, the models could not segment different objects of the same class. The semantic segmentation method segregates regions that only contain objects from the same class. In contrast, the fetal heart may contain multiple objects, such as the atria, ventricles, valves, and aorta. Besides, blurry boundaries (shadows) or a lack of consistency in the acquisition ultrasonography can cause wide variations. This study utilizes Mask-RCNN (MRCNN) to handle fetal ultrasonography images and employ it to detect and segment defects in heart walls with multiple objects. To our knowledge, this is the first study involving a medical application for septal defect detection using instance segmentation. The use of MRCNN architecture with ResNet50 as a backbone and a 0.0001 learning rate allows for two times faster training of the model on fetal heart images compared to other object detection methods, such as Faster-RCNN (FRCNN). We demonstrate a strong correlation between the predicted septal defects and ground truth as a mean average precision (mAP). As shown in the results, the proposed MRCNN model achieves good performance in multiclass detection of the heart chamber, with 97.59% for the right atrium, 99.67% for the left atrium, 86.17% for the left ventricle, 98.83% for the right ventricle, and 99.97% for the aorta. We also report competitive results for the defect detection of holes in the atria and ventricles via semantic and instance segmentation. The results show that the mAP for MRCNN is about 99.48% and 82% for FRCNN. We suggest that evaluation and prediction with our proposed model provide reliable detection of septal defects, including defects in the atria, ventricles, or both. These results suggest that the model used has a high potential to help cardiologists complete the initial screening for fetal congenital heart disease.","Image segmentation,Fetal heart,Echocardiography,Object detection,Ultrasonography,Congenital heart disease,fetal echocardiography,mask-RCNN,septal defects,multiclass instance segmentation",Article,"IEEE-INST ELECTRICAL ELECTRONICS ENGINEERS INC, 445 HOES LANE, PISCATAWAY, NJ 08855-4141 USA","Computer Science,Engineering,Telecommunications",,3.671,LOCALIZATION,IEEE ACCESS,https://doi.org/10.1109/access.2020.3034367,
77,An Adaptive Intelligence Algorithm for Undersampled Knee MRI Reconstruction,8,,204825-204838,"Pezzotti Nicola,Yousefi Sahar,Elmahdy Mohamed S.,Van Gemert Jeroen Hendrikus Fransiscus,Schuelke Christophe,Doneva Mariya,Nielsen Tim,Kastryulin Sergey,Lelieveldt Boudewijn P. F.,Van Osch Matthias J. P.","Pezzotti N,Yousefi S,Elmahdy MS,Van Gemert JHF,Schuelke C,Doneva M,Nielsen T,Kastryulin S,Lelieveldt BPF,Van Osch MJP",Pezzotti N,10.1109/ACCESS.2020.3034287,Philips,"Adaptive intelligence aims at empowering machine learning techniques with the additional use of domain knowledge. In this work, we present the application of adaptive intelligence to accelerate MR acquisition. Starting from undersampled k-space data, an iterative learning-based reconstruction scheme inspired by compressed sensing theory is used to reconstruct the images. We developed a novel deep neural network to refine and correct prior reconstruction assumptions given the training data. The network was trained and tested on a knee MRI dataset from the 2019 fastMRI challenge organized by Facebook AI Research and NYU Langone Health. All submissions to the challenge were initially ranked based on similarity with a known groundtruth, after which the top 4 submissions were evaluated radiologically. Our method was evaluated by the fastMRI organizers on an independent challenge dataset. It ranked #1, shared #1, and #3 on respectively the 8x accelerated multi-coil, the 4x multi-coil, and the 4x single-coil tracks. This demonstrates the superior performance and wide applicability of the method.","Image reconstruction,Magnetic resonance imaging,Acceleration,Coils,Training,Optimization,Image reconstruction,MRI,deep learning,ISTA,fastMRI challenge",Article,"IEEE-INST ELECTRICAL ELECTRONICS ENGINEERS INC, 445 HOES LANE, PISCATAWAY, NJ 08855-4141 USA","Computer Science,Engineering,Telecommunications",,3.671,"IMAGE-RECONSTRUCTION,NETWORK",IEEE ACCESS,http://arxiv.org/pdf/2004.07339,
78,Towards Classifying Cognitive Performance by Sensing Electrodermal Activity in Children With Specific Learning Disorders,8,,196187-196196,"Rico-Olarte Carolina,Lopez Diego M.,Becker Linda,Eskofier Bjoern","Rico-Olarte C,Lopez DM,Becker L,Eskofier B",Rico-Olarte C,10.1109/ACCESS.2020.3033769,Universidad del Cauca,"When children suffer from cognitive disorders, school performance and social environment are affected. Measuring changes in cognitive progress is essential for assessing the clinical follow-up of the patient's cognitive abilities. This process is considered as a challenge in ambulatory settings, where follow-ups should be non-invasive and continuous. Psychophysiological measures are an objective and unobtrusive evaluation alternative for recognizing cognitive changes. This paper aims to validate the relationship between cognition and the changes in physiological signals of children suffering from Specific Learning Disorders (SLD). This validation was carried out in an eHealth rehabilitation context (with the HapHop-Physio game). Electrodermal activity (EDA) signals were collected, processed, and analyzed through a machine learning approach. Obtained results were: a dataset built from wearable physiological data and a supervised classification model. The classification model can identify the children's cognitive performance (class) from the features of the tonic component of the EDA signal (attributes) with an accuracy of 79.95%. The presented results evidence that psychophysiological measures could allow for a highly objective follow-up for patients. They can also lead to creating a basis for further improvement of rehabilitation environments and developing neurofeedback applications.","Pediatrics,Physiology,Heart rate variability,Cognition,Biomedical monitoring,Sensors,Medical treatment,Electrodermal activity,cognitive performance,supervised classification,specific learning disorders",Article,"IEEE-INST ELECTRICAL ELECTRONICS ENGINEERS INC, 445 HOES LANE, PISCATAWAY, NJ 08855-4141 USA","Computer Science,Engineering,Telecommunications",,3.671,"USER,EXPERIENCE,WORKLOAD,SPECTRUM,AROUSAL,GAMES",IEEE ACCESS,https://opus4.kobv.de/opus4-fau/files/15598/09239296.pdf,
